,id,permalink,username,to,text,date,retweets,favorites,replies,mentions,hashtags,geo
837,1173641475575336961,https://twitter.com/lzyaml2018/status/1173641475575336961,lzyaml2018,,SoftBank Backers Rethink Role in Next Vision Fund on WeWork https://www.bloomberg.com/news/articles/2019-09-16/softbank-backers-rethink-role-in-next-vision-fund-after-wework …,2019-09-16 16:55:07+00:00,0,1,1,,,
838,1173641258000166912,https://twitter.com/africatechie/status/1173641258000166912,africatechie,,Is WeWork a Fraud? https://medium.com/@henry.hawksberry/is-we-work-a-fraud-5b78987d3e61 … by @HenryHawksberry #WeworkIPO,2019-09-16 16:54:15+00:00,15,25,25,@henry @HenryHawksberry,#WeworkIPO,
839,1173641210637905921,https://twitter.com/mentallion/status/1173641210637905921,mentallion,,NYU professor calls WeWork's IPO 'Botox on a lame Unicorn' and says its price and valuation will be a 'throne of lies' #BreakingNews #rdt http://dlvr.it/RDD0sW pic.twitter.com/6b0ExnN5h2,2019-09-16 16:54:04+00:00,0,0,0,,#BreakingNews #rdt,
840,1173640984753844224,https://twitter.com/FWWinterberg/status/1173640984753844224,FWWinterberg,,"WeWork Rio Centro und HERE Mobility schließen sich zusammen, um der lokalen WeW... http://ots.de/42c91f via @na_presseportal",2019-09-16 16:53:10+00:00,0,0,0,@na_presseportal,,
841,1173640952537214980,https://twitter.com/khairais/status/1173640952537214980,khairais,david_perell,$SBUX #WeWork https://twitter.com/david_perell/status/1172348376266022912 …,2019-09-16 16:53:02+00:00,1,0,0,,#WeWork,
842,1173640952059183106,https://twitter.com/GameMinimalist/status/1173640952059183106,GameMinimalist,,The rather meagre board game collection at my WeWork pic.twitter.com/BhXyF7oRIi,2019-09-16 16:53:02+00:00,0,3,3,,,
843,1173640719770226688,https://twitter.com/Mithos09/status/1173640719770226688,Mithos09,iverbpunkt,Das ist offenbar veraltet (und permanent geschlossen). Guck dir mal das andere google-Ergebnis an: Die sitzen wohl jetzt im Co-Working-Space von @WeWork am Axel-Springer-Platz 3. Das passt auch von der Inneneinrichtung zum Bild des Konferenzraums.,2019-09-16 16:52:07+00:00,1,6,6,@WeWork,,
844,1173640686777851905,https://twitter.com/_Philip_Martin/status/1173640686777851905,_Philip_Martin,thomasrice_au,My comment particularly related to startups with 50-500 employees using WeWork as HQ versus large companies using WeWork in some capacity.,2019-09-16 16:51:59+00:00,0,0,0,,,
845,1173640315816816641,https://twitter.com/Presse_Netz/status/1173640315816816641,Presse_Netz,,"WeWork Rio Centro und HERE Mobility schließen sich zusammen, um der lokalen WeWork-Community ein neues https://www.presse-channel.net/2019/09/16/wework-rio-centro-und-here-mobility-schliessen-sich-zusammen-um-der-lokalen-wework-community-ein-neues-mobilitaetserlebnis-zu-bieten/ …",2019-09-16 16:50:31+00:00,0,0,0,,,
846,1173640020755959809,https://twitter.com/chrisbmarquez/status/1173640020755959809,chrisbmarquez,,"FARIA LIMA #Co-Working #Space by WeWork, #Brasil >> https://www.designeour.com/collaborative-workspaces … https://chrisbmarquez.com/post/187758132435/faria-lima-co-working-space-by-wework-brasil …pic.twitter.com/dFprCDMJLz",2019-09-16 16:49:20+00:00,0,0,0,,#Co #Space #Brasil,
847,1173639863058534403,https://twitter.com/PPosledovich/status/1173639863058534403,PPosledovich,,#banking #business #financialmarkets #valueinvesting #financeandeconomy #economics #finance #equities #trading #stocks #economy #investments #stockmarket #valuation #investing #funding #investment #investors #wework #ipos https://lnkd.in/ePr3Jk9,2019-09-16 16:48:43+00:00,0,0,0,,#banking #business #financialmarkets #valueinvesting #financeandeconomy #economics #finance #equities #trading #stocks #economy #investments #stockmarket #valuation #investing #funding #investment #investors #wework #ipos,
848,1173639700831068160,https://twitter.com/ryanmgem/status/1173639700831068160,ryanmgem,,Check this out Masa’s Folly: How WeWork Differs From Uber And Airbnb http://dlvr.it/RDCzSh @forbespic.twitter.com/X7fafl8evR,2019-09-16 16:48:04+00:00,0,0,0,@forbespic,,
849,1173639666903347200,https://twitter.com/LynnPorter77/status/1173639666903347200,LynnPorter77,,Microsoft takes full floor at Capitol Hill WeWork https://www.djc.com/news/re/12125329.html …pic.twitter.com/0jjN0YKYdh,2019-09-16 16:47:56+00:00,1,3,3,,,
850,1173639613262393351,https://twitter.com/investor_saiyan/status/1173639613262393351,investor_saiyan,,日本の大手企業はメンツ勝負なことも多いのでこうなりますが、 スタートアップ・ベンチャー・フリーランスでwework利用は周囲ではまだあまり聞かないですね。 手頃な不動産借りて経費抑えると聞きます。要は中途半端なんですよね、これ。 日本じゃあまり流行んないと思います。,2019-09-16 16:47:43+00:00,0,0,0,,,
851,1173639112357830660,https://twitter.com/VL_solution/status/1173639112357830660,VL_solution,,Masa’s Folly: How WeWork Differs From Uber And Airbnb https://www.forbes.com/sites/dileeprao/2019/09/16/masas-folly-how-wework-differs-from-uber-and-airbnb/ … via @VL_solution #Entrepreneurpic.twitter.com/ABEXp3eeJd,2019-09-16 16:45:44+00:00,0,0,0,@VL_solution,#Entrepreneurpic,
852,1173639071664672770,https://twitter.com/Ronnie_Icon/status/1173639071664672770,Ronnie_Icon,,Smiling today after a friendly and fruitful first meeting #wework #meetings #songwriter #makeithappen #livethedream @WeWork at Yeouido Station https://www.instagram.com/p/B2erGpvIlOT/?igshid=1gpkvcy8bzyec …,2019-09-16 16:45:34+00:00,0,0,0,@WeWork,#wework #meetings #songwriter #makeithappen #livethedream,
853,1173638848179593220,https://twitter.com/15MinuteNewsBus/status/1173638848179593220,15MinuteNewsBus,,Woozy WeWork Targets Global Investment Banking In Fertility Via IPO Fast Track https://www.15minutenews.com/article/171070841/woozy-wework-targets-global-investment-banking-in-fertility-via-ipo-fast-track/ … #StockMarkets,2019-09-16 16:44:41+00:00,0,0,0,,#StockMarkets,
854,1173638139593797634,https://twitter.com/leiamoneytimes/status/1173638139593797634,leiamoneytimes,,Isto não é o Facebook: fundador da WeWork aprende lição com IPO https://moneytimes.com.br/isto-nao-e-o-facebook-fundador-da-wework-aprende-licao-com-ipo/ …,2019-09-16 16:41:52+00:00,0,2,2,,,
855,1173637629285298177,https://twitter.com/thomasrice_au/status/1173637629285298177,thomasrice_au,_Philip_Martin,"Well-funded companies are already using WeWork. 40% of their memberships come from companies with 500+ employees, up from 20% at end of March 2017, and their goal is to get it to 60% over time. Tenants include Microsoft, Facebook, RBC, GE Healthcare, etc.",2019-09-16 16:39:50+00:00,0,0,0,,,
856,1173637599489155072,https://twitter.com/carribablue/status/1173637599489155072,carribablue,,Masa’s Folly: How WeWork Differs From Uber And Airbnb https://www.forbes.com/sites/dileeprao/2019/09/16/masas-folly-how-wework-differs-from-uber-and-airbnb/ …pic.twitter.com/JF5wZtc2Fm,2019-09-16 16:39:43+00:00,0,0,0,,,
857,1173637579478093824,https://twitter.com/laruw/status/1173637579478093824,laruw,,fico chocada em como o wework é tecnológico,2019-09-16 16:39:38+00:00,0,0,0,,,
858,1173637400376963073,https://twitter.com/zachtratar/status/1173637400376963073,zachtratar,africatechie,"I mean, I'm all for keeping WeWork accountable, but... ""A throne of lies""? Curious what novel this professor is currently reading! $50 it's fantasy. https://twitter.com/africatechie/status/1173635713646170112 …",2019-09-16 16:38:56+00:00,0,0,0,,,
859,1173637154674814977,https://twitter.com/StREITSmart/status/1173637154674814977,StREITSmart,jeffsifen,It’s crazy to think that SoftBank invested at a $47 billion valuation not too long ago. WeWork is not profitable and has significant downside potential if a recession occurs. I’d like to know how a $10 billion valuation is justified. $WEhttps://twitter.com/jeffsifen/status/1173560321375723521 …,2019-09-16 16:37:57+00:00,0,0,0,,,
860,1173636845806268416,https://twitter.com/hans_enlin/status/1173636845806268416,hans_enlin,GavinSBaker,"You are correct. It is not contrarian to be negative on #WeWork, it's an overwhelming universal consensus.",2019-09-16 16:36:43+00:00,0,0,0,,#WeWork,
861,1173636719393959937,https://twitter.com/madhavchanchani/status/1173636719393959937,madhavchanchani,,"Wework effect --> Saudi Arabia’s Public Investment Fund, which contributed $45 billion to the $100 billion Vision Fund, is now only planning to reinvest profits from that vehicle into its successor, according to people familiar with the talks. https://www.bloomberg.com/news/articles/2019-09-16/softbank-backers-rethink-role-in-next-vision-fund-after-wework …",2019-09-16 16:36:13+00:00,13,21,21,,,
862,1173636693196337153,https://twitter.com/hedgefundreject/status/1173636693196337153,hedgefundreject,profgalloway,Lolll hardly a list of positives... half the points were actually negative. Goes to show how difficult it is to spin this turd (we work) as positive,2019-09-16 16:36:07+00:00,0,2,2,,,
863,1173636685332197377,https://twitter.com/BenDWalsh/status/1173636685332197377,BenDWalsh,africatechie,"the wework IPO coverage feels like day three of the Hudson Yards architecture reviews. everyone knows everyone is making the same points, so they're layering on evermore rococo phrasing to stand out https://twitter.com/africatechie/status/1173635713646170112 …",2019-09-16 16:36:05+00:00,3,27,27,,,
864,1173636553492586497,https://twitter.com/jokottenweb/status/1173636553492586497,jokottenweb,,"WeWork Rio Centro und HERE Mobility schließen sich zusammen, um der lokalen WeWork-Community ein neues Mobilitätserlebnis zu bieten https://civil.de/wework-rio-centro-und-here-mobility-schliessen-sich-zusammen-um-der-lokalen-wework-community-ein-neues-mobilitaetserlebnis-zu-bieten/ …",2019-09-16 16:35:34+00:00,0,0,0,,,
865,1173636523339726848,https://twitter.com/MikeNelson/status/1173636523339726848,MikeNelson,,The failings of the WeWork and Uber IPOs may reshape the app economy for consumers https://shar.es/aXwUXS via @techonomy #NetFutures,2019-09-16 16:35:26+00:00,0,1,1,@techonomy,#NetFutures,
866,1173636193990467591,https://twitter.com/stickerbeatinc/status/1173636193990467591,stickerbeatinc,,Who needs a little bit of miring magic when they wake up? wework #Stickerbeat #Coffee #coffeeshop #coffeebar #coffeebeans #wakeup #grind #morningmotivation #morningpickmeup #morningmagic #WeWork https://www.instagram.com/p/B2epziGAk5e/?igshid=23pfu111tl4g …,2019-09-16 16:34:08+00:00,0,0,0,,#Stickerbeat #Coffee #coffeeshop #coffeebar #coffeebeans #wakeup #grind #morningmotivation #morningpickmeup #morningmagic #WeWork,
867,1173636151405506563,https://twitter.com/sdmcmaster/status/1173636151405506563,sdmcmaster,,#WeWork: The Last Unicorn or a Black Sheep? https://www.bloomberg.com/news/articles/2019-09-16/wework-the-last-unicorn-or-a-black-sheep …,2019-09-16 16:33:58+00:00,0,0,0,,#WeWork,
868,1173635876066168832,https://twitter.com/SeattleDJC/status/1173635876066168832,SeattleDJC,,"Microsoft takes full floor at Capitol Hill WeWork. A new plan shows the tech company plans to occupy 14,700 square feet. http://bit.ly/30oD0hg pic.twitter.com/eBpc7gltKK",2019-09-16 16:32:52+00:00,6,12,12,,,
869,1173635723863347200,https://twitter.com/EnergiaPublica/status/1173635723863347200,EnergiaPublica,GavinSBaker,Interesting thread on WeWork (counter-pt to negative coverage of IPO) https://twitter.com/GavinSBaker/status/1173316274799226880 …,2019-09-16 16:32:16+00:00,0,0,0,,,
870,1173635713646170112,https://twitter.com/africatechie/status/1173635713646170112,africatechie,,NYU professor calls WeWork's IPO 'Botox on a lame Unicorn' and says its price and valuation will be a 'throne of lies' https://www.businessinsider.com/nyu-professor-slams-wework-ipo-as-botox-on-a-lame-unicorn-2019-9?utm_source=twitter&utm_medium=referral&utm_content=topbar&utm_term=desktop&referrer=twitter … via @businessinsider,2019-09-16 16:32:13+00:00,3,4,4,@businessinsider,,
871,1173635684382445569,https://twitter.com/AlainAsmar/status/1173635684382445569,AlainAsmar,profgalloway,Even with the incoming 47 billion in lease liabilities? I always took issue with companies whose losses correlate almost perfectly with their revenue...,2019-09-16 16:32:06+00:00,0,0,0,,,
872,1173635598982230016,https://twitter.com/africatechie/status/1173635598982230016,africatechie,,NYU professor calls WeWork's IPO 'Botox on a lame Unicorn' and says its price and valuation will be a 'throne of lies' https://www.businessinsider.com/nyu-professor-slams-wework-ipo-as-botox-on-a-lame-unicorn-2019-9?utm_source=twitter&utm_medium=referral&utm_content=topbar&utm_term=desktop&referrer=twitter …,2019-09-16 16:31:46+00:00,4,6,6,,,
873,1173635476198187009,https://twitter.com/yanacona/status/1173635476198187009,yanacona,,#WeWork’s need for cash gives it incentive to bend on #governance ahead of its #IPO. But not by too much https://www.bloomberg.com/opinion/articles/2019-09-13/wework-ipo-governance-changes-don-t-fix-flawed-business-model … vía @bopinion,2019-09-16 16:31:17+00:00,0,1,1,@bopinion,#WeWork #governance #IPO,
874,1173635457600688128,https://twitter.com/lil_shimmy/status/1173635457600688128,lil_shimmy,,"A lot of bad things being said about WeWork, prepare the PUTS",2019-09-16 16:31:12+00:00,0,0,0,,,
875,1173635413145088001,https://twitter.com/sri_batchu/status/1173635413145088001,sri_batchu,GavinSBaker,Insightful balanced thread on Wework https://twitter.com/GavinSBaker/status/1173316274799226880 …,2019-09-16 16:31:02+00:00,0,0,0,,,
876,1173635385282285569,https://twitter.com/brlaron/status/1173635385282285569,brlaron,,"Despite Valuation Concerns, WeWork’s S-1 Filing Is a Glimpse into the Office Market of the Future - https://www.propmodo.com/despite-valuation-concerns-weworks-s-1-filing-is-a-glimpse-into-the-office-market-of-the-future/ … via @propmodo",2019-09-16 16:30:55+00:00,0,0,0,@propmodo,,
877,1173635262565498880,https://twitter.com/DealStreetAsia/status/1173635262565498880,DealStreetAsia,,"Uber’s tepid IPO, WeWork valuation slump cast shadow on exit path for India’s unicorns http://bit.ly/2UZUhfN",2019-09-16 16:30:26+00:00,0,0,0,,,
878,1173635249902968832,https://twitter.com/RudyFaust/status/1173635249902968832,RudyFaust,mimisjo,WeWork conspiracies are my #MondayMotivation. Am I doing this right?,2019-09-16 16:30:23+00:00,0,0,0,,#MondayMotivation,
879,1173635241401114625,https://twitter.com/meta3investor/status/1173635241401114625,meta3investor,eliotwb,". @wework employees should sue the WeWork Board for gross negligence in completing their fiduciary responsibility: corporate governance. Bruce Dunlevie @benchmark, Ronald Fisher of @softbank, Mark Schwartz of @softbank, Lewis Frankfort of @flywheel and John Zhao of Hony Capital.",2019-09-16 16:30:21+00:00,0,0,0,@wework @benchmark @softbank @softbank @flywheel,,
880,1173635210434568192,https://twitter.com/NewWeatherCard/status/1173635210434568192,NewWeatherCard,,Lets Get It !!!! @AndrewYang @BusinessMAP1984 @Math @Streetdreamsre2 @FAFSA @UsBank @WellsFargoWorks @WeWork @Nas @GretaThunberg @ZeldaOfficialJP @Nintendo @Konami @konamieu @Ameristar @AmeristarEChttps://open.spotify.com/track/3PFPSmrVbLRm0MLCGQ5trp?si=gG4aS_pERg60DkWbd2GXgQ …,2019-09-16 16:30:13+00:00,0,0,0,@AndrewYang @BusinessMAP1984 @Math @Streetdreamsre2 @FAFSA @UsBank @WellsFargoWorks @WeWork @Nas @GretaThunberg @ZeldaOfficialJP @Nintendo @Konami @konamieu @Ameristar @AmeristarEChttps,,
881,1173635208735625216,https://twitter.com/nksingal/status/1173635208735625216,nksingal,,#SoftBank Backers Rethink Role in Next #VisionFund on #WeWork https://www.bloomberg.com/news/articles/2019-09-16/softbank-backers-rethink-role-in-next-vision-fund-after-wework …,2019-09-16 16:30:13+00:00,0,2,2,,#SoftBank #VisionFund #WeWork,
882,1173635195225956352,https://twitter.com/eduatfordhamGSE/status/1173635195225956352,eduatfordhamGSE,,The online programs from @FordhamGSE seamlessly deliver the campus and classroom experience with: Face-to-face online classes Engaging course content In-person experiences Student support @WeWork Global Access membership Learn more: https://bddy.me/2LTO5Sn pic.twitter.com/SFUGLDobqE,2019-09-16 16:30:10+00:00,0,0,0,@FordhamGSE @WeWork,,
883,1173635179899842562,https://twitter.com/alasoff/status/1173635179899842562,alasoff,,SoftBank Backers Rethink Role in Next Vision Fund on WeWork https://www.bloomberg.com/amp/news/articles/2019-09-16/softbank-backers-rethink-role-in-next-vision-fund-after-wework#click=https://t.co/po6HPL9G9G …,2019-09-16 16:30:06+00:00,0,0,0,,#click,
884,1173634746993319936,https://twitter.com/creationagency/status/1173634746993319936,creationagency,,Masa’s Folly: How WeWork Differs From Uber And Airbnb http://twib.in/l/4MdL4z8x4KA7 via @Forbes #Marketing #Leadershippic.twitter.com/PKrQ1EBSTW,2019-09-16 16:28:23+00:00,1,0,0,@Forbes,#Marketing #Leadershippic,
885,1173634733089021957,https://twitter.com/eliotwb/status/1173634733089021957,eliotwb,,Saudi Arabia & Abu Dhabi cooling on Vision Fund Act II amid WeWork's rough entry to the public markets (reminder that wework hasn't even entered the public markets yet) https://www.bloomberg.com/news/articles/2019-09-16/softbank-backers-rethink-role-in-next-vision-fund-after-wework …,2019-09-16 16:28:20+00:00,3,8,8,,,
886,1173634725044457477,https://twitter.com/soares_asociado/status/1173634725044457477,soares_asociado,,"Las discusiones siguen el proceso de WeWork IPO, caída en la valoración.",2019-09-16 16:28:18+00:00,0,0,0,,,
887,1173634722087522304,https://twitter.com/soares_asociado/status/1173634722087522304,soares_asociado,,"¿Corchos de champán pop en las empresas de Silicon Valley Venture? Los patrocinadores de SoftBank repensan el papel en el próximo fondo de visión después de WeWork, informa BBG. Los sauditas, Abu Dhabi consideran reducir drásticamente la inversión. pic.twitter.com/AX3lpHuTBV",2019-09-16 16:28:17+00:00,0,0,0,,,
888,1173634654559252480,https://twitter.com/nadeemansary/status/1173634654559252480,nadeemansary,,"In May, WeWork’s CEO and CFO explained to @businessinsider why they think they’ve built a strong business. Here’s their logic. https://www.businessinsider.com/wework-ceo-cfo-financials-revenue-recession-2019-5 …pic.twitter.com/NlZwiPwKs5",2019-09-16 16:28:01+00:00,0,0,0,@businessinsider,,
889,1173634470026600448,https://twitter.com/NpappaG/status/1173634470026600448,NpappaG,GavinSBaker,"Finally, at long last, a sensible WeWork take https://twitter.com/GavinSBaker/status/1173316279899500544 …",2019-09-16 16:27:17+00:00,0,3,3,,,
890,1173634185967390722,https://twitter.com/robblackshow/status/1173634185967390722,robblackshow,,"Rob Black talks about drone strikes, oil prices, WeWork, Apple, and Certified Financial Planner @ChadMBurton , host of New Focus on Wealth, discusses buyer remorse, growth investing, and more topics covered this Saturday at San Jose's Rotary Summit Center. http://rbymradio.libsyn.com/rob-black-september-16-1?tdest_id=102898 …",2019-09-16 16:26:09+00:00,0,1,1,@ChadMBurton,,
891,1173634161287950337,https://twitter.com/BNI_SuccessLink/status/1173634161287950337,BNI_SuccessLink,,Masa’s Folly: How WeWork Differs From Uber And Airbnb http://dlvr.it/RDCvTn pic.twitter.com/Fzeam0WK5t,2019-09-16 16:26:03+00:00,0,0,0,,,
892,1173634070527533068,https://twitter.com/RCDidles/status/1173634070527533068,RCDidles,ben__h,Look if your going to invest in wework send your to me and be part of the Consortium Syndicate - it’s a no brainer and as safe as investing directly in wework,2019-09-16 16:25:42+00:00,0,1,1,,,
893,1173634009135493121,https://twitter.com/profgalloway/status/1173634009135493121,profgalloway,GavinSBaker,"An interesting take, highlighting many of the positives of @WeWork and Adam Neuman's role/leadership https://twitter.com/GavinSBaker/status/1173316274799226880 …",2019-09-16 16:25:27+00:00,6,33,33,@WeWork,,
894,1173633911311818754,https://twitter.com/aboutcoworking/status/1173633911311818754,aboutcoworking,,Flex Office Space: Much More Than Just WeWork https://www.cpexecutive.com/post/flex-office-space-much-more-than-just-wework/ … #coworking #aboutcoworking #coworkingnews #monday #mondaymotivation #news #officespace #industrynews,2019-09-16 16:25:04+00:00,0,0,0,,#coworking #aboutcoworking #coworkingnews #monday #mondaymotivation #news #officespace #industrynews,
895,1173633864318763009,https://twitter.com/MissD_Dallas/status/1173633864318763009,MissD_Dallas,FightinBluHen51,"PHEW, and I was thinking safety was WEWORK!",2019-09-16 16:24:52+00:00,0,1,1,,,
896,1173633361488703488,https://twitter.com/propmodo/status/1173633361488703488,propmodo,,"Despite valuation concerns, @WeWork’s S-1 filing is a glimpse into the office market of the future https://www.propmodo.com/despite-valuation-concerns-weworks-s-1-filing-is-a-glimpse-into-the-office-market-of-the-future/ … via @propmodo",2019-09-16 16:22:53+00:00,0,2,2,@WeWork @propmodo,,
897,1173632682791723013,https://twitter.com/genemarks/status/1173632682791723013,genemarks,,. @Twitch co-founder’s new #startup rents #lawyers to other #startups via @business @atrium has raised about $75 million from investors to rent lawyers to startups the way @WeWork rents them desks. #MondayThoughtshttps://www.bloomberg.com/news/articles/2019-09-16/atrium-startup-rents-lawyers-to-other-startups …,2019-09-16 16:20:11+00:00,3,8,8,@Twitch @business @atrium @WeWork,#startup #lawyers #startups #MondayThoughtshttps,
898,1173632654073376769,https://twitter.com/diving_news/status/1173632654073376769,diving_news,,"Bad Haircuts, Expensive Robots, And We Eat Cereal As WeWork Dives - Crunchbase News http://bit.ly/2IcRhYm",2019-09-16 16:20:04+00:00,0,0,0,,,
899,1173632646099984385,https://twitter.com/WeWork/status/1173632646099984385,WeWork,,People spend a lot of time at work—which is why the office experience should feel elevated and epic. Here's how we approach workspace design: https://we.co/energytw . #wework ⁠ pic.twitter.com/vZ8m4FKJ1x,2019-09-16 16:20:02+00:00,8,25,25,,#wework,
900,1173632274668998656,https://twitter.com/gowdyfinancial/status/1173632274668998656,gowdyfinancial,,Masa’s Folly: How WeWork Differs From Uber And Airbnb http://dlvr.it/RDCt3P pic.twitter.com/eyfCZg5BBs,2019-09-16 16:18:33+00:00,0,0,0,,,
901,1173632149355786240,https://twitter.com/HouseSolutionE/status/1173632149355786240,HouseSolutionE,,Masa’s Folly: How WeWork Differs From Uber And Airbnb http://dlvr.it/RDCsxW pic.twitter.com/bfTLUA2ZP5,2019-09-16 16:18:04+00:00,0,0,0,,,
902,1173632016769675264,https://twitter.com/MaloneySandwich/status/1173632016769675264,MaloneySandwich,,I usually work from home. One of my favorite parts about going into a WeWork is the the cold brew. Has anyone looked at the numbers in major WeWork cities comparing coffee consumed vs. Starbucks or anything major coffee chain?,2019-09-16 16:17:32+00:00,0,6,6,,,
903,1173631514522685440,https://twitter.com/ProtagonistGrp/status/1173631514522685440,ProtagonistGrp,,Masaâ??s Folly: How WeWork Differs From Uber And Airbnb https://www.forbes.com/sites/dileeprao/2019/09/16/masas-folly-how-wework-differs-from-uber-and-airbnb/ …,2019-09-16 16:15:32+00:00,0,0,0,,,
904,1173631497775063040,https://twitter.com/BIZKID_WORLD/status/1173631497775063040,BIZKID_WORLD,,"Businesses like WeWork & Magic Leap will never truly work, because they are largely built on ideal projections, not real-world metrics and market conditions.",2019-09-16 16:15:28+00:00,0,0,0,,,
905,1173631378300080130,https://twitter.com/SevilleReport/status/1173631378300080130,SevilleReport,,In Focus: WeWork | What to Consider Before Investing | http://bit.ly/2kgbcg4 | #WeWork #IPO #Investing #Investments #Money #RealEstate #CoWorkingpic.twitter.com/2ic5wVqpe6,2019-09-16 16:15:00+00:00,0,0,0,,#WeWork #IPO #Investing #Investments #Money #RealEstate #CoWorkingpic,
906,1173631351117025281,https://twitter.com/jmnoguera/status/1173631351117025281,jmnoguera,,"WeWork tiene graves problemas financieros, la sede prevista que hay entre Rhode Island y la 17St en DC sigue vacía y sin acabar pic.twitter.com/NxSbwXgzPl",2019-09-16 16:14:53+00:00,2,1,1,,,
907,1173631024875462656,https://twitter.com/fabianbreschi/status/1173631024875462656,fabianbreschi,,WeWork: The Last Unicorn or a Black Sheep? http://bit.ly/2O6QifN pic.twitter.com/77E779n41Q,2019-09-16 16:13:35+00:00,0,0,0,,,
908,1173631024212803584,https://twitter.com/ChanderSinghEsq/status/1173631024212803584,ChanderSinghEsq,,Masa’s Folly: How WeWork Differs From Uber And Airbnb http://dlvr.it/RDCs9K pic.twitter.com/eMkG4NqK7u,2019-09-16 16:13:35+00:00,0,0,0,,,
909,1173630460242595840,https://twitter.com/MattHirschy/status/1173630460242595840,MattHirschy,,@WeWork playing @robynkonichiwa is #gayrights,2019-09-16 16:11:21+00:00,0,0,0,@WeWork @robynkonichiwa,#gayrights,
910,1173630359105355782,https://twitter.com/MilagroRealty/status/1173630359105355782,MilagroRealty,,Masa’s Folly: How WeWork Differs From Uber And Airbnb ... http://tinyurl.com/y3g9xmqp,2019-09-16 16:10:57+00:00,0,0,0,,,
911,1173630219422502919,https://twitter.com/JamesOLott/status/1173630219422502919,JamesOLott,Gehrig_Leary,"“Pinterest is ICONIC! WeWork (understood silence), Lyft is INSPIRING!” LmAo",2019-09-16 16:10:23+00:00,0,1,1,,,
912,1173630195032559616,https://twitter.com/Papulli/status/1173630195032559616,Papulli,,NYU professor calls WeWork's IPO 'Botox on a lame Unicorn' and says its price and valuation will be a 'throne of lies' https://www.businessinsider.com/nyu-professor-slams-wework-ipo-as-botox-on-a-lame-unicorn-2019-9?utm_source=twitter&utm_medium=referral&utm_content=topbar&utm_term=desktop&referrer=twitter … via @businessinsider << @profgalloway is amazing!! Some really worrying points he raised on Wework!!>>,2019-09-16 16:10:18+00:00,0,0,0,@businessinsider @profgalloway,,
