,id,permalink,username,to,text,date,retweets,favorites,replies,mentions,hashtags,geo
707,1185544125061488640,https://twitter.com/ReloconUK/status/1185544125061488640,ReloconUK,,Uncomfortable I am sure Checking In On WeWork’s Cash Situation https://buff.ly/2VXMXls,2019-10-19 13:12:00+00:00,0,0,0,,,
708,1185543999064625154,https://twitter.com/Skhoury910/status/1185543999064625154,Skhoury910,,WeWork’s Failure is SoftBank’s Day Of Reckoning https://ift.tt/2VVsHRj #tech #entrepreneur #digital #wired,2019-10-19 13:11:30+00:00,0,0,0,,#tech #entrepreneur #digital #wired,
709,1185543938452676609,https://twitter.com/News1English/status/1185543938452676609,News1English,,"WeWork, we failed – Time https://www.news1.news/2019/10/wework-we-failed-time.html …pic.twitter.com/kH3JxGj9uZ",2019-10-19 13:11:15+00:00,0,0,0,,,
710,1185543816209731586,https://twitter.com/sduroh/status/1185543816209731586,sduroh,,WeWork’s Failure is SoftBank’s Day Of Reckoning http://blog.gstore.es/weworks-failure-is-softbanks-day-of-reckoning/ …,2019-10-19 13:10:46+00:00,0,0,0,,,
711,1185543764854657024,https://twitter.com/SusanDrakeford2/status/1185543764854657024,SusanDrakeford2,,WeWork’s Failure is SoftBank’s Day Of Reckoning https://www.wired.com pic.twitter.com/Hm10Nyhl6n,2019-10-19 13:10:34+00:00,0,0,0,,,
712,1185543734886391808,https://twitter.com/RankYourShit/status/1185543734886391808,RankYourShit,,WeWork’s Failure is SoftBank’s Day Of Reckoning https://chrisgreenhoughblog.wordpress.com/2019/10/19/weworks-failure-is-softbanks-day-of-reckoning/ …,2019-10-19 13:10:27+00:00,0,0,0,,,
713,1185543702086848519,https://twitter.com/JobExpressUK/status/1185543702086848519,JobExpressUK,,WeWork’s Failure is SoftBank’s Day Of Reckoning https://ift.tt/2VVsHRj Leonard Sherman,2019-10-19 13:10:19+00:00,0,0,0,,,
714,1185543688006619142,https://twitter.com/octaviorojas/status/1185543688006619142,octaviorojas,,WeWork’s Failure is SoftBank’s Day Of Reckoning https://ift.tt/2VVsHRj https://ift.tt/eA8V8J,2019-10-19 13:10:16+00:00,0,0,0,,,
715,1185543683132870656,https://twitter.com/einarmorillo/status/1185543683132870656,einarmorillo,,#tech #technology #news WeWork’s Failure is SoftBank’s Day Of Reckoning http://bit.ly/31sLg0g,2019-10-19 13:10:15+00:00,0,0,0,,#tech #technology #news,
716,1185543662794489857,https://twitter.com/akshaychat/status/1185543662794489857,akshaychat,,If you don’t have time to read the article just look at these two images #Digital #Uber #WeWork #BusinessModelspic.twitter.com/PicIdYVUBB,2019-10-19 13:10:10+00:00,0,0,0,,#Digital #Uber #WeWork #BusinessModelspic,
717,1185543662287101953,https://twitter.com/VampirSexKttns/status/1185543662287101953,VampirSexKttns,,WeWork’s Failure is SoftBank’s Day Of Reckoning https://ift.tt/2BsEjlr #NewMusic #Futurism #Global #RobotYoga #ArtificialIntelligence #AI #RobotSlaves #Robotics #Robots #NeuralNetworks #RobotFood #AR #DigitalHumans,2019-10-19 13:10:10+00:00,0,0,0,,#NewMusic #Futurism #Global #RobotYoga #ArtificialIntelligence #AI #RobotSlaves #Robotics #Robots #NeuralNetworks #RobotFood #AR #DigitalHumans,
718,1185543581278162944,https://twitter.com/jp_masah/status/1185543581278162944,jp_masah,,そんな中、、来月からウィーワークのアークヒルズ にて当社新部署が立ち上がります。入居者に影響無ければいいですが ソフトバンクG、WeWork混乱にどう対応？ 5400億円支援報道も...次の一手は #SmartNews https://www.j-cast.com/2019/10/19370466.html …,2019-10-19 13:09:50+00:00,0,1,1,,#SmartNews,
719,1185543443889692673,https://twitter.com/KasandreaSereno/status/1185543443889692673,KasandreaSereno,,WeWork’s Failure is SoftBank’s Day Of Reckoning https://ift.tt/2VVsHRj,2019-10-19 13:09:18+00:00,0,0,0,,,
720,1185543395327926274,https://twitter.com/Dr_Samuel_Conn/status/1185543395327926274,Dr_Samuel_Conn,,WeWork’s Failure is SoftBank’s Day Of Reckoning http://dlvr.it/RGWyD8 pic.twitter.com/o4jrr1L8oN,2019-10-19 13:09:06+00:00,0,0,0,,,
721,1185543384502423552,https://twitter.com/evanderburg/status/1185543384502423552,evanderburg,,WeWork’s Failure is SoftBank’s Day Of Reckoning http://i.securitythinkingcap.com/RGWyBs pic.twitter.com/ZcB66GdgCe,2019-10-19 13:09:03+00:00,0,0,0,,,
722,1185543315321573376,https://twitter.com/akshaychat/status/1185543315321573376,akshaychat,,Profit over growth Flywheel approach Margin consciousness Great leaders have been practising this since long. Heard these from boss man @gsinha across discussions Is it the end of road for Uber / WeWork ? Scott Galloway articulates it all so well here https://www.profgalloway.com/marginal,2019-10-19 13:08:47+00:00,0,2,2,@gsinha,,
723,1185543156034609153,https://twitter.com/mshwire/status/1185543156034609153,mshwire,,"New post: ""WeWork’s Failure is SoftBank’s Day Of Reckoning"" https://ift.tt/2VVsHRj",2019-10-19 13:08:09+00:00,0,0,0,,,
724,1185542829818499074,https://twitter.com/nick_chater/status/1185542829818499074,nick_chater,,WeWork’s Failure is SoftBank’s Day Of Reckoning https://ift.tt/2VVsHRj #EdTech,2019-10-19 13:06:51+00:00,0,0,0,,#EdTech,
725,1185542763539922944,https://twitter.com/h1takayama/status/1185542763539922944,h1takayama,,WeWorkの企業価値、1月比8割減8700億円に ①ソフトバンクが見積もる8700億円ももう信頼できない。 ②社長が自社株担保に借金して、本業が傾き、一気に追担求められて、自社株の雪崩売りに追い込まれるのって良くある倒産サイン。 https://www.nikkei.com/article/DGXMZO51176380Z11C19A0000000/ …,2019-10-19 13:06:35+00:00,2,8,8,,,
726,1185542709752356866,https://twitter.com/divhmishra/status/1185542709752356866,divhmishra,,WeWork’s Failure is SoftBank’s Day Of Reckoning http://bit.ly/33L0wqQ,2019-10-19 13:06:22+00:00,0,0,0,,,
727,1185542708372353025,https://twitter.com/bihit/status/1185542708372353025,bihit,PeterSchiff,bitcoin is like wework. neither do and both are frauds.,2019-10-19 13:06:22+00:00,0,1,1,,,
728,1185542619717345281,https://twitter.com/SandersFirmPC/status/1185542619717345281,SandersFirmPC,,(The investing public avoided a major financial headache here. Imagine if the $47 billion Initial Public Offering (IPO) launched?) WeWork's valuation could reportedly slip below $8 billion as part of SoftBank's proposed bailout of the embattled company https://buff.ly/2BorXL5 pic.twitter.com/4se718HDFX,2019-10-19 13:06:01+00:00,0,1,1,,,
729,1185542465912225793,https://twitter.com/mattberg/status/1185542465912225793,mattberg,,"If you wake up on a Casper mattress, work out with a Peloton before breakfast, Uber to your desk at a WeWork, order DoorDash for lunch, take a Lyft home, and get dinner through Postmates, you’ve interacted with 7 companies that will collectively lose nearly $14 billion this year",2019-10-19 13:05:24+00:00,0,0,0,,,
730,1185542422803206145,https://twitter.com/Afristotle/status/1185542422803206145,Afristotle,architectmag,pic.twitter.com/3LzrYXppEt,2019-10-19 13:05:14+00:00,0,0,0,,,
731,1185542382965555200,https://twitter.com/soyjefe27/status/1185542382965555200,soyjefe27,,WeWork could run out of cash by mid-November — here's what would happen next https://lnkd.in/gPAM6Cz,2019-10-19 13:05:05+00:00,0,1,1,,,
732,1185542156867510272,https://twitter.com/backchnnl/status/1185542156867510272,backchnnl,,WeWork’s Failure is SoftBank’s Day Of Reckoning https://trib.al/5ujSHRG,2019-10-19 13:04:11+00:00,2,3,3,,,
733,1185542066962493442,https://twitter.com/kriviv/status/1185542066962493442,kriviv,,"""The old ways will no longer work"" - Post WeWork IPO fiasco...some great insights from @AswathDamodaran on what's in store for the ongoing #IPO market disruption. https://aswathdamodaran.blogspot.com/2019/10/disrupting-ipo-process-challenging.html?m=1 …",2019-10-19 13:03:49+00:00,0,0,0,@AswathDamodaran,#IPO,
734,1185542062332092416,https://twitter.com/tiny_motion/status/1185542062332092416,tiny_motion,,ソフトバンクG、WeWork混乱にどう対応？ 5400億円支援報道も...次の一手は #ニュース #経済https://this.kiji.is/558264085981168737?c=489071089890952289 …,2019-10-19 13:03:48+00:00,0,0,0,,#ニュース #経済https,
735,1185541817061826565,https://twitter.com/PaulJNegron/status/1185541817061826565,PaulJNegron,,"“If you wake up on a Casper mattress, work out w/ a Peloton before breakfast, Uber to your desk at WeWork, order DoorDash for lunch, take Lyft home & get dinner w/ Postmates, you’ve interacted w/ 7 companies that will lose nearly $14 billion this year.” https://www.theatlantic.com/ideas/archive/2019/10/say-goodbye-millennial-urban-lifestyle/599839/ …",2019-10-19 13:02:50+00:00,0,0,0,,,
736,1185541690813116416,https://twitter.com/sumafodeanalyst/status/1185541690813116416,sumafodeanalyst,tsukuruba,weworkみたいなの？ https://twitter.com/tsukuruba/status/1183923292781998080 …,2019-10-19 13:02:20+00:00,0,0,0,,,
737,1185541486584193024,https://twitter.com/remilekun42/status/1185541486584193024,remilekun42,,GOSSIPINGCENTER: WeWork prefers JPMorgan’s financing package over S... https://www.gossipingcenter.com/2019/10/wework-prefers-jpmorgans-financing.html?spref=tw …,2019-10-19 13:01:31+00:00,0,0,0,,,
738,1185541363779039232,https://twitter.com/pandajoho/status/1185541363779039232,pandajoho,,ソフトバンクG、WeWork混乱にどう対応？ 5400億円支援報道も...次の一手は。(´Д｀υ),2019-10-19 13:01:02+00:00,0,0,0,,,
739,1185541363338625025,https://twitter.com/Gnews__/status/1185541363338625025,Gnews__,,ソフトバンクG、WeWork混乱にどう対応？ 5400億円支援報道も．．．次の一手は - J-CASTニュース https://www.j-cast.com/2019/10/19370466.html … 米シェアオフィス「WeWork（ウィーワーク）」を運営するウィーカンパニーの上場とりやめで、最大の株主であるソフトバンクグループ（SBG）への影響、孫正義会長兼社長の対応策… pic.twitter.com/Lr36oykqiv,2019-10-19 13:01:01+00:00,0,0,0,,,
740,1185541269914902528,https://twitter.com/ContentScene/status/1185541269914902528,ContentScene,,"Another big #IPO delay following WeWork. Hasn't gone so well for WeWork so far (rescue financing plan in the works), time will tell for Aramco. #financialnews Saudi Aramco to Delay Launch of Its Initial Public Offeringhttps://www.bloomberg.com/news/articles/2019-10-17/saudi-aramco-delays-launch-of-initial-public-offering-ft-says …",2019-10-19 13:00:39+00:00,0,0,0,,#IPO #financialnews,
741,1185541258162458624,https://twitter.com/nichcarlson/status/1185541258162458624,nichcarlson,,Leaked video reveals Adam Neumann told staff earlier this year that his family had 100% control of WeWork and that even in 300 years his descendants would be in control https://www.businessinsider.com/wework-adam-neumann-said-family-control-company-300-years-january-2019-10?utmSource=twitter&utmContent=referral&utmTerm=topbar&referrer=twitter … via @businessinsider,2019-10-19 13:00:36+00:00,51,132,132,@businessinsider,,
742,1185541129325961217,https://twitter.com/qconnewyork/status/1185541129325961217,qconnewyork,,Discover the platform and architecture behind @WeWork’s technology transformation over the past 2.5 years. Watch @whugoh’s #QConNYC 2019 talk: https://bit.ly/2YKYYOW #softwaredeveloper #programmer #developer #programming #coding #coder #software #softwareengineerpic.twitter.com/qglBJTtw7u,2019-10-19 13:00:06+00:00,0,1,1,@WeWork @whugoh,#QConNYC #softwaredeveloper #programmer #developer #programming #coding #coder #software #softwareengineerpic,
743,1185541108090040321,https://twitter.com/architectmag/status/1185541108090040321,architectmag,,This Week in Tech: @WeWork and @S9Architecture Inaugurate Flood-Resilient Dock 72 in Brooklyn & More News http://bit.ly/2nXoUGF pic.twitter.com/aHFlI0uka1,2019-10-19 13:00:01+00:00,7,40,40,@WeWork @S9Architecture,,
744,1185540930650161153,https://twitter.com/thebrichman/status/1185540930650161153,thebrichman,,"“Imagine being a secured debt investor, having to foreclose, and getting paid in a trademark on the word “We” and a bunch of kombucha taps. Your collateral is basically the concentrated essence of WeWork, which is maybe not what you want.” @matt_levine is hysterical",2019-10-19 12:59:18+00:00,0,0,0,@matt_levine,,
745,1185540731672219648,https://twitter.com/nikkei_michael/status/1185540731672219648,nikkei_michael,kaz_kabuki_kaz2,こんにちは！WeWork絡みはソフトバンクグループ（9984）の方だと思います！,2019-10-19 12:58:31+00:00,0,3,3,,,
746,1185540119668936704,https://twitter.com/Pablo_Chihuahua/status/1185540119668936704,Pablo_Chihuahua,,"Here's a bet: once @WeWork crashes, dragging @SoftBank with it, it will be the turn of @Uber then @Tesla. The question is: will @GoldmanSachs suffer for underwriting an #IPO meant solely to keep a sham company afloat? #woke #capitalism isn't capitalismhttps://www.zerohedge.com/markets/wework-cash-crunch-could-be-disastrous-hong-kong-office-market …",2019-10-19 12:56:05+00:00,0,1,1,@WeWork @SoftBank @Uber @Tesla @GoldmanSachs,#IPO #woke #capitalism,
747,1185539497225850881,https://twitter.com/JamieHeller/status/1185539497225850881,JamieHeller,,"Two years ago today (two years ago!), @eliotwb wrote in @WSJ that Adam Neumann ""dazzled tech investors by portraying WeWork as a Silicon Valley-style company"" but others ""say the company’s well-crafted image belies the mundane nature of its business."" https://www.wsj.com/articles/wework-a-20-billion-startup-fueled-by-silicon-valley-pixie-dust-1508424483 …",2019-10-19 12:53:37+00:00,9,39,39,@eliotwb @WSJ,,
748,1185539315616636928,https://twitter.com/PLACEEdinburgh/status/1185539315616636928,PLACEEdinburgh,,"'Still, with Lyft and Uber both having bumpy IPOs due to jittery investors, and WeWork having recently abandoned its IPO, it’s no surprise that a quarterly loss that more than doubles could give investors cause for concern.' https://www.fastcompany.com/90418766/report-not-even-airbnb-can-turn-a-profit …",2019-10-19 12:52:53+00:00,2,2,2,,,
749,1185539250420436992,https://twitter.com/remic/status/1185539250420436992,remic,,"If you wake up on a Casper mattress, work out with a Peloton before breakfast, Uber to your desk at a WeWork, order DoorDash for lunch, take a Lyft home, and get dinner through Postmates, you’ve interacted with 7 companies that will collectively lose nearly $14 billion this year",2019-10-19 12:52:38+00:00,0,1,1,,,
750,1185539185786216449,https://twitter.com/jejohnson322/status/1185539185786216449,jejohnson322,,"“If you wake up on a Casper mattress,work out w/a Peloton before breakfast, Uber to your desk at a WeWork, order DoorDash for lunch, take a Lyft home, & get dinner through Postmates, you’ve interacted w/7 companies that will... lose nearly $14B this year.” https://apple.news/A_3edpbsASJuQnlGChYEOag …",2019-10-19 12:52:22+00:00,30,107,107,,,
751,1185539178567782406,https://twitter.com/mylesjrobinson/status/1185539178567782406,mylesjrobinson,,"as #WeWork ( @WeWork) crashes & #Uber ( @Uber) bleeds cash, the consumer-tech gold rush may be coming to an end. : https://www.theatlantic.com/ideas/archive/2019/10/say-goodbye-millennial-urban-lifestyle/599839/ … #millenials great piece, @DKThomp.",2019-10-19 12:52:21+00:00,0,0,0,@WeWork @Uber @DKThomp,#WeWork #Uber #millenials,
752,1185539076503592960,https://twitter.com/ricardocarreon/status/1185539076503592960,ricardocarreon,,Mi #video sobre el continuo deterioro de la situación de @WeWork es lo más visto de la semana #FelizSabadohttps://youtu.be/r-i4aHRyI20,2019-10-19 12:51:56+00:00,0,0,0,@WeWork,#video #FelizSabadohttps,
753,1185539057331396608,https://twitter.com/wagnermr14/status/1185539057331396608,wagnermr14,,Can anyone say he hasn't always looked like a shyster..... Leaked video reveals Adam Neumann told staff earlier this year that his family had 100% control of WeWork and that even in 300 years his descendants would be in control - Business Insider https://www.businessinsider.com/wework-adam-neumann-said-family-control-company-300-years-january-2019-10 …,2019-10-19 12:51:52+00:00,0,0,0,,,
754,1185539016013299712,https://twitter.com/TokyoHappenings/status/1185539016013299712,TokyoHappenings,,SoftBank eyes WeWork rescue valuation below $8 billion https://www.japantimes.co.jp/?post_type=news&p=2258060 …,2019-10-19 12:51:42+00:00,0,0,0,,,
755,1185538789462163456,https://twitter.com/toughbunny1/status/1185538789462163456,toughbunny1,jaypalter,Oh- so this is why I have seen revolut called the wework of Fintech,2019-10-19 12:50:48+00:00,0,1,1,,,
756,1185538683505504256,https://twitter.com/dayplusinfo/status/1185538683505504256,dayplusinfo,,ソフトバンクG、WeWork混乱にどう対応？ 5400億円支援報道も...次の一手は（J-CASTニュース） | DayPlus - https://dayplus.info/economy-6047/ #news #ニュース #経済,2019-10-19 12:50:23+00:00,0,0,0,,#news #ニュース #経済,
757,1185538435366260737,https://twitter.com/stomcat_MSC_fan/status/1185538435366260737,stomcat_MSC_fan,,WeworkもUberも、許認可や特許で排他しない限り、類似サービスとの価格競争から逃れられず、勝者総取りにはならない。 ソフトバンクG、WeWork混乱にどう対応？ 5400億円支援報道も...次の一手は https://www.j-cast.com/2019/10/19370466.html … @jcast_news,2019-10-19 12:49:23+00:00,0,0,0,@jcast_news,,
758,1185538410045415424,https://twitter.com/businesstjp/status/1185538410045415424,businesstjp,,ソフトバンクG、WeWork混乱にどう対応？ 5400億円支援報道も...次の一手は https://ift.tt/2P0Q7Dj タグ： #ビジネス #マネー,2019-10-19 12:49:17+00:00,0,0,0,,#ビジネス #マネー,
759,1185538106394664960,https://twitter.com/oliver_rees/status/1185538106394664960,oliver_rees,,Adam Neumann planned for his children and grandchildren to control WeWork https://tcrn.ch/35Wa98e via @techcrunch,2019-10-19 12:48:05+00:00,0,0,0,@techcrunch,,
760,1185538063621115904,https://twitter.com/FairfieldMarlin/status/1185538063621115904,FairfieldMarlin,,Midwest Marlins 12u Softball getting after it this AM with some weighted bat training and girls are killing it!! Let’s go ladies! #MarlinFam #WeWork pic.twitter.com/LpPrHl7KPC,2019-10-19 12:47:55+00:00,1,12,12,,#MarlinFam #WeWork,
761,1185537652566552576,https://twitter.com/ryukbk/status/1185537652566552576,ryukbk,,議決権種類株式を通じ創業者が子々孫々の代に渡るまで上場企業を永久にコントロールしていくという資本主義時代の世襲貴族。WeWorkとか風向き微妙だからこういう眉を顰めるような社員集会での発言が暴露されるもののそうでなかったら出てこないと考えると危険 https://techcrunch.com/2019/10/18/adam-neumann-planned-for-his-children-and-grandchildren-to-control-wework/ …,2019-10-19 12:46:17+00:00,0,0,0,,,
762,1185537538296958976,https://twitter.com/sagano10886581/status/1185537538296958976,sagano10886581,,ソフトバンクＧ、さらにＣＤＳ上昇－WeWorkで悪材料続く (ブルームバーグ) https://news.line.me/issue/oa-bloomberg/899196cfb09b?utm_source=Twitter&utm_medium=share&utm_campaign=none&share_id=ODL71489114138 … #linenews ソフトバンク破綻秒読み段階へか？,2019-10-19 12:45:50+00:00,2,2,2,,#linenews,
763,1185537428410585088,https://twitter.com/ReverendDrDash/status/1185537428410585088,ReverendDrDash,seefergvick,I think the landlords would work something out if the WeWork deals allow it because cash is cash.,2019-10-19 12:45:23+00:00,0,1,1,,,
764,1185537235405262850,https://twitter.com/teyllan/status/1185537235405262850,teyllan,,「WeWork Valuationが現金不足から崩壊し、香港のオフィス市場を押しつぶす可能性がある WeWorkは「 市場のトップで長いリースを取り、その後市場は変わりました。」」 WeWork Valuation Collapse From Cash Crunch Could Crush Hong Kong Office Market | Zero Hedge https://www.zerohedge.com/markets/wework-cash-crunch-could-be-disastrous-hong-kong-office-market …,2019-10-19 12:44:37+00:00,0,0,0,,,
765,1185537111937564672,https://twitter.com/dorarytt/status/1185537111937564672,dorarytt,,ソフトバンクがトレンドにあったから、WeWork関連のニュースかと思ったら日本シリーズ始まっただけだった,2019-10-19 12:44:08+00:00,0,0,0,,,
766,1185536939186741248,https://twitter.com/HayabusaM5/status/1185536939186741248,HayabusaM5,,どういう理屈でウィーワークにこれだけの企業価値があると思ったのか孫さんに聞いてみたい WeWorkの企業価値、1月比8割減8700億円に 海外報道: 日本経済新聞 https://www.nikkei.com/article/DGXMZO51176380Z11C19A0000000/ …,2019-10-19 12:43:27+00:00,0,0,0,,,
767,1185536310863433728,https://twitter.com/DataNeutrality/status/1185536310863433728,DataNeutrality,villi,Wonder how much of @wework's M&A was in stock & how those investors/founders are feeling about now. Putting corks back in champagne bottles. https://twitter.com/villi/status/1185300281803694080 …,2019-10-19 12:40:57+00:00,0,0,0,@wework,,
768,1185536214725619712,https://twitter.com/emerald88844/status/1185536214725619712,emerald88844,,ソフトバンクＧ、さらにＣＤＳ上昇－WeWorkで悪材料続く https://www.bloomberg.co.jp/news/articles/2019-10-18/PZJQNQDWX2PV01?utm_source=twitter&utm_campaign=socialflow-organic&utm_medium=social&cmpid%3D=socialflow-twitter-japan&utm_content=japan …,2019-10-19 12:40:34+00:00,2,1,1,,,
769,1185535945858260994,https://twitter.com/seefergvick/status/1185535945858260994,seefergvick,ReverendDrDash,Yep I’m reading the article now!!! One of our major health care places is in a WeWork here in DC. If they are booted that’s going to be a major blow to them. Their main building is still being built they went to WeWork as a temp place.,2019-10-19 12:39:30+00:00,0,0,0,,,
770,1185535719038771202,https://twitter.com/edmlmd/status/1185535719038771202,edmlmd,,Adam Neumann planned for his children and grandchildren to control WeWork https://ift.tt/31x5hTs 70,2019-10-19 12:38:36+00:00,0,0,0,,,
771,1185535460623429633,https://twitter.com/KG_Mogane/status/1185535460623429633,KG_Mogane,EdGrapeNutZimm,In what universe is wework a software company let alone a tech company @business,2019-10-19 12:37:34+00:00,0,0,0,@business,,
772,1185535349772169216,https://twitter.com/realbobstarr/status/1185535349772169216,realbobstarr,TechCrunch,One last nepotism story for the week #WeWork https://twitter.com/TechCrunch/status/1185320570898059266 …,2019-10-19 12:37:08+00:00,0,0,0,,#WeWork,
773,1185535317278937088,https://twitter.com/CreativeConstr/status/1185535317278937088,CreativeConstr,,#SoftBank Eyes #WeWork Rescue Valuation Below $8 Billion https://buff.ly/2BqTmMw #unicorns #valuation,2019-10-19 12:37:00+00:00,0,0,0,,#SoftBank #WeWork #unicorns #valuation,
774,1185535096905842688,https://twitter.com/_keizai_news/status/1185535096905842688,_keizai_news,,ソフトバンクG、WeWork混乱にどう対応？ 5400億円支援報道も...次の一手は - J-CASTニュース https://www.j-cast.com/2019/10/19370466.html …,2019-10-19 12:36:07+00:00,0,0,0,,,
775,1185535029579075589,https://twitter.com/seefergvick/status/1185535029579075589,seefergvick,ReverendDrDash,Wait WeWork is failing????,2019-10-19 12:35:51+00:00,0,0,0,,,
776,1185534883730296832,https://twitter.com/yuki_mimu/status/1185534883730296832,yuki_mimu,,トレンドにあったソフトバンク、WeWorkのニュースのリンクが貼られているが、今のトレンドそっちじゃねぇよって思った。笑 pic.twitter.com/28bs4cZMlA,2019-10-19 12:35:17+00:00,0,2,2,,,
777,1185534870644084738,https://twitter.com/haroron001/status/1185534870644084738,haroron001,,トレンドのソフトバンクは日本シリーズだから入ってるんだろうけど、WeWorkに関する記事が出てきてるのじわる pic.twitter.com/HuYRUS9ysC,2019-10-19 12:35:13+00:00,0,0,0,,,
778,1185534557820346369,https://twitter.com/you152383133/status/1185534557820346369,you152383133,SUG103258_666,孫さんよりも、SBよりも、wework よりも私を勝たせてください！ I want to be a winner !!!!!!!!!!!,2019-10-19 12:33:59+00:00,0,8,8,,,
779,1185534543610159105,https://twitter.com/EdGrapeNutZimm/status/1185534543610159105,EdGrapeNutZimm,business,“The rally in software stocks came to a stop as WeWork withdrew its” #IPOhttps://twitter.com/business/status/1185531011557478400 …,2019-10-19 12:33:56+00:00,1,3,3,,#IPOhttps,
780,1185533815177056256,https://twitter.com/CurrentNewsLIOS/status/1185533815177056256,CurrentNewsLIOS,,ソフトバンクG、WeWork混乱にどう対応？ 5400億円支援報道も...次の一手は 米シェアオフィス「WeWork（ウィーワーク）」を運営するウィーカンパニーの上場とりやめで、最大の株... https://this.kiji.is/558264085981168737?c=535843299845702753&s=t …,2019-10-19 12:31:02+00:00,0,0,0,,,
781,1185533362024390656,https://twitter.com/ReverendDrDash/status/1185533362024390656,ReverendDrDash,,What WeWork's Demise Could Do to NYC Real Estate https://www.citylab.com/life/2019/10/wework-manhattan-real-estate-coworking-office-space-rental/599338/?utm_source=twitter&utm_term=2019-10-18T20%3A05%3A06&utm_medium=social&utm_campaign=citylab&utm_content=edit-promo?utm_source=twb …,2019-10-19 12:29:14+00:00,0,0,0,,,
782,1185533186450903040,https://twitter.com/ThomasS32918110/status/1185533186450903040,ThomasS32918110,CubicleWarrior_,Maybe that valuation calculated by same method that had wild value on wework until a couple weeks ago,2019-10-19 12:28:32+00:00,0,2,2,,,
