,id,permalink,username,to,text,date,retweets,favorites,replies,mentions,hashtags,geo
1234,1173581307714002944,https://twitter.com/theunicornboard/status/1173581307714002944,theunicornboard,,"Sales Director, East China, Regional Sales: Shanghai, Shanghai, China WeWork About the Role… http://dlvr.it/RDC4vH #startups #jobs #hiring",2019-09-16 12:56:02+00:00,0,0,0,,#startups #jobs #hiring,
1235,1173581245713801216,https://twitter.com/evanepstein/status/1173581245713801216,evanepstein,,"Cautionary tale for every new tech company... important to know ""what's the path to profits"" in an environment with so much (VC) funding and so many loss-making companies (ie. WeWork, Uber...) bc’ shares can go to almost $0 like MoviePass. #corpgovhttps://www.businesswire.com/news/home/20190913005496/en/Board-Directors-Helios-Matheson-Analytics-Forms-Strategic …",2019-09-16 12:55:47+00:00,0,0,0,,#corpgovhttps,
1236,1173581154567512065,https://twitter.com/psarygin/status/1173581154567512065,psarygin,vcstarterkit,i just love how wework gets roasted all the time,2019-09-16 12:55:25+00:00,0,3,3,,,
1237,1173580936073633793,https://twitter.com/ZippyDigital/status/1173580936073633793,ZippyDigital,,NYU professor calls WeWork’s IPO ‘Botox on a lame Unicorn’ and says its price and valuation will be a ‘throne of lies’ - https://zippy.digital/?p=9397,2019-09-16 12:54:33+00:00,0,0,0,,,
1238,1173580754405797893,https://twitter.com/scootdogster/status/1173580754405797893,scootdogster,SRuhle,I think @SoftBank should ask for a Wefund,2019-09-16 12:53:50+00:00,0,1,1,@SoftBank,,
1239,1173580736588328960,https://twitter.com/LiveAssets/status/1173580736588328960,LiveAssets,,10 things in #tech you need to know today Learn more: https://buff.ly/2LVo4lB #WeWork #technology #business #news #app #web #security #digital #recruiting #staffing #retail #LiveAssets #MondayMotivationpic.twitter.com/XiOt4eQkIj,2019-09-16 12:53:46+00:00,0,0,0,,#tech #WeWork #technology #business #news #app #web #security #digital #recruiting #staffing #retail #LiveAssets #MondayMotivationpic,
1240,1173580733648125952,https://twitter.com/Glowhillbeauty/status/1173580733648125952,Glowhillbeauty,,방금 사진을 게시했습니다 wework https://www.instagram.com/p/B2eQl3sns6K/?igshid=tnaeq37ecamh …,2019-09-16 12:53:45+00:00,0,0,0,,,
1241,1173580731173494785,https://twitter.com/milkpapi_oke/status/1173580731173494785,milkpapi_oke,,They should just buy WeWork and let the CEO of them run the oil show.. would send a signal as well.. he has a different religion.,2019-09-16 12:53:45+00:00,0,0,0,,,
1242,1173580418806898688,https://twitter.com/Grohganz/status/1173580418806898688,Grohganz,,"Vortrag ""Alles neu?! Verändern New Work, VR, AR, KI & Co. unsere Arbeitswelt"" Wann: 08.10.2019 um 18:30 Uhr Wo: wework Europa Passage, Hermannstr. 13 #NewWork #Business #Zukunft #Arbeit #KI #VR #AR #Innovation #Future #digital #VirtualAssistent #agil #Digitalisierungpic.twitter.com/JcRbEzVxkA",2019-09-16 12:52:30+00:00,0,1,1,,#NewWork #Business #Zukunft #Arbeit #KI #VR #AR #Innovation #Future #digital #VirtualAssistent #agil #Digitalisierungpic,
1243,1173580241198972930,https://twitter.com/LLangostine/status/1173580241198972930,LLangostine,SRuhle,Am I supposed to know what . @wework is? https://twitter.com/SRuhle/status/1173578186938097665 …,2019-09-16 12:51:48+00:00,0,0,0,@wework,,
1244,1173580150409179136,https://twitter.com/PrimeGlobalBuzz/status/1173580150409179136,PrimeGlobalBuzz,,"Last week, our New York colleagues celebrated Prime Global's #exciting office move to 9th Avenue! Check out the photos below. #PrimeGlobalPeople #OfficeMove #NewYork #MedComms #Pharma @WeWork pic.twitter.com/2mPyfYegZw",2019-09-16 12:51:26+00:00,2,4,4,@WeWork,#exciting #PrimeGlobalPeople #OfficeMove #NewYork #MedComms #Pharma,
1245,1173580139336220672,https://twitter.com/weltfern_tech/status/1173580139336220672,weltfern_tech,,"Ankündigung für den Vortrag ""Alles neu?! Verändern New Work, VR, AR, KI & Co. unsere Arbeitswelt"" Wann: 08.10.2019 um 18:30 Uhr Wo: wework Europa Passage, Hermannstr. 13 #NewWork #Business #Zukunft #Arbeit #KI #VR #AR #Innovation #Future #digital #VirtualAssistent #agilpic.twitter.com/uwr1y2esnH",2019-09-16 12:51:23+00:00,2,4,4,,#NewWork #Business #Zukunft #Arbeit #KI #VR #AR #Innovation #Future #digital #VirtualAssistent #agilpic,
1246,1173579800138510337,https://twitter.com/tryanderror23/status/1173579800138510337,tryanderror23,,appleのスタートはガレージだけど、最近のイキってるスタートアップは、weworkだったり内装を凝りに凝ったオフィスだったりするの面白いね。 内装屋だけ儲かる,2019-09-16 12:50:03+00:00,0,0,0,,,
1247,1173579626544881665,https://twitter.com/theadambalsam/status/1173579626544881665,theadambalsam,Evan_Petitt7,The world’s most underrated #PropTech legend @ZacharyAarons on @cnbc talking #WeWork. cc @MetaPropNYChttps://twitter.com/Evan_Petitt7/status/1173579079787929600 …,2019-09-16 12:49:21+00:00,1,10,10,@ZacharyAarons @cnbc @MetaPropNYChttps,#PropTech #WeWork,
1248,1173579538120478721,https://twitter.com/WeWork/status/1173579538120478721,WeWork,,How can brands better broadcast their message to new audiences via social media? WeWork member company Social Studies has the answers: https://we.co/socialstudiestw . #weworkmember #wework,2019-09-16 12:49:00+00:00,0,9,9,,#weworkmember #wework,
1249,1173579472458723334,https://twitter.com/pfersht/status/1173579472458723334,pfersht,vijayasankarv,We're checking out @WeWork Chicago today... Stay tuned @saurabh_hfshttps://twitter.com/vijayasankarv/status/1173379304912125953 …,2019-09-16 12:48:44+00:00,0,1,1,@WeWork @saurabh_hfshttps,,
1250,1173579436308017153,https://twitter.com/jg_mendoza/status/1173579436308017153,jg_mendoza,,WeWork anticipa el derrumbe de otras 15 empresas: https://mailchi.mp/cartafinanciera.com/mercado-libre-entre-las-que-ms-caern-355243 … @Miguel_Boggiano,2019-09-16 12:48:36+00:00,0,0,0,@Miguel_Boggiano,,
1251,1173579242061422594,https://twitter.com/EricEElliott/status/1173579242061422594,EricEElliott,Hipster_Trader,I hope they make up the pay gap in Peloton and WeWork stock...,2019-09-16 12:47:50+00:00,0,0,0,,,
1252,1173579079787929600,https://twitter.com/Evan_Petitt7/status/1173579079787929600,Evan_Petitt7,,Who better to talk #WeWork IPO on @CNBC than the man who's invested in three #startups acquired by the flex space behemoth? Way to go @ZacharyAarons aka The High Priest of #PropTech!! Always the most knowledgable guy in the room. @MetaPropNYC @SquawkCNBC @spacioushq @ManagedbyQpic.twitter.com/Odp2m9mAiT,2019-09-16 12:47:11+00:00,8,36,36,@CNBC @ZacharyAarons @MetaPropNYC @SquawkCNBC @spacioushq @ManagedbyQpic,#WeWork #startups #PropTech,
1253,1173579043989442566,https://twitter.com/debbychiukitmei/status/1173579043989442566,debbychiukitmei,SRuhle,,2019-09-16 12:47:02+00:00,0,0,0,,,
1254,1173578879426080768,https://twitter.com/statuptechindia/status/1173578879426080768,statuptechindia,,NYU professor calls WeWork's IPO 'Botox on a lame Unicorn' and says its price and valuation will be a 'throne of lies' https://ift.tt/34NwyE5 https://ift.tt/eA8V8J,2019-09-16 12:46:23+00:00,0,0,0,,,
1255,1173578576265977856,https://twitter.com/News1English/status/1173578576265977856,News1English,,Zappa and Spring Geffen will run a work complex for WeWork https://www.news1.news/il/2019/09/zappa-and-spring-geffen-will-run-a-work-complex-for-wework.html …pic.twitter.com/YKWcjlvM8a,2019-09-16 12:45:11+00:00,0,0,0,,,
1256,1173578186938097665,https://twitter.com/SRuhle/status/1173578186938097665,SRuhle,profgalloway,"Since @WeWork is open to adding board members, Imagine if they tapped @profgalloway. He certainly knows the companyhttps://twitter.com/profgalloway/status/1173345054506803200 …",2019-09-16 12:43:38+00:00,5,48,48,@WeWork @profgalloway,,
1257,1173578081010900997,https://twitter.com/dmlevitt/status/1173578081010900997,dmlevitt,,#CMBS analysts question 'inherent risk' in #WeWork+ #coworking. `The company has yet to post a profit or experience a downturn' #CRE #NYC #SanFran #Morningstar #StandardandPoors #IPOhttps://therealdeal.com/national/2019/09/13/inherent-risk-ratings-agencies-have-had-doubts-about-wework-for-years/?utm_medium=social&utm_source=twitter&utm_campaign=single_content_share …,2019-09-16 12:43:13+00:00,0,0,0,,#CMBS #WeWork #coworking #CRE #NYC #SanFran #Morningstar #StandardandPoors #IPOhttps,
1258,1173577972604899328,https://twitter.com/PrinceValiant16/status/1173577972604899328,PrinceValiant16,,NYU professor calls WeWork's IPO 'Botox on a lame Unicorn' and says its price and valuation will be a 'throne of lies' https://www.businessinsider.com/nyu-professor-slams-wework-ipo-as-botox-on-a-lame-unicorn-2019-9?utm_source=twitter&utm_medium=referral&utm_content=topbar&utm_term=mobile&referrer=twitter … via @businessinsider,2019-09-16 12:42:47+00:00,0,1,1,@businessinsider,,
1259,1173577853608374272,https://twitter.com/EuroPleasureMac/status/1173577853608374272,EuroPleasureMac,,NYU professor calls WeWork's IPO 'Botox on a lame Unicorn' and says its price and valuation will be a 'throne of lies' https://www.businessinsider.com/nyu-professor-slams-wework-ipo-as-botox-on-a-lame-unicorn-2019-9?utm_source=twitter&utm_medium=referral&utm_content=topbar&utm_term=mobile&referrer=twitter … via @businessinsider,2019-09-16 12:42:18+00:00,0,0,0,@businessinsider,,
1260,1173577507666374656,https://twitter.com/HerestheFuture/status/1173577507666374656,HerestheFuture,,Spaces is just as bad as WeWork but without the beer. tbh I miss @TQams,2019-09-16 12:40:56+00:00,0,3,3,@TQams,,
1261,1173577503270735873,https://twitter.com/WillemKadijk/status/1173577503270735873,WillemKadijk,PolemicTMM,WeWork is jewish,2019-09-16 12:40:55+00:00,0,0,0,,,
1262,1173577135610617858,https://twitter.com/SinaYilu/status/1173577135610617858,SinaYilu,,NYU professor slams WeWork IPO as 'botox on a lame unicorn' - Business Insider https://www.businessinsider.com/nyu-professor-slams-wework-ipo-as-botox-on-a-lame-unicorn-2019-9 …,2019-09-16 12:39:27+00:00,0,0,0,,,
1263,1173577084800765952,https://twitter.com/the_chrismc/status/1173577084800765952,the_chrismc,,"my future-facing-hot-take for today: #wework would be much more sensible as a franchise model (selling the IP, community, interior design, operations, payments, etc. to landlords or local mgmt - scalable & profitable, min. risk)",2019-09-16 12:39:15+00:00,0,1,1,,#wework,
1264,1173577073304248320,https://twitter.com/vidalvilloria/status/1173577073304248320,vidalvilloria,Statista_ES,"Interesante… pero quizá haya que actualizar WeWork a entre 10 y 12, según decía Reuters el viernes https://www.reuters.com/article/us-wework-ipo-valuation-exclusive/exclusive-wework-considers-ipo-valuation-of-as-low-as-10-billion-sources-idUSKCN1VY1PB … o como mucho, hasta 20, según WSJhttps://www.wsj.com/articles/wework-to-list-shares-on-nasdaq-make-governance-changes-11568348421 …",2019-09-16 12:39:12+00:00,0,0,0,,,
1265,1173576911362187264,https://twitter.com/IanGertler/status/1173576911362187264,IanGertler,Katadhin,"The Photofy team rocks, John! You guys just finished the new HQ studio too, right? And I heard about the big @REMAX partnership ... enabling 125,000 agents with the power of branded content. Understanding people, then personalizing. #ContentMarketing to build relationships.",2019-09-16 12:38:34+00:00,0,3,3,@REMAX,#ContentMarketing,
1266,1173576710215938049,https://twitter.com/KingKreuger/status/1173576710215938049,KingKreuger,jimbojoyce,What is so revolutionary ?? Watch Sam Sell interview CNBC,2019-09-16 12:37:46+00:00,0,1,1,,,
1267,1173576651466317824,https://twitter.com/treybarrineau/status/1173576651466317824,treybarrineau,,"""However the IPO goes, WeWork’s difficulties hitting the stock market should – but probably won’t – spark soul searching among those who start companies and support them with financing in Silicon Valley, on Wall Street and far beyond."" https://beta.washingtonpost.com/business/wework-isnt-solving-its-biggest-problem/2019/09/13/3f89b5ae-d63e-11e9-8924-1db7dac797fb_story.html …",2019-09-16 12:37:32+00:00,0,0,0,,,
1268,1173576527063191553,https://twitter.com/benzi_gispan/status/1173576527063191553,benzi_gispan,,בחירות 2019 מועד ב&#039; - איקאה מול wework https://www.zman.co.il/39017/ via @zmanisrael,2019-09-16 12:37:02+00:00,0,0,0,@zmanisrael,#039,
1269,1173576400000835584,https://twitter.com/theunicornboard/status/1173576400000835584,theunicornboard,,"Manager, Global Expansion - Ventures: New York, New York, United States of America WeWork… http://dlvr.it/RDC1Z2 #startups #jobs #hiring",2019-09-16 12:36:32+00:00,0,0,0,,#startups #jobs #hiring,
1270,1173576357101678592,https://twitter.com/PolemicTMM/status/1173576357101678592,PolemicTMM,,IPO mergers .. perhaps Aramco could team up with WeWork,2019-09-16 12:36:22+00:00,2,17,17,,,
1271,1173576199152504832,https://twitter.com/NICEBROgg/status/1173576199152504832,NICEBROgg,,"NYU professor calls WeWork’s IPO ‘Botox on a lame Unicorn’ and says its price and valuation will be a ‘throne of lies’ | NYU professor Scott Galloway, known for his fiery tech punditry, has descr ... https://nicebrogg.com/?p=83956",2019-09-16 12:35:44+00:00,0,0,0,,,
1272,1173575723443007488,https://twitter.com/syldube47/status/1173575723443007488,syldube47,,"L’investissement de 1,3 milliard $de la Caisse de dépôt et placement du #Québec dans un fonds immobilier de WeWork fait sourciller | WeWork n’y injectera pas plus de 25 millions $américains. https://www.tvanouvelles.ca/2019/09/16/un-pari-de-13-milliard--qui-fait-sourciller … #polqc",2019-09-16 12:33:51+00:00,1,1,1,,#Québec #polqc,
1273,1173575374007132167,https://twitter.com/ComAware_4S/status/1173575374007132167,ComAware_4S,,Has the US flotation (IPO) bubble burst? One of the most hotly anticipated stock market listings of the year - the flotation of office property rental firm WeWork - is now in doubt. https://www.bbc.co.uk/news/business-49687338 …,2019-09-16 12:32:27+00:00,0,2,2,,,
1274,1173575328343756801,https://twitter.com/Jeannette_Bot/status/1173575328343756801,Jeannette_Bot,,10 Things To Know. NYU professor calls WeWork's IPO 'Botox on a lame Unicorn' and says its price and valuation will be a 'throne of lies' https://ift.tt/34MJl9R,2019-09-16 12:32:16+00:00,0,0,0,,,
1275,1173575258307252224,https://twitter.com/n_w_x/status/1173575258307252224,n_w_x,,[ExpeditionNWX Day 1] Découverte de l'écosystème tech israélien ce matin avec la visite de impact lab wework #incubateur et de Terra ventures partners #vcpic.twitter.com/sOPz2VYay9,2019-09-16 12:32:00+00:00,4,9,9,,#incubateur #vcpic,
1276,1173575093387177986,https://twitter.com/JohnAngel1977/status/1173575093387177986,JohnAngel1977,,NYU professor calls WeWork's IPO 'Botox on a lame Unicorn' and says its price and valuation will be a 'throne of lies' https://ift.tt/34MJl9R johnangel1977,2019-09-16 12:31:20+00:00,0,0,0,,,
1277,1173575057601441792,https://twitter.com/Ree_elhuisseny/status/1173575057601441792,Ree_elhuisseny,,WeWork considers dramatic valuation cut in IPO http://po.st/P1i0Sb via @ChannelNewsAsia,2019-09-16 12:31:12+00:00,0,0,0,@ChannelNewsAsia,,
1278,1173574835789647872,https://twitter.com/SeekingAlpha/status/1173574835789647872,SeekingAlpha,,$WE - WeWork Doesn't Practice What It Preaches https://seekingalpha.com/article/4291713-wework-practice-preaches?source=feed_f&utm_campaign=twitter_automated&utm_medium=social&utm_source=twitter …,2019-09-16 12:30:19+00:00,0,1,1,,,
1279,1173574529123278850,https://twitter.com/Ree_elhuisseny/status/1173574529123278850,Ree_elhuisseny,,"What does the post IPO valuation for WeWork, Lyft & Uber mean for the startup world?",2019-09-16 12:29:06+00:00,0,0,0,,,
1280,1173574409417887745,https://twitter.com/credemographics/status/1173574409417887745,credemographics,,Flex Office Space: Much More Than Just WeWork http://bit.ly/32J6CaJ #realestate #CREpic.twitter.com/vSDWBxQUsx,2019-09-16 12:28:37+00:00,0,0,0,,#realestate #CREpic,
1281,1173574371954311168,https://twitter.com/Ree_elhuisseny/status/1173574371954311168,Ree_elhuisseny,,So Wework's IPO didn't turn out as planned with $12B valuation which is less than $47B valuation achieved in Jan. Major hit to Softbank Fund that is currently in the process to raise fund 2.0.,2019-09-16 12:28:28+00:00,0,0,0,,,
1282,1173574364735922182,https://twitter.com/jazzdrummer420/status/1173574364735922182,jazzdrummer420,,NYU professor calls WeWork's IPO 'Botox on a lame Unicorn' and says its price and valuation will be a 'throne of lies' https://ift.tt/34MJl9R,2019-09-16 12:28:27+00:00,0,0,0,,,
1283,1173574267058843648,https://twitter.com/luo_tokyo/status/1173574267058843648,luo_tokyo,,・ギフトを贈り合うのはコミュニケーションそのもの ・weworkは、オフィス内ネットワーキングが初期の成長の鍵 ・ニュースアプリは「共通の話題」をコピーに採用 ・ゴルフも喫煙室もキャバクラも会話の手段 ・CMもメーカーにとっては店舗向け営業の手段 会話の媒介物はいつだってニーズがあるみたい,2019-09-16 12:28:03+00:00,0,2,2,,,
1284,1173574183873175552,https://twitter.com/MasiroWisteria/status/1173574183873175552,MasiroWisteria,,米WeWork、上場先はナスダックに 目論見書を提出 :日本経済新聞: https://www.nikkei.com/article/DGXMZO49827480U9A910C1000000/ …,2019-09-16 12:27:44+00:00,0,0,0,,,
1285,1173574145285611520,https://twitter.com/HPTarget/status/1173574145285611520,HPTarget,,NYU professor calls WeWork's IPO 'Botox on a lame Unicorn' and says its price and valuation will be a 'throne of lies' http://dlvr.it/RDC040 #bigbusiness #educationpic.twitter.com/MrS9LciZWD,2019-09-16 12:27:34+00:00,0,0,0,,#bigbusiness #educationpic,
1286,1173574139522760704,https://twitter.com/PRNewswireIL/status/1173574139522760704,PRNewswireIL,,#WeWork #Rio #Centro and #HERE #Mobility #Partner to #Offer a #New #Mobility #Experience to the #Local #WeWork #Community http://ow.ly/tG9Y50wbmHz @HEREMobility,2019-09-16 12:27:33+00:00,0,0,0,@HEREMobility,#WeWork #Rio #Centro #HERE #Mobility #Partner #Offer #New #Mobility #Experience #Local #WeWork #Community,
1287,1173573986971717633,https://twitter.com/LarocqueSyl/status/1173573986971717633,LarocqueSyl,,"Un pari qui fait sourciller: la Caisse de dépôt donne une grande latitude à WeWork pour un investissement de 1,3 milliard $https://www.journaldemontreal.com/2019/09/16/un-pari-de-13-milliard-qui-fait-sourciller …",2019-09-16 12:26:57+00:00,2,2,2,,,
1288,1173573683799109632,https://twitter.com/finam_blog/status/1173573683799109632,finam_blog,,"WeWork может значительно снизить оценку перед IPO Компания может снизить свою оценку до $10-12 млрд, что почти в пять раз меньше суммы, в которую компания оценивалась в начале текущего года http://tinyurl.com/yypqgrqc",2019-09-16 12:25:44+00:00,1,0,0,,,
1289,1173573637431017473,https://twitter.com/CGoodwolf/status/1173573637431017473,CGoodwolf,,"Ultimately @WeWork will fail to raise the capital they want to get through the IPO. They will most likely have a second offering, then slowly start to die before the final nail is put in the coffin. I don't see $WE IPO going anywhere and I'm certainly not going to buy the stock.",2019-09-16 12:25:33+00:00,0,0,0,@WeWork,,
1290,1173573304386539521,https://twitter.com/iFortknox/status/1173573304386539521,iFortknox,,WeWork's valuation is dropping faster than panties when sex is offered and this is before being listed... I know fraud when I see one lol,2019-09-16 12:24:14+00:00,0,0,0,,,
1291,1173572766915710976,https://twitter.com/askasumihara/status/1173572766915710976,askasumihara,,明日のイベント準備な今宵。文化祭とかしたことないからわからないけど、そんな感じでちょっと楽しい Shake'n Popローンチイベント @WeWork Iceberg 9/17 18:00-20:00 完全招待制です。 pic.twitter.com/NvLHAuz5Ik,2019-09-16 12:22:06+00:00,0,1,1,@WeWork,,
1292,1173572631661953024,https://twitter.com/loukwok/status/1173572631661953024,loukwok,,Flex Office Space: Much More Than Just WeWork http://dlvr.it/RDBzBK pic.twitter.com/ArqfjWmwFA,2019-09-16 12:21:33+00:00,0,0,0,,,
1293,1173572485746429955,https://twitter.com/consultmonique/status/1173572485746429955,consultmonique,,"This Week on Monday: What is your worth? All public relations is not good especially when it is primarily in the spirit of damage control. Just ask WeWork and SoftBank Group International. Now, much of The We Company’s PR problem is their own making. If…https://lnkd.in/ejxT6JA",2019-09-16 12:20:59+00:00,0,0,0,,,
1294,1173571956597239808,https://twitter.com/orafaaraujo/status/1173571956597239808,orafaaraujo,,Bem legal o novo escritório na WeWork pic.twitter.com/40Jh2SWy76,2019-09-16 12:18:53+00:00,0,12,12,,,
1295,1173571850422669312,https://twitter.com/TEZNYC/status/1173571850422669312,TEZNYC,businessinsider,"Lyft, Uber etc... own no cars but they’re the largest ride-share companiesin the world. There’s got to be some value to WeWork",2019-09-16 12:18:27+00:00,0,0,0,,,
1296,1173571818885713920,https://twitter.com/mybroadband/status/1173571818885713920,mybroadband,,WeWork's IPO could be a disaster https://mybroadband.co.za/news/business/320177-weworks-ipo-could-be-a-disaster.html …,2019-09-16 12:18:20+00:00,0,2,2,,,
1297,1173571633576964097,https://twitter.com/try_language/status/1173571633576964097,try_language,businessinsider,@WeWork,2019-09-16 12:17:36+00:00,0,0,0,@WeWork,,
1298,1173571393222578176,https://twitter.com/businessinsider/status/1173571393222578176,businessinsider,,NYU professor calls WeWork's IPO 'Botox on a lame Unicorn' and says its price and valuation will be a 'throne of lies' http://www.businessinsider.com/nyu-professor-slams-wework-ipo-as-botox-on-a-lame-unicorn-2019-9 …,2019-09-16 12:16:38+00:00,10,24,24,,,
1299,1173570545465679873,https://twitter.com/TechCentral/status/1173570545465679873,TechCentral,,ANALYSIS | A WeWork IPO flop could signal the end of the unicorn era https://techcentral.co.za/a-wework-ipo-flop-could-signal-the-end-of-the-unicorn-era/92627/ …pic.twitter.com/GAa7DdHAVe,2019-09-16 12:13:16+00:00,0,0,0,,,
1300,1173570372471418880,https://twitter.com/pure_sophy/status/1173570372471418880,pure_sophy,ChronoMerchant,これは、大手企業がweworkに入っていることを考えると、賃料高い一等地に、無駄なスペースを抱えている大手企業が、経費節約として、Weworkに移転するメリットがあると思う。 https://twitter.com/ChronoMerchant/status/1172835840302538753 …,2019-09-16 12:12:35+00:00,0,1,1,,,
1301,1173570033366290432,https://twitter.com/SowellColumn/status/1173570033366290432,SowellColumn,,"Uber and Lyft are, essentially, a charity dedicated to shuttling people among airports, hotels, WeWork 'ho... http://po.st/aDRVd4 via @po_st",2019-09-16 12:11:14+00:00,0,2,2,@po_st,,
1302,1173569485342674944,https://twitter.com/TeleGeography/status/1173569485342674944,TeleGeography,,SoftBank Group Corp targets USD750m worth of shares in WeWork IPO; investors clamour for bonds: #telecomshttp://bit.ly/2I9LO4B,2019-09-16 12:09:03+00:00,0,0,0,,#telecomshttp,
1303,1173569030596247552,https://twitter.com/Katadhin/status/1173569030596247552,Katadhin,IanGertler,"I'll stick with @PhotofyApp, more profitable than @WeWork, @lyft and @Uber combined. Throw in a @smiledirectclub for good measure...",2019-09-16 12:07:15+00:00,0,5,5,@PhotofyApp @WeWork @lyft @Uber @smiledirectclub,,
1304,1173568904058351617,https://twitter.com/mencke/status/1173568904058351617,mencke,,Seems greedy and could have been done way sooner. WeWork considers even lower valuation amid investor concerns | PitchBook https://pitchbook.com/news/articles/wework-may-cut-valuation-again-amid-investor-concerns … via @PitchBook,2019-09-16 12:06:45+00:00,0,0,0,@PitchBook,,
1305,1173568803294326784,https://twitter.com/mrtjuste/status/1173568803294326784,mrtjuste,JGF92,Este hilo de @JGF92 explica genial lo que está pasando con #WeWork. ¿Hay motivos para desconfiar en esta empresa? https://twitter.com/JGF92/status/1173546448975290368 …,2019-09-16 12:06:21+00:00,2,5,5,@JGF92,#WeWork,
1306,1173568779047055360,https://twitter.com/stand_4_america/status/1173568779047055360,stand_4_america,,Exclusive: WeWork considers IPO valuation of as low as $10 billion – sources FILE PHOTO: The WeWork logo is http://rviv.ly/jhHlkI,2019-09-16 12:06:15+00:00,0,0,0,,,
1307,1173568604132036608,https://twitter.com/PchBasketball/status/1173568604132036608,PchBasketball,,CaneGang in the building yesterday ... #WEWORK @PrepHoopsTop250pic.twitter.com/lZM40WLxav,2019-09-16 12:05:33+00:00,4,17,17,@PrepHoopsTop250pic,#WEWORK,
1308,1173568496606883840,https://twitter.com/HedgeBz/status/1173568496606883840,HedgeBz,,WeWork IPO spells rough landing for CEO Neumann https://tradeforprofit.net/2019/09/wework-ipo-spells-rough-landing-for-ceo-neumann/?utm_source=ReviveOldPost&utm_medium=social&utm_campaign=ReviveOldPost … #businessnews #energy,2019-09-16 12:05:08+00:00,0,0,0,,#businessnews #energy,
1309,1173568079089098754,https://twitter.com/mayhersays/status/1173568079089098754,mayhersays,,WeWork IPO today. Don’t say I didn’t tell you,2019-09-16 12:03:28+00:00,0,2,2,,,
1310,1173567711575793665,https://twitter.com/heshnarayanan/status/1173567711575793665,heshnarayanan,,. @WeWork Considers Slashing Its #IPO Valuation Below $20 Billion https://buff.ly/2NhvYcf pic.twitter.com/GmXVM3gvZr,2019-09-16 12:02:00+00:00,0,0,0,@WeWork,#IPO,
