,id,permalink,username,to,text,date,retweets,favorites,replies,mentions,hashtags,geo
0,1185344758861840384,https://twitter.com/askboomer1949/status/1185344758861840384,askboomer1949,,"Seattle Stranger Slog PM Trump is worse than Hitler (?) edition #Seattle #Stranger #SlogPM RT Slog PM: Studio Ghibli Will Stream, WeWork Is Troubled, Trump Is Worse Than Hitler? https://www.thestranger.com/slog/2019/10/17/41722301/slog-pm-studio-ghibli-will-stream-wework-is-troubled-trump-is-worse-than-hitler …",2019-10-18 23:59:47+00:00,2,0,0,,#Seattle #Stranger #SlogPM,
1,1185344663533715457,https://twitter.com/coderhs/status/1185344663533715457,coderhs,BobbyMagicGuy,Suggest a better tool to discover small community in a new place? I like going hiking with groups or going for Meetups. The http://meetup.org tool helps a lot with that. I haven't been able to find a better alternative.,2019-10-18 23:59:25+00:00,0,1,1,,,
2,1185344200226693121,https://twitter.com/sakura8ryo/status/1185344200226693121,sakura8ryo,,IPO前の盛り上がりがすごいの、インディーズバンドがデビュー直前が一番盛り上がるのに似てるな。 WeWork炎上、ソフトバンク「新ファンド」へ飛び火のワケ https://gendai.ismedia.jp/articles/-/67696 … #マネー現代,2019-10-18 23:57:34+00:00,0,0,0,,#マネー現代,
3,1185344172737384449,https://twitter.com/CJSantarelli/status/1185344172737384449,CJSantarelli,,"“ @WeWork might have pumped the brakes on signing new leases in the city, but its rivals haven’t.“ https://commercialobserver.com/2019/10/knotel-lease-60-madison-avenue-the-moinian-group/#.XapQ-yXzM_A.twitter … #cre #flexoffice @knotel",2019-10-18 23:57:28+00:00,0,0,0,@WeWork @knotel,# #cre #flexoffice,
4,1185343612269154304,https://twitter.com/banawedata/status/1185343612269154304,banawedata,,WeWork Valuation Collapse From Cash Crunch Could Crush Hong Kong Office Market | Zero Hedge https://www.zerohedge.com/markets/wework-cash-crunch-could-be-disastrous-hong-kong-office-market …,2019-10-18 23:55:14+00:00,0,0,0,,,
5,1185343585895383040,https://twitter.com/CryptoWallStre1/status/1185343585895383040,CryptoWallStre1,,Map of the #WeWork DESTRUCTION of the #HongKong Office Market. And Hong Kong is already being shaken by the Protests. WeWork is going to wreak havoc on almost every real estate market on the planet #RealEstate #AdamNeumann #Softbank #StandWithHongHong #HongKongProtestspic.twitter.com/VEs9grBXh8,2019-10-18 23:55:08+00:00,0,0,0,,#WeWork #HongKong #RealEstate #AdamNeumann #Softbank #StandWithHongHong #HongKongProtestspic,
6,1185343479133556736,https://twitter.com/ktckm4649/status/1185343479133556736,ktckm4649,,WeWorkの企業価値 1月比8割減の8700億円に 海外メディア報道 https://www.nikkei.com/article/DGXMZO51176380Z11C19A0000000/ …,2019-10-18 23:54:42+00:00,1,0,0,,,
7,1185343273260290048,https://twitter.com/lhxVqNbgJVE6EIo/status/1185343273260290048,lhxVqNbgJVE6EIo,,孫さんはIPOによって、個人投資家にアホな値段で売り付けてババ引かせようとしたけどもう無理だね。 WeWorkの企業価値 1月比8割減の8700億円に 海外メディア報道：日本経済新聞 https://www.nikkei.com/article/DGXMZO51176380Z11C19A0000000/ …,2019-10-18 23:53:53+00:00,0,0,0,,,
8,1185342843667107840,https://twitter.com/LisaFurioso/status/1185342843667107840,LisaFurioso,,The local WeWork knock-off thats charging 500 dollars a month for a membership is giving me realy professional vibes pic.twitter.com/BPBIZbvnjB,2019-10-18 23:52:11+00:00,0,0,0,,,
9,1185342663521910789,https://twitter.com/GarrickVance/status/1185342663521910789,GarrickVance,TheWrightView,There's going to be some more discount furniture from the @wework fire sale soon. I'm sure it'll only get better.,2019-10-18 23:51:28+00:00,0,1,1,@wework,,
10,1185342547595419653,https://twitter.com/MattMotsick/status/1185342547595419653,MattMotsick,,"If you are a startup, you really need to get the AMEX Business Platinum card. Free WeWork entry for a year, $200 in airline expense credits, etc.",2019-10-18 23:51:00+00:00,1,7,7,,,
11,1185342044962639872,https://twitter.com/akaido45/status/1185342044962639872,akaido45,,【Wework再生の本気度】 もし本当にこの評価をしたとしたら、 やはりソフトバンクはすごいと思う。 事業のコンセプトが良いものであっても、オペレーションがうまくいかなければ、その価値は下がる。 これはWeworkに... #NewsPickshttps://npx.me/Gy36/p7B7?from=twitter …,2019-10-18 23:49:00+00:00,0,3,3,,#NewsPickshttps,
12,1185341951253667840,https://twitter.com/SamuelHeming/status/1185341951253667840,SamuelHeming,,Goldman writes down value of WeWork stake https://www.propertyweek.com/news/goldman-writes-down-value-of-wework-stake/5104793.article … #London #RealEstate #Propertypic.twitter.com/t68Hi2yXNB,2019-10-18 23:48:38+00:00,0,0,0,,#London #RealEstate #Propertypic,
13,1185341266063695874,https://twitter.com/maloftis1/status/1185341266063695874,maloftis1,CGasparino,No value here.Still scouring...unclear...you’ve said nothing.,2019-10-18 23:45:55+00:00,0,0,0,,,
14,1185340934495576066,https://twitter.com/GLOlivera/status/1185340934495576066,GLOlivera,,"SoftBank and JPMorgan at odds over WeWork rescue. Should Neumann’s equity stake suffer a significant writedown as part of the SoftBank deal, he could face a margin call from JPMorgan, UBS and Credit Suisse. https://www.ft.com/content/a9254a70-f1a8-11e9-bfa4-b25f11f42901?segmentid=acee4131-99c2-09d3-a635-873e61754ec6 …",2019-10-18 23:44:36+00:00,0,2,2,,,
15,1185340493003145217,https://twitter.com/FastiNews/status/1185340493003145217,FastiNews,,Real estate mogul Barry Sternlicht: WeWork went ‘off the rails’ but it’s still a ‘real company’ https://fastinews.com/2019/10/18/real-estate-mogul-barry-sternlicht-wework-went-off-the-rails-but-its-still-a-real-company/ …pic.twitter.com/F8qTNBez7V,2019-10-18 23:42:50+00:00,0,0,0,,,
16,1185340423536906240,https://twitter.com/CryptoTraderPro/status/1185340423536906240,CryptoTraderPro,,WeWork Valuation Collapse From Cash Crunch Could Crush Hong Kong Office Market http://dlvr.it/RGVTWt pic.twitter.com/IKfqlbR0XX,2019-10-18 23:42:34+00:00,0,0,0,,,
17,1185340140962496512,https://twitter.com/todays_luck/status/1185340140962496512,todays_luck,,自己啓発セミナーと孫正義、 ソフトバンク倒産。wework問題、 引き寄せの法則の嘘。 https://youtu.be/i32b5KJ43g4 @YouTubeより,2019-10-18 23:41:26+00:00,0,0,0,@YouTubeより,,
18,1185340096934887424,https://twitter.com/brodie_wright/status/1185340096934887424,brodie_wright,,Why isn't WeWork Broke? https://youtu.be/Cb4CGn4a1Y0 via @YouTube,2019-10-18 23:41:16+00:00,0,0,0,@YouTube,,
19,1185340033034850304,https://twitter.com/kevinGEEdavis/status/1185340033034850304,kevinGEEdavis,,Airbnb’s WeWork problem – TechCrunch https://tcrn.ch/2BrjpTv,2019-10-18 23:41:01+00:00,0,0,0,,,
20,1185339995202080769,https://twitter.com/Tetsuya_Tuchida/status/1185339995202080769,Tetsuya_Tuchida,,話題のWeWork丸の内に行きました。快適だけど、利用料って1人87000円も掛かるんだね。 因みに来年から私たちが行う天竜トライアルオフィスは無料です。 pic.twitter.com/y1REpwVcgi,2019-10-18 23:40:52+00:00,0,0,0,,,
21,1185339985270116352,https://twitter.com/Popupradio06/status/1185339985270116352,Popupradio06,,Adam Neumann planned for his children and grandchildren to control WeWork http://feedproxy.google.com/~r/techcrunch/startups/~3/E5kLmBMFnZA/ …pic.twitter.com/C1KBOm2KBE,2019-10-18 23:40:49+00:00,0,0,0,,,
22,1185339904936599552,https://twitter.com/MaragosAth/status/1185339904936599552,MaragosAth,,"Νέο άρθρο (Ο Adam Neumann σχεδίαζε τα παιδιά και τα εγγόνια του να ελέγχουν την WeWork), Δημοσιεύτηκε στον Fm2 - https://www.fm2.gr/2019/10/19/%ce%bf-adam-neumann-%cf%83%cf%87%ce%b5%ce%b4%ce%af%ce%b1%ce%b6%ce%b5-%cf%84%ce%b1-%cf%80%ce%b1%ce%b9%ce%b4%ce%b9%ce%ac-%ce%ba%ce%b1%ce%b9-%cf%84%ce%b1-%ce%b5%ce%b3%ce%b3%cf%8c%ce%bd%ce%b9%ce%b1-%cf%84/ … | like and retweetpic.twitter.com/NdYqCgqq43",2019-10-18 23:40:30+00:00,0,0,0,,,
23,1185339802033381376,https://twitter.com/replore/status/1185339802033381376,replore,,WeWork炎上、ソフトバンク「新ファンド」へ飛び火のワケ（石原 順） | マネー現代 | 講談社（1/5） https://gendai.ismedia.jp/articles/-/67696 …,2019-10-18 23:40:06+00:00,0,0,0,,,
24,1185339374814318593,https://twitter.com/ShadiYazdan/status/1185339374814318593,ShadiYazdan,,Adam Neumann planned for his children and grandchildren to control WeWork https://ift.tt/2pAie1q,2019-10-18 23:38:24+00:00,0,0,0,,,
25,1185339370984767491,https://twitter.com/dmchodesign/status/1185339370984767491,dmchodesign,,Adam Neumann incorporated Kabbalah into WeWork business https://www.yahoo.com/finance/video/adam-neumann-mixed-spiritual-group-152542874.html?.tsrc=fauxdal …,2019-10-18 23:38:23+00:00,0,0,0,,,
26,1185339334687248385,https://twitter.com/dmchodesign/status/1185339334687248385,dmchodesign,,SoftBank Eyes WeWork Rescue Valuation Below $8 Billion https://www.yahoo.com/finance/news/softbank-eyes-wework-rescue-valuation-143300699.html?.tsrc=fauxdal …,2019-10-18 23:38:14+00:00,0,0,0,,,
27,1185339156022484992,https://twitter.com/pops131/status/1185339156022484992,pops131,,WeWork Valuation Collapse From Cash Crunch Could Crush Hong Kong Office Market | Zero Hedge: https://www.zerohedge.com/markets/wework-cash-crunch-could-be-disastrous-hong-kong-office-market …,2019-10-18 23:37:31+00:00,0,0,0,,,
28,1185339029384056837,https://twitter.com/imthekdj/status/1185339029384056837,imthekdj,,Take my daughter to #wework day. Thanks @storjproject for building a wonderfully distributed team! #remotework #minneapolis #techforgood #girlsintechpic.twitter.com/GZF75Oun2D,2019-10-18 23:37:01+00:00,1,4,4,@storjproject,#wework #remotework #minneapolis #techforgood #girlsintechpic,
29,1185338955840929793,https://twitter.com/rachelhoneth/status/1185338955840929793,rachelhoneth,ellenhuet,"As @MikeIsaac so eloquently said yesterday, the WeWork book is being served up on a platter. You must write it!",2019-10-18 23:36:44+00:00,0,1,1,@MikeIsaac,,
30,1185338534783344640,https://twitter.com/FxBookLTTG/status/1185338534783344640,FxBookLTTG,,http://fxb.cm/8ASP WeWork Valuation Collapse From Cash Crunch Could Crush Hong Kong Office Market,2019-10-18 23:35:03+00:00,0,0,0,,,
31,1185338016514134020,https://twitter.com/nerdsquawk/status/1185338016514134020,nerdsquawk,johnbiggs,"Goodbye, @WeWork. https://twitter.com/johnbiggs/status/1185215680737697794 …",2019-10-18 23:33:00+00:00,0,0,0,@WeWork,,
32,1185337980828999681,https://twitter.com/_1BUV/status/1185337980828999681,_1BUV,,#WeWork running out of #Cash has derailed the company's plan for massive expansion worldwide. JPMorgan Chase and SoftBank/Vision Fund are preparing to offer the company financial lifelines to avoid bankruptcy in the coming months. As ... https://1buv.com/wework-valuation-collapse-from-cash-crunch-could-crush-hong-kong-office-market/ …pic.twitter.com/IARjdVV122,2019-10-18 23:32:51+00:00,0,0,0,,#WeWork #Cash,
33,1185337898901463040,https://twitter.com/nathwithanh/status/1185337898901463040,nathwithanh,johnbiggs,love snacking on wet fruit,2019-10-18 23:32:32+00:00,0,0,0,,,
34,1185337883927953409,https://twitter.com/DailyLafayette/status/1185337883927953409,DailyLafayette,,WeWork Valuation Collapse From Cash Crunch Could Crush Hong Kong Office Market https://ift.tt/2BnTIDt #honkhonkpic.twitter.com/kwmpKJ5Acs,2019-10-18 23:32:28+00:00,0,0,0,,#honkhonkpic,
35,1185337870497632256,https://twitter.com/CryptoWallStre1/status/1185337870497632256,CryptoWallStre1,,Looks like #WeWork is about to nuke the #HongKong Office Market. WeWork destroys everything in its path these days. Just what #HongKongers need right now lol #RealEstate #AdamNeumann #HongKongProtests #StandWithHongKongpic.twitter.com/bYbbjNvEZK,2019-10-18 23:32:25+00:00,0,0,0,,#WeWork #HongKong #HongKongers #RealEstate #AdamNeumann #HongKongProtests #StandWithHongKongpic,
36,1185337860154675200,https://twitter.com/robertojirusta/status/1185337860154675200,robertojirusta,zerohedge,Hasta donde llego WEWORK... q farsa https://twitter.com/zerohedge/status/1185336009527087105 …,2019-10-18 23:32:23+00:00,1,0,0,,,
37,1185337834963689477,https://twitter.com/avfolk/status/1185337834963689477,avfolk,,Sleazy @WeWork huckster planned Trump Inc style dynasty. https://apple.news/AWa5xG8tiQ1a_QuQ5pKwT5w …,2019-10-18 23:32:17+00:00,0,0,0,@WeWork,,
38,1185337771545657344,https://twitter.com/hboljp/status/1185337771545657344,hboljp,,注目のスタートアップだった WeWork の評価はどこで反転したのか？ https://hbol.jp/204347 #WeWork,2019-10-18 23:32:01+00:00,3,2,2,,#WeWork,
39,1185337649982140416,https://twitter.com/TINTechBloggers/status/1185337649982140416,TINTechBloggers,,Adam Neumann planned for his children and grandchildren to control WeWork (Connie Loizos/TechCrunch) http://dlvr.it/RGVSTm,2019-10-18 23:31:32+00:00,0,0,0,,,
40,1185337623373590529,https://twitter.com/AlenKarabegovic/status/1185337623373590529,AlenKarabegovic,,WeWork Valuation Collapse From Cash Crunch Could Crush Hong Kong Office Market https://ift.tt/2BnTIDt #Money #Finance #Economics #Market,2019-10-18 23:31:26+00:00,0,1,1,,#Money #Finance #Economics #Market,
41,1185337388698091520,https://twitter.com/objectivepress/status/1185337388698091520,objectivepress,,Adam Neumann planned for his children and grandchildren to control WeWork http://objectivenews.co/index.php/2019/10/18/adam-neumann-planned-for-his-children-and-grandchildren-to-control-wework/ …,2019-10-18 23:30:30+00:00,0,0,0,,,
42,1185337362953453569,https://twitter.com/REITs_Nareit/status/1185337362953453569,REITs_Nareit,,Why WeWork's troubles won't have a huge impact on REITs - http://bit.ly/2MX4VAt pic.twitter.com/We9v8L2M0U,2019-10-18 23:30:24+00:00,3,11,11,,,
43,1185337342044884994,https://twitter.com/andrewhorowitz/status/1185337342044884994,andrewhorowitz,,"A new segment to test your brainteaser skills. Plus a look at the WeWork debacle, The Skinny, partial Phase 1 trade deal. A stroll down Podcast Memory Lane. https://www.dhunplugged.com/2019/10/15/dhunplugged-476-appeal-of-the-skinny-deal/ …",2019-10-18 23:30:19+00:00,1,3,3,,,
44,1185337291457384449,https://twitter.com/themainichi/status/1185337291457384449,themainichi,,SoftBank Group mulls extra $5 bil. investment in WeWork operator https://mainichi.jp/english/articles/20191018/p2g/00m/0bu/067000c …,2019-10-18 23:30:07+00:00,1,1,1,,,
45,1185336312875741184,https://twitter.com/mattaparker/status/1185336312875741184,mattaparker,,This is like business 101 for private companies: Adam Neumann planned for his children and grandchildren to control WeWork https://tcrn.ch/35Wa98e via @techcrunch,2019-10-18 23:26:14+00:00,0,0,0,@techcrunch,,
46,1185336077231374336,https://twitter.com/BJonRo/status/1185336077231374336,BJonRo,QLDPyrrhonist,Wonder if I could lease an office here off WeWork? Would need fruity water,2019-10-18 23:25:17+00:00,0,2,2,,,
47,1185336009527087105,https://twitter.com/zerohedge/status/1185336009527087105,zerohedge,,WeWork Valuation Collapse From Cash Crunch Could Crush Hong Kong Office Market https://www.zerohedge.com/markets/wework-cash-crunch-could-be-disastrous-hong-kong-office-market …,2019-10-18 23:25:01+00:00,27,65,65,,,
48,1185335012897382401,https://twitter.com/sivanakai/status/1185335012897382401,sivanakai,,WeWorkの企業価値 1月比8割減の8700億円に http://koebon.shop/2019/10/19/748108/ …,2019-10-18 23:21:04+00:00,0,0,0,,,
49,1185335008619163648,https://twitter.com/eugenplaton/status/1185335008619163648,eugenplaton,,Adam Neumann planned for his children and grandchildren to control WeWork http://dlvr.it/RGVRRS pic.twitter.com/t90km4WWMr,2019-10-18 23:21:03+00:00,0,0,0,,,
50,1185334756306636800,https://twitter.com/BringingTech/status/1185334756306636800,BringingTech,,Adam Neumann planned for his children and grandchildren to control WeWork https://techcrunch.com/2019/10/18/adam-neumann-planned-for-his-children-and-grandchildren-to-control-wework/?utm_source=dlvr.it&utm_medium=twitter …,2019-10-18 23:20:03+00:00,0,0,0,,,
51,1185334744692772864,https://twitter.com/SevilleReport/status/1185334744692772864,SevilleReport,,"Time to stop over valuing companies attempting to replicate the Amazon. It's not Amazon, it's Jeff, These unicorns don't have a Jeff | http://bit.ly/2nAr7qV | #WeWork #investments #Growth #IPOs #Bezos #Unicornspic.twitter.com/Hg8vAJZQ2E",2019-10-18 23:20:00+00:00,1,0,0,,#WeWork #investments #Growth #IPOs #Bezos #Unicornspic,
52,1185334733498138624,https://twitter.com/petition/status/1185334733498138624,petition,,TL;DR WeWork has absolutely no moat. https://www.citylab.com/life/2019/10/wework-manhattan-real-estate-coworking-office-space-rental/599338 …pic.twitter.com/ZIXsiCHiSH,2019-10-18 23:19:57+00:00,0,6,6,,,
53,1185334086451249152,https://twitter.com/SophieZo/status/1185334086451249152,SophieZo,,Adam Neumann planned for his children and grandchildren to control WeWork https://techcrunch.com/2019/10/18/adam-neumann-planned-for-his-children-and-grandchildren-to-control-wework/ …,2019-10-18 23:17:23+00:00,0,0,0,,,
54,1185333583139016711,https://twitter.com/kevin_frint/status/1185333583139016711,kevin_frint,adeadelaida_s,Dick sponsored by wework,2019-10-18 23:15:23+00:00,0,1,1,,,
55,1185333505733083136,https://twitter.com/Ranzware/status/1185333505733083136,Ranzware,,Adam Neumann planned for his children and grandchildren to control WeWork https://www.ranzware.com/2019/10/19/adam-neumann-planned-for-his-children-and-grandchildren-to-control-wework … #Tech #Technews #Ranzware,2019-10-18 23:15:04+00:00,0,0,0,,#Tech #Technews #Ranzware,
56,1185333487521456130,https://twitter.com/bitsmart_io/status/1185333487521456130,bitsmart_io,,Ex-CEO of Google Africa: Bitcoin a ‘Gift’ That Will Change Humanity #bitcoin #wework #southafrica #siliconvalley #facebook #bitsmarthttps://bitsmart.io/bitcoin/news/ex-ceo-of-google-africa-bitcoin-a-gift-that-will-change-humanity …,2019-10-18 23:15:00+00:00,0,0,0,,#bitcoin #wework #southafrica #siliconvalley #facebook #bitsmarthttps,
57,1185333344604688385,https://twitter.com/shelearnsonline/status/1185333344604688385,shelearnsonline,,#techcrunch Adam Neumann planned for his children and grandchildren to control WeWork https://techcrunch.com/2019/10/18/adam-neumann-planned-for-his-children-and-grandchildren-to-control-wework/ …,2019-10-18 23:14:26+00:00,0,0,0,,#techcrunch,
58,1185332962813853696,https://twitter.com/GlobalNewsHerld/status/1185332962813853696,GlobalNewsHerld,,Ex-CEO of Google Africa and WeWork South Africa GM Stafford Masie has argued that Bitcoin will revolutionize global trade https://ct.com/7xtt via @Cointelegraph,2019-10-18 23:12:55+00:00,0,0,0,@Cointelegraph,,
59,1185332767254552577,https://twitter.com/Automobilnews1/status/1185332767254552577,Automobilnews1,,Adam Neumann planned for his children and grandchildren to control WeWork – TechCrunch – NEWPAPER24 https://newpaper24.com/adam-neumann-planned-for-his-children-and-grandchildren-to-control-wework-techcrunch-newpaper24/ …pic.twitter.com/G7592083QK,2019-10-18 23:12:08+00:00,0,0,0,,,
60,1185332760128446464,https://twitter.com/newpaper24/status/1185332760128446464,newpaper24,,Adam Neumann planned for his children and grandchildren to control WeWork – TechCrunch – NEWPAPER24 https://newpaper24.com/adam-neumann-planned-for-his-children-and-grandchildren-to-control-wework-techcrunch-newpaper24/ …pic.twitter.com/TQd2qqNOxl,2019-10-18 23:12:07+00:00,0,0,0,,,
61,1185332492011589632,https://twitter.com/TLITFranklin/status/1185332492011589632,TLITFranklin,,Adam Neumann planned for his children and grandchildren to control WeWork http://dlvr.it/RGVQPw #tech #teamlogicit #techsecuritypic.twitter.com/INZQSKcLcl,2019-10-18 23:11:03+00:00,0,0,0,,#tech #teamlogicit #techsecuritypic,
62,1185332340144377856,https://twitter.com/fabriziopaventi/status/1185332340144377856,fabriziopaventi,,Adam Neumann planned for his children and grandchildren to control WeWork https://tcrn.ch/2OXyap8 https://ift.tt/2jUS1X5,2019-10-18 23:10:26+00:00,0,0,0,,,
63,1185331818112995330,https://twitter.com/qwerty__red/status/1185331818112995330,qwerty__red,,Adam Neumann planned for his children and grandchildren to control WeWork https://qwerty.red/adam-neumann-planned-for-his-children-and-grandchildren-to-control-wework/ …,2019-10-18 23:08:22+00:00,0,0,0,,,
64,1185331611128066048,https://twitter.com/planyourwebsite/status/1185331611128066048,planyourwebsite,,Adam Neumann planned for his children and grandchildren to control WeWork http://dlvr.it/RGVQ4P #TechNewspic.twitter.com/h6vBgy0j0H,2019-10-18 23:07:33+00:00,0,0,0,,#TechNewspic,
65,1185331570271510528,https://twitter.com/spotcheckz/status/1185331570271510528,spotcheckz,,"Adam Neumann planned for his children and grandchildren to control WeWork WeWork co-founder Adam Neumann didn’t plan for his family’s control of WeWork to end at his death but he expected it be controlled by future generations of Neumanns, too, says Bu... https://techcrunch.com/2019/10/18/adam-neumann-planned-for-his-children-and-grandchildren-to-control-wework/ …pic.twitter.com/PduT3zTO60",2019-10-18 23:07:23+00:00,0,0,0,,,
66,1185331560821735424,https://twitter.com/balanyo/status/1185331560821735424,balanyo,,"Adam Neumann planned for his children and grandchildren to control WeWork WeWork co-founder Adam Neumann didn’t plan for his family’s control of WeWork to end at his death but he expected it be controlled by future generations of Neumanns, too, says Bus… https://techcrunch.com/2019/10/18/adam-neumann-planned-for-his-children-and-grandchildren-to-control-wework/ …",2019-10-18 23:07:21+00:00,0,0,0,,,
67,1185331497911422977,https://twitter.com/OnInvestor/status/1185331497911422977,OnInvestor,,Discussing a possible 'ripple effect' from WeWork - https://newsoninvestor.com/2019/10/18/discussing-a-possible-ripple-effect-from-wework/ …pic.twitter.com/vOdIpqSvGH,2019-10-18 23:07:06+00:00,0,0,0,,,
68,1185331475438284800,https://twitter.com/ColumbiaLaw/status/1185331475438284800,ColumbiaLaw,,"“A market that makes it difficult and costly to express negative sentiments is prone to a bubble and thus an abrupt collapse,” writes Prof. Jeffrey Gordon in an examination of the fall of @WeWork and the valuation and governance bubbles of Silicon Valley. https://buff.ly/33GclyI",2019-10-18 23:07:00+00:00,1,3,3,@WeWork,,
69,1185331377845047296,https://twitter.com/AnilBatra/status/1185331377845047296,AnilBatra,,@Airbnb @uber @WeWork - none of them own any (or little) inventory of the product they sell yet have failed to generate profit. What can we learn from them? Failure of VCs?,2019-10-18 23:06:37+00:00,0,0,0,@Airbnb @uber @WeWork,,
70,1185331209670287361,https://twitter.com/maosopera/status/1185331209670287361,maosopera,TheAtlantic,"""""By “real tech,” Cembalest was referring to companies whose principal product is software, rather than, say, WeWork, which is in truth a real-estate company caught wearing an Actual Tech Company costume before Halloween."" https://twitter.com/TheAtlantic/status/1185170543915470848 …",2019-10-18 23:05:57+00:00,0,0,0,,,
71,1185331156356603905,https://twitter.com/AnglNews/status/1185331156356603905,AnglNews,,Adam Neumann planned for his children and grandchildren to control WeWork - https://ift.tt/2pAie1q #AngelNews #startup,2019-10-18 23:05:44+00:00,1,0,0,,#AngelNews #startup,
72,1185331136505044993,https://twitter.com/thecaptable/status/1185331136505044993,thecaptable,,Adam Neumann planned for his children and grandchildren to control WeWork https://ift.tt/2pAie1q #startups #techcrunch #venturecapital,2019-10-18 23:05:39+00:00,0,0,0,,#startups #techcrunch #venturecapital,
73,1185331043206746112,https://twitter.com/TubasaUnder715/status/1185331043206746112,TubasaUnder715,,起業家や個人事業主、フリーランスの方対象！ ビスタプリント WeWorkコラボレーションセミナー 第2回「しくじり経営-挫折が教えてくれたもの-」 2019年10月24日(木)開催 http://s-pst.com/ax23638c/ #socialpost,2019-10-18 23:05:17+00:00,0,0,0,,#socialpost,
74,1185330857063698440,https://twitter.com/LabitatInc/status/1185330857063698440,LabitatInc,,New TechCrunch Article: Adam Neumann planned for his children and grandchildren to control WeWork https://ift.tt/2pAie1q,2019-10-18 23:04:33+00:00,0,0,0,,,
75,1185330848876433409,https://twitter.com/laurencehaslop/status/1185330848876433409,laurencehaslop,,Adam Neumann planned for his children and grandchildren to control WeWork https://ift.tt/2pAie1q #growcyber,2019-10-18 23:04:31+00:00,0,0,0,,#growcyber,
76,1185330777522888706,https://twitter.com/chafikyahou/status/1185330777522888706,chafikyahou,,#start up: Adam Neumann planned for his children and grandchildren to control WeWork https://ift.tt/2pAie1q,2019-10-18 23:04:14+00:00,0,0,0,,#start,
77,1185330603471847425,https://twitter.com/dharmeshsb/status/1185330603471847425,dharmeshsb,,Adam Neumann planned for his children and grandchildren to control WeWork https://tcrn.ch/31qkzcv #startup,2019-10-18 23:03:32+00:00,0,0,0,,#startup,
78,1185330287473037313,https://twitter.com/TheReal_BingLai/status/1185330287473037313,TheReal_BingLai,,Can’t believe WeWork investment bankers were pitching valuations between $50-$100B to public markets just a month ago and now it’s looking at <$8B and possibly bankrupt,2019-10-18 23:02:17+00:00,0,0,0,,,
79,1185330275993243648,https://twitter.com/Erroin/status/1185330275993243648,Erroin,,Adam Neumann planned for his children and grandchildren to control WeWork https://ift.tt/2pAie1q #startups,2019-10-18 23:02:14+00:00,0,0,0,,#startups,
