,id,permalink,username,author_id,text,date,formatted_date,to,retweets,favorites,replies,mentions,hashtags,urls,geo
820,1190263079595937793,https://twitter.com/hoofnagle/status/1190263079595937793,hoofnagle,164365747,FT: Former chief of staff to WeWork founder claims discrimination https://www.ft.com/content/8cd5d2aa-fc1f-11e9-a354-36acbbb0d9b6 …,2019-11-01 13:43:26+00:00,Fri Nov 01 13:43:26 +0000 2019,,0,0,0,,,https://www.ft.com/content/8cd5d2aa-fc1f-11e9-a354-36acbbb0d9b6,
821,1190262858358984704,https://twitter.com/HPTarget/status/1190262858358984704,HPTarget,195065032,Here are the 3 men quietly overseeing WeWork cofounder Adam Neumann's millions http://dlvr.it/RHQ4tn #idea #businesspic.twitter.com/ZiSVVUb7J8,2019-11-01 13:42:34+00:00,Fri Nov 01 13:42:34 +0000 2019,,0,0,0,,#idea #businesspic,http://dlvr.it/RHQ4tn,
822,1190262858098987008,https://twitter.com/marciojmsilva/status/1190262858098987008,marciojmsilva,82350646,Here are the 3 men quietly overseeing WeWork cofounder Adam Neumann's millions http://dlvr.it/RHQ4tk pic.twitter.com/HPQhX64Ztq,2019-11-01 13:42:34+00:00,Fri Nov 01 13:42:34 +0000 2019,,0,0,0,,,http://dlvr.it/RHQ4tk,
823,1190262796673523712,https://twitter.com/PurbitaDitecha/status/1190262796673523712,PurbitaDitecha,199931666,Here are the 3 men quietly overseeing WeWork cofounder Adam Neumann's… https://goo.gl/fb/W8Ru5j via #Indilens #India,2019-11-01 13:42:19+00:00,Fri Nov 01 13:42:19 +0000 2019,,0,0,0,,#Indilens #India,https://goo.gl/fb/W8Ru5j,
824,1190262794077249536,https://twitter.com/Indilens_Times/status/1190262794077249536,Indilens_Times,4807964520,Here are the 3 men quietly overseeing WeWork cofounder Adam Neumann's millions https://goo.gl/fb/w2qSpD via #India,2019-11-01 13:42:18+00:00,Fri Nov 01 13:42:18 +0000 2019,,0,0,0,,#India,https://goo.gl/fb/w2qSpD,
825,1190262744630599686,https://twitter.com/irmazandl/status/1190262744630599686,irmazandl,17323875,Just like WeWork was valuable at $46billion - until it wasnt,2019-11-01 13:42:06+00:00,Fri Nov 01 13:42:06 +0000 2019,robinivski,0,0,0,,,,
826,1190262592914243584,https://twitter.com/DSMWcom/status/1190262592914243584,DSMWcom,72906858,"In WeWork’s Wake, Stock Investors Demand Profits Over Growth http://www.dontspreadmywealth.com/in-weworks-wake-stock-investors-demand-profits-over-growth/ …",2019-11-01 13:41:30+00:00,Fri Nov 01 13:41:30 +0000 2019,,0,0,0,,,http://www.dontspreadmywealth.com/in-weworks-wake-stock-investors-demand-profits-over-growth/,
827,1190262400827764736,https://twitter.com/cesarqtiva/status/1190262400827764736,cesarqtiva,285814055,at WeWork https://www.facebook.com/1021597693/posts/10217879796079507/ …,2019-11-01 13:40:45+00:00,Fri Nov 01 13:40:45 +0000 2019,,0,0,0,,,https://www.facebook.com/1021597693/posts/10217879796079507/,
828,1190262273312468994,https://twitter.com/TXcyclist72/status/1190262273312468994,TXcyclist72,16373185,"Welcome to the world that @AynRand warned us about in #AtlasShrugged in 1957. ""How Going #Woke Makes Companies Like #California Utilities And @WeWork Go Broke"" http://bit.ly/34icRmP @AynRandOrg @AynRandInst",2019-11-01 13:40:14+00:00,Fri Nov 01 13:40:14 +0000 2019,,2,1,1,@AynRand @WeWork @AynRandOrg @AynRandInst,#AtlasShrugged #Woke #California,http://bit.ly/34icRmP,
829,1190262217461157892,https://twitter.com/RobinsKaplan/status/1190262217461157892,RobinsKaplan,58575363,Financial Daily Dose 11.01.2019 by @reifmd | Top Story: Watching for the GM-strike Impact on the October Jobs Report #USJobs #WeWork #DeutscheBank #Fleece #RewritingTheOddshttps://bit.ly/36qpoXh,2019-11-01 13:40:01+00:00,Fri Nov 01 13:40:01 +0000 2019,,1,3,3,@reifmd,#USJobs #WeWork #DeutscheBank #Fleece #RewritingTheOddshttps,https://bit.ly/36qpoXh,
830,1190262057477853189,https://twitter.com/businessinsider/status/1190262057477853189,businessinsider,20562637,Here are the 3 men quietly overseeing WeWork cofounder Adam Neumann's millions http://www.businessinsider.com/inside-adam-neumanns-secretive-family-office-166-2nd-llp-2019-10 …,2019-11-01 13:39:23+00:00,Fri Nov 01 13:39:23 +0000 2019,,9,6,6,,,http://www.businessinsider.com/inside-adam-neumanns-secretive-family-office-166-2nd-llp-2019-10,
831,1190261885515554817,https://twitter.com/cofoundertron/status/1190261885515554817,cofoundertron,882786232585138176,"Like WeWork, but for cousins",2019-11-01 13:38:42+00:00,Fri Nov 01 13:38:42 +0000 2019,,0,0,0,,,,
832,1190261810391207937,https://twitter.com/bbbduckuni/status/1190261810391207937,bbbduckuni,1147995331197468674,ソフトバンクはそういう面もあるでしょうね 経営者としては当然利益は求める訳で。 ちなみにwework についてはどう思いますか？ご存知の範囲内で構わないのですが色々な見解を聞きたいと思いまして。 手放した方が楽なはずだと普通は思うんですが、どんな挽回策があるのかと https://twitter.com/euroseller/status/1187612597413011461?s=21 …,2019-11-01 13:38:24+00:00,Fri Nov 01 13:38:24 +0000 2019,rossorise72,0,1,1,,,https://twitter.com/euroseller/status/1187612597413011461?s=21,
833,1190261575623544833,https://twitter.com/Adveith/status/1190261575623544833,Adveith,70936068,SCOOP! WeWork’s new management is reassessing whether to proceed with about 28 potential office deals in London following a bailout by Softbank. https://www.bloomberg.com/news/articles/2019-11-01/wework-reviews-london-expansion-plans-after-softbank-bailout … via @markets,2019-11-01 13:37:28+00:00,Fri Nov 01 13:37:28 +0000 2019,,0,0,0,@markets,,https://www.bloomberg.com/news/articles/2019-11-01/wework-reviews-london-expansion-plans-after-softbank-bailout,
834,1190261537069395968,https://twitter.com/motorbikematt/status/1190261537069395968,motorbikematt,7420552,"""Part of what makes this tragedy possible is the dual-class share structure of many tech companies, which allows founders to remain in control without owning a majority of the company."" Wait is this article about @GoPro or @uber or @WeWork? https://www.nbcnews.com/think/opinion/wework-uber-s-struggles-show-how-venture-capital-backed-tech-ncna1074881 …",2019-11-01 13:37:19+00:00,Fri Nov 01 13:37:19 +0000 2019,,0,4,4,@GoPro @uber @WeWork,,https://www.nbcnews.com/think/opinion/wework-uber-s-struggles-show-how-venture-capital-backed-tech-ncna1074881,
835,1190261186807435265,https://twitter.com/statuptechindia/status/1190261186807435265,statuptechindia,2951995507,"WeWork competitor Convene is still growing, and unique spaces like its 5th Ave location in New York prove it offers something different https://ift.tt/2px1oB4 https://ift.tt/eA8V8J",2019-11-01 13:35:55+00:00,Fri Nov 01 13:35:55 +0000 2019,,0,0,0,,,"https://ift.tt/2px1oB4,https://ift.tt/eA8V8J",
836,1190260909504991232,https://twitter.com/tculpan/status/1190260909504991232,tculpan,14978616,"After SoftBank’s WeWork disaster, Alibaba steps up to fill in a massive hole in 3Q earnings. By taking its 33% stake in Ant Financial, Alibaba’s value rises. That flows through to become a $2.6bln gain to SoftBank. Well played SoftBank. Well played. https://group.softbank/en/corp/news/press/sb/2019/20191101_01/ …",2019-11-01 13:34:49+00:00,Fri Nov 01 13:34:49 +0000 2019,,27,67,67,,,https://group.softbank/en/corp/news/press/sb/2019/20191101_01/,
837,1190260894464278528,https://twitter.com/TheWayfarerSoul/status/1190260894464278528,TheWayfarerSoul,2385395126,"Come to WeWork Gurgaon - you will get all of this and more (read booze, if you like it haha)!",2019-11-01 13:34:45+00:00,Fri Nov 01 13:34:45 +0000 2019,justkanchana,0,3,3,,,,
838,1190260816647462912,https://twitter.com/FightGandhi/status/1190260816647462912,FightGandhi,373550786,So theyre paying for the whole company about what Softbank paid to make the wework CEO just go away.,2019-11-01 13:34:27+00:00,Fri Nov 01 13:34:27 +0000 2019,zerohedge,0,3,3,,,,
839,1190260405114945536,https://twitter.com/EmpandaProperty/status/1190260405114945536,EmpandaProperty,887933735550758912,Successful day for the Bosu Body Bar team earlier this week. Sounds like they’ve had a lot of interest from the WeWork Community! Happy to help pal. https://lnkd.in/dAKWyYR,2019-11-01 13:32:49+00:00,Fri Nov 01 13:32:49 +0000 2019,,0,1,1,,,https://lnkd.in/dAKWyYR,
840,1190259887575621633,https://twitter.com/will_noisebleed/status/1190259887575621633,will_noisebleed,18285293,Dejan un tendal de destrucción y el ceo se va con un par de millones bajo el brazo ? Wework,2019-11-01 13:30:45+00:00,Fri Nov 01 13:30:45 +0000 2019,NetNezva,0,0,0,,,,
841,1190259772747964417,https://twitter.com/airbornejump/status/1190259772747964417,airbornejump,565091138,WeWork’s Ousted C.E.O. Adam Neumann Is Accused of Pregnancy Discrimination https://nyti.ms/36ln0AX . How about planned parenthood? If you go there they terminate your baby. You can’t get more prejudiced against pregnancy than that,2019-11-01 13:30:18+00:00,Fri Nov 01 13:30:18 +0000 2019,,0,0,0,,,https://nyti.ms/36ln0AX,
842,1190259736454815746,https://twitter.com/teamcoworker/status/1190259736454815746,teamcoworker,759665412,"""In a federal complaint, a former chief of staff to WeWork’s Ousted C.E.O. Adam Neumann said she was demoted twice after she became pregnant."" #PregnancyDiscrimination https://www.nytimes.com/2019/10/31/business/wework-neumann-discrimination-complaint.html …",2019-11-01 13:30:09+00:00,Fri Nov 01 13:30:09 +0000 2019,,0,0,0,,#PregnancyDiscrimination,https://www.nytimes.com/2019/10/31/business/wework-neumann-discrimination-complaint.html,
843,1190259736358338560,https://twitter.com/BODValores/status/1190259736358338560,BODValores,2497124203,"WeWork podría valer ""cero"", dice multimillonario inversionista Bill Ackman http://bit.ly/2WC0T4Z vía #DiarioElFinanciero",2019-11-01 13:30:09+00:00,Fri Nov 01 13:30:09 +0000 2019,,0,0,0,,#DiarioElFinanciero,http://bit.ly/2WC0T4Z,
844,1190259697233862657,https://twitter.com/finzine/status/1190259697233862657,finzine,748817972970463232,$GOOGL $CSGP WeWork Reviews London Expansion Plans After Softbank Bailout via http://www.hvper.com/?ref=s,2019-11-01 13:30:00+00:00,Fri Nov 01 13:30:00 +0000 2019,,0,0,0,,,http://www.hvper.com/?ref=s,
845,1190259696986394624,https://twitter.com/WCCBCharlotte/status/1190259696986394624,WCCBCharlotte,15080288,. @KashiyamaTailor is officially open in @wework on S. Tryon St and they are making the process of getting a custom tailored suit quick and affordable in the #QueenCity. #WCCB #cltnews #ncnews #suits #wework #kashiyamapic.twitter.com/wPKsgM4DdA,2019-11-01 13:30:00+00:00,Fri Nov 01 13:30:00 +0000 2019,,3,5,5,@KashiyamaTailor @wework,#QueenCity #WCCB #cltnews #ncnews #suits #wework #kashiyamapic,,
846,1190259696294338563,https://twitter.com/forbes_india/status/1190259696294338563,forbes_india,22205952,"#WeWork ex-chief Adam Neumann accused of pregnancy discrimination. His chief of staff said in a complaint that he called her maternity leave a ""vacation"" or ""retirement"" http://www.forbesindia.com/article/special/wework-exchief-adam-neumann-accused-of-pregnancy-discrimination/55967/1 … via @nytimespic.twitter.com/xAWkomaJRz",2019-11-01 13:30:00+00:00,Fri Nov 01 13:30:00 +0000 2019,,1,5,5,@nytimespic,#WeWork,http://www.forbesindia.com/article/special/wework-exchief-adam-neumann-accused-of-pregnancy-discrimination/55967/1,
847,1190259352239771648,https://twitter.com/will_noisebleed/status/1190259352239771648,will_noisebleed,18285293,"Funciona como una startup. Link a ""el caso wework"" https://twitter.com/Dan_Abadie/status/1188079601525907456 …",2019-11-01 13:28:38+00:00,Fri Nov 01 13:28:38 +0000 2019,Dan_Abadie,1,0,0,,,https://twitter.com/Dan_Abadie/status/1188079601525907456,
848,1190259164913766403,https://twitter.com/mogeladze1/status/1190259164913766403,mogeladze1,2676025951,"WeWork competitor Convene is still growing, and unique spaces like its 5th Ave location in New York prove it offers something different http://feedproxy.google.com/~r/typepad/alleyinsider/silicon_alley_insider/~3/gBX0E9WNNh8/convene-wework-competitor-growing-by-focusing-on-events-workspaces-pictures-2019-10 …",2019-11-01 13:27:53+00:00,Fri Nov 01 13:27:53 +0000 2019,,0,0,0,,,http://feedproxy.google.com/~r/typepad/alleyinsider/silicon_alley_insider/~3/gBX0E9WNNh8/convene-wework-competitor-growing-by-focusing-on-events-workspaces-pictures-2019-10,
849,1190259136187031552,https://twitter.com/mnagawaka/status/1190259136187031552,mnagawaka,8975512,WeWork?,2019-11-01 13:27:46+00:00,Fri Nov 01 13:27:46 +0000 2019,fhideki,0,0,0,,,,
850,1190258821991739394,https://twitter.com/SiasatToday/status/1190258821991739394,SiasatToday,404389897,PTI News (WeWork ex-boss had penchant to smoke marijuana) has been published on PTI News - http://pti.news/wework-ex-boss-had-penchant-to-smoke-marijuana/ …pic.twitter.com/AP1Ue2hLOU,2019-11-01 13:26:31+00:00,Fri Nov 01 13:26:31 +0000 2019,,0,0,0,,,http://pti.news/wework-ex-boss-had-penchant-to-smoke-marijuana/,
851,1190258614805643264,https://twitter.com/matt_whitney10/status/1190258614805643264,matt_whitney10,134680019,@WeWork would you please buy better coffee for the downtown Nashville office. Thanks,2019-11-01 13:25:42+00:00,Fri Nov 01 13:25:42 +0000 2019,,0,0,0,@WeWork,,,
852,1190258588889047042,https://twitter.com/AlexineGS/status/1190258588889047042,AlexineGS,1356882248,Pure class best of luck in your next step,2019-11-01 13:25:36+00:00,Fri Nov 01 13:25:36 +0000 2019,andrewheumann,0,0,0,,,,
853,1190258561579925505,https://twitter.com/old_but_works/status/1190258561579925505,old_but_works,190162176,"Купите еще и WeWork, por favor. https://twitter.com/jonerlichman/status/1190252267406069760 …",2019-11-01 13:25:29+00:00,Fri Nov 01 13:25:29 +0000 2019,JonErlichman,0,2,2,,,https://twitter.com/jonerlichman/status/1190252267406069760,
854,1190258335934795781,https://twitter.com/coworking__news/status/1190258335934795781,coworking__news,937678428614156288,"WeWork competitor Convene is growing by focusing on events, workspaces - INSIDER https://www.insider.com/convene-wework-competitor-growing-by-focusing-on-events-workspaces-pictures-2019-10 … #coworkingpic.twitter.com/FvS3hMptHG",2019-11-01 13:24:35+00:00,Fri Nov 01 13:24:35 +0000 2019,,0,0,0,,#coworkingpic,https://www.insider.com/convene-wework-competitor-growing-by-focusing-on-events-workspaces-pictures-2019-10,
855,1190258318708822018,https://twitter.com/NatGMac/status/1190258318708822018,NatGMac,846765876,"yea, but let him run your Twitter too",2019-11-01 13:24:31+00:00,Fri Nov 01 13:24:31 +0000 2019,HyparAEC,0,17,17,,,,
856,1190257943536640002,https://twitter.com/ndtvfeed/status/1190257943536640002,ndtvfeed,96900937,Former WeWork Staffer Sues Ousted CEO For Pregnancy Discrimination https://www.ndtv.com/world-news/former-wework-staffer-sues-ousted-ceo-adam-neumann-for-pregnancy-discrimination-2125949 …,2019-11-01 13:23:02+00:00,Fri Nov 01 13:23:02 +0000 2019,,0,0,0,,,https://www.ndtv.com/world-news/former-wework-staffer-sues-ousted-ceo-adam-neumann-for-pregnancy-discrimination-2125949,
857,1190257764024471558,https://twitter.com/tarocko/status/1190257764024471558,tarocko,220652224,WeWorkで産休が「休暇」扱い－前ＣＥＯの元側近が差別を訴え https://www.bloomberg.co.jp/news/articles/2019-11-01/Q09E8PDWRGG201 … @businessさんから,2019-11-01 13:22:19+00:00,Fri Nov 01 13:22:19 +0000 2019,,0,0,0,@businessさんから,,https://www.bloomberg.co.jp/news/articles/2019-11-01/Q09E8PDWRGG201,
858,1190257705115480064,https://twitter.com/smenor/status/1190257705115480064,smenor,21063394,The same way they can make Adam a billionaire - «priorities»,2019-11-01 13:22:05+00:00,Fri Nov 01 13:22:05 +0000 2019,TwinerWill,0,2,2,,,,
859,1190257525117075456,https://twitter.com/aaronpholmes/status/1190257525117075456,aaronpholmes,457791062,Scoop with @Julie188: WeWork didn't just have toxic phone booths — WeWork MADE the toxic phone booths https://www.businessinsider.com/weworks-toxic-phone-booths-were-created-by-wework-2019-10 …,2019-11-01 13:21:22+00:00,Fri Nov 01 13:21:22 +0000 2019,,8,9,9,@Julie188,,https://www.businessinsider.com/weworks-toxic-phone-booths-were-created-by-wework-2019-10,
860,1190257460646416384,https://twitter.com/JohnAngel1977/status/1190257460646416384,JohnAngel1977,940765422,"WeWork competitor Convene is still growing, and unique spaces like its 5th Ave location in New York prove it offers something different https://ift.tt/2Nz0nQL johnangel1977",2019-11-01 13:21:07+00:00,Fri Nov 01 13:21:07 +0000 2019,,0,0,0,,,https://ift.tt/2Nz0nQL,
861,1190257338243903488,https://twitter.com/Gautamxl99/status/1190257338243903488,Gautamxl99,1169629714488578054,More trouble for WeWork and its former CEO https://gizmodo.com/wework-former-ceo-adam-neumann-accused-of-rampant-preg-1839513939 …,2019-11-01 13:20:38+00:00,Fri Nov 01 13:20:38 +0000 2019,,1,0,0,,,https://gizmodo.com/wework-former-ceo-adam-neumann-accused-of-rampant-preg-1839513939,
862,1190257202000470016,https://twitter.com/HyparAEC/status/1190257202000470016,HyparAEC,926920001688178688,"Hypar is delighted that @andrewheumann will be joining our team in November. With experience @NBBJDesign, @WoodsBagot, and @WeWork, Andrew brings a rich professional history to help us build the future of generative design and construction. http://andrewheumann.com/ https://twitter.com/andrewheumann/status/1190256245577539585 …",2019-11-01 13:20:05+00:00,Fri Nov 01 13:20:05 +0000 2019,andrewheumann,8,102,102,@andrewheumann @NBBJDesign @WoodsBagot @WeWork,,"http://andrewheumann.com/,https://twitter.com/andrewheumann/status/1190256245577539585",
863,1190257040075186176,https://twitter.com/jazzdrummer420/status/1190257040075186176,jazzdrummer420,66550558,"WeWork competitor Convene is still growing, and unique spaces like its 5th Ave location in New York prove it offers something different https://ift.tt/2Nz0nQL",2019-11-01 13:19:26+00:00,Fri Nov 01 13:19:26 +0000 2019,,0,0,0,,,https://ift.tt/2Nz0nQL,
864,1190256978871889920,https://twitter.com/JANUS_Tech/status/1190256978871889920,JANUS_Tech,1019276151079030784,Bearish WeWork. https://twitter.com/RampCapitalLLC/status/1189966096121643008 …,2019-11-01 13:19:12+00:00,Fri Nov 01 13:19:12 +0000 2019,RampCapitalLLC,0,0,0,,,https://twitter.com/RampCapitalLLC/status/1189966096121643008,
865,1190256767340548097,https://twitter.com/Jeannette_Bot/status/1190256767340548097,Jeannette_Bot,1136595200,"10 Things To Know. WeWork competitor Convene is still growing, and unique spaces like its 5th Ave location in New York prove it offers something different https://ift.tt/2Nz0nQL",2019-11-01 13:18:21+00:00,Fri Nov 01 13:18:21 +0000 2019,,0,0,0,,,https://ift.tt/2Nz0nQL,
866,1190256700877492225,https://twitter.com/HPTarget/status/1190256700877492225,HPTarget,195065032,"WeWork competitor Convene is still growing, and unique spaces like its 5th Ave location in New York prove it offers something different http://dlvr.it/RHQ1Kd #bigbusiness #businesspic.twitter.com/3KYGScNqS7",2019-11-01 13:18:06+00:00,Fri Nov 01 13:18:06 +0000 2019,,0,0,0,,#bigbusiness #businesspic,http://dlvr.it/RHQ1Kd,
867,1190256700445511680,https://twitter.com/marciojmsilva/status/1190256700445511680,marciojmsilva,82350646,"WeWork competitor Convene is still growing, and unique spaces like its 5th Ave location in New York prove it offers something different http://dlvr.it/RHQ1KY pic.twitter.com/1xXhWt8sPQ",2019-11-01 13:18:05+00:00,Fri Nov 01 13:18:05 +0000 2019,,0,0,0,,,http://dlvr.it/RHQ1KY,
868,1190256630551760896,https://twitter.com/fahimaq/status/1190256630551760896,fahimaq,723576316243656704,Former chief of staff to WeWork founder claims discrimination as the fragile house of cards begins to fall - read more @FThttps://on.ft.com/2JGq4y1,2019-11-01 13:17:49+00:00,Fri Nov 01 13:17:49 +0000 2019,,0,2,2,@FThttps,,https://on.ft.com/2JGq4y1,
869,1190256569868525570,https://twitter.com/Deweyornot/status/1190256569868525570,Deweyornot,990937908596150272,Webankrupt yet?,2019-11-01 13:17:34+00:00,Fri Nov 01 13:17:34 +0000 2019,WeWork,0,0,0,,,,
870,1190256439799025669,https://twitter.com/benjaminr/status/1190256439799025669,benjaminr,9103482,"It is easy to look at today’s crop of sinking IPOs—like Uber, Lyft, and Peloton—or scuttled public offerings, like WeWork, and see an eerie resemblance to the dot-com bubble that popped in 2000 #benjaminr #worldchangers #entrepreneurship Check this out https://buff.ly/31sREES pic.twitter.com/srdairWUN0",2019-11-01 13:17:03+00:00,Fri Nov 01 13:17:03 +0000 2019,,0,1,1,,#benjaminr #worldchangers #entrepreneurship,https://buff.ly/31sREES,
871,1190256422279249921,https://twitter.com/bench_web/status/1190256422279249921,bench_web,1021646955858915330,2018/08/08 (水) 開催CyberAgent x referme WeWorkアークヒルズで開催 https://g-miura.jp/2018/07/28/post-1432/ …,2019-11-01 13:16:59+00:00,Fri Nov 01 13:16:59 +0000 2019,,0,0,0,,,https://g-miura.jp/2018/07/28/post-1432/,
872,1190256348811927553,https://twitter.com/antoinetvdalen/status/1190256348811927553,antoinetvdalen,180773176,Pourquoi la chute de WeWork fait craindre une nouvelle crise financière #wework https://www.rtl.fr/actu/international/pourquoi-la-chute-de-wework-fait-craindre-une-nouvelle-crise-financiere-7799316536 …,2019-11-01 13:16:42+00:00,Fri Nov 01 13:16:42 +0000 2019,,0,0,0,,#wework,https://www.rtl.fr/actu/international/pourquoi-la-chute-de-wework-fait-craindre-une-nouvelle-crise-financiere-7799316536,
873,1190256101490642944,https://twitter.com/AinsworthKeith/status/1190256101490642944,AinsworthKeith,2176476241,"Going “WOKE” will make a company quickly go broke California law requiring PG&E to invest mostly into renewables not current infrastructure and now bankrupting them WeWork focused on “environmental sustainability,” they lost sight of their business https://thefederalist.com/2019/11/01/how-going-woke-makes-companies-like-california-utilities-and-wework-quickly-go-broke/ …",2019-11-01 13:15:43+00:00,Fri Nov 01 13:15:43 +0000 2019,,69,83,83,,,https://thefederalist.com/2019/11/01/how-going-woke-makes-companies-like-california-utilities-and-wework-quickly-go-broke/,
874,1190256067290095617,https://twitter.com/HPTarget/status/1190256067290095617,HPTarget,195065032,"WeWork competitor Convene is still growing, and unique spaces like its 5th Ave location in New York prove it offers something different http://dlvr.it/RHQ0xR #successpic.twitter.com/2cVvzsAvA3",2019-11-01 13:15:34+00:00,Fri Nov 01 13:15:34 +0000 2019,,0,0,0,,#successpic,http://dlvr.it/RHQ0xR,
875,1190255928580308992,https://twitter.com/SexNewsLady/status/1190255928580308992,SexNewsLady,955511326683561985,WeWork founder faces sex bias lawsuit https://www.standard.co.uk/business/wework-founder-faces-sex-bias-lawsuit-a4276441.html …,2019-11-01 13:15:01+00:00,Fri Nov 01 13:15:01 +0000 2019,,0,0,0,,,https://www.standard.co.uk/business/wework-founder-faces-sex-bias-lawsuit-a4276441.html,
876,1190255818773540869,https://twitter.com/coworking__news/status/1190255818773540869,coworking__news,937678428614156288,"WeWork competitor Convene is growing by focusing on events, workspaces - Business Insider https://www.businessinsider.com/convene-wework-competitor-growing-by-focusing-on-events-workspaces-pictures-2019-10 … #coworkingpic.twitter.com/ptZOP0Ouxm",2019-11-01 13:14:35+00:00,Fri Nov 01 13:14:35 +0000 2019,,0,1,1,,#coworkingpic,https://www.businessinsider.com/convene-wework-competitor-growing-by-focusing-on-events-workspaces-pictures-2019-10,
877,1190255545946660866,https://twitter.com/ZaysevB/status/1190255545946660866,ZaysevB,735753740213354497,"WeWork competitor Convene is still growing, and unique spaces like its 5th Ave location in New York prove it offers something different https://ift.tt/328WaZo #funding",2019-11-01 13:13:30+00:00,Fri Nov 01 13:13:30 +0000 2019,,0,0,0,,#funding,https://ift.tt/328WaZo,
878,1190255473997447168,https://twitter.com/kabu_ana/status/1190255473997447168,kabu_ana,720954799005380610,weworkへの追加分を捻出した感じ？？？ https://twitter.com/irbank_td2/status/1190254758369513473 …,2019-11-01 13:13:13+00:00,Fri Nov 01 13:13:13 +0000 2019,irbank_td2,0,0,0,,,https://twitter.com/irbank_td2/status/1190254758369513473,
879,1190255472168693765,https://twitter.com/Ripozo777/status/1190255472168693765,Ripozo777,1063803756796534784,なぜ孫正義はWeWorkの投資失敗を認めないのか はした金なんや… https://president.jp/articles/-/30535 …,2019-11-01 13:13:13+00:00,Fri Nov 01 13:13:13 +0000 2019,,1,1,1,,,https://president.jp/articles/-/30535,
880,1190255440992432133,https://twitter.com/GerberKawasaki/status/1190255440992432133,GerberKawasaki,349249475,Not the way to make money investing. Lack of #vision fund. #SoftBank #wework https://www.wsj.com/articles/rajeev-misra-built-softbanks-vision-fund-now-he-has-to-save-it-11572536439?shareToken=st6b998f4758a74388aad5cb83bf2cd85e&reflink=share_mobilewebshare …,2019-11-01 13:13:05+00:00,Fri Nov 01 13:13:05 +0000 2019,,2,4,4,,#vision #SoftBank #wework,https://www.wsj.com/articles/rajeev-misra-built-softbanks-vision-fund-now-he-has-to-save-it-11572536439?shareToken=st6b998f4758a74388aad5cb83bf2cd85e&reflink=share_mobilewebshare,
881,1190255418280423425,https://twitter.com/caiwuunion/status/1190255418280423425,caiwuunion,738924043307503616,"Join us today at our open meeting- hear from our members about their campaigns against WeWork, Google and many more, and see how you can get involved. We want to hear your ideas and your fighting spirit! 6.30pm, @maydayroomspic.twitter.com/jDJSVaw8us",2019-11-01 13:13:00+00:00,Fri Nov 01 13:13:00 +0000 2019,,5,5,5,@maydayroomspic,,,
