,id,permalink,username,to,text,date,retweets,favorites,replies,mentions,hashtags,geo
324,1185631716439920645,https://twitter.com/WeWork/status/1185631716439920645,WeWork,,These eye-catching WeWork locations around the world feature inviting exteriors that welcome everyone into our spaces. Here's a look at why curb appeal matters: https://we.co/exteriorstw . #wework pic.twitter.com/IbCeAm2Fv3,2019-10-19 19:00:03+00:00,1,11,11,,#wework,
325,1185631434662268928,https://twitter.com/cesar_amezcua/status/1185631434662268928,cesar_amezcua,,Why isn't WeWork Broke? https://youtu.be/Cb4CGn4a1Y0 via @YouTube,2019-10-19 18:58:56+00:00,0,0,0,@YouTube,,
326,1185630986303705088,https://twitter.com/algorhythnn/status/1185630986303705088,algorhythnn,,どっちを信じるか？そう考えるのも面白いもんだな。 孫氏の決算発表を振り返ってみる。 WeWork問題も気にならなくなってしまうという言い分。 ここまで図で説明しないとならん状況だって事か… ＞孫正義ソフトバンクＧ会長、 2019年4-6月期決算発表（8月7日、会見全編） https://www.youtube.com/watch?v=I2sMPyUy0Dc …,2019-10-19 18:57:09+00:00,0,1,1,,,
327,1185630860655116288,https://twitter.com/updatedliving/status/1185630860655116288,updatedliving,,Real estate news: WeWork opens its first members-only offices in Newport Beach - OCRegister https://ift.tt/2qtdw6h,2019-10-19 18:56:39+00:00,0,0,0,,,
328,1185629977250848768,https://twitter.com/iannottxr/status/1185629977250848768,iannottxr,,https://www.bloomberg.com/news/articles/2019-10-18/softbank-is-said-to-eye-wework-rescue-valuation-below-8-billion … #WeWork,2019-10-19 18:53:09+00:00,2,1,1,,#WeWork,
329,1185628963911163904,https://twitter.com/HackersGeek/status/1185628963911163904,HackersGeek,,"Google Said to Snub WeWork, Sign Toronto Lease With Co-Working Rival http://bit.ly/2MwKY48 @inkPointTech | @Gadgets360",2019-10-19 18:49:07+00:00,0,0,0,@inkPointTech @Gadgets360,,
330,1185628742229446656,https://twitter.com/boltyboy/status/1185628742229446656,boltyboy,sarita,I'd still go short at that price. Please IPO @wework!,2019-10-19 18:48:14+00:00,0,1,1,@wework,,
331,1185628613766504450,https://twitter.com/Investeraren/status/1185628613766504450,Investeraren,erikmalm,The Indicator som pratade om årets IPO:s o i slutet pratar de om WeWork https://podcasts.apple.com/se/podcast/the-indicator-from-planet-money/id1320118593?i=1000454039584 …,2019-10-19 18:47:44+00:00,0,2,2,,,
332,1185628543583244290,https://twitter.com/NaplesRunner/status/1185628543583244290,NaplesRunner,rcwhalen,"@jpmorgan I think Jamie's pride won't let Wework fail. That said, he should let it go in the dustpan of capital burning unicorns like Wayfair",2019-10-19 18:47:27+00:00,0,0,0,@jpmorgan,,
333,1185628065973432320,https://twitter.com/trtoise_shell/status/1185628065973432320,trtoise_shell,,ソフトバンクG、WeWork混乱にどう対応？ 5400億円支援報道も...次の一手は（J-CASTニュース） http://dlvr.it/RGXn9d pic.twitter.com/ygBsVuXjpE,2019-10-19 18:45:33+00:00,0,0,0,,,
334,1185627889783525381,https://twitter.com/BarbarianCap/status/1185627889783525381,BarbarianCap,,WeWork capital structure pic.twitter.com/QcMAroiEbq,2019-10-19 18:44:51+00:00,0,7,7,,,
335,1185627487314644992,https://twitter.com/90JEduardo/status/1185627487314644992,90JEduardo,,Adam Neumann planned for his children and grandchildren to control WeWork – TechCrunch WeWork co-founder Adam Neumann didn’t plan for his family’s control of WeWork to end at his death but instead expected to pass… https://www.instagram.com/p/B3z20AugUzq/?igshid=ef2ljo7b55a9 …,2019-10-19 18:43:15+00:00,0,0,0,,,
336,1185626892843532288,https://twitter.com/jyarow/status/1185626892843532288,jyarow,,Subtweeting WeWork? pic.twitter.com/2DF69MsHqQ,2019-10-19 18:40:53+00:00,0,4,4,,,
337,1185626477951442944,https://twitter.com/Jules_T_/status/1185626477951442944,Jules_T_,,WeWork’s Failure is SoftBank’s Day Of Reckoning https://www.wired.com/story/weworks-failure-is-softbanks-day-of-reckoning …pic.twitter.com/tXy1UneXGE,2019-10-19 18:39:14+00:00,0,0,0,,,
338,1185626277073608706,https://twitter.com/ruchitweet/status/1185626277073608706,ruchitweet,ZLaTaNp1KacHu10,What I am saying is that their model is flawed ...lot of things are good but are not sustainable. WeWork is not recovering even 25% cost from customer whom it is renting these offices. yes offices are good ..so enjoy whilst you can because the business model is unsustainable,2019-10-19 18:38:26+00:00,0,1,1,,,
339,1185626078330572800,https://twitter.com/CowardsRatio/status/1185626078330572800,CowardsRatio,CowardsRatio,I can’t wait for Kamala to put her campaign HQ in a WeWork,2019-10-19 18:37:39+00:00,0,1,1,,,
340,1185625994612359168,https://twitter.com/SuccessLandlord/status/1185625994612359168,SuccessLandlord,,"Google snubs WeWork, signs Toronto lease with co-working rival IWG http://business.financialpost.com/wcm/a5a20880-38e1-4e1d-a615-b7eeb64b8f67 … via @nationalpost",2019-10-19 18:37:19+00:00,0,0,0,@nationalpost,,
341,1185625913385312256,https://twitter.com/qcae13py/status/1185625913385312256,qcae13py,,ソフトバンクG、WeWork混乱にどう対応？ 5400億円支援報道も...次の一手は。そうだ。,2019-10-19 18:37:00+00:00,0,0,0,,,
342,1185625468130779136,https://twitter.com/paul_hundred/status/1185625468130779136,paul_hundred,kushnerbomb,Did the CEO of WeWork hire Parsi advisors?,2019-10-19 18:35:14+00:00,0,2,2,,,
343,1185625362853584896,https://twitter.com/310JPN/status/1185625362853584896,310JPN,,weworkの追加資金をソフトバンクから入れると、GPとLPのコンフリクトが生じるって指摘があるけど、SBグループは、そうやって大きくなってきたから。思考の根幹には「最終最後、LPが納得する解を出せばいいでしょ」というスタンス。「捨てる神あれば、拾う神あり精神」とも言える。勇ましいよなぁ。,2019-10-19 18:34:49+00:00,0,2,2,,,
344,1185625171329081344,https://twitter.com/ArchDailyBR/status/1185625171329081344,ArchDailyBR,,Prestige Central: a primeira seda da WeWork na Índia http://dlvr.it/RGXlnY,2019-10-19 18:34:03+00:00,0,0,0,,,
345,1185625048104742912,https://twitter.com/AtaHomayoun/status/1185625048104742912,AtaHomayoun,,"Scott Galloway says market is shifting, trouble for Uber and WeWork - Business Insider ⁦ @profgalloway⁩https://www.profgalloway.com/marginal",2019-10-19 18:33:33+00:00,0,1,1,@profgalloway,,
346,1185624967402213377,https://twitter.com/AventeonNL/status/1185624967402213377,AventeonNL,,"Scott Galloway says market is shifting, trouble for Uber and WeWork https://www.businessinsider.com/scott-galloway-says-market-shifting-trouble-for-uber-and-wework-2019-10 …",2019-10-19 18:33:14+00:00,0,0,0,,,
347,1185624605001691136,https://twitter.com/erikmalm/status/1185624605001691136,erikmalm,Investeraren,"WeWork förtjänar ett hedersomnämnande i den kategorin tycker jag, även om de då inte ens kom till startlinjen.",2019-10-19 18:31:48+00:00,0,0,0,,,
348,1185624447325212674,https://twitter.com/kushnerbomb/status/1185624447325212674,kushnerbomb,,"Moby Dick is about WeWork avant le lettre, a venture-funded enterprise destroyed by the self-dealing and recklessness of a monomaniacal executive send tweet",2019-10-19 18:31:10+00:00,0,13,13,,,
349,1185623180272197632,https://twitter.com/hurrya1/status/1185623180272197632,hurrya1,ahmed,"Why is @PIFSaudi obsessed with investing in VC & doomed startups like #WeWork, #Uber..., If the ROI provided by VC is less than the S&P 500 and that of #Softbank is even worse? Why not invest in more original ideashttps://www.pionline.com/article/20180319/PRINT/180319872/lower-returns-on-horizon-for-venture-capital …",2019-10-19 18:26:08+00:00,0,0,0,@PIFSaudi,#WeWork #Uber #Softbank,
350,1185622991356354561,https://twitter.com/Jill_Milan/status/1185622991356354561,Jill_Milan,,San Francisco EcoFashion Show produced by #sffama. Sponsors included #suntory #goodwill #WeWork pic.twitter.com/suDHFldQJQ,2019-10-19 18:25:23+00:00,0,1,1,,#sffama #suntory #goodwill #WeWork,
351,1185622757737783296,https://twitter.com/Airhoster2/status/1185622757737783296,Airhoster2,,@WeWork you guys need to have places with commercial washers and dyers! We are a co-hosting company that would pay for a hip place to network and do laundry for our clients! #gigmarket #airbnb #vrbo #llc #startup #startupchats,2019-10-19 18:24:27+00:00,2,0,0,@WeWork,#gigmarket #airbnb #vrbo #llc #startup #startupchats,
352,1185622469522186240,https://twitter.com/flyalex666/status/1185622469522186240,flyalex666,axios,#SoftBank investments could land in a hard landing fashion. #JustSaying #WeWork https://twitter.com/axios/status/1185621634935164928 …,2019-10-19 18:23:19+00:00,0,0,0,,#SoftBank #JustSaying #WeWork,
353,1185622453596246016,https://twitter.com/SystemicSarcasm/status/1185622453596246016,SystemicSarcasm,,Worth reading! There is no free lunch or easy ride. Hard work and #leadership. #startup #fintech WeWork’s Failure is SoftBank’s Day Of Reckoning http://flip.it/dosTMM RT @ManuMedinar,2019-10-19 18:23:15+00:00,1,0,0,@ManuMedinar,#leadership #startup #fintech,
354,1185622444322607105,https://twitter.com/ZLaTaNp1KacHu10/status/1185622444322607105,ZLaTaNp1KacHu10,ruchitweet,"I don't get it. If a company can afford it, then it's worth it. I'm not talking about WeWork's finances. I'm talking about their offices.",2019-10-19 18:23:13+00:00,0,0,0,,,
355,1185621969099640832,https://twitter.com/HighSierraMan/status/1185621969099640832,HighSierraMan,,WeWork Runs Out Of Money https://www.axios.com/wework-value-8-billion-c65ba7d7-32d8-4748-a33f-c0c159d2fd84.html?utm_source=twitter&utm_medium=twsocialshare&utm_campaign=organic …,2019-10-19 18:21:19+00:00,0,0,0,,,
356,1185621773288648704,https://twitter.com/ManuMedinar/status/1185621773288648704,ManuMedinar,,Worth reading! There is no free lunch or easy ride. Hard work and #leadership. #startup #fintech WeWork’s Failure is SoftBank’s Day Of Reckoning http://flip.it/dosTMM,2019-10-19 18:20:33+00:00,3,2,2,,#leadership #startup #fintech,
357,1185621634935164928,https://twitter.com/axios/status/1185621634935164928,axios,,"As WeWork runs out of money, SoftBank Group is orchestrating the company's ""rescue financing plan"" that could value it below $8 billion. https://www.axios.com/wework-value-8-billion-c65ba7d7-32d8-4748-a33f-c0c159d2fd84.html?utm_source=twitter&utm_medium=social&utm_campaign=organic …",2019-10-19 18:20:00+00:00,1,8,8,,,
358,1185621282911670273,https://twitter.com/MMAGuardian/status/1185621282911670273,MMAGuardian,,WeWork’s Failure is SoftBank’s Day Of Reckoning | WIRED https://www.wired.com/story/weworks-failure-is-softbanks-day-of-reckoning/ …,2019-10-19 18:18:36+00:00,0,0,0,,,
359,1185621266532687872,https://twitter.com/ApakshG/status/1185621266532687872,ApakshG,,Adam Neumann planned for his children and grandchildren to control WeWork http://dlvr.it/RGXjyh pic.twitter.com/OWrl47NbYn,2019-10-19 18:18:32+00:00,0,0,0,,,
360,1185620780794540032,https://twitter.com/intra_daytrader/status/1185620780794540032,intra_daytrader,business,"That's called WeWork model, just burn the money.",2019-10-19 18:16:36+00:00,0,0,0,,,
361,1185620635982225409,https://twitter.com/Vizidio1/status/1185620635982225409,Vizidio1,,#WeWork troubles may have a knock on effect on some of #Softbanks other investments like #Uber and #DoorDash. Softbank has invested over $10b in the troubled office start up and their reputation is on the line big time with this one.https://www.fool.com/investing/2019/10/19/wework-collapse-warning-for-food-delivery-apps.aspx …,2019-10-19 18:16:02+00:00,0,0,0,,#WeWork #Softbanks #Uber #DoorDash,
362,1185620463948566528,https://twitter.com/sacrelyne/status/1185620463948566528,sacrelyne,profgalloway,"Well, WeWork thought it was placing its stakes in as wide a market that it could - being afraid from the competition that would be copying their model. They should have had more faith in being creative and hiring the right talent to keep the needed innovations coming...",2019-10-19 18:15:21+00:00,0,0,0,,,
363,1185620393152958464,https://twitter.com/aoliverax/status/1185620393152958464,aoliverax,,WeWork And The Value Of Effective Governance https://buff.ly/31fqbGu #governance #leadership #BoardOfDirectors #accountability #management #CEOspic.twitter.com/80dOsmqpTR,2019-10-19 18:15:04+00:00,1,1,1,,#governance #leadership #BoardOfDirectors #accountability #management #CEOspic,
364,1185620101027913730,https://twitter.com/310JPN/status/1185620101027913730,310JPN,,wework単体でリターンを上げるのではなく、ネット業界の見本市だったコムデックスを買収することで、世界へのルートを作ったパターンのように、weworkで世界の起業家の生態系を作ろうとしたのだろうから、それは、単体で評価するものではない気がしてる。 ↓過去の見てみて。 https://president.jp/articles/-/23998 …,2019-10-19 18:13:54+00:00,1,3,3,,,
365,1185619705916116993,https://twitter.com/ZLaTaNp1KacHu10/status/1185619705916116993,ZLaTaNp1KacHu10,,WeWork's offices r good. No doubt about it.,2019-10-19 18:12:20+00:00,0,0,0,,,
366,1185619228617072640,https://twitter.com/A1Mhigh/status/1185619228617072640,A1Mhigh,MarketCrumbs,All turned out to be donkeys with a traffic cone strapped to the top of their head. As for WeWork it didn't even get down the cat walk before it face planted. https://twitter.com/MarketCrumbs/status/1185259499155787777 …,2019-10-19 18:10:26+00:00,0,2,2,,,
367,1185619142268932097,https://twitter.com/erealty/status/1185619142268932097,erealty,,"Why #realestate #startup Compass, valued at $6.4B, wants you to know its executives fly coach - nothing says “We’re not WeWork” like a coach class ticket on a commercial airline http://ow.ly/hN3730pK6ya | Fortune",2019-10-19 18:10:05+00:00,0,0,0,,#realestate #startup,
368,1185619129832820736,https://twitter.com/RebelDevNews/status/1185619129832820736,RebelDevNews,,WeWork’s Failure is SoftBank’s Day Of Reckoning https://www.wired.com/story/weworks-failure-is-softbanks-day-of-reckoning …,2019-10-19 18:10:02+00:00,0,0,0,,,
369,1185619123734220801,https://twitter.com/ColoradoSun/status/1185619123734220801,ColoradoSun,,"With or without WeWork, Colorado’s coworking industry sees sustainable growth in flexible office space http://bit.ly/2BlBFhk",2019-10-19 18:10:01+00:00,0,0,0,,,
370,1185619110962417664,https://twitter.com/gontakokawaii/status/1185619110962417664,gontakokawaii,,価値5兆円→8000億円=4兆2000億円減。ド赤字のオフィスのまた貸し屋に付加価値ないのは猿でもわかる。すでに1兆円突っ込み、さらに5000億円追い銭 #ソフトバンク WeWorkの企業価値、1月比8割減8700億円に 日経新聞 https://www.nikkei.com/article/DGXMZO51176380Z11C19A0000000/ …,2019-10-19 18:09:58+00:00,0,1,1,,#ソフトバンク,
371,1185619072609931264,https://twitter.com/I_had_a_tweet/status/1185619072609931264,I_had_a_tweet,tonymrarcher,"SoftBank lol, throwing Money at WeWork and Uber unable to make a profit. They don’t need labor to ruin anything.",2019-10-19 18:09:49+00:00,0,0,0,,,
372,1185618714395316224,https://twitter.com/Arceliocarrasco/status/1185618714395316224,Arceliocarrasco,,Concep for new features on @instagram @dburka @asallen @producthunt @designdeptco @a16z @dougmcgray @popupmag @calsunday @artsy @framer @ghoshal @wework @erondu @sdadich @invisionapp @leggett @nori @facebook @aaronsklar @VictorMathieux @TheRyanFord @sdw @rideearth @jculbertson,2019-10-19 18:08:23+00:00,0,0,0,@instagram @dburka @asallen @producthunt @designdeptco @a16z @dougmcgray @popupmag @calsunday @artsy @framer @ghoshal @wework @erondu @sdadich @invisionapp @leggett @nori @facebook @aaronsklar @VictorMathieux @TheRyanFord @sdw @rideearth @jculbertson,,
373,1185618652499984387,https://twitter.com/austin_rief/status/1185618652499984387,austin_rief,,"""WeWork has raised more money from one fund ($11 billion) than the sum total of venture investments in 1996"" (h/t @profgalloway)",2019-10-19 18:08:09+00:00,9,45,45,@profgalloway,,
374,1185618311335141377,https://twitter.com/310JPN/status/1185618311335141377,310JPN,,weworkがすごいのかは、正直、ピンときてないけど、Uberとか、ほとんどのビジネスはネットに代替されるか、ネットを通じて規模の経済が働き、寡占していくと思う。そうなると、価格決定権を握れて、利益率も格段に上がる。利便性などを考えると消費者もそれを支持するから、全体として変な話ではない。,2019-10-19 18:06:47+00:00,1,2,2,,,
375,1185618126756401152,https://twitter.com/Paradox_Hosting/status/1185618126756401152,Paradox_Hosting,,WeWork's other toxicity problem: formaldehyde http://dlvr.it/RGXh2X pic.twitter.com/FkDvml5p1M,2019-10-19 18:06:03+00:00,0,0,0,,,
376,1185618124390973440,https://twitter.com/daveheckathorn/status/1185618124390973440,daveheckathorn,,"* Another WeWork exec is out, Bank OZK’s construction lending is up: Daily digest http://feedproxy.google.com/~r/trdnews/~3/ee6YJTKDPxQ/ … @trdny #CRE",2019-10-19 18:06:03+00:00,0,0,0,@trdny,#CRE,
377,1185617902856216577,https://twitter.com/architonic/status/1185617902856216577,architonic,,Rise by We by Wework (US) http://ow.ly/6hkV30pIM5G #interior #design #yogapic.twitter.com/6H7oyhlObh,2019-10-19 18:05:10+00:00,4,10,10,,#interior #design #yogapic,
378,1185617316358184960,https://twitter.com/bookwithlegs/status/1185617316358184960,bookwithlegs,SuperMugatu,"New New York’s hottest club is...WeWork. This place has everything – all you can drink kombucha, co-tenants that don’t shower or know what a courtesy flush is, and 8 startup ideas worse than a jump to conclusion mat.",2019-10-19 18:02:50+00:00,0,2,2,,,
379,1185617225073516544,https://twitter.com/mrmaiko/status/1185617225073516544,mrmaiko,,"In fact, the ""Hot Desks"" at libraries are probably quieter and more private than what I experienced at WeWork.",2019-10-19 18:02:28+00:00,0,2,2,,,
380,1185617107985293319,https://twitter.com/ProductEvents/status/1185617107985293319,ProductEvents,,How to Transition Into Your New #ProdMgmt Role? Learn at out free online event with @WeWork Platform PM live in 1h! Register here to join: https://prdct.school/2P539zA #ProductEvents #ProdMgmt,2019-10-19 18:02:00+00:00,0,0,0,@WeWork,#ProdMgmt #ProductEvents #ProdMgmt,
381,1185616966024941568,https://twitter.com/CurtisKimpton/status/1185616966024941568,CurtisKimpton,,"The rise and fall of WeWork's valuation shines a spotlight on the risks of insider-led ""up"" rounds, in which a firm reinvests in one of its portfolio companies at a higher price tag. http://www.wellington-altus.ca.advisor.news/wework-debacle-highlights-risks-of-high-valuations-set-by-existing-investors/?c=eyJ0eXAiOiJKV1QiLCJhbGciOiJIUzI1NiJ9.eyJub2RlX2lkIjoxMDU3OSwicHJldmlldyI6ZmFsc2UsImNvbW1faWQiOjE1NjI1MDcsImRlc3RfaWQiOjIxNTY4Nzl9.a7ryahRFkO4pAbLfLkhq-rsrweqkyV84chLC_ezcTcI …pic.twitter.com/iPyMkhvBQz",2019-10-19 18:01:27+00:00,0,0,0,,,
382,1185616885511053313,https://twitter.com/mrmaiko/status/1185616885511053313,mrmaiko,,WeWork charges people for services they can get for free at a public library.,2019-10-19 18:01:07+00:00,1,5,5,,,
383,1185616742980042752,https://twitter.com/Technology42day/status/1185616742980042752,Technology42day,,SoftBank reportedly preps a package to take control of WeWork parent company http://dlvr.it/RGXgP4 pic.twitter.com/70fAT4BmFn,2019-10-19 18:00:33+00:00,0,0,0,,,
384,1185616572376899585,https://twitter.com/FNGhadaki/status/1185616572376899585,FNGhadaki,,The casualties of moving fast and breaking things Bad behaviours ( @JUULvapor @WeWork @google @facebook..) vs #ethical ( @salesforce) http://bit.ly/2MvHn6A by @jencouldrey @BetaKit #socialimpact #ethics #leadership #CorporateGovernance Today’s #leaders need to be more #purposeful,2019-10-19 17:59:53+00:00,1,4,4,@JUULvapor @WeWork @google @facebook @salesforce @jencouldrey @BetaKit,#ethical #socialimpact #ethics #leadership #CorporateGovernance #leaders #purposeful,
385,1185616405917511680,https://twitter.com/satouKashuwamo/status/1185616405917511680,satouKashuwamo,,【WeWorkで働く理由をやめたわけ】 今回はそれに関して詳しく述べてみました。是非ともご覧ください。 https://mtlnk.net/j_%253A%252F%252Flovedesign.wpblog.jp%252F … #UX #Design #User #blog #デザイン #流行り #ユーザビリティ #仕事,2019-10-19 17:59:13+00:00,0,0,0,,#UX #Design #User #blog #デザイン #流行り #ユーザビリティ #仕事,
386,1185616355854209024,https://twitter.com/kakinokitane/status/1185616355854209024,kakinokitane,,ソフトバンクG、WeWork混乱にどう対応？ 5400億円支援報道も...次の一手は。そうだ。,2019-10-19 17:59:01+00:00,0,0,0,,,
387,1185616221074411520,https://twitter.com/JoeOfShadows/status/1185616221074411520,JoeOfShadows,TheAtlantic,"""By “real tech,” Cembalest was referring to companies whose principal product is software, rather than, say, WeWork, which is in truth a real-estate company caught wearing an Actual Tech Company costume before Halloween."" https://twitter.com/TheAtlantic/status/1185350528999579649 …",2019-10-19 17:58:29+00:00,0,1,1,,,
388,1185616092686733318,https://twitter.com/sergioaved/status/1185616092686733318,sergioaved,,"Adam Neumann told staff earlier this year his family had 100% control of WeWork and even in 300 years, his descendants would be in control as 'the moral compass of the company' WeBroke? https://www.businessinsider.in/finance/news/adam-neumann-told-staff-earlier-this-year-his-family-had-100-control-of-wework-and-even-in-300-years-his-descendants-would-be-in-control-as-the-moral-compass-of-the-company/amp_articleshow/71657244.cms …",2019-10-19 17:57:58+00:00,0,2,2,,,
389,1185615932821032960,https://twitter.com/iceboxdesigns/status/1185615932821032960,iceboxdesigns,,Adam Neumann planned for his children and grandchildren to control WeWork https://techcrunch.com/2019/10/18/adam-neumann-planned-for-his-children-and-grandchildren-to-control-wework/ … #tech #marketing #technewspic.twitter.com/wQp0vz0c2L,2019-10-19 17:57:20+00:00,0,0,0,,#tech #marketing #technewspic,
390,1185615222175723521,https://twitter.com/ryeander/status/1185615222175723521,ryeander,mcclure111,My last job used wework for meeting rooms when our elevator was down and we had disabled employees who needed to attend stuff. Solid meeting rooms but struck me as a terrible space to get work done in.,2019-10-19 17:54:31+00:00,0,0,0,,,
391,1185614954902294529,https://twitter.com/ratram1/status/1185614954902294529,ratram1,,4. WeWork value plunges https://www.axios.com/newsletters/axios-am-2022871b-2384-4c4b-a9f1-4585da9ff487.html?chunk=4&utm_term=twsocialshare#story4 … #axiosam,2019-10-19 17:53:27+00:00,0,0,0,,#story4 #axiosam,
392,1185613955626131456,https://twitter.com/alistair_chart/status/1185613955626131456,alistair_chart,,"Talking to two FinBros earlier today. One still in, currently working on an takeover/acquisition of a fintech firm (wouldn't tell me which one, damn) and one just left. We had a good laugh about WeWork, SoftBank and Uber.",2019-10-19 17:49:29+00:00,0,1,1,,,
393,1185613792421597190,https://twitter.com/cremarketingirl/status/1185613792421597190,cremarketingirl,mbalexan,I am putting a reminder in my calendar right now because #coworking is my life!!,2019-10-19 17:48:50+00:00,2,4,4,,#coworking,
394,1185612908090351618,https://twitter.com/listentotherowe/status/1185612908090351618,listentotherowe,,"The original WeWork! BLT, breakfast, accounting, coffee, lunch, realty, hamburger, income tax, coffee, leasing, dinner, $30, 30 years. #roncesvalles #dundaswest #wework #weworktorontopic.twitter.com/44DCNlvU18",2019-10-19 17:45:19+00:00,0,1,1,,#roncesvalles #dundaswest #wework #weworktorontopic,
395,1185612523321593866,https://twitter.com/ansmach/status/1185612523321593866,ansmach,CaseFoundation,"Garbage, this whole scheme of ‘entrepreneur’ is better know as getting rich with other peoples money. Every person I ever met who calls themselves entrepreneur is a con artist. Communities are better off without WeWork, condos and elitist restaurants.",2019-10-19 17:43:47+00:00,0,0,0,,,
396,1185611296764334080,https://twitter.com/Venice311/status/1185611296764334080,Venice311,LauraLeeActor,Ask if his series A investor has an option to buy their IP out for pennies on the dollar now... only to take IPO later under a different company...unless it is WeWork cause that’s already compromised,2019-10-19 17:38:55+00:00,0,2,2,,,
397,1185611051695517696,https://twitter.com/MikeYFLam/status/1185611051695517696,MikeYFLam,,This is also related to centralize vs decentralize... ...When any key decisions are held by so few ppl without any check and balance... @WIRED #WeWork #SoftBankhttps://www.wired.com/story/weworks-failure-is-softbanks-day-of-reckoning/ …,2019-10-19 17:37:56+00:00,0,0,0,@WIRED,#WeWork #SoftBankhttps,
398,1185610315838312448,https://twitter.com/jeromeusa/status/1185610315838312448,jeromeusa,,WeEat away any profits we could’ve had #WeWork #SoftBankhttps://lnkd.in/gzWRX8g,2019-10-19 17:35:01+00:00,0,0,0,,#WeWork #SoftBankhttps,
399,1185610254320422913,https://twitter.com/border___/status/1185610254320422913,border___,,要するにweworkの問題って第二のサブプライムローンで色々連鎖的に被害でるみたいな？,2019-10-19 17:34:46+00:00,0,0,0,,,
400,1185609792217341953,https://twitter.com/puledo/status/1185609792217341953,puledo,,WeWork’s Failure is SoftBank’s Day Of Reckoning https://ift.tt/2VVsHRj #Technology #technews #puledo_tech_update,2019-10-19 17:32:56+00:00,0,0,0,,#Technology #technews #puledo_tech_update,
