,id,permalink,username,author_id,text,date,formatted_date,to,retweets,favorites,replies,mentions,hashtags,urls,geo
1241,1190180199863898112,https://twitter.com/usacustomers/status/1190180199863898112,usacustomers,2190845029,WeWork and Uber’s struggles show how venture capital-backed #tech giants fail workershttp://www.ucscreen.com/wework-and-ubers-struggles-show-how-venture-capital-backed-tech-giants-fail-workers/ …,2019-11-01 08:14:06+00:00,Fri Nov 01 08:14:06 +0000 2019,,0,0,0,,#tech,http://www.ucscreen.com/wework-and-ubers-struggles-show-how-venture-capital-backed-tech-giants-fail-workers/,
1242,1190179558172966912,https://twitter.com/yuji_haba/status/1190179558172966912,yuji_haba,116892719,"WeWork Companies, Inc. pic.twitter.com/Fr8so8GJ8w",2019-11-01 08:11:33+00:00,Fri Nov 01 08:11:33 +0000 2019,,0,7,7,,,,
1243,1190179367218888709,https://twitter.com/peeleraja/status/1190179367218888709,peeleraja,16980261,wework founder is a militant vegetarian who doesnt even reimburse employees for nonveg food on official meals,2019-11-01 08:10:48+00:00,Fri Nov 01 08:10:48 +0000 2019,ramana_reddy,0,0,0,,,,
1244,1190179229939437573,https://twitter.com/geoff_ink/status/1190179229939437573,geoff_ink,15579088,in terms of value creation $JSETAS is the WeWork of South Africa. (some details differ but i am just a bear) https://twitter.com/smalltalkdaily/status/1190178444379860992 …,2019-11-01 08:10:15+00:00,Fri Nov 01 08:10:15 +0000 2019,smalltalkdaily,0,1,1,,,https://twitter.com/smalltalkdaily/status/1190178444379860992,
1245,1190179200231247872,https://twitter.com/kenhtingame/status/1190179200231247872,kenhtingame,903467412502151170,"Giữa tâm bão, WeWork bất ngờ đầu tư cho... Esports - https://ift.tt/2PEhi7k pic.twitter.com/Rao9R31jG2",2019-11-01 08:10:08+00:00,Fri Nov 01 08:10:08 +0000 2019,,0,0,0,,,https://ift.tt/2PEhi7k,
1246,1190179108287852544,https://twitter.com/ramana_reddy/status/1190179108287852544,ramana_reddy,39073086,Even wework offices have veg/nonveg microwaves :) ... this has gone to a place of no return :),2019-11-01 08:09:46+00:00,Fri Nov 01 08:09:46 +0000 2019,peeleraja,0,0,0,,,,
1247,1190179027241193474,https://twitter.com/shotaawata/status/1190179027241193474,shotaawata,94968395,スタートアップでご活躍の皆様がきっちりスーツ系の写真撮ってるの増えてるな〜 WeWork問題が象徴的だけど自由で挑戦的であることが賞賛されたスタートアップのバブル的な雰囲気が色褪せ、組織としてしっかりしてることに対する社会的評価が高まってきてる今日この頃なのかな pic.twitter.com/M6qWhHhHZs,2019-11-01 08:09:27+00:00,Fri Nov 01 08:09:27 +0000 2019,,0,0,0,,,,
1248,1190178497475559429,https://twitter.com/MY21_Oracle/status/1190178497475559429,MY21_Oracle,4054643129,WeWork's ex-CEO accused of pregnancy discrimination by former chief of staff https://www.theguardian.com/business/2019/oct/31/wework-ceo-adam-neumann-pregnancy-discrimination-lawsuit?CMP=share_btn_tw …,2019-11-01 08:07:20+00:00,Fri Nov 01 08:07:20 +0000 2019,,0,0,0,,,https://www.theguardian.com/business/2019/oct/31/wework-ceo-adam-neumann-pregnancy-discrimination-lawsuit?CMP=share_btn_tw,
1249,1190178188288126978,https://twitter.com/VitoCarrozzo/status/1190178188288126978,VitoCarrozzo,312967248,"Another doozy on everything wrong about WeWork....this one is about toxic phone booths made in China After today’s revelations about the former CEO’s attitude toward female employees at WeWork , fascinated to see what other controversies arise during the rest of November https://twitter.com/economynews2019/status/1190080653347311616 …",2019-11-01 08:06:07+00:00,Fri Nov 01 08:06:07 +0000 2019,economynews2019,0,1,1,,,https://twitter.com/economynews2019/status/1190080653347311616,
1250,1190178172869828610,https://twitter.com/WallStTV/status/1190178172869828610,WallStTV,2664230101,WeWork进军电子竞技，以后在办公室也可以打电动？ http://dlvr.it/RHP67L,2019-11-01 08:06:03+00:00,Fri Nov 01 08:06:03 +0000 2019,,0,0,0,,,http://dlvr.it/RHP67L,
1251,1190178067416854533,https://twitter.com/AccessWallST/status/1190178067416854533,AccessWallST,1526051053,"WeWork, former CEO Adam Neumann accused of pregnancy discrimination http://bit.ly/2C2LBMU",2019-11-01 08:05:38+00:00,Fri Nov 01 08:05:38 +0000 2019,,0,0,0,,,http://bit.ly/2C2LBMU,
1252,1190178051180638208,https://twitter.com/OutrageGuy/status/1190178051180638208,OutrageGuy,700512844161241089,"WeWork, former CEO Adam Neumann accused of pregnancy discrimination #tech #newshttp://feeds.reuters.com/~r/reuters/technologyNews/~3/iHY3Tsp-zOg/wework-former-ceo-adam-neumann-accused-of-pregnancy-discrimination-idUSKBN1XA2OA …",2019-11-01 08:05:34+00:00,Fri Nov 01 08:05:34 +0000 2019,,0,0,0,,#tech #newshttp,http://feeds.reuters.com/~r/reuters/technologyNews/~3/iHY3Tsp-zOg/wework-former-ceo-adam-neumann-accused-of-pregnancy-discrimination-idUSKBN1XA2OA,
1253,1190177546077442048,https://twitter.com/LafonDominique/status/1190177546077442048,LafonDominique,822177381507014656,Comment la chute de WeWork trouble la grande mode du coworking - Boursorama https://www.boursorama.com/bourse/actualites/comment-la-chute-de-wework-trouble-la-grande-mode-du-coworking-4e5fe6da00410ee8777f840acaf25a81 … Aucun modèle ne relève du “miracle”.,2019-11-01 08:03:34+00:00,Fri Nov 01 08:03:34 +0000 2019,,1,0,0,,,https://www.boursorama.com/bourse/actualites/comment-la-chute-de-wework-trouble-la-grande-mode-du-coworking-4e5fe6da00410ee8777f840acaf25a81,
1254,1190177213360070656,https://twitter.com/_Sound_Around_/status/1190177213360070656,_Sound_Around_,2807029784,"Co-working: When the home office is away from home Freelancers, consultants and entrepreneurs no longer need to work out of their homes or garages. Instead, they can rent space at ""co-working"" firms, such as WeWork, that provide a place to plug in as well as all the perks of…",2019-11-01 08:02:14+00:00,Fri Nov 01 08:02:14 +0000 2019,,0,0,0,,,,
1255,1190177208565981185,https://twitter.com/Pre_Online/status/1190177208565981185,Pre_Online,424707351,なぜ孫正義はWeWorkの投資失敗を認めないのか 一日でも早く｢携帯電話の次｣が必要 https://ift.tt/2PBa8kc,2019-11-01 08:02:13+00:00,Fri Nov 01 08:02:13 +0000 2019,,8,9,9,,,https://ift.tt/2PBa8kc,
1256,1190175996722348032,https://twitter.com/mizut99/status/1190175996722348032,mizut99,863026277615157248,話題のwework、建築設計で利用してる人いるんだろうか。 打ち合わせは捗るけど作業は進まないみたいなことにならないだろうか。,2019-11-01 07:57:24+00:00,Fri Nov 01 07:57:24 +0000 2019,,0,0,0,,,,
1257,1190175152346058752,https://twitter.com/viplavam/status/1190175152346058752,viplavam,11770362,WeWork and Uber's struggles show how venture capital-backed-tech giants fail workers https://www.nbcnews.com/think/opinion/wework-uber-s-struggles-show-how-venture-capital-backed-tech-ncna1074881 …,2019-11-01 07:54:03+00:00,Fri Nov 01 07:54:03 +0000 2019,,1,3,3,,,https://www.nbcnews.com/think/opinion/wework-uber-s-struggles-show-how-venture-capital-backed-tech-ncna1074881,
1258,1190175089804886016,https://twitter.com/monngonmoingay3/status/1190175089804886016,monngonmoingay3,956536476874895360,"Cựu CEO WeWork phân biệt giới tính, hút cần sa trước mặt phụ nữ mang thai https://ngon24h.wordpress.com/2019/11/01/cuu-ceo-wework-phan-biet-gioi-tinh-hut-can-sa-truoc-mat-phu-nu-mang-thai/ …pic.twitter.com/jkCeaChmc2",2019-11-01 07:53:48+00:00,Fri Nov 01 07:53:48 +0000 2019,,0,0,0,,,https://ngon24h.wordpress.com/2019/11/01/cuu-ceo-wework-phan-biet-gioi-tinh-hut-can-sa-truoc-mat-phu-nu-mang-thai/,
1259,1190174938310701056,https://twitter.com/Playtopseller/status/1190174938310701056,Playtopseller,3190457286,トプセライベント！ソーシャルマーケティングセミナーWeWork難波のメインスピーカーの1人 @nycityindex がN.Yお土産持ってきてくれた！ありがとう！ もうちょいでスタートです！pic.twitter.com/tIf18yrWqF,2019-11-01 07:53:12+00:00,Fri Nov 01 07:53:12 +0000 2019,,1,4,4,@nycityindex,,,
1260,1190174522730663936,https://twitter.com/SPORTSCIRCUSINT/status/1190174522730663936,SPORTSCIRCUSINT,293968006,"WeWork's Neumann gives up control, CEO role following investor revolt http://dlvr.it/RHP4Fp pic.twitter.com/p79B8dKx1d",2019-11-01 07:51:33+00:00,Fri Nov 01 07:51:33 +0000 2019,,0,0,0,,,http://dlvr.it/RHP4Fp,
1261,1190174467772674048,https://twitter.com/D4Csuperdragoon/status/1190174467772674048,D4Csuperdragoon,823716251033706500,WeWorkは生ビールが飲める！ pic.twitter.com/e2Z6NYcVIY,2019-11-01 07:51:20+00:00,Fri Nov 01 07:51:20 +0000 2019,,0,19,19,,,,
1262,1190174431240433667,https://twitter.com/LondonLovesBiz/status/1190174431240433667,LondonLovesBiz,13519212,WeWork slapped with discrimination case - http://londonlovesbusiness.com/wework-slapped-with-discrimination-case/ …pic.twitter.com/6qzHMrvHBR,2019-11-01 07:51:11+00:00,Fri Nov 01 07:51:11 +0000 2019,,0,0,0,,,http://londonlovesbusiness.com/wework-slapped-with-discrimination-case/,
1263,1190173965769048064,https://twitter.com/ivashko/status/1190173965769048064,ivashko,21271464,Maybe the VC scene in the bay is a sufficient differentiator. But I’m not so sure money will flow so freely post WeWork. And there are quality of life sacrifices few are prepared to make,2019-11-01 07:49:20+00:00,Fri Nov 01 07:49:20 +0000 2019,ivashko,0,0,0,,,,
1264,1190173665540943872,https://twitter.com/AllDailyRepNews/status/1190173665540943872,AllDailyRepNews,388084044,Embattled WeWork opens San Francisco co-working space for food startups [San Francisco Chronicle] https://www.dailyrepublic.com/all-dr-news/wires/embattled-wework-opens-san-francisco-co-working-space-for-food-startups-san-francisco-chronicle/ …,2019-11-01 07:48:08+00:00,Fri Nov 01 07:48:08 +0000 2019,,0,0,0,,,https://www.dailyrepublic.com/all-dr-news/wires/embattled-wework-opens-san-francisco-co-working-space-for-food-startups-san-francisco-chronicle/,
1265,1190172929918668800,https://twitter.com/WillStaats/status/1190172929918668800,WillStaats,1499069844,Me: I'm sick and should go to sleep Also me: *stays up until 4:00 am reading articles about AirBnB scams and how WeWork is hemorrhaging money*,2019-11-01 07:45:13+00:00,Fri Nov 01 07:45:13 +0000 2019,,0,1,1,,,,
1266,1190172910104829952,https://twitter.com/theWOWpodcast/status/1190172910104829952,theWOWpodcast,1053297731542880256,WeWork have risen to a huge status in the world and the world of work. Here's a bit of a deep look at them and the kind of weird place they are. http://ow.ly/Dg8130pihiR,2019-11-01 07:45:08+00:00,Fri Nov 01 07:45:08 +0000 2019,,1,2,2,,,http://ow.ly/Dg8130pihiR,
1267,1190172876881776642,https://twitter.com/nadeemansary/status/1190172876881776642,nadeemansary,108074347,RT @businessinsider: WeWork's toxic phone booths were created in-house by its 'Powered by We' business http://www.businessinsider.com/weworks-toxic-phone-booths-were-created-by-wework-2019-10 …,2019-11-01 07:45:00+00:00,Fri Nov 01 07:45:00 +0000 2019,,0,0,0,@businessinsider,,http://www.businessinsider.com/weworks-toxic-phone-booths-were-created-by-wework-2019-10,
1268,1190171840817385472,https://twitter.com/WeinbrennJonny/status/1190171840817385472,WeinbrennJonny,915921617011830786,"Today’s #financialtimes highlighting shrinking US IPO activity (almost halved over last two decades) whilst x5 increase of global private equity market, over same period. #privateequity #investments #banking #economy #ipo #market #wework #uber #airbnbhttps://lnkd.in/egcDkWY",2019-11-01 07:40:53+00:00,Fri Nov 01 07:40:53 +0000 2019,,1,1,1,,#financialtimes #privateequity #investments #banking #economy #ipo #market #wework #uber #airbnbhttps,https://lnkd.in/egcDkWY,
1269,1190171796017963008,https://twitter.com/feedpushr/status/1190171796017963008,feedpushr,971401388860243970,WeWork and its ousted CEO accused of pregnancy discrimination https://www.cnn.com/2019/10/31/tech/wework-pregnancy-discrimination/index.html …,2019-11-01 07:40:43+00:00,Fri Nov 01 07:40:43 +0000 2019,,0,0,0,,,https://www.cnn.com/2019/10/31/tech/wework-pregnancy-discrimination/index.html,
1270,1190170954409754624,https://twitter.com/miyasunny2/status/1190170954409754624,miyasunny2,721165927736156160,【解説】ソフトバンク、WeWorkに「1兆円支援」のポイント https://newspicks.com/news/4323798/,2019-11-01 07:37:22+00:00,Fri Nov 01 07:37:22 +0000 2019,,0,0,0,,,https://newspicks.com/news/4323798/,
1271,1190170856833605633,https://twitter.com/zapnito/status/1190170856833605633,zapnito,600833730,"WeWork spend “$229,000 every hour, every day, year after year”. Why we may have seen the last of the unicorns for a while, as shared on @_moneymarketing's The DFM Centre, #PoweredByZapnitohttps://zapn.it/2qIt5qJ",2019-11-01 07:36:59+00:00,Fri Nov 01 07:36:59 +0000 2019,,1,2,2,@_moneymarketing,#PoweredByZapnitohttps,https://zapn.it/2qIt5qJ,
1272,1190170854719660032,https://twitter.com/dealbook/status/1190170854719660032,dealbook,16955517,"Adam Neumann's chief of staff at WeWork faced a pattern of gender and pregnancy discrimination, she says in a complaint filed with the EEOC today. https://nyti.ms/2NxABfO by @yaffebellany",2019-11-01 07:36:58+00:00,Fri Nov 01 07:36:58 +0000 2019,,1,2,2,@yaffebellany,,https://nyti.ms/2NxABfO,
1273,1190170666177384448,https://twitter.com/SangeetaWaldron/status/1190170666177384448,SangeetaWaldron,53368069,WeWork's ex-CEO accused of pregnancy discrimination by former chief of staff | Business | The Guardian https://www.theguardian.com/business/2019/oct/31/wework-ceo-adam-neumann-pregnancy-discrimination-lawsuit …,2019-11-01 07:36:13+00:00,Fri Nov 01 07:36:13 +0000 2019,,0,1,1,,,https://www.theguardian.com/business/2019/oct/31/wework-ceo-adam-neumann-pregnancy-discrimination-lawsuit,
1274,1190170546195095552,https://twitter.com/KPLR11/status/1190170546195095552,KPLR11,7612242,A former chief of staff to WeWork's cofounder and former CEO Adam Neumann says in a complaint filed Thursday that she was repeatedly discriminated against while pregnant at the company. https://kplr11.com/2019/10/31/wework-and-its-ousted-ceo-accused-of-pregnancy-discrimination/?utm_campaign=trueAnthem%3A+Trending+Content&utm_content=5dbbe0404c15b80001495669&utm_medium=trueAnthem&utm_source=twitter …,2019-11-01 07:35:45+00:00,Fri Nov 01 07:35:45 +0000 2019,,0,0,0,,,https://kplr11.com/2019/10/31/wework-and-its-ousted-ceo-accused-of-pregnancy-discrimination/?utm_campaign=trueAnthem%3A+Trending+Content&utm_content=5dbbe0404c15b80001495669&utm_medium=trueAnthem&utm_source=twitter,
1275,1190170448786575362,https://twitter.com/politicalHEDGE/status/1190170448786575362,politicalHEDGE,790019230389248000,"October 21, 2019@3:46pm Report: SoftBank is taking control of WeWork at an ~$8B valuation https://hedgeaccordingly.com/report-softbank-is-taking-control-of-wework-at-an-8b-valuation/ … #Nasdaq",2019-11-01 07:35:21+00:00,Fri Nov 01 07:35:21 +0000 2019,,0,0,0,@3,#Nasdaq,https://hedgeaccordingly.com/report-softbank-is-taking-control-of-wework-at-an-8b-valuation/,
1276,1190170127381209088,https://twitter.com/boydak120/status/1190170127381209088,boydak120,989216510928474113,Ordan ettiği zararın fazlasını dünyada sıkıntı çeken insanlara sigara satarak kazanıyorlar zaten,2019-11-01 07:34:05+00:00,Fri Nov 01 07:34:05 +0000 2019,ilysbydk,0,3,3,,,,
1277,1190170102777466880,https://twitter.com/cullenang/status/1190170102777466880,cullenang,480298967,WeWork and former CEO Adam Neumann were sued for alleged pregnancy and gender discrimination https://www.bloomberg.com/news/articles/2019-10-31/wework-ex-ceo-neumann-accused-of-pregnancy-discrimination … via @technology @eelarson,2019-11-01 07:33:59+00:00,Fri Nov 01 07:33:59 +0000 2019,,0,0,0,@technology @eelarson,,https://www.bloomberg.com/news/articles/2019-10-31/wework-ex-ceo-neumann-accused-of-pregnancy-discrimination,
1278,1190169659426967552,https://twitter.com/iashleyrichards/status/1190169659426967552,iashleyrichards,801766637066211328,#RT @businessinsider: WeWork's toxic phone booths were created in-house by its 'Powered by We' business http://www.businessinsider.com/weworks-toxic-phone-booths-were-created-by-wework-2019-10 …,2019-11-01 07:32:13+00:00,Fri Nov 01 07:32:13 +0000 2019,,0,0,0,@businessinsider,#RT,http://www.businessinsider.com/weworks-toxic-phone-booths-were-created-by-wework-2019-10,
1279,1190168857073205248,https://twitter.com/CWMedia2017/status/1190168857073205248,CWMedia2017,906833760972267521,"Some of Taipei’s biggest idle buildings are converted into vibrant co-working spaces. In 2019 alone, four international shared office brands have moved into the city. What is it that is attracting them to Taiwan? http://bit.ly/2WE9tjC #Taiwan #Taipei #WeTech #WeWork #Justco",2019-11-01 07:29:02+00:00,Fri Nov 01 07:29:02 +0000 2019,,4,5,5,,#Taiwan #Taipei #WeTech #WeWork #Justco,http://bit.ly/2WE9tjC,
1280,1190168005176676353,https://twitter.com/tmunatmatzav/status/1190168005176676353,tmunatmatzav,4902350182,"תלונה נגד אדם נוימן: ""מנכ""ל WeWork לעג לי ופגע במשרתי כשנכנסתי להריון"" - ynet ידיעות אחרונות http://www.tmuna.info/",2019-11-01 07:25:39+00:00,Fri Nov 01 07:25:39 +0000 2019,,0,0,0,,,http://www.tmuna.info/,
1281,1190167980761665536,https://twitter.com/jm_fayard/status/1190167980761665536,jm_fayard,2151758220,Like which tech company? I sure hope they don't run it like Theranos or WeWork,2019-11-01 07:25:33+00:00,Fri Nov 01 07:25:33 +0000 2019,nicolas_frankel,0,0,0,,,,
1282,1190167977204666368,https://twitter.com/hedgefundfocus/status/1190167977204666368,hedgefundfocus,16719112,WeWork's ex-CEO accused of pregnancy discrimination by former chief of staff http://dlvr.it/RHP0vN pic.twitter.com/6OzoiqnFbt,2019-11-01 07:25:32+00:00,Fri Nov 01 07:25:32 +0000 2019,,0,0,0,,,http://dlvr.it/RHP0vN,
1283,1190167886016516096,https://twitter.com/ilysbydk/status/1190167886016516096,ilysbydk,1084919626402840577,"Altria @JUULvapor için yaptığı 12.8 milyar USD'lik yatırımın 4.5 milyar USD'sini zarar yazmış, sanki devamı da gelecek gibi. @WeWork ve Juul'den sonra bakalım kim patlayacak. Abd'de VC krizi kapıda gibi sanki",2019-11-01 07:25:10+00:00,Fri Nov 01 07:25:10 +0000 2019,,0,4,4,@JUULvapor @WeWork,,,
1284,1190167845558198272,https://twitter.com/cxinsider/status/1190167845558198272,cxinsider,236294966,WeWork's cash problems could lead to a takeover by its largest investor that would see its valuation dip below $10B https://buff.ly/2VHbafv via @Inc,2019-11-01 07:25:01+00:00,Fri Nov 01 07:25:01 +0000 2019,,0,0,0,@Inc,,https://buff.ly/2VHbafv,
1285,1190167485317816321,https://twitter.com/swfinstitute/status/1190167485317816321,swfinstitute,144685905,WeWork and Katerra Weigh on SoftBank&#8217;s Vision Fund https://www.swfinstitute.org/news/75853/wework-and-katerra-weigh-on-softbanks-vision-fund …,2019-11-01 07:23:35+00:00,Fri Nov 01 07:23:35 +0000 2019,,0,0,0,,#8217,https://www.swfinstitute.org/news/75853/wework-and-katerra-weigh-on-softbanks-vision-fund,
1286,1190166922790346752,https://twitter.com/Gander_News_i5/status/1190166922790346752,Gander_News_i5,790037567232024577,"WeWork, former CEO Adam Neumann accused of pregnancy discrimination https://ift.tt/36jSR50",2019-11-01 07:21:21+00:00,Fri Nov 01 07:21:21 +0000 2019,,0,0,0,,,https://ift.tt/36jSR50,
1287,1190166656192004096,https://twitter.com/JCSura/status/1190166656192004096,JCSura,28096651,"WeWork, Former CEO Adam Neumann Accused of Rampant Pregnancy and Gender Discrimination https://ift.tt/336bmHY",2019-11-01 07:20:17+00:00,Fri Nov 01 07:20:17 +0000 2019,,0,0,0,,,https://ift.tt/336bmHY,
1288,1190166636193431552,https://twitter.com/ishiken_bot/status/1190166636193431552,ishiken_bot,57963979,WeWorkの前CEO、飛行機内のマリファナ吸引が妊婦と胎児の健康を脅かし、産休によって不当な扱いを受けたとして訴訟される。https://www.reuters.com/article/us-wework-discrimination-idUSKBN1XA2OA …,2019-11-01 07:20:12+00:00,Fri Nov 01 07:20:12 +0000 2019,,4,1,1,,,https://www.reuters.com/article/us-wework-discrimination-idUSKBN1XA2OA,
1289,1190166634088009728,https://twitter.com/JCSura/status/1190166634088009728,JCSura,28096651,Incredibly Stable Company WeWork Appears To Be Investing In Incredibly Stable Industry: Esports https://ift.tt/2BYePMT,2019-11-01 07:20:12+00:00,Fri Nov 01 07:20:12 +0000 2019,,0,0,0,,,https://ift.tt/2BYePMT,
1290,1190166597287084033,https://twitter.com/Boog1e_Man831/status/1190166597287084033,Boog1e_Man831,33452293,WeWork and its ousted CEO accused of pregnancy discrimination http://dlvr.it/RHP0Fp pic.twitter.com/gbXPDCezTx,2019-11-01 07:20:03+00:00,Fri Nov 01 07:20:03 +0000 2019,,0,0,0,,,http://dlvr.it/RHP0Fp,
1291,1190166476201721857,https://twitter.com/jijinjohn/status/1190166476201721857,jijinjohn,35845925,WeWork's ex-CEO accused of pregnancy discrimination by former chief of staff https://www.theguardian.com/business/2019/oct/31/wework-ceo-adam-neumann-pregnancy-discrimination-lawsuit?CMP=Share_AndroidApp_Tweet …,2019-11-01 07:19:34+00:00,Fri Nov 01 07:19:34 +0000 2019,,0,0,0,,,https://www.theguardian.com/business/2019/oct/31/wework-ceo-adam-neumann-pregnancy-discrimination-lawsuit?CMP=Share_AndroidApp_Tweet,
1292,1190166231535374338,https://twitter.com/g_solaria/status/1190166231535374338,g_solaria,840809649901264896,Things are going very well for wework I see. https://twitter.com/Reuters/status/1190165059756007425 …,2019-11-01 07:18:36+00:00,Fri Nov 01 07:18:36 +0000 2019,Reuters,1,2,2,,,https://twitter.com/Reuters/status/1190165059756007425,
1293,1190166019236597760,https://twitter.com/alphazbeta/status/1190166019236597760,alphazbeta,427091744,"New top story from Time: WeWork’s Ex-CEO Faces Pregnancy Discrimination Complaint https://ift.tt/2pwR1Nt ALEXANDRA OLSON / AP November 01, 2019 at 10:00AM",2019-11-01 07:17:45+00:00,Fri Nov 01 07:17:45 +0000 2019,,0,0,0,,,https://ift.tt/2pwR1Nt,
1294,1190165820338556928,https://twitter.com/katikelola/status/1190165820338556928,katikelola,23480087,"Neumannin kaltaisten ""guru""johtajien ilmiö on kiinnostava. Vaikka miten puhutaan modernista johtamisesta ja metoosta, tällaiset henkilöt vetoavat valtaa jakaviin yhä. WeWork’s Ousted C.E.O. Adam Neumann Is Accused of Pregnancy Discrimination via @NYTimeshttps://nyti.ms/36ln0AX?smid=nytcore-ios-share …",2019-11-01 07:16:58+00:00,Fri Nov 01 07:16:58 +0000 2019,,1,3,3,@NYTimeshttps,,https://nyti.ms/36ln0AX?smid=nytcore-ios-share,
1295,1190165809164886016,https://twitter.com/peterproperty/status/1190165809164886016,peterproperty,299151372,"Property Week: Terrific article on WeWork: “51 Eastcheap was acquired on 27 July for £47m, 120 Moorgate was acquired on 6 September for £43m. WeWork’s accounts show by the end of 2017, the properties were worth £56m and £59m, up 19% and 37% respectively.” https://www.propertyweek.com/news/wework-marked-up-value-of-london-offices-sharply-months-after-buying-them-investigation/5105010.article …",2019-11-01 07:16:55+00:00,Fri Nov 01 07:16:55 +0000 2019,,7,13,13,,,https://www.propertyweek.com/news/wework-marked-up-value-of-london-offices-sharply-months-after-buying-them-investigation/5105010.article,
1296,1190165407719514112,https://twitter.com/PllushCapital/status/1190165407719514112,PllushCapital,824856943768383491,"#WeWork's Corporate Structures, Special Purpose Vehicles and Off-shore Havens All Over The World Finally, 7 Weeks After I Broke the WeWork story in a global published article in the wee hours of morning on September 16, 2019, #Jou…https://lnkd.in/gkNXgMp https://lnkd.in/gYBvtgJ",2019-11-01 07:15:20+00:00,Fri Nov 01 07:15:20 +0000 2019,,0,0,0,,#WeWork #Jou,"https://lnkd.in/gkNXgMp,https://lnkd.in/gYBvtgJ",
1297,1190165324399706112,https://twitter.com/BloombergQuint/status/1190165324399706112,BloombergQuint,714731566828793857,"After lawsuits over gender and age discrimination, a complaint of anti-pregnancy bias has been filed against WeWork. http://bit.ly/2qcld0k",2019-11-01 07:15:00+00:00,Fri Nov 01 07:15:00 +0000 2019,,0,1,1,,,http://bit.ly/2qcld0k,
1298,1190165258620620800,https://twitter.com/JoshepAyya/status/1190165258620620800,JoshepAyya,124672114,"TIME ""WeWork's ex-CEO faces pregnancy discrimination complaint https://ti.me/2NxolMe """,2019-11-01 07:14:44+00:00,Fri Nov 01 07:14:44 +0000 2019,,0,0,0,,,https://ti.me/2NxolMe,
1299,1190165076277366784,https://twitter.com/ITMobjobs/status/1190165076277366784,ITMobjobs,128494703,Even if WeWork is in trouble the office is still being reinvented - It could lead to a two-tier system https://buff.ly/2M7NMn2 #office #work #talentmanagement #workculture,2019-11-01 07:14:01+00:00,Fri Nov 01 07:14:01 +0000 2019,,0,0,0,,#office #work #talentmanagement #workculture,https://buff.ly/2M7NMn2,
1300,1190165059756007425,https://twitter.com/Reuters/status/1190165059756007425,Reuters,1652541,"WeWork, former CEO Adam Neumann accused of pregnancy discrimination https://reut.rs/2NtyVEj via @brenpierspic.twitter.com/B5qtnFVQnm",2019-11-01 07:13:57+00:00,Fri Nov 01 07:13:57 +0000 2019,,17,22,22,@brenpierspic,,https://reut.rs/2NtyVEj,
1301,1190164989849546752,https://twitter.com/SeatSale/status/1190164989849546752,SeatSale,2173158246,WeWork’s Ousted C.E.O. Adam Neumann Is Accused of Pregnancy Discrimination: https://ift.tt/36lEOvQ,2019-11-01 07:13:40+00:00,Fri Nov 01 07:13:40 +0000 2019,,0,0,0,,,https://ift.tt/36lEOvQ,
1302,1190164850728718337,https://twitter.com/BloombergJapan/status/1190164850728718337,BloombergJapan,145455082,WeWorkで産休が「休暇」扱い－前ＣＥＯの元側近が差別を訴え https://bloom.bg/36pNNw4 pic.twitter.com/mNS3Tnnn2B,2019-11-01 07:13:07+00:00,Fri Nov 01 07:13:07 +0000 2019,,8,4,4,,,https://bloom.bg/36pNNw4,
