,id,permalink,username,to,text,date,retweets,favorites,replies,mentions,hashtags,geo
481,1185271186835550208,https://twitter.com/CoyDavidsonCRE/status/1185271186835550208,CoyDavidsonCRE,,SoftBank and JPMorgan at odds over WeWork rescue https://www.ft.com/content/a9254a70-f1a8-11e9-bfa4-b25f11f42901 … via @financialtimes,2019-10-18 19:07:26+00:00,0,7,7,@financialtimes,,
482,1185271142581493760,https://twitter.com/ColinJ_Keogh/status/1185271142581493760,ColinJ_Keogh,,"Events like the @NASA Space Apps Challenge couldn't happen without great sponsors like @BailyLabs, @WeWork, @smartdublin, @iadt, @DubCityCouncil, @esa and @StartupWeekDub. #StartupWeekDubpic.twitter.com/JmDaHhgHlm",2019-10-18 19:07:16+00:00,3,8,8,@NASA @BailyLabs @WeWork @smartdublin @iadt @DubCityCouncil @esa @StartupWeekDub,#StartupWeekDubpic,
483,1185270940596363269,https://twitter.com/Donzzo/status/1185270940596363269,Donzzo,FinancialTimes,"QUITE A REVALUATION....JUST WEEKS AGO, WEWORK WAS TOUTED AS A $48B BUSINESS.... https://twitter.com/FinancialTimes/status/1185269393728638977 …",2019-10-18 19:06:28+00:00,0,0,0,,,
484,1185270898334371840,https://twitter.com/CRLP_UCSD/status/1185270898334371840,CRLP_UCSD,ASMILEwithAnna,"Wow, Anna! What a way to showcase your students' vision and hard work. Congratulations!",2019-10-18 19:06:18+00:00,0,1,1,,,
485,1185270823189434370,https://twitter.com/startupnws/status/1185270823189434370,startupnws,,Goldman Sachs unloaded some of its WeWork shares before its investment bankers pitched investors on what it once considered a $60 billion-plus IPO https://www.businessinsider.com/goldman-sold-wework-stake-and-gave-lower-value-ipo-pitch-2019-10 … #Ipo,2019-10-18 19:06:00+00:00,0,0,0,,#Ipo,
486,1185270740213469184,https://twitter.com/DavidPollardIRL/status/1185270740213469184,DavidPollardIRL,,We’re running across the city from @SWDub to @NASA @SpaceAppsDublin at @WeWork - the second event of @StartupWeekDub! #SpaceAppspic.twitter.com/WQakmikSAb,2019-10-18 19:05:40+00:00,6,12,12,@SWDub @NASA @SpaceAppsDublin @WeWork @StartupWeekDub,#SpaceAppspic,
487,1185270682751586304,https://twitter.com/genemurphy/status/1185270682751586304,genemurphy,,Great start for the @NASA @SpaceAppsDublin Hackathon happening this weekend in @WeWork Labs Dublin! #StartupWeekDub #spaceappspic.twitter.com/8NeFSkmzFk,2019-10-18 19:05:26+00:00,3,11,11,@NASA @SpaceAppsDublin @WeWork,#StartupWeekDub #spaceappspic,
488,1185270657627643905,https://twitter.com/coachadam34/status/1185270657627643905,coachadam34,ASMILEwithAnna,How awesome!!!,2019-10-18 19:05:20+00:00,0,1,1,,,
489,1185270547338256385,https://twitter.com/AbogadoGomez2/status/1185270547338256385,AbogadoGomez2,washingtonpost,#WeWork and #WeInspirepic.twitter.com/Xk5HNOM9fc,2019-10-18 19:04:54+00:00,0,0,0,,#WeWork #WeInspirepic,
490,1185270524655616002,https://twitter.com/QuietFlostheDan/status/1185270524655616002,QuietFlostheDan,,Just spent a pleasant hour at Woodridge @dcpl. Why do we need WeWork?,2019-10-18 19:04:48+00:00,0,2,2,@dcpl,,
491,1185270502689927168,https://twitter.com/niconama2015/status/1185270502689927168,niconama2015,,自己啓発セミナーと孫正義、ソフトバンク倒産。wework問題、引き寄せの法則の嘘。 https://youtu.be/i32b5KJ43g4 @YouTubeさんから,2019-10-18 19:04:43+00:00,0,0,0,@YouTubeさんから,,
492,1185270169456656384,https://twitter.com/willstew/status/1185270169456656384,willstew,thesarahmain,Rise and fall of the fruity water!,2019-10-18 19:03:24+00:00,0,0,0,,,
493,1185270130651086848,https://twitter.com/ShamirAmit/status/1185270130651086848,ShamirAmit,,SoftBank Eyes WeWork Rescue Valuation Below $8 Billion - Bloomberg https://www.bloomberg.com/news/articles/2019-10-18/softbank-is-said-to-eye-wework-rescue-valuation-below-8-billion …,2019-10-18 19:03:15+00:00,0,0,0,,,
494,1185269837402005504,https://twitter.com/AbogadoGomez2/status/1185269837402005504,AbogadoGomez2,PamAdam67507224,#WeWork pic.twitter.com/Kc1KbBWCMy,2019-10-18 19:02:05+00:00,0,0,0,,#WeWork,
495,1185269813540773889,https://twitter.com/briand_mi/status/1185269813540773889,briand_mi,,"The profitability challenge for ""Challenger Banks"": Why it's not so easy to disrupt the large, legacy banks, especially in a post-WeWork world - http://ed.gr/bxmeq pic.twitter.com/1rPwbrfGVH",2019-10-18 19:01:59+00:00,0,1,1,,,
496,1185269804099346433,https://twitter.com/TalkMarkets/status/1185269804099346433,TalkMarkets,,More Lessons From #WeWork https://talkmarkets.com/content/more-lessons-from-wework?post=237657 …,2019-10-18 19:01:57+00:00,0,0,0,,#WeWork,
497,1185269662440755200,https://twitter.com/thesarahmain/status/1185269662440755200,thesarahmain,johnbiggs,@willstew,2019-10-18 19:01:23+00:00,0,1,1,@willstew,,
498,1185269405544058880,https://twitter.com/ColinJ_Keogh/status/1185269405544058880,ColinJ_Keogh,,Sending to outer space at @WeWork Charlemont Exchange #Dublin with @BailyLabs @NASA space apps global challenge. As part of @StartupWeekDub #StartupWeekDub. Check it outpic.twitter.com/ll9cWzJqRv,2019-10-18 19:00:22+00:00,5,11,11,@WeWork @BailyLabs @NASA @StartupWeekDub,#Dublin #StartupWeekDub,
499,1185269393728638977,https://twitter.com/FinancialTimes/status/1185269393728638977,FinancialTimes,,SoftBank and JPMorgan Chase are at odds over a multibillion-dollar rescue package for WeWork — submitting competing plans to pump as much as $5bn into WeWork in a deal that could value the group at $8bn or less. https://on.ft.com/31sYWZg,2019-10-18 19:00:19+00:00,7,13,13,,,
500,1185269346748239872,https://twitter.com/CarpeNoctom/status/1185269346748239872,CarpeNoctom,,MON Syria Rekt WeWork Phone Booths Rekt Libra Rekt Again TUES DNM Vaper Rekt WED Child Porn Ring Rekt Yahoo Groups Rekt THUR RIP Elijah Cummings TON agrees to halt CHI Teachers Strike FRI RIP Oracle CEO Barcelona Rekt US Polo Users Rekt G7: BTC has Failed UAW Strike,2019-10-18 19:00:08+00:00,8,38,38,,,
501,1185269331892101121,https://twitter.com/CryptoGlobeInfo/status/1185269331892101121,CryptoGlobeInfo,,"Bitcoin 'Greatest Gift' to Mankind, Says Former Google Africa CEO https://www.cryptoglobe.com/latest/2019/10/bitcoin-greatest-gift-to-mankind-says-former-google-africa-ceo/ … #StaffordMasie #Wework #WeworkSouthAfrica #GoogleAfrica #Bitcoin #Cointelegraph",2019-10-18 19:00:04+00:00,0,3,3,,#StaffordMasie #Wework #WeworkSouthAfrica #GoogleAfrica #Bitcoin #Cointelegraph,
502,1185269321800601600,https://twitter.com/hodl4eva/status/1185269321800601600,hodl4eva,haggertynDC,Nah that quote was about the WeWork IPO,2019-10-18 19:00:02+00:00,0,1,1,,,
503,1185269315039182848,https://twitter.com/koalsultingmx/status/1185269315039182848,koalsultingmx,,@WeWork está colocando fuera de servicio a 2.300 cabinas telefónicas de sus oficinas de alquiler en Estados Unidos y Canadá porque pueden tener niveles elevados de la sustancia química nociva para la salud: https://cnnespanol.cnn.com/video/wework-cabinas-telefonicas-causan-problemas-portafolio-global-cnnee/ …,2019-10-18 19:00:00+00:00,0,0,0,@WeWork,,
504,1185269303890907138,https://twitter.com/wojo_NYC/status/1185269303890907138,wojo_NYC,johnbiggs,I wish they'd sell off the Bose speakers in the bathroom to make extra money. Because there is nothing restful about a restroom that sounds like a concert venue.,2019-10-18 18:59:57+00:00,1,6,6,,,
505,1185269196973731840,https://twitter.com/eplynn/status/1185269196973731840,eplynn,,"2019 @WeWork: Hi we are struggling due to exposure from renting one floor, long-term, in many buildings. 2019 @Sonder: Cool so we will rent the whole building, long-term. It's cool though hotels are safer than commercial. #proptech #cretech #yikeshttps://www.wsj.com/articles/this-dallas-apartment-buildings-sole-tenant-is-a-new-lodging-company-11571137202 …",2019-10-18 18:59:32+00:00,0,4,4,@WeWork @Sonder,#proptech #cretech #yikeshttps,
506,1185269086122663937,https://twitter.com/JustinNolan_/status/1185269086122663937,JustinNolan_,ASMILEwithAnna,Awesome!,2019-10-18 18:59:06+00:00,0,1,1,,,
507,1185268988445691904,https://twitter.com/ryan932ljfldjf3/status/1185268988445691904,ryan932ljfldjf3,,WeWork got ReWorked.,2019-10-18 18:58:42+00:00,0,2,2,,,
508,1185268823798276098,https://twitter.com/StartupWeekDub/status/1185268823798276098,StartupWeekDub,,Love Space? Then you’ll love @NASA #SpaceApps challenge taking place in @WeWork Labs #Dublin all weekend! Well done to @BailyLabs and @SpaceAppsDublin team@for@putting this together and great to have you as part of #StartupWeekDub!!pic.twitter.com/qjCbtqkwGw,2019-10-18 18:58:03+00:00,3,4,4,@NASA @WeWork @BailyLabs @SpaceAppsDublin @for @putting,#SpaceApps #Dublin #StartupWeekDub,
509,1185268775333052417,https://twitter.com/Norman_Holler/status/1185268775333052417,Norman_Holler,,Some impressions from the new #WeWork #Berlin Friedrichstraße 76. Nice!pic.twitter.com/W6BH3coP5C,2019-10-18 18:57:51+00:00,0,0,0,,#WeWork #Berlin,
510,1185268303918456832,https://twitter.com/jesse_z06/status/1185268303918456832,jesse_z06,vixcontango,Nothing to see here. Carry on. Invest in wework or something.,2019-10-18 18:55:59+00:00,0,1,1,,,
511,1185268175262236672,https://twitter.com/ASMILEwithAnna/status/1185268175262236672,ASMILEwithAnna,,LOVED hosting @nichellem_tv and @CBSNews to celebrate the beautiful classroom remodel by @WeWork !! #SUHSDLearns #CrazyPLN #BetterTogether #PLN #WeAreWeWork #DoWhatYouLove #ClassroomRemodel #SUHSDpic.twitter.com/QTcuCpuE9T,2019-10-18 18:55:28+00:00,1,21,21,@nichellem_tv @CBSNews @WeWork,#SUHSDLearns #CrazyPLN #BetterTogether #PLN #WeAreWeWork #DoWhatYouLove #ClassroomRemodel #SUHSDpic,
512,1185267770004557824,https://twitter.com/CalebMelby/status/1185267770004557824,CalebMelby,,Another WeWork exec is gone from @ellenhuet and @GillianTanhttps://www.bloomberg.com/news/articles/2019-10-18/wework-is-facing-an-executive-exodus …,2019-10-18 18:53:52+00:00,0,0,0,@ellenhuet @GillianTanhttps,,
513,1185267722944499713,https://twitter.com/lisaabramowicz1/status/1185267722944499713,lisaabramowicz1,,Related: Morale ain't great at WeWork right now. https://www.bloomberg.com/news/articles/2019-10-18/wework-is-facing-an-executive-exodus …,2019-10-18 18:53:41+00:00,4,25,25,,,
514,1185267029621858304,https://twitter.com/ckc12_rb/status/1185267029621858304,ckc12_rb,crypto,why invest in crypto when you can invest in WeWork,2019-10-18 18:50:55+00:00,0,3,3,,,
515,1185266691271467009,https://twitter.com/ComAware_4S/status/1185266691271467009,ComAware_4S,,WeWork could run out of cash by mid-November — here’s what would happen next. https://www.cnbc.com/2019/10/17/what-happens-if-wework-runs-out-of-cash.html …,2019-10-18 18:49:35+00:00,1,0,0,,,
516,1185266626569965568,https://twitter.com/thebrandindex/status/1185266626569965568,thebrandindex,athomson6,I think SoftBank is bailing itself out more than wework lol,2019-10-18 18:49:19+00:00,0,3,3,,,
517,1185266385204731904,https://twitter.com/mattborchert/status/1185266385204731904,mattborchert,,"If this goes through, I'd expect SoftBank to try to get WeWork to rush to IPO again to get their capital back. Short that puppy when it happens.",2019-10-18 18:48:22+00:00,0,1,1,,,
518,1185266029351464960,https://twitter.com/chanian/status/1185266029351464960,chanian,,"WeWork: 90sDotCom Bubble Level Bankruptcies A stark reminder of the startup stock gambit, and absurdities of (modern) AMT. Let's look at a hypothetical of how bad this outcome could be for an early employee: https://www.businessinsider.com/wework-valuation-could-slip-below-8-billion-softbank-bailout-report-2019-10 …pic.twitter.com/63GAQzQy4s",2019-10-18 18:46:57+00:00,31,140,140,,,
519,1185265559409221632,https://twitter.com/agreenwaldHQ/status/1185265559409221632,agreenwaldHQ,briannekimmel,"There are other iterations of new, flexible type space for larger companies as well. i.e. HQ by WeWork and @knotel",2019-10-18 18:45:05+00:00,0,1,1,@knotel,,
520,1185265431524859905,https://twitter.com/GillianTan/status/1185265431524859905,GillianTan,,"Former fashion designer Adam Kimmel, WeWork's chief creative officer, is the co-working company's latest exec to depart. Scooplet w/ @ellenhuet https://www.bloomberg.com/news/articles/2019-10-18/wework-is-facing-an-executive-exodus …",2019-10-18 18:44:34+00:00,3,1,1,@ellenhuet,,
521,1185264514796867584,https://twitter.com/conorsen/status/1185264514796867584,conorsen,naufalsanaullah,2010’s tech culture rebelled against 90’s-2000’s corporate/finance culture. Next culture will rebel against the WeWork era.,2019-10-18 18:40:56+00:00,0,1,1,,,
522,1185264290611322882,https://twitter.com/DropsWizdom/status/1185264290611322882,DropsWizdom,,Ok im sick of this company RT @zerohedge: *WEWORK CREATIVE CHIEF ADAM KIMMEL IS SAID TO RESIGN,2019-10-18 18:40:02+00:00,0,0,0,@zerohedge,,
523,1185263921655091200,https://twitter.com/moritheil/status/1185263921655091200,moritheil,Edgecliffe,Time to WeWork-Theranos comparisons: Soon. #moneyhttps://twitter.com/Edgecliffe/status/1185248563661590529 …,2019-10-18 18:38:34+00:00,0,1,1,,#moneyhttps,
524,1185263849315950592,https://twitter.com/iproup/status/1185263849315950592,iproup,,WeWork sigue en problemas: el plan de rescate de Softbank reduciría drásticamente su valoración https://ift.tt/2J3rrqd,2019-10-18 18:38:17+00:00,0,0,0,,,
525,1185263792671907840,https://twitter.com/AnneHodgson17/status/1185263792671907840,AnneHodgson17,,"The rise and fall of WeWork's valuation shines a spotlight on the risks of insider-led ""up"" rounds, in which a firm reinvests in one of its portfolio companies at a higher price tag. http://www.advisorstream.com/read/wework-debacle-highlights-risks-of-high-valuations-set-by-existing-investors/?c=eyJ0eXAiOiJKV1QiLCJhbGciOiJIUzI1NiJ9.eyJub2RlX2lkIjoxMzc3NywicHJldmlldyI6ZmFsc2UsImNvbW1faWQiOjE1NTY5NTgsImRlc3RfaWQiOjIxNDc1MjB9.DyoAiLmpbx_A5t90I3X4J1UuERWfVnXQBve-Ke6JqHc …pic.twitter.com/MN8bLHFBFc",2019-10-18 18:38:03+00:00,0,0,0,,,
526,1185263668587565056,https://twitter.com/LAMarketRealEst/status/1185263668587565056,LAMarketRealEst,,Exclusive: WeWork owner creates committee to decide on financing lifeline - sources #Torabi.com #investment #RealEstate #Properties #LosAngeleshttps://bhive.nectar.social/Aa4nDd,2019-10-18 18:37:34+00:00,0,0,0,,#Torabi #investment #RealEstate #Properties #LosAngeleshttps,
527,1185263275560226817,https://twitter.com/ElizabethArcaro/status/1185263275560226817,ElizabethArcaro,,"Like WeWork, Compass touts tech and culture. Are the companies different enough? https://therealdeal.com/national/2019/10/17/like-wework-compass-touts-tech-and-culture-are-the-companies-different/?utm_medium=social&utm_source=twitter&utm_campaign=single_content_share … @IDollyLenz @joshreef",2019-10-18 18:36:00+00:00,2,2,2,@IDollyLenz @joshreef,,
528,1185263244719677441,https://twitter.com/CarolineHydeTV/status/1185263244719677441,CarolineHydeTV,,"""If SoftBank puts in a new $5 billion at a sub-$8 billion valuation, that will bring its total investment to about $15.8 billion, or about twice WeWork’s current value...” https://www.bloomberg.com/opinion/articles/2019-10-18/half-a-share-of-stock-is-better-than-nothing … via @bopinion",2019-10-18 18:35:53+00:00,2,6,6,@bopinion,,
529,1185263169977159685,https://twitter.com/WallStCards/status/1185263169977159685,WallStCards,,"SoftBank, JPMorgan submit competing rescue packages for WeWork, FT says $WE",2019-10-18 18:35:35+00:00,0,0,0,,,
530,1185262901797543936,https://twitter.com/nwwong/status/1185262901797543936,nwwong,,"Someone at SoftBank needs to be fired for their due diligence and valuation... (But it's probably Son). ""SoftBank Group Corp. is assembling a rescue financing plan for WeWork that may value the office-sharing company below $8 billion"" https://www.bloomberg.com/news/articles/2019-10-18/softbank-is-said-to-eye-wework-rescue-valuation-below-8-billion …",2019-10-18 18:34:31+00:00,0,0,0,,,
531,1185262779655245831,https://twitter.com/iceboxdesigns/status/1185262779655245831,iceboxdesigns,,Airbnb’s WeWork problem https://techcrunch.com/2019/10/17/airbnbs-wework-problem/ … #tech #marketing #technewspic.twitter.com/KXCMsZ3oTt,2019-10-18 18:34:02+00:00,0,1,1,,#tech #marketing #technewspic,
532,1185262421767790592,https://twitter.com/SethGoldstein13/status/1185262421767790592,SethGoldstein13,sallyshin,"WeWork employees take collective action and demand relief before Company goes bankrupt and it’s assets are sold off to pay Vision Fund, SoftBank, and JP Morgan.",2019-10-18 18:32:37+00:00,0,0,0,,,
533,1185262299575013376,https://twitter.com/WILLisACTIVE/status/1185262299575013376,WILLisACTIVE,CalWells,#buzzkill,2019-10-18 18:32:07+00:00,0,2,2,,#buzzkill,
534,1185262203290689537,https://twitter.com/veoliveirat/status/1185262203290689537,veoliveirat,,a wework definitivamente nao conhece o termo ''meio termo'',2019-10-18 18:31:45+00:00,0,0,0,,,
535,1185262132763471874,https://twitter.com/EnzoCalamo/status/1185262132763471874,EnzoCalamo,,"WeWork has an unusual way of counting its members, many sources say | @scoopithttps://www.businessinsider.com/wework-has-unusual-way-of-counting-members-sources-say-2019-10?utm_medium=social&utm_source=twitter …",2019-10-18 18:31:28+00:00,0,0,0,@scoopithttps,,
536,1185262127478722569,https://twitter.com/prop_tech/status/1185262127478722569,prop_tech,,Barry Sternlicht: WeWork went 'off the rails' but is a 'real company' https://www.cnbc.com/2019/10/18/barry-sternlicht-wework-went-off-the-rails-but-is-a-real-company.html …,2019-10-18 18:31:26+00:00,0,0,0,,,
537,1185262098055663618,https://twitter.com/ICEHInvest_USA/status/1185262098055663618,ICEHInvest_USA,zerohedge,#WeWork https://twitter.com/zerohedge/status/1185260154763251712 …,2019-10-18 18:31:19+00:00,0,0,0,,#WeWork,
538,1185261866173358081,https://twitter.com/Walldo/status/1185261866173358081,Walldo,johnbiggs,I do NOT miss the gross spa water from my wework days https://twitter.com/johnbiggs/status/1185215680737697794 …,2019-10-18 18:30:24+00:00,0,7,7,,,
539,1185261765417943042,https://twitter.com/WSJ/status/1185261765417943042,WSJ,,"#WSJWhatsNow: Brexit, WeWork, and more earnings. @paulvigna breaks down this week’s winners and losers and what we’re looking ahead to next week.pic.twitter.com/ZypvJ3wENk",2019-10-18 18:30:00+00:00,5,18,18,@paulvigna,#WSJWhatsNow,
540,1185261764235218944,https://twitter.com/Pauta_cl/status/1185261764235218944,Pauta_cl,,SoftBank valora el rescate de WeWork bajo los US$8.000 millones → http://bit.ly/2ptYWuT pic.twitter.com/mL2FuEbQtl,2019-10-18 18:30:00+00:00,0,1,1,,,
541,1185261622803292161,https://twitter.com/aleja_puente/status/1185261622803292161,aleja_puente,,Quieres saber ¿Cómo se viralizan las noticias Falsas? Ven a nuestra Charla Gratuita y entérate cómo puedes ayudar en la Mediathon. Fecha: Martes 29 de Octubre. Hora: 7pm. Lugar: WeWork Javier Prado. Inscríbete https://docs.google.com/forms/d/e/1FAIpQLScemyMLJZnn_7Xn6xxZIkoRr38GDvDNgFRvqRgad7WMjjSCPQ/viewform?usp=sf_link …pic.twitter.com/ZspsxuBYUl,2019-10-18 18:29:26+00:00,9,19,19,,,
542,1185261324634333190,https://twitter.com/archiloque/status/1185261324634333190,archiloque,mcclure111,"In France many WeWork customers are large corps that want to start « digital factories » were they create new projects to try this new agile thing they hear about, so they have big innovation budgets to burn",2019-10-18 18:28:15+00:00,0,0,0,,,
543,1185261168190865408,https://twitter.com/kimmytaylor/status/1185261168190865408,kimmytaylor,CalWells,I miss you too Cal.,2019-10-18 18:27:38+00:00,0,1,1,,,
544,1185260543587815424,https://twitter.com/rhotwire/status/1185260543587815424,rhotwire,,Airbnb’s WeWork problem https://techcrunch.com/2019/10/17/airbnbs-wework-problem/ … via @rhotwirepic.twitter.com/1oRS3b0ZWC,2019-10-18 18:25:09+00:00,0,0,0,@rhotwirepic,,
545,1185260411836391424,https://twitter.com/SethGoldstein13/status/1185260411836391424,SethGoldstein13,sallyshin,Time for WeWork employees to collectively walk out. Should demand WeWork end its forced arbitration agreements and non-competes.,2019-10-18 18:24:37+00:00,1,1,1,,,
546,1185260154763251712,https://twitter.com/zerohedge/status/1185260154763251712,zerohedge,,*WEWORK CREATIVE CHIEF ADAM KIMMEL IS SAID TO RESIGN,2019-10-18 18:23:36+00:00,26,81,81,,,
547,1185260119837294593,https://twitter.com/pdelamothe/status/1185260119837294593,pdelamothe,Jason_Rowley,Touche,2019-10-18 18:23:28+00:00,0,0,0,,,
548,1185260056109035525,https://twitter.com/predictiveinv/status/1185260056109035525,predictiveinv,,Real estate mogul Barry Sternlicht: WeWork went 'off the rails' but it's still a 'real company' https://www.cnbc.com/2019/10/18/barry-sternlicht-wework-went-off-the-rails-but-is-a-real-company.html … via @circleboom,2019-10-18 18:23:13+00:00,0,0,0,@circleboom,,
549,1185259903310614528,https://twitter.com/VRangade/status/1185259903310614528,VRangade,,"Google Said to Snub WeWork, Sign Toronto Lease With Co-Working Rival https://dailynews-india.com/google-said-to-snub-wework-sign-toronto-lease-with-co-working-rival/ …",2019-10-18 18:22:36+00:00,0,0,0,,,
550,1185259900777181184,https://twitter.com/vishal185526203/status/1185259900777181184,vishal185526203,,"Google Said to Snub WeWork, Sign Toronto Lease With Co-Working Rival https://dailynews-india.com/google-said-to-snub-wework-sign-toronto-lease-with-co-working-rival/ …",2019-10-18 18:22:36+00:00,0,0,0,,,
551,1185259898105487360,https://twitter.com/vishal210487/status/1185259898105487360,vishal210487,,"Google Said to Snub WeWork, Sign Toronto Lease With Co-Working Rival https://dailynews-india.com/google-said-to-snub-wework-sign-toronto-lease-with-co-working-rival/ …",2019-10-18 18:22:35+00:00,0,0,0,,,
552,1185259839200649221,https://twitter.com/sarahsholder/status/1185259839200649221,sarahsholder,,wework’s financial issues will be far more devastating for employees facing layoffs than for nyc real estate via @kristoncapps n mehttps://www.citylab.com/life/2019/10/wework-manhattan-real-estate-coworking-office-space-rental/599338/ …,2019-10-18 18:22:21+00:00,7,13,13,@kristoncapps,,
553,1185259799866265600,https://twitter.com/mattetti/status/1185259799866265600,mattetti,,"Neumann buys properties using a WeWork loan then rents out his new properties to the very same company. Trump: brilliant... hold my beer! G7 at my resort next year folks, oh and Alexa in every room!",2019-10-18 18:22:12+00:00,0,2,2,,,
554,1185259798352273410,https://twitter.com/dakincampbell/status/1185259798352273410,dakincampbell,,"This week's newsletter, including earnings insights and yes, more WeWork coverage: https://tinyletter.com/Dakin-Campbell/letters/jpmorgan-s-no-comment-on-its-wework-relationships-the-startup-s-kabbalah-connections-ubs-s-project-lexington-plan-to-combine-trading-teams … $JPM $GS $BAC $C $MS",2019-10-18 18:22:11+00:00,0,3,3,,,
555,1185259795873320960,https://twitter.com/ellenhuet/status/1185259795873320960,ellenhuet,,"also, i know it's more complicated than this, but as a ballpark: last time WeWork was valued around this much (2015), it had ~350 employees. now it has ~12,500, many of whom might've though that stock in late-stage unicorn would be, even priced conservatively, more $than this",2019-10-18 18:22:11+00:00,0,4,4,,,
556,1185259673332649987,https://twitter.com/EricGPlatt/status/1185259673332649987,EricGPlatt,,"SoftBank and JPMorgan are at odds over WeWork’s financial rescue. One option on the table could lead to margin calls for co-founder Adam Neumann, and present a risk to JPM. Our story w/ @JFK_America and @Edgecliffehttps://www.ft.com/content/a9254a70-f1a8-11e9-bfa4-b25f11f42901 …",2019-10-18 18:21:41+00:00,6,13,13,@JFK_America @Edgecliffehttps,,
557,1185259532982898688,https://twitter.com/gmanustudio/status/1185259532982898688,gmanustudio,,CityLab Daily: Imagining New York Without WeWork https://www.citylab.com/newsletter-editions/2019/10/citylab-daily/600304/?utm_source=feed … #gmanu #gmanudesigns #designbuild #inspirationpic.twitter.com/I2daZlNT0I,2019-10-18 18:21:08+00:00,0,0,0,,#gmanu #gmanudesigns #designbuild #inspirationpic,
558,1185259315390828552,https://twitter.com/Jason_Rowley/status/1185259315390828552,Jason_Rowley,pdelamothe,One might even call that a sobering experience,2019-10-18 18:20:16+00:00,0,1,1,,,
559,1185259120825376768,https://twitter.com/CeciliaStroppa/status/1185259120825376768,CeciliaStroppa,matheuslaneri,@elrafosaldanha wework faliu por causa disso aí https://twitter.com/matheuslaneri/status/1184110282265841667 …,2019-10-18 18:19:30+00:00,0,1,1,@elrafosaldanha,,
560,1185258907817693190,https://twitter.com/olvrcrf/status/1185258907817693190,olvrcrf,amandav_crf,eu de 5 em 5 segundos na wework https://twitter.com/amandav_crf/status/1184983169717719042 …,2019-10-18 18:18:39+00:00,0,1,1,,,
561,1185258783674515456,https://twitter.com/sallyshin/status/1185258783674515456,sallyshin,,when it rains it pours Wework being valued at fraction of the price.. and then this: Some deal options could lead to margin calls for co-founder Adam Neumann https://www.ft.com/content/a9254a70-f1a8-11e9-bfa4-b25f11f42901 …,2019-10-18 18:18:09+00:00,6,16,16,,,
562,1185258778545053697,https://twitter.com/pdelamothe/status/1185258778545053697,pdelamothe,johnbiggs,They first came for the beer. That was upsetting,2019-10-18 18:18:08+00:00,0,0,0,,,
563,1185258555345195009,https://twitter.com/bitentrepreneur/status/1185258555345195009,bitentrepreneur,BRubinCNBC,This is why I never worked at a wework it’s for people “playing startup” https://twitter.com/BRubinCNBC/status/1184040375218036737 …,2019-10-18 18:17:15+00:00,0,3,3,,,
564,1185258459337502721,https://twitter.com/ckc12_rb/status/1185258459337502721,ckc12_rb,Hugh_Son,"Hey, when you're crushing it with deals like WeWork...",2019-10-18 18:16:52+00:00,0,0,0,,,
