,id,permalink,username,author_id,text,date,formatted_date,to,retweets,favorites,replies,mentions,hashtags,urls,geo
753,1189183645770113026,https://twitter.com/lglabash/status/1189183645770113026,lglabash,30266761,Your invitation to hunt a unicorn... Are these disasters lurking in your 401(k)?... The fall of WeWork http://soci1.com/i/rltiu-your-invitation-to-hunt-a-unicorn-are-these-disasters-lurking-in-your-401k-the-fall-of-wework …,2019-10-29 14:14:09+00:00,Tue Oct 29 14:14:09 +0000 2019,,0,0,0,,,http://soci1.com/i/rltiu-your-invitation-to-hunt-a-unicorn-are-these-disasters-lurking-in-your-401k-the-fall-of-wework,
754,1189183622755971080,https://twitter.com/MarcGiller/status/1189183622755971080,MarcGiller,526602981,ISIS is fast becoming the WeWork of terrorist outfits. https://twitter.com/realDonaldTrump/status/1189172468159864832 …,2019-10-29 14:14:04+00:00,Tue Oct 29 14:14:04 +0000 2019,realDonaldTrump,0,0,0,,,https://twitter.com/realDonaldTrump/status/1189172468159864832,
755,1189183426936504320,https://twitter.com/KizouN/status/1189183426936504320,KizouN,4010456598,ソフトバンクに日銀が支援！？アベノミクスの闇。倒産。wework、ETF、ゴールドマンサックス https://youtu.be/j4WJSTJiye8 @YouTubeより,2019-10-29 14:13:17+00:00,Tue Oct 29 14:13:17 +0000 2019,,0,1,1,@YouTubeより,,https://youtu.be/j4WJSTJiye8,
756,1189183259160104965,https://twitter.com/TuliUrbach/status/1189183259160104965,TuliUrbach,3292175230,WeWork Teaches Investors a Lesson About Value https://www.wsj.com/articles/wework-debacle-teaches-investors-a-lesson-about-value-11572349056 …,2019-10-29 14:12:37+00:00,Tue Oct 29 14:12:37 +0000 2019,,0,0,0,,,https://www.wsj.com/articles/wework-debacle-teaches-investors-a-lesson-about-value-11572349056,
757,1189183230974418947,https://twitter.com/hikari_no_umi_8/status/1189183230974418947,hikari_no_umi_8,1090626980511272960,ソフトバンクに日銀が支援！？アベノミクスの闇。倒産。wework、ETF、ゴールドマンサックス https://youtu.be/j4WJSTJiye8 @YouTubeさんから,2019-10-29 14:12:30+00:00,Tue Oct 29 14:12:30 +0000 2019,,0,0,0,@YouTubeさんから,,https://youtu.be/j4WJSTJiye8,
758,1189183053471473664,https://twitter.com/ugatako/status/1189183053471473664,ugatako,83546289,何でweworkに投資したのでしょう？,2019-10-29 14:11:48+00:00,Tue Oct 29 14:11:48 +0000 2019,Fukadamoe,0,1,1,,,,
759,1189182646762557441,https://twitter.com/TheDomino/status/1189182646762557441,TheDomino,37718217,Part of me really wants to believe that if enough money gets lost...the lessons will stick... I'm being naive...right?,2019-10-29 14:10:11+00:00,Tue Oct 29 14:10:11 +0000 2019,ThorntonMcEnery,0,3,3,,,,
760,1189182585429086208,https://twitter.com/NBDR_CEO/status/1189182585429086208,NBDR_CEO,981258705265090560,WeWork Debacle Teaches Investors a Lesson About Value - The Wall Street Journal https://apple.news/AiY9tvaWHTsm_XX-dQQZglw …,2019-10-29 14:09:56+00:00,Tue Oct 29 14:09:56 +0000 2019,,0,2,2,,,https://apple.news/AiY9tvaWHTsm_XX-dQQZglw,
761,1189182485894070272,https://twitter.com/DudeWithModem/status/1189182485894070272,DudeWithModem,86569713,Wework is a great product. I’m sad Adam Neumann so carelessly abused his position of power.,2019-10-29 14:09:33+00:00,Tue Oct 29 14:09:33 +0000 2019,,0,0,0,,,,
762,1189182470526095365,https://twitter.com/realtreesquirel/status/1189182470526095365,realtreesquirel,1132659896334389249,"But if you were presented with the alternative of living in a WeWork cell and selling your plasma, wouldn’t that appeal to your sense of creativity and freedom and not costing the university anything?",2019-10-29 14:09:29+00:00,Tue Oct 29 14:09:29 +0000 2019,ryanaboyd,0,3,3,,,,
763,1189182396354256896,https://twitter.com/ThorntonMcEnery/status/1189182396354256896,ThorntonMcEnery,164021882,"While I enjoy a nice flotilla of thinkpieces as much as the next clown, the amount of public blame being placed on Adam Neumann makes me think that Wall Street will actually learn very little about its valuation problems from the @wework debacle.",2019-10-29 14:09:11+00:00,Tue Oct 29 14:09:11 +0000 2019,,2,15,15,@wework,,,
764,1189182380860268545,https://twitter.com/abcdbandit2017/status/1189182380860268545,abcdbandit2017,4846834408,So did the 47 billion evaluation,2019-10-29 14:09:08+00:00,Tue Oct 29 14:09:08 +0000 2019,SquawkCNBC,0,0,0,,,,
765,1189182130959470593,https://twitter.com/makoto_icoi_/status/1189182130959470593,makoto_icoi_,997867701698682881,僕がWeWorkでやってきたこと。 ●ランチ会を作って気軽な接点づくり ●満足度調査をしてニーズの可視化 ●アイデアソンでメンバーさんの事業支援 ●メンバーインタビューで活用法の共有 コミュニティの仕事はただ場のマネジメントだけじゃない。 満足度把握からナレッジシェアまで幅広い最高の仕事,2019-10-29 14:08:08+00:00,Tue Oct 29 14:08:08 +0000 2019,,0,3,3,,,,
766,1189181631044521988,https://twitter.com/Bank_CIC/status/1189181631044521988,Bank_CIC,393344675,#BUBBLE Einhörner gibt es nur im Märchenland http://bit.ly/2Wrqj4X #WeWork #Wirecard #Softbank,2019-10-29 14:06:09+00:00,Tue Oct 29 14:06:09 +0000 2019,,0,0,0,,#BUBBLE #WeWork #Wirecard #Softbank,http://bit.ly/2Wrqj4X,
767,1189181481656041472,https://twitter.com/loukwok/status/1189181481656041472,loukwok,7806382,"Is WeWork an Outlier, or Is Proptech Broken? http://dlvr.it/RHBdY6 pic.twitter.com/sGJ4cN1FHg",2019-10-29 14:05:33+00:00,Tue Oct 29 14:05:33 +0000 2019,,0,0,0,,,http://dlvr.it/RHBdY6,
768,1189181413335224320,https://twitter.com/TCNWorldwide/status/1189181413335224320,TCNWorldwide,50398107,WeWork’s Multibillion-Dollar Takeover by SoftBank Could Turn Into a Money Pit http://ow.ly/PstA30pNaf3 pic.twitter.com/LMEfOKknFv,2019-10-29 14:05:17+00:00,Tue Oct 29 14:05:17 +0000 2019,,0,0,0,,,http://ow.ly/PstA30pNaf3,
769,1189181149798526976,https://twitter.com/15MinuteNewsBus/status/1189181149798526976,15MinuteNewsBus,1540996266,WeWork Debacle Teaches Investors a Lesson About Value https://www.15minutenews.com/article/173204898/wework-debacle-teaches-investors-a-lesson-about-value/ … #StockMarkets,2019-10-29 14:04:14+00:00,Tue Oct 29 14:04:14 +0000 2019,,0,0,0,,#StockMarkets,https://www.15minutenews.com/article/173204898/wework-debacle-teaches-investors-a-lesson-about-value/,
770,1189181109453479936,https://twitter.com/ChanderSinghEsq/status/1189181109453479936,ChanderSinghEsq,16300295,Ben Horowitz: WeWork's company culture caused it to lose touch with reality http://dlvr.it/RHBdBj pic.twitter.com/q5ZTLDRsBc,2019-10-29 14:04:05+00:00,Tue Oct 29 14:04:05 +0000 2019,,0,0,0,,,http://dlvr.it/RHBdBj,
771,1189180957141733381,https://twitter.com/WeeklyMtgNL/status/1189180957141733381,WeeklyMtgNL,79206001,Ben Horowitz: WeWork's company culture caused it to lose touch with reality #realestatenewshttps://ift.tt/31ZKDeN,2019-10-29 14:03:28+00:00,Tue Oct 29 14:03:28 +0000 2019,,0,0,0,,#realestatenewshttps,https://ift.tt/31ZKDeN,
772,1189180725586620416,https://twitter.com/LLChatoff/status/1189180725586620416,LLChatoff,3232216225,Ben Horowitz: WeWork's company culture caused it to lose touch with reality http://dlvr.it/RHBd1R pic.twitter.com/fQZ65JBcsn,2019-10-29 14:02:33+00:00,Tue Oct 29 14:02:33 +0000 2019,,1,0,0,,,http://dlvr.it/RHBd1R,
773,1189180618204241920,https://twitter.com/Dear_John/status/1189180618204241920,Dear_John,136301956,Our gorgeous and talented Pink Wisdom Founder @alisonchace feelin' herself in those cameos and black leather jacket today. She's a lovvaa not a fighter. See you @wework soon xo #alisonchace #WeWork pic.twitter.com/wmhfHSGHFF,2019-10-29 14:02:07+00:00,Tue Oct 29 14:02:07 +0000 2019,,0,2,2,@alisonchace @wework,#alisonchace #WeWork,,
774,1189180513413500928,https://twitter.com/atami_urara/status/1189180513413500928,atami_urara,62922146,WeWorkの業態でこれだけ焦げてたら閉じるしかないような気がするんだけど孫さんはそうは思わなかったようだ,2019-10-29 14:01:42+00:00,Tue Oct 29 14:01:42 +0000 2019,,0,0,0,,,,
775,1189180339689795586,https://twitter.com/techjunkiejh/status/1189180339689795586,techjunkiejh,3064266184,#WeWork #TechJunkieNewshttps://twitter.com/CNBCtech/status/1189172805339959296 …,2019-10-29 14:01:01+00:00,Tue Oct 29 14:01:01 +0000 2019,CNBCtech,0,0,0,,#WeWork #TechJunkieNewshttps,https://twitter.com/CNBCtech/status/1189172805339959296,
776,1189180320135954432,https://twitter.com/commobserver/status/1189180320135954432,commobserver,40050816,"Is WeWork an Outlier, or Is Proptech Broken? http://bit.ly/2MRQ5MG",2019-10-29 14:00:56+00:00,Tue Oct 29 14:00:56 +0000 2019,,1,0,0,,,http://bit.ly/2MRQ5MG,
777,1189180309062983685,https://twitter.com/marketcheetah/status/1189180309062983685,marketcheetah,718440932652109824,VC Ben Horowitz: WeWork’s overly optimistic culture distorted reality https://marketcheetah.com/2019/10/29/vc-ben-horowitz-weworks-overly-optimistic-culture-distorted-reality/?utm_campaign=twitter&utm_medium=twitter&utm_source=twitter …,2019-10-29 14:00:54+00:00,Tue Oct 29 14:00:54 +0000 2019,,0,0,0,,,https://marketcheetah.com/2019/10/29/vc-ben-horowitz-weworks-overly-optimistic-culture-distorted-reality/?utm_campaign=twitter&utm_medium=twitter&utm_source=twitter,
778,1189180300821176320,https://twitter.com/wayyouwork/status/1189180300821176320,wayyouwork,1490469428,@WeWork has some of the nicest offices globally pic.twitter.com/HzOmouiW67,2019-10-29 14:00:52+00:00,Tue Oct 29 14:00:52 +0000 2019,,0,1,1,@WeWork,,,
779,1189180249633894402,https://twitter.com/mattypjs/status/1189180249633894402,mattypjs,1151877136619384832,How do you tell your WeWork neighbor that you love them?,2019-10-29 14:00:40+00:00,Tue Oct 29 14:00:40 +0000 2019,,0,0,0,,,,
780,1189180227525718016,https://twitter.com/mailandguardian/status/1189180227525718016,mailandguardian,16735210,WeWork went from unicorn darling with a nearly $50-billion valuation to a cautionary tale for gullible investors worth just $8-billion in a matter of months. https://mg.co.za/article/2019-10-29-wework-debacle-exposes-why-investing-in-a-charismatic-founder-can-be-dangerous …,2019-10-29 14:00:34+00:00,Tue Oct 29 14:00:34 +0000 2019,,0,4,4,,,https://mg.co.za/article/2019-10-29-wework-debacle-exposes-why-investing-in-a-charismatic-founder-can-be-dangerous,
781,1189180148588920833,https://twitter.com/NextBigThingBot/status/1189180148588920833,NextBigThingBot,866042267508891648,The next big thing is: WeWork but for Tiny homes,2019-10-29 14:00:15+00:00,Tue Oct 29 14:00:15 +0000 2019,,0,1,1,,,,
782,1189180086093860866,https://twitter.com/WeWork/status/1189180086093860866,WeWork,111092283,An increasing number of companies are going dog-friendly—something many people consider an office perk. Here's how bringing your dog to work can help promote social interactions: https://we.co/dogworktw . #wework #dogsofwework,2019-10-29 14:00:01+00:00,Tue Oct 29 14:00:01 +0000 2019,,2,16,16,,#wework #dogsofwework,https://we.co/dogworktw,
783,1189180083317043200,https://twitter.com/Works_For_Us/status/1189180083317043200,Works_For_Us,1031540435733360642,If you work or have worked for #WeWork we want to hear from you Are you worried about what is happening to the company? How can we help you on the workplaces issues that matter to you? Get in touch https://zcu.io/Co11 https://www.theguardian.com/commentisfree/2019/oct/28/wework-finance-workspace-unicorn-economic-model …,2019-10-29 14:00:00+00:00,Tue Oct 29 14:00:00 +0000 2019,,0,2,2,,#WeWork,"https://zcu.io/Co11,https://www.theguardian.com/commentisfree/2019/oct/28/wework-finance-workspace-unicorn-economic-model",
784,1189180018926276608,https://twitter.com/TgMacro/status/1189180018926276608,TgMacro,766312509829705728,"If Vision Fund/Saudi Arabia are getting rinsed in $UBER, $LYFT, $BYND, $SHOP, $GRUB, #WeWork - how fast do you think any Aramco bids will get smashed?",2019-10-29 13:59:45+00:00,Tue Oct 29 13:59:45 +0000 2019,,0,7,7,,#WeWork,,
785,1189179970821771265,https://twitter.com/MarketingDuck2/status/1189179970821771265,MarketingDuck2,83133722,Ben Horowitz: WeWork's company culture caused it to lose touch with reality #realestatenewshttps://cnb.cx/2MUTpXs,2019-10-29 13:59:33+00:00,Tue Oct 29 13:59:33 +0000 2019,,0,0,0,,#realestatenewshttps,https://cnb.cx/2MUTpXs,
786,1189179967566860291,https://twitter.com/FathomRealtyATX/status/1189179967566860291,FathomRealtyATX,3332016434,Ben Horowitz: WeWork's company culture caused it to lose touch with reality http://dlvr.it/RHBcRy pic.twitter.com/taSaJfIrec,2019-10-29 13:59:32+00:00,Tue Oct 29 13:59:32 +0000 2019,,0,0,0,,,http://dlvr.it/RHBcRy,
787,1189179967227121669,https://twitter.com/RealtorJairo/status/1189179967227121669,RealtorJairo,62128121,Ben Horowitz: WeWork's company culture caused it to lose touch with reality http://dlvr.it/RHBcQs pic.twitter.com/qq1L84OnkD,2019-10-29 13:59:32+00:00,Tue Oct 29 13:59:32 +0000 2019,,0,0,0,,,http://dlvr.it/RHBcQs,
788,1189179964567875586,https://twitter.com/InterprisesInc/status/1189179964567875586,InterprisesInc,1604144761,"NowSpace's failure to launch contrasts with Austin's coworking boom: WeWork, the dominant coworking provider in Austin, has been taken over by its largest investor. NowSpace, the flexible office company launched by Nate Paul, seems to have stalled… http://j.mp/2JuKTwf — ABN",2019-10-29 13:59:32+00:00,Tue Oct 29 13:59:32 +0000 2019,,0,0,0,,,http://j.mp/2JuKTwf,
789,1189179930623520769,https://twitter.com/JonathanSeaboIt/status/1189179930623520769,JonathanSeaboIt,267217383,Ben Horowitz: WeWork's company culture caused it to lose touch with reality https://ift.tt/31ZKDeN,2019-10-29 13:59:24+00:00,Tue Oct 29 13:59:24 +0000 2019,,0,0,0,,,https://ift.tt/31ZKDeN,
790,1189179806446809089,https://twitter.com/FinTechZoom/status/1189179806446809089,FinTechZoom,729754661213884416,"New article: ""VC Ben Horowitz: WeWork's overly optimistic culture distorted reality"" has been published on Fintech Zoom - https://fintechzoom.com/fintech_news/vc-ben-horowitz-weworks-overly-optimistic-culture-distorted-reality/ … @FintechZoom #Fintech #Blockchain #Crypto #Cryptocurrency #ICO",2019-10-29 13:58:54+00:00,Tue Oct 29 13:58:54 +0000 2019,,0,0,0,@FintechZoom,#Fintech #Blockchain #Crypto #Cryptocurrency #ICO,https://fintechzoom.com/fintech_news/vc-ben-horowitz-weworks-overly-optimistic-culture-distorted-reality/,
791,1189179488195604481,https://twitter.com/mahorobajapan/status/1189179488195604481,mahorobajapan,113800979,ソフトバンクに日銀が支援！？アベノミクスの闇。倒産。wework、ETF、ゴールドマンサックス https://youtu.be/j4WJSTJiye8 @YouTubeさんから,2019-10-29 13:57:38+00:00,Tue Oct 29 13:57:38 +0000 2019,,0,0,0,@YouTubeさんから,,https://youtu.be/j4WJSTJiye8,
792,1189179434856660992,https://twitter.com/tyatti/status/1189179434856660992,tyatti,111020807,ソフトバンクに日銀が支援！？アベノミクスの闇。倒産。wework、ETF、ゴールドマンサックス https://youtu.be/j4WJSTJiye8 @YouTubeさんから 日経平均の殆どが日銀が買っちゃってるって言うのがやばいよねぇ,2019-10-29 13:57:25+00:00,Tue Oct 29 13:57:25 +0000 2019,,0,0,0,@YouTubeさんから,,https://youtu.be/j4WJSTJiye8,
793,1189179085345427461,https://twitter.com/baronhuntergrp/status/1189179085345427461,baronhuntergrp,930535976895737857,@SoftBank fund that fueled private #investing bubble reportedly curbing #risk after @WeWork debacle https://buff.ly/2qKfPSr #riskreduction #BusinessStrategy #strategicalignmentpic.twitter.com/fjGJu6vN6M,2019-10-29 13:56:02+00:00,Tue Oct 29 13:56:02 +0000 2019,,0,0,0,@SoftBank @WeWork,#investing #risk #riskreduction #BusinessStrategy #strategicalignmentpic,https://buff.ly/2qKfPSr,
794,1189179000394014721,https://twitter.com/carodjah/status/1189179000394014721,carodjah,4871150422,"I’ve got a groundbreaking idea. What if we took the idea of WeWork, where spaces are rented out for people to “congregate”, and people congregate there to praise the lord? We could call it, like, WeWorship?",2019-10-29 13:55:42+00:00,Tue Oct 29 13:55:42 +0000 2019,casersatz,0,1,1,,,,
795,1189178941405196288,https://twitter.com/mitsue0820_i/status/1189178941405196288,mitsue0820_i,1186411393,ソフトバンクに日銀が支援！？アベノミクスの闇。倒産。wework、ETF、ゴールドマンサックス https://youtu.be/j4WJSTJiye8 @YouTubeより,2019-10-29 13:55:28+00:00,Tue Oct 29 13:55:28 +0000 2019,,0,0,0,@YouTubeより,,https://youtu.be/j4WJSTJiye8,
796,1189178873889443841,https://twitter.com/AedhMor/status/1189178873889443841,AedhMor,1182166277869228032,"I could've told them the business model would fail. People use cafes, coffee shops, libraries and trains as mobile offices. No need to hot desk in these spaces. Another charming con man fleeces the gullible and greedy The WeWork debacle Nesrine Malik https://www.theguardian.com/commentisfree/2019/oct/28/wework-finance-workspace-unicorn-economic-model …",2019-10-29 13:55:12+00:00,Tue Oct 29 13:55:12 +0000 2019,,0,0,0,,,https://www.theguardian.com/commentisfree/2019/oct/28/wework-finance-workspace-unicorn-economic-model,
797,1189178853798768647,https://twitter.com/AdamSinger/status/1189178853798768647,AdamSinger,14031032,There was 0 chance WeWork was ever getting out. Zero. The scale of that one was a bridge too far even for the pump team at Goldman.,2019-10-29 13:55:07+00:00,Tue Oct 29 13:55:07 +0000 2019,,0,7,7,,,,
798,1189178738161795072,https://twitter.com/democracymonst/status/1189178738161795072,democracymonst,839438663880589312,ソフトバンクに日銀が支援！？ アベノミクスの闇 #倒産 #ソフトバンク #SoftBank #wework #ETF #ゴールドマンサックス #オリーブの木 https://youtu.be/j4WJSTJiye8 @YouTubeよりpic.twitter.com/ME2HRJrX9L,2019-10-29 13:54:39+00:00,Tue Oct 29 13:54:39 +0000 2019,,32,43,43,@YouTubeよりpic,#倒産 #ソフトバンク #SoftBank #wework #ETF #ゴールドマンサックス #オリーブの木,https://youtu.be/j4WJSTJiye8,
799,1189178476948901889,https://twitter.com/kokushinnkai358/status/1189178476948901889,kokushinnkai358,3238153780,ソフトバンクに日銀が支援！？ アベノミクスの闇。倒産。 wework、ETF、ゴールドマンサックス https://youtu.be/j4WJSTJiye8 @YouTubeさんから,2019-10-29 13:53:37+00:00,Tue Oct 29 13:53:37 +0000 2019,,0,0,0,@YouTubeさんから,,https://youtu.be/j4WJSTJiye8,
800,1189178159964524545,https://twitter.com/_ThottiePebbles/status/1189178159964524545,_ThottiePebbles,890161150515712001,Anyone know if WeWork has a daily hot desk option?,2019-10-29 13:52:21+00:00,Tue Oct 29 13:52:21 +0000 2019,,0,0,0,,,,
801,1189177811866542081,https://twitter.com/AskNisheeth/status/1189177811866542081,AskNisheeth,144175905,Could an asset light model similar to AirBnB be the way forward for co-working spaces like WeWork? #TuesdayThoughts from an episode on WeWork @fromend2end https://anchor.fm/end-2-end/episodes/5--WeWork---The-Good--the-Bad-and-the-Ugly-e5rigp/a-apmchs … #PodernFamily,2019-10-29 13:50:58+00:00,Tue Oct 29 13:50:58 +0000 2019,,0,2,2,@fromend2end,#TuesdayThoughts #PodernFamily,https://anchor.fm/end-2-end/episodes/5--WeWork---The-Good--the-Bad-and-the-Ugly-e5rigp/a-apmchs,
802,1189177720242167809,https://twitter.com/gwynbr/status/1189177720242167809,gwynbr,58654907,a cat going over a lease with the leasor and disgraced ceo of the We Company (WeWork) pic.twitter.com/uv5BjkPE0C,2019-10-29 13:50:37+00:00,Tue Oct 29 13:50:37 +0000 2019,,1,42,42,,,,
803,1189177622707625986,https://twitter.com/midorimaru_/status/1189177622707625986,midorimaru_,915558082393997312,今、ソフトバンクちょっとピンチですよね。 WeWork騒動だけじゃなくて財務省も動いてますし、もしも何かあったらまた外資に戻るのでしょうか。今でも顧客情報は外国に駄々洩れの印象受けますけど,2019-10-29 13:50:13+00:00,Tue Oct 29 13:50:13 +0000 2019,takashi55870774,0,1,1,,,,
804,1189177453270298624,https://twitter.com/lheseeRanZgQPdC/status/1189177453270298624,lheseeRanZgQPdC,920563791934263298,ソフトバンクに日銀が支援！？アベノミクスの闇。倒産。wework、ETF、ゴールドマンサックス https://youtu.be/j4WJSTJiye8 @YouTubeより,2019-10-29 13:49:33+00:00,Tue Oct 29 13:49:33 +0000 2019,,0,1,1,@YouTubeより,,https://youtu.be/j4WJSTJiye8,
805,1189177386434064390,https://twitter.com/Fukadamoe/status/1189177386434064390,Fukadamoe,95616628,いや、だから『アダム』と『ソン』という神話の崩壊の始まりでしょ、Ｗｅｗｏｒｋとソフトバンク。 善悪を知らない二人が、マッチポンプで株価を吊り上げていたが 『人工知能』という木の実を食べてしまい、ＡＩ戦争の火ぶたが切っておとされちゃったってことです。(笑) https://www.youtube.com/watch?v=SJZKS_AvlP0&feature=share&fbclid=IwAR03td_Xo69CoHZWFECfCoThVnWj0D-7iisYsXex0ziX20XWGhgKDdWKhK4 …,2019-10-29 13:49:17+00:00,Tue Oct 29 13:49:17 +0000 2019,,91,346,346,,,https://www.youtube.com/watch?v=SJZKS_AvlP0&feature=share&fbclid=IwAR03td_Xo69CoHZWFECfCoThVnWj0D-7iisYsXex0ziX20XWGhgKDdWKhK4,
806,1189177369082449920,https://twitter.com/chrisbmarquez/status/1189177369082449920,chrisbmarquez,1106723496,PLACE VILLE MARIE #Co-Working by WeWork #Canada >> https://www.designeour.com/place-ville-marie-co-working-by-wework-canada … https://chrisbmarquez.com/post/188676652145/place-ville-marie-co-working-by-wework-canada …pic.twitter.com/L9yeP1rl3g,2019-10-29 13:49:13+00:00,Tue Oct 29 13:49:13 +0000 2019,,0,0,0,,#Co #Canada,"https://www.designeour.com/place-ville-marie-co-working-by-wework-canada,https://chrisbmarquez.com/post/188676652145/place-ville-marie-co-working-by-wework-canada",
807,1189177334319837184,https://twitter.com/ramondomiingos/status/1189177334319837184,ramondomiingos,104174195,"Pra mim, o wework é melhor rede de coworking.",2019-10-29 13:49:05+00:00,Tue Oct 29 13:49:05 +0000 2019,,0,0,0,,,,
808,1189177260168880128,https://twitter.com/ramondomiingos/status/1189177260168880128,ramondomiingos,104174195,"Eita, o wework vai mudar de dono.",2019-10-29 13:48:47+00:00,Tue Oct 29 13:48:47 +0000 2019,,0,0,0,,,,
809,1189177107210997760,https://twitter.com/mattmoscardi/status/1189177107210997760,mattmoscardi,55108268,"Did WeWork kill the name ""We"" forever? Now all I see is ""loss leading unicorn"" when I see a company with ""We"" in the title... oh, by the way, this Malaysian company is loss leading... :: https://ift.tt/2NkdjKw",2019-10-29 13:48:10+00:00,Tue Oct 29 13:48:10 +0000 2019,,0,0,0,,,https://ift.tt/2NkdjKw,
810,1189176546923122690,https://twitter.com/minamimitsuhiro/status/1189176546923122690,minamimitsuhiro,104773757,ソフトバンクはWeWorkを「壊れたので買わざるを得なかった」 | TechCrunch Japan https://jp.techcrunch.com/2019/10/28/2019-10-27-week-in-review-you-break-it-you-buy-it/ … @jptechcrunchより,2019-10-29 13:45:57+00:00,Tue Oct 29 13:45:57 +0000 2019,,0,0,0,@jptechcrunchより,,https://jp.techcrunch.com/2019/10/28/2019-10-27-week-in-review-you-break-it-you-buy-it/,
811,1189176324134440967,https://twitter.com/commonsense1956/status/1189176324134440967,commonsense1956,3033124451,#CAISSEDEDÉPOT https://www.cnbc.com/2019/10/29/vc-ben-horowitz-weworks-overly-optimistic-culture-distorted-reality.html …....... WEWORK et la philosophie de la caisse!!!!! ca se ressemble...pathétique....,2019-10-29 13:45:04+00:00,Tue Oct 29 13:45:04 +0000 2019,,0,0,0,,#CAISSEDEDÉPOT,https://www.cnbc.com/2019/10/29/vc-ben-horowitz-weworks-overly-optimistic-culture-distorted-reality.html,
812,1189176307847970817,https://twitter.com/counternotions/status/1189176307847970817,counternotions,19225408,"""85 percent of WeWork’s white-collar employees don’t think Adam Neumann’s $1.7 billion exit package is fair"" (Socialists!)",2019-10-29 13:45:00+00:00,Tue Oct 29 13:45:00 +0000 2019,,1,5,5,,,,
813,1189175927671967744,https://twitter.com/CNBCJosh/status/1189175927671967744,CNBCJosh,468703129,Disappointed @andrewrsorkin didn't ask @bhorowitz the question we need answered: which @RickRoss lyric best describes @WeWork? https://twitter.com/SquawkCNBC/status/1189162040168013824 …,2019-10-29 13:43:29+00:00,Tue Oct 29 13:43:29 +0000 2019,SquawkCNBC,1,0,0,@andrewrsorkin @bhorowitz @RickRoss @WeWork,,https://twitter.com/SquawkCNBC/status/1189162040168013824,
814,1189175902959046656,https://twitter.com/rairararara/status/1189175902959046656,rairararara,144047532,ソフトバンク倒産問題。LINE買収、みずほ銀行仲介。ライン、WeWork、倒産問題、CLO、ホリエモン - YouTube https://www.youtube.com/channel/UCHUU8VHKcePqDgkjuX60aUg …,2019-10-29 13:43:23+00:00,Tue Oct 29 13:43:23 +0000 2019,,0,0,0,,,https://www.youtube.com/channel/UCHUU8VHKcePqDgkjuX60aUg,
815,1189175794343526400,https://twitter.com/eruntale/status/1189175794343526400,eruntale,6695212,"I'm at WeWork in Lima, Municipalidad Metropolitana de Lima https://www.swarmapp.com/c/arM6vb7PVg0",2019-10-29 13:42:57+00:00,Tue Oct 29 13:42:57 +0000 2019,,0,1,1,,,https://www.swarmapp.com/c/arM6vb7PVg0,
816,1189175520526766080,https://twitter.com/WFC_Writing/status/1189175520526766080,WFC_Writing,3344383803,How the WeWork debacle can teach investors a lesson about value. More on that and other news and feature stories we're reading. | https://hubs.ly/H0lwsv70 pic.twitter.com/auGbh6VEgB,2019-10-29 13:41:52+00:00,Tue Oct 29 13:41:52 +0000 2019,,0,0,0,,,https://hubs.ly/H0lwsv70,
