,id,permalink,username,to,text,date,retweets,favorites,replies,mentions,hashtags,geo
1045,1185199092294705155,https://twitter.com/richardbeales1/status/1185199092294705155,richardbeales1,,"If WeWork is offered a choice of more equity by SoftBank or pricey debt via JPMorgan, the decision should be easy - they should bite Masa Son's hand off. My latest for @Breakingviewshttps://bit.ly/2MsQjtx",2019-10-18 14:20:58+00:00,2,0,0,@Breakingviewshttps,,
1046,1185198999231328256,https://twitter.com/feed_stocks/status/1185198999231328256,feed_stocks,,#CNBCStockMarketNews Real estate mogul Barry Sternlicht: WeWork went ‘off the rails’ but it’s still a ‘real company’ http://dlvr.it/RGSryx pic.twitter.com/JSdnZLrs5h,2019-10-18 14:20:36+00:00,0,0,0,,#CNBCStockMarketNews,
1047,1185198881514102785,https://twitter.com/AiryOrange/status/1185198881514102785,AiryOrange,2357_is_prime,It took down WeWork,2019-10-18 14:20:07+00:00,0,0,0,,,
1048,1185198542052347905,https://twitter.com/napkatz/status/1185198542052347905,napkatz,QuisitiveInvest,This is probably exasperated by the notion that companies currently will be hesitant to move into a WeWork and get new business cards printed when they might be forced to move again in a couple months.,2019-10-18 14:18:47+00:00,0,2,2,,,
1049,1185198468098379777,https://twitter.com/OnRallyRd/status/1185198468098379777,OnRallyRd,theSkylerIrvine,About to put this on in the office... 33 individual opinions incoming,2019-10-18 14:18:29+00:00,1,1,1,,,
1050,1185198440281542661,https://twitter.com/kodai_matuda/status/1185198440281542661,kodai_matuda,,weworkの広告めちゃめちゃ出るんだけど俺だけか？,2019-10-18 14:18:22+00:00,0,0,0,,,
1051,1185198165722652672,https://twitter.com/sheet_masc/status/1185198165722652672,sheet_masc,,hey guys come to my rave in the abandoned WeWork formaldehyde phone booths,2019-10-18 14:17:17+00:00,0,4,4,,,
1052,1185198135976644608,https://twitter.com/arunkw/status/1185198135976644608,arunkw,,How WeWork spiraled from a $47 billion valuation to talk of bankruptcy in just 6 weeks #Startup #businessmodel #gonebad via http://twinybots.ch https://www.businessinsider.com/weworks-nightmare-ipo?IR=T …,2019-10-18 14:17:10+00:00,0,0,0,,#Startup #businessmodel #gonebad,
1053,1185197898897584128,https://twitter.com/i0akaten/status/1185197898897584128,i0akaten,,"遂にオリーブの声も聞くようになった自分w Watch ""自己啓発セミナーと孫正義、ソフトバンク倒産。wework問題、引き寄せの法則の嘘。"" on YouTube - https://youtu.be/i32b5KJ43g4",2019-10-18 14:16:13+00:00,0,0,0,,,
1054,1185197801719746560,https://twitter.com/theSkylerIrvine/status/1185197801719746560,theSkylerIrvine,,My take on the impact @OnRallyRd could have on the highest end sports cards Also what @WeWork *could* have been And why sports cards will likely see govt regulations (psst- It’s children’s gambling!) https://podcasts.apple.com/us/podcast/the-skyler-irvine-podcast/id1247699775?i=1000453970356 …,2019-10-18 14:15:50+00:00,3,7,7,@OnRallyRd @WeWork,,
1055,1185197624716079105,https://twitter.com/itsstevenhudson/status/1185197624716079105,itsstevenhudson,,WeWork Is Slouching Toward Its Least-Worst Rescue Option http://nymag.com/intelligencer/2019/10/wework-is-slouching-toward-its-least-worst-rescue-option.html?utm_source=Sailthru&utm_medium=email&utm_campaign=Intelligencer%20-%20October%2017%2C%202019&utm_term=Subscription%20List%20-%20Daily%20Intelligencer%20%281%20Year%29 …,2019-10-18 14:15:08+00:00,0,1,1,,,
1056,1185197600321884160,https://twitter.com/kanaekudo195901/status/1185197600321884160,kanaekudo195901,,ソフトバンクＧ、さらにＣＤＳ上昇－WeWorkで悪材料続く https://www.bloomberg.co.jp/news/articles/2019-10-18/PZJQNQDWX2PV01?srnd=cojp-v2 …,2019-10-18 14:15:02+00:00,0,0,0,,,
1057,1185197004638556160,https://twitter.com/apppro1/status/1185197004638556160,apppro1,,@oghowie $TWLO entire sector. blame Slack_er not WeWork pic.twitter.com/Hv2ZzC9HK9,2019-10-18 14:12:40+00:00,0,0,0,@oghowie,,
1058,1185196986653401093,https://twitter.com/nickjohn/status/1185196986653401093,nickjohn,,WeWork the movie can’t be far off. It would be like The Big short but funnier.,2019-10-18 14:12:36+00:00,0,0,0,,,
1059,1185196851697291267,https://twitter.com/sinsenkane/status/1185196851697291267,sinsenkane,,自己啓発セミナーと孫正義、ソフトバンク倒産。wework問題、引き寄せの法則の嘘。 https://youtu.be/i32b5KJ43g4 @YouTubeよりpic.twitter.com/zjdTuSX3aB,2019-10-18 14:12:03+00:00,0,1,1,@YouTubeよりpic,,
1060,1185196778024558594,https://twitter.com/nolookshot/status/1185196778024558594,nolookshot,,"“… the most celebrated unicorns weren’t actually software companies. They have struggled to achieve liftoff because their feet are stuck in the mud of the physical world—whether it’s labor costs for Uber and Lyft, or real-estate costs for WeWork.” https://www.theatlantic.com/ideas/archive/2019/10/are-we-cusp-next-dot-com-bubble/600232/ …",2019-10-18 14:11:46+00:00,0,0,0,,,
1061,1185196698517172225,https://twitter.com/kumakum34172286/status/1185196698517172225,kumakum34172286,,自己啓発セミナーと孫正義、ソフトバンク倒産。wework問題、引き寄せの法則の嘘。 https://youtu.be/i32b5KJ43g4 @YouTubeよりpic.twitter.com/dF6jj51Byn,2019-10-18 14:11:27+00:00,0,1,1,@YouTubeよりpic,,
1062,1185196638123544579,https://twitter.com/apppro1/status/1185196638123544579,apppro1,,Not just $TWLO entire sector again. $WDAY $AYX $WORK $CRM $TWLO $SQ $ZM $SHOP $OKTA $COUP $MSFT and dont blame WeWork - this reall is MORE due to Slacker pic.twitter.com/SM4TABxwkK,2019-10-18 14:11:13+00:00,0,2,2,,,
1063,1185196527683280900,https://twitter.com/Gamedevjs/status/1185196527683280900,Gamedevjs,,Można już oglądać zdjęcia z wtorkowego spotkania w Warszawie. https://www.facebook.com/pg/Gamedevjs/photos/?tab=album&album_id=2783598468375243 … #gamedev #techwawa #meetup #warszawa #wework #js13k #gamedevjspic.twitter.com/xCqrl8w5oc,2019-10-18 14:10:46+00:00,3,1,1,,#gamedev #techwawa #meetup #warszawa #wework #js13k #gamedevjspic,
1064,1185196264188776448,https://twitter.com/CenCom/status/1185196264188776448,CenCom,,Sex drugs and (failed) IPO: WeWork mania has been good for business publishers. http://bit.ly/33EyCNl pic.twitter.com/eWOjxq4kga,2019-10-18 14:09:43+00:00,1,1,1,,,
1065,1185195896398663681,https://twitter.com/CGasparino/status/1185195896398663681,CGasparino,,SCOOP—WeWork needs a bailout and they could get one as early as Friday https://fxn.ws/2MWimAG #FoxBusiness,2019-10-18 14:08:16+00:00,3,5,5,,#FoxBusiness,
1066,1185195882158923776,https://twitter.com/agusdanvivi/status/1185195882158923776,agusdanvivi,,"The resignation of WeWork's CEO will likely see a tempering of super-sized valuations, with founders put on a tighter leash. Perhaps it's time to admit that great founders =/= great CEOs? #ceo #wework #founderhttps://ift.tt/2pwYwnk",2019-10-18 14:08:12+00:00,0,0,0,,#ceo #wework #founderhttps,
1067,1185195581305741313,https://twitter.com/finanzascom/status/1185195581305741313,finanzascom,,Softbank no se rinde con WeWork http://www.finanzas.com/noticias/empresas/20191018/softbank-rinde-work-4025454.html?utm_medium=Social&utm_source=Twitter#Echobox=1571383528 …pic.twitter.com/UuJmUvW61H,2019-10-18 14:07:01+00:00,1,0,0,,#Echobox,
1068,1185195518982606848,https://twitter.com/techinasia/status/1185195518982606848,techinasia,,"The resignation of WeWork's CEO will likely see a tempering of super-sized valuations, with founders put on a tighter leash. Perhaps it's time to admit that great founders =/= great CEOs? #ceo #wework #founder https://ift.tt/2pwYwnk",2019-10-18 14:06:46+00:00,3,8,8,,#ceo #wework #founder,
1069,1185195135211954176,https://twitter.com/kaoruww/status/1185195135211954176,kaoruww,,昔ながらの貸机という仕事で普通に不動産業なんだけど、包装紙をかけ替えて最先端ぽくするとWeWorkになってしまうんだなあ… 貸机業に触れた文学作品というと、城山三郎の「成算あり」ですね。1973年初版。 https://amzn.to/2OUHtGB #ドキュメント72時間,2019-10-18 14:05:14+00:00,4,12,12,,#ドキュメント72時間,
1070,1185195023073075200,https://twitter.com/ExactOptionPick/status/1185195023073075200,ExactOptionPick,,Real estate mogul Barry Sternlicht: WeWork went 'off the rails' but it's still a 'real company' - http://exactoptionpicks.com/?post_type=wprss_feed_item&p=549301 …,2019-10-18 14:04:48+00:00,0,0,0,,,
1071,1185194941573664768,https://twitter.com/cthaxtonilsr/status/1185194941573664768,cthaxtonilsr,,"Co-working isn't going away, but the top-heavy, overly-leveraged WeWork model is. Interesting to see it's another concentrated industry; WeWork controls a full 1/3 of the market. But there are hundreds of independents on deck. https://www.citylab.com/life/2019/10/wework-manhattan-real-estate-coworking-office-space-rental/599338/ …",2019-10-18 14:04:28+00:00,0,1,1,,,
1072,1185194905594937344,https://twitter.com/aarongell/status/1185194905594937344,aarongell,,"Was copying the business model illegal? No. It’s just a footnote to the WeWork trainwreck, but an revealing one. Fun fact: before entering politics, @AOC was a “Shiner,” as they were called, working out of Sunshine’s Bronx location. Thanks for reading!https://marker.medium.com/was-weworks-business-a-copy-paste-job-b52d2c45099f …",2019-10-18 14:04:20+00:00,0,0,0,@AOC,,
1073,1185194636807233536,https://twitter.com/FastCoTech/status/1185194636807233536,FastCoTech,,WeWork’s fall could spell disaster for other overvalued unicorns http://f-st.co/ANUCOdk,2019-10-18 14:03:15+00:00,0,1,1,,,
1074,1185194515969331201,https://twitter.com/aarongell/status/1185194515969331201,aarongell,,"WeWork came along in 2010 and crushed the competition with bargain rates, burning venture cash and becoming a unicorn. Meanwhile, Sunshine eventually folded.",2019-10-18 14:02:47+00:00,0,0,0,,,
1075,1185194509447172097,https://twitter.com/mbalexan/status/1185194509447172097,mbalexan,,"Our biggest fans this week: WeWork, theBrokerList, WeAreATYPICAL. Thank you! via https://sumall.com/thankyou?utm_source=twitter&utm_medium=publishing&utm_campaign=thank_you_tweet&utm_content=text_and_media&utm_term=7da516b5eca10154f9376e22 …",2019-10-18 14:02:45+00:00,0,2,2,,,
1076,1185194468909166593,https://twitter.com/Andy_Dyer_NOVA/status/1185194468909166593,Andy_Dyer_NOVA,DbtheeBustocles,Capitalism goes both ways. Ask the guys at WeWork.,2019-10-18 14:02:35+00:00,0,0,0,,,
1077,1185194404702806016,https://twitter.com/TSCTA/status/1185194404702806016,TSCTA,,Tech world stymied by fallen umbrella that wedged a WeWork office door shut for 2 days http://ow.ly/MUhw30pIPLP #Fail #Friday,2019-10-18 14:02:20+00:00,0,0,0,,#Fail #Friday,
1078,1185194329893027840,https://twitter.com/EsCointelegraph/status/1185194329893027840,EsCointelegraph,,"El informático y #CEO de #WeWork de #Sudáfrica, Stafford #Masie, dice que #Bitcoin cambiará el #futuro de la #humanidad más que cualquier otra #innovación tecnológica.https://es.cointelegraph.com/news/ex-ceo-of-google-africa-bitcoin-a-gift-that-will-change-humanity …",2019-10-18 14:02:02+00:00,1,0,0,,#CEO #WeWork #Sudáfrica #Masie #Bitcoin #futuro #humanidad #innovación,
1079,1185194134891646976,https://twitter.com/marketcheetah/status/1185194134891646976,marketcheetah,,Real estate mogul Barry Sternlicht: WeWork went ‘off the rails’ but it’s still a ‘real company’ https://marketcheetah.com/2019/10/18/real-estate-mogul-barry-sternlicht-wework-went-off-the-rails-but-its-still-a-real-company/?utm_campaign=twitter&utm_medium=twitter&utm_source=twitter …,2019-10-18 14:01:16+00:00,0,0,0,,,
1080,1185194092143230983,https://twitter.com/newswithvalue/status/1185194092143230983,newswithvalue,,$MAR $JPM: Real estate mogul Barry Sternlicht: WeWork went ‘off the rails’ but it’s still a ‘real company�…: https://www.StockNewsWires.com/mar-jpm-real-estate-mogul-barry-sternlicht-wework-went-off-the-rails-but-its-still-a-real-company/ …,2019-10-18 14:01:06+00:00,0,0,0,,,
1081,1185194048732192769,https://twitter.com/tonerisms/status/1185194048732192769,tonerisms,,WeWork’s fall could spell disaster for other overvalued unicorns https://www.fastcompany.com/90417250/weworks-fall-could-spell-disaster-for-other-overvalued-unicorns …,2019-10-18 14:00:55+00:00,0,0,0,,,
1082,1185193994885533696,https://twitter.com/drymayo/status/1185193994885533696,drymayo,,WeWork 株爆上げ,2019-10-18 14:00:42+00:00,0,1,1,,,
1083,1185193824563412992,https://twitter.com/WeWork/status/1185193824563412992,WeWork,,An ideal #fridayfeeling found at WeWork Gurugram. #wework #weworkindiapic.twitter.com/kQl8XqFjqc,2019-10-18 14:00:02+00:00,2,6,6,,#fridayfeeling #wework #weworkindiapic,
1084,1185193817454063618,https://twitter.com/FinancialMail/status/1185193817454063618,FinancialMail,,"The WeWork unicorn went from a $47bn valuation to near bankruptcy in six weeks as its IPO prospectus was analysed, writes @shapshak. http://ht.ly/upCe30pJxBS",2019-10-18 14:00:00+00:00,4,1,1,@shapshak,,
1085,1185193654736097283,https://twitter.com/aarongell/status/1185193654736097283,aarongell,,"You probably know the saga of how Adam Neumann was pushed out as WeWork CEO. For @MRKR, I wrote the exclusive story of how he got the idea in the first place, which he never acknowledged.https://medium.com/p/was-weworks-business-a-copy-paste-job-b52d2c45099f …",2019-10-18 13:59:21+00:00,0,0,0,@MRKR,,
1086,1185193601011048448,https://twitter.com/coosproject/status/1185193601011048448,coosproject,,ソフトバンクがwework問題でヤバいって最近よく見るんやけど、ほんまなんかな,2019-10-18 13:59:08+00:00,0,0,0,,,
1087,1185193549588905984,https://twitter.com/PaulFEstes/status/1185193549588905984,PaulFEstes,,POLL: Will WeWork's decline negatively impact the entire co-working space? http://flip.it/dI.BuR,2019-10-18 13:58:56+00:00,0,0,0,,,
1088,1185193548871852034,https://twitter.com/nachkari/status/1185193548871852034,nachkari,,"https://www.reuters.com/article/us-europe-ipo/yacht-maker-ferrettis-cancellation-caps-dismal-european-ipo-season-idUSKBN1WW2KH … Lux Yacht IPO canceled, no one biting on 15% wework paper or IPO... lot of the egregious excess has been culled",2019-10-18 13:58:56+00:00,0,5,5,,,
1089,1185193503921463297,https://twitter.com/eduruizhipolito/status/1185193503921463297,eduruizhipolito,,La estrepitosa caída del dueño de WeWork: de milmillonario a la posible ruina en solo un mes https://www.revistavanityfair.es/poder/articulos/dueno-wework-quien-es-adam-neumann-salida-bolsa-fracaso-ruina/41165 … vía @VanityFairSpain,2019-10-18 13:58:45+00:00,0,0,0,@VanityFairSpain,,
1090,1185193259867475969,https://twitter.com/daviddoughty/status/1185193259867475969,daviddoughty,,RT @ZandaSearch: @EIT_Digital @UKBAngels @WeWork @LBS #Enterprise100 #fintech #Insurtech #legaltech #cleantransport #HealthTech #uktech #techevents,2019-10-18 13:57:47+00:00,0,0,0,@ZandaSearch @EIT_Digital @UKBAngels @WeWork @LBS,#Enterprise100 #fintech #Insurtech #legaltech #cleantransport #HealthTech #uktech #techevents,
1091,1185193071274856453,https://twitter.com/ReutersJF/status/1185193071274856453,ReutersJF,,"Breakingviews' @richardbeales1 argues @WeWork’s rescue choice couldn’t be easier: ""If SoftBank’s Masayoshi Son is willing to double down and inject more, WeWork should bite his hand off"" https://www.breakingviews.com/considered-view/weworks-rescue-choice-couldnt-be-easier/#.XanEWS-G6s0.twitter …",2019-10-18 13:57:02+00:00,0,1,1,@richardbeales1 @WeWork,#,
1092,1185193015318646784,https://twitter.com/dagmdawit/status/1185193015318646784,dagmdawit,,The Kabbalah Connection: Insiders say a celebrity-centered religious sect deeply influenced how Adam Neumann ran WeWork before its spectacular collapse https://www.pulselive.co.ke/bi/finance/the-kabbalah-connection-insiders-say-a-celebrity-centered-religious-sect-deeply/tnw7t4j … via @Twitter,2019-10-18 13:56:49+00:00,0,0,0,@Twitter,,
1093,1185192814549852165,https://twitter.com/fzanetti/status/1185192814549852165,fzanetti,,Airbnb's cash numbers could show that it's not another WeWork in the making https://buff.ly/2MnF6u0 pic.twitter.com/hXxN6Na5rB,2019-10-18 13:56:01+00:00,0,0,0,,,
1094,1185192684387995649,https://twitter.com/epamineto/status/1185192684387995649,epamineto,,"Atlantic: Companies like WeWork and Uber have helped shape urban lifestyle habits, with little to show for it in profits. @DKThomp asks: How long can that last?https://www.theatlantic.com/ideas/archive/2019/10/say-goodbye-millennial-urban-lifestyle/599839/?utm_source=twitter&utm_medium=social&utm_campaign=share …",2019-10-18 13:55:30+00:00,0,0,0,@DKThomp,,
1095,1185192565127163904,https://twitter.com/emifocus15gmai1/status/1185192565127163904,emifocus15gmai1,InesParnisari,Yaroon Brook el presidente de Ayn Rand Institute habló sobre WeWork hace unos días. https://youtu.be/QH7rFEtu5JI,2019-10-18 13:55:01+00:00,0,1,1,,,
1096,1185192452522762240,https://twitter.com/sidontae/status/1185192452522762240,sidontae,,WeWork and the Great Unicorn Delusion by @TheAtlantichttps://link.medium.com/Y63GPOTh9Z,2019-10-18 13:54:35+00:00,0,0,0,@TheAtlantichttps,,
1097,1185191947419316226,https://twitter.com/LLChatoff/status/1185191947419316226,LLChatoff,,Real estate mogul Barry Sternlicht: WeWork went 'off the rails' but it's still a 'real company' http://dlvr.it/RGSlVp pic.twitter.com/cAlnakrZXd,2019-10-18 13:52:34+00:00,1,0,0,,,
1098,1185191767399751681,https://twitter.com/meganeinu/status/1185191767399751681,meganeinu,,weworkではないのか,2019-10-18 13:51:51+00:00,0,0,0,,,
1099,1185191718464958464,https://twitter.com/bilbospizza/status/1185191718464958464,bilbospizza,,Airbnb's cash numbers could show that it's not another WeWork in the making https://www.cnbc.com/2019/10/17/airbnb-with-3-billion-on-balance-sheet-trying-to-avoid-wework.html …,2019-10-18 13:51:40+00:00,0,0,0,,,
1100,1185191691915014144,https://twitter.com/ZandaSearch/status/1185191691915014144,ZandaSearch,,#Enterprise100 #fintech #Insurtech #legaltech #cleantransport #HealthTech #uktech #techevents,2019-10-18 13:51:33+00:00,0,0,0,,#Enterprise100 #fintech #Insurtech #legaltech #cleantransport #HealthTech #uktech #techevents,
1101,1185191648894029824,https://twitter.com/MarketingDuck2/status/1185191648894029824,MarketingDuck2,,Real estate mogul Barry Sternlicht: WeWork went 'off the rails' but it's still a 'real company' #realestatenewshttps://cnb.cx/2VTAPlf,2019-10-18 13:51:23+00:00,0,0,0,,#realestatenewshttps,
1102,1185191645828042754,https://twitter.com/ZTonnis/status/1185191645828042754,ZTonnis,,Real estate mogul Barry Sternlicht: WeWork went 'off the rails' but it's still a 'real company' https://ift.tt/2zLUs4D pic.twitter.com/33GY21iie4,2019-10-18 13:51:22+00:00,0,0,0,,,
1103,1185191578631135232,https://twitter.com/C6WolfEnergy/status/1185191578631135232,C6WolfEnergy,,Real estate mogul Barry Sternlicht: WeWork went 'off the rails' but it's a still 'real company' https://cnb.cx/2pvczKg,2019-10-18 13:51:06+00:00,0,0,0,,,
1104,1185191578563837953,https://twitter.com/GoldSpotNews/status/1185191578563837953,GoldSpotNews,,#JPMorgan_Chase_Co #Marriott_International_Inc #Real_estate #Markets Real estate mogul Barry Sternlicht: WeWork went 'off the rails' but it's still a 'real company' http://dlvr.it/RGSlFs http://bit.ly/33qFvl6 pic.twitter.com/j7nhMEia3Z,2019-10-18 13:51:06+00:00,0,0,0,,#JPMorgan_Chase_Co #Marriott_International_Inc #Real_estate #Markets,
1105,1185191455750414336,https://twitter.com/TimChessman/status/1185191455750414336,TimChessman,StockCats,"Rules for the latest CNBC Drinking Game are in: 1) one shot for every mention of “slowing global growth,” “wework” and “recession.” 2) Whoever does not die of alcohol poisoning by noon, wins.",2019-10-18 13:50:37+00:00,0,1,1,,,
1106,1185191352407150592,https://twitter.com/aguilarnet/status/1185191352407150592,aguilarnet,javiercalvop,"“el director ejecutivo de una compañía dedicada al negocio inmobiliario compraba propiedades para alquilar a su empresa y, al mismo tiempo, se concedía préstamos millonarios desde su empresa”. En este caso, el mayor riesgo es la conducta de quien lidera el proyecto. #Wework https://twitter.com/javiercalvop/status/1185093008095698946 …",2019-10-18 13:50:12+00:00,0,2,2,,#Wework,
1107,1185191099129880576,https://twitter.com/WeeklyMtgNL/status/1185191099129880576,WeeklyMtgNL,,Real estate mogul Barry Sternlicht: WeWork went 'off the rails' but it's still a 'real company' #realestatenews https://ift.tt/2o1nWcu,2019-10-18 13:49:12+00:00,0,0,0,,#realestatenews,
1108,1185190940387889153,https://twitter.com/ChanderSinghEsq/status/1185190940387889153,ChanderSinghEsq,,Real estate mogul Barry Sternlicht: WeWork went 'off the rails' but it's still a 'real company' http://dlvr.it/RGSkwC pic.twitter.com/QiuqYlx32W,2019-10-18 13:48:34+00:00,0,0,0,,,
1109,1185190939171508225,https://twitter.com/FathomRealtyATX/status/1185190939171508225,FathomRealtyATX,,Real estate mogul Barry Sternlicht: WeWork went 'off the rails' but it's still a 'real company' http://dlvr.it/RGSkxb pic.twitter.com/ixS96wAXgT,2019-10-18 13:48:34+00:00,0,0,0,,,
1110,1185190936927621120,https://twitter.com/RealtorJairo/status/1185190936927621120,RealtorJairo,,Real estate mogul Barry Sternlicht: WeWork went 'off the rails' but it's still a 'real company' http://dlvr.it/RGSksY pic.twitter.com/OSkvQ3eMnX,2019-10-18 13:48:33+00:00,0,0,0,,,
1111,1185190934260191232,https://twitter.com/javiercalvop/status/1185190934260191232,javiercalvop,barandaizkierda,"Hola Paul !!, el principal error fue creer que su empresa valía 42,000 millones $!!, cuando realmente podría valer 4,000 $!!. Al salir a vender en la bolsa de valores, x supuesto, nadie le reconoció el valor que él pretendía hacer creer que valía. Cuidado cómo valorizas tu Cia.",2019-10-18 13:48:33+00:00,0,1,1,,,
1112,1185190804572250112,https://twitter.com/Digiday/status/1185190804572250112,Digiday,,Sex drugs and (failed) IPO: WeWork mania has been good for business publishers https://buff.ly/31q2lYI pic.twitter.com/wRaffZRBjN,2019-10-18 13:48:02+00:00,0,2,2,,,
1113,1185190593070276609,https://twitter.com/DKThomp/status/1185190593070276609,DKThomp,,"This underlines two of the truisms of the state of technology in 2019: 1) Companies like Uber, Lyft, WeWork have tech parts —like a digital marketplace for humans to transact services—but their costs are grounded in the undisrupted physical world of real estate and labor.",2019-10-18 13:47:11+00:00,4,34,34,,,
1114,1185190419132497920,https://twitter.com/eruntale/status/1185190419132497920,eruntale,,"(2) (@WeWork in Lima, Municipalidad Metropolitana de Lima) https://www.swarmapp.com/c/3OZhFJuDp2y",2019-10-18 13:46:30+00:00,0,0,0,@WeWork,,
1115,1185190302052687873,https://twitter.com/politicalHEDGE/status/1185190302052687873,politicalHEDGE,,Real estate mogul Barry Sternlicht: WeWork went 'off the rails' but it's still a 'real company' https://hedgeaccordingly.com/real-estate-mogul-barry-sternlicht-wework-went-off-the-rails-but-its-still-a-real-company/ …,2019-10-18 13:46:02+00:00,0,0,0,,,
1116,1185190278455582721,https://twitter.com/IntellugoA/status/1185190278455582721,IntellugoA,,At @intellugo we actively engage in using the most common maths logic to solve UI design challenges we face during mobile application development. There is still time to join our #workexperience opportunities at our new office in #London. #UX #design #maths #wework pic.twitter.com/VwAKzvVUcV,2019-10-18 13:45:56+00:00,1,1,1,@intellugo,#workexperience #London #UX #design #maths #wework,
1117,1185190202681237504,https://twitter.com/breakingnewshe1/status/1185190202681237504,breakingnewshe1,,WeWork’s fall could spell disaster for other overvalued unicorns https://thebreakingnewsheadlines.com/blog/weworks-fall-could-spell-disaster-for-other-overvalued-unicorns/ …pic.twitter.com/XB2Nud0Vy3,2019-10-18 13:45:38+00:00,0,0,0,,,
1118,1185190058195857408,https://twitter.com/RobinBew/status/1185190058195857408,RobinBew,,"Wondering if FT headline ""WeWork’s woes threaten Hong Kong’s teetering office market"" might be missing an additional crucial factor?",2019-10-18 13:45:04+00:00,1,1,1,,,
1119,1185189835704635392,https://twitter.com/harmonixy/status/1185189835704635392,harmonixy,,自己啓発セミナーと孫正義 ソフトバンク倒産 wework問題 引き寄せの法則の嘘 https://youtu.be/i32b5KJ43g4 @YouTubeより,2019-10-18 13:44:11+00:00,0,0,0,@YouTubeより,,
1120,1185189613519982592,https://twitter.com/javiercalvop/status/1185189613519982592,javiercalvop,LUISALBERTOLOLI,Abrazos,2019-10-18 13:43:18+00:00,0,1,1,,,
1121,1185189544045535233,https://twitter.com/djg_media/status/1185189544045535233,djg_media,,Adam Neumann’s relationship with the Kabbalah Centre went beyond the former CEO’s personal beliefs: It helped build WeWork from its early days https://buff.ly/2MNgdak @Shayndipic.twitter.com/RgonxJPtHj,2019-10-18 13:43:01+00:00,0,0,0,@Shayndipic,,
1122,1185189541151424514,https://twitter.com/javiercalvop/status/1185189541151424514,javiercalvop,franlionn,"Hola Fran, los problemas son muchísimos !!. Por eso, hay que prepararse para gestionar y liderar !!. Siempre, con el mejor equipo que puedas formar y escuchando asesores y lo que dice el Mercado !!. Abrazos",2019-10-18 13:43:01+00:00,0,1,1,,,
1123,1185189464328552450,https://twitter.com/QuisitiveInvest/status/1185189464328552450,QuisitiveInvest,CGasparino,Burn is coming because they signed leases they have to start paying faster than they can rent them out and get them to a respectable level of utilization.,2019-10-18 13:42:42+00:00,0,0,0,,,
