,id,permalink,username,to,text,date,retweets,favorites,replies,mentions,hashtags,geo
439,1173714130580062208,https://twitter.com/eringriffith/status/1173714130580062208,eringriffith,,"ugh pretend this tweet says ""amid"" not ""among"" and not ""the wework's""",2019-09-16 21:43:49+00:00,0,5,5,,,
440,1173712919210745857,https://twitter.com/observer/status/1173712919210745857,observer,,"WeWork IPO Update Sees CEO’s Power Slashed, Valuation Dropped http://bit.ly/2QbdtbG pic.twitter.com/5ORBjJpAKl",2019-09-16 21:39:01+00:00,0,0,0,,,
441,1173712593443311616,https://twitter.com/laurieontech/status/1173712593443311616,laurieontech,buitengebieden_,WeWork IPO... *walks away whistling* https://twitter.com/buitengebieden_/status/1173120478057304064 …,2019-09-16 21:37:43+00:00,3,30,30,,,
442,1173712381895172097,https://twitter.com/chrisbmarquez/status/1173712381895172097,chrisbmarquez,,"Chegamos, Brasília! Inauguramos recentemente o nosso Open Studio - uma verdadeira imersão nos serviços da WeWork. Convidamos todos a vivenciar uma nova experiência de trabalho neste espaço para conexões, concentração e criatividade. Conheça mais em … https://chrisbmarquez.com/post/187763411290/chegamos-bras%C3%ADlia-inauguramos-recentemente-o …pic.twitter.com/DyZuUofUyx",2019-09-16 21:36:53+00:00,0,1,1,,,
443,1173711373861306369,https://twitter.com/PedroRLopezGar1/status/1173711373861306369,PedroRLopezGar1,,"These are the highest valued startups in the world From WeWork and Airbnb, to Stripe, Grab and others https://lnkd.in/dQzudEh",2019-09-16 21:32:52+00:00,0,0,0,,,
444,1173711080738230273,https://twitter.com/RoshanChain/status/1173711080738230273,RoshanChain,,Hey #DC Friends! If you know anyone that is looking for WeWork (hot-desk) in DC 718 7th Street NW.Please get in contact! We have 2.5 months vacant starting now to November 30th. Discounted rate. https://www.wework.com/buildings/718-7th-st-nw--washington-DC …,2019-09-16 21:31:42+00:00,0,2,2,,#DC,
445,1173710988128006145,https://twitter.com/ElieFinegold/status/1173710988128006145,ElieFinegold,,"Proptech VCs criticize WeWork leadership as IPO valuation cut likely - ⁦⁦⁦ @businessinsider⁩ Featuring commentary from me, ⁦ @Bradley_Greiwe of ⁦ @fifthwallvc⁩ and @cleliapeters my esteemed former colleague at ⁦ @MetaPropNYChttps://www.businessinsider.com/proptech-vcs-criticize-wework-leadership-as-ipo-valuation-cut-likely-2019-9 …",2019-09-16 21:31:20+00:00,4,10,10,@businessinsider @Bradley_Greiwe @fifthwallvc @cleliapeters @MetaPropNYChttps,,
446,1173710656803168257,https://twitter.com/GoVengreso/status/1173710656803168257,GoVengreso,,WeWork’s Formula to Hiring & Onboarding Success - Is this the secret sauce to getting and retaining the best members for your business? Find out via @ColinNanka1's content piece w/ @Quotable: https://sforce.co/2IMXGvC #SalesHiring #Leadershippic.twitter.com/uKyoqdgQRC,2019-09-16 21:30:01+00:00,0,1,1,@ColinNanka1 @Quotable,#SalesHiring #Leadershippic,
447,1173710327784935425,https://twitter.com/poetential/status/1173710327784935425,poetential,,"Thought. @MikeIsaac wrote the Uber book, @benmezrich wrote the Facebook one, @BradStone the Amazon book, @JohnCarreyrou wrote the Theranos book, WHO is writing the WeWork one?",2019-09-16 21:28:43+00:00,0,6,6,@MikeIsaac @benmezrich @BradStone @JohnCarreyrou,,
448,1173709939040292865,https://twitter.com/WeWorkBrasil/status/1173709939040292865,WeWorkBrasil,,"Chegamos, Brasília! Inauguramos recentemente o nosso Open Studio - uma verdadeira imersão nos serviços da WeWork. Convidamos todos a vivenciar uma nova experiência de trabalho neste espaço para conexões, concentração e criatividade. Conheça mais em https://we.co/bsbopenstudio .pic.twitter.com/5LDECUNWlX",2019-09-16 21:27:10+00:00,0,1,1,,,
449,1173709840264433665,https://twitter.com/Taylorule1/status/1173709840264433665,Taylorule1,,I walk past WeWork every day to go to work,2019-09-16 21:26:47+00:00,0,0,0,,,
450,1173709799466426368,https://twitter.com/dhnsinghtamu/status/1173709799466426368,dhnsinghtamu,,#WeWork IPO is yet to be seen,2019-09-16 21:26:37+00:00,0,0,0,,#WeWork,
451,1173709786409517057,https://twitter.com/batchelorshow/status/1173709786409517057,batchelorshow,,"“WeWork’s executives, investors and advisers are discussing curbing the voting power of co-founder Adam Neumann” ⁦ @FT⁩",2019-09-16 21:26:34+00:00,1,0,0,@FT,,
452,1173709690494046208,https://twitter.com/eliotwb/status/1173709690494046208,eliotwb,eringriffith,indeed. Silicon Valley hates hating on their own brethren. But they don't see WeWork as one their own. https://twitter.com/eringriffith/status/1173668285813936128 …,2019-09-16 21:26:11+00:00,0,16,16,,,
453,1173709581337464833,https://twitter.com/freizeitstyler/status/1173709581337464833,freizeitstyler,Mithos09,Gut zu wissen.,2019-09-16 21:25:45+00:00,0,1,1,,,
454,1173709118667755520,https://twitter.com/mr_james_c/status/1173709118667755520,mr_james_c,MattZeitlin,Begun? It's been going on for years dude. Mainly because the people who try to tie WeWork to the Valley are either journalists or WeWork itself. https://twitter.com/MattZeitlin/status/1173668557789552641 …,2019-09-16 21:23:55+00:00,0,1,1,,,
455,1173708895002517504,https://twitter.com/Jayatc1/status/1173708895002517504,Jayatc1,HindenburgRes,WeWork hasn't IPO'd yet fellas...,2019-09-16 21:23:01+00:00,0,27,27,,,
456,1173708892884414464,https://twitter.com/Technori/status/1173708892884414464,Technori,,Things aren't looking great for the WeWork CEO. https://reut.rs/32KLbGe,2019-09-16 21:23:01+00:00,0,0,0,,,
457,1173708783773769728,https://twitter.com/dinna_shepard/status/1173708783773769728,dinna_shepard,AlmingtonCap,pic.twitter.com/UclXYAeie2,2019-09-16 21:22:35+00:00,0,0,0,,,
458,1173708722431877120,https://twitter.com/KAFinvesting/status/1173708722431877120,KAFinvesting,HindenburgRes,"Damn, coming after #weWork before they even IPO https://twitter.com/HindenburgRes/status/1173705549726265349 …",2019-09-16 21:22:20+00:00,0,0,0,,#weWork,
459,1173707883218964486,https://twitter.com/PashaLawPC/status/1173707883218964486,PashaLawPC,,WeWork and Uber are proof (some) valuations are meaningless – TechCrunch https://pasha.bz/34Khze5,2019-09-16 21:19:00+00:00,0,1,1,,,
460,1173707539395072000,https://twitter.com/ThinkTony/status/1173707539395072000,ThinkTony,,"Hi Tribe Looking for quiet swanky or hip options for meeting for 6 tomorrow 9-12 In Sf. Best in dtwn, soma or marina..rooms, shares, best hotel, wework? Would love to have someone on speakerphone remote...",2019-09-16 21:17:38+00:00,0,0,0,,,
461,1173707136108564480,https://twitter.com/newyorkdailyjob/status/1173707136108564480,newyorkdailyjob,,Classrooms Community Associate (Part-time) https://www.worldwidenetjobs.com/newyork/classrooms-community-associate-part-time/ … WeWork Location : New York NY US Classrooms at WeWork is a new initiative for WeWork aimed at using WeWork space in the evenings and weekends as classrooms for schools all over the globe. More >> jobs... pic.twitter.com/DWO7UYS6zA,2019-09-16 21:16:02+00:00,0,0,0,,,
462,1173706889181442048,https://twitter.com/AllOffice_Space/status/1173706889181442048,AllOffice_Space,,Real estate tycoon Sam Zell slams WeWork: 'Every single company in this space has gone broke' https://p.grapevine6.com/tjRtSk,2019-09-16 21:15:03+00:00,0,0,0,,,
463,1173706834059939841,https://twitter.com/TheT_Room/status/1173706834059939841,TheT_Room,,"In the WeWork IPO, the Money Trails End Up at JPMorgan’s Doorstep… http://bit.ly/2O3ffcc #TRoom #politics",2019-09-16 21:14:50+00:00,0,0,0,,#TRoom #politics,
464,1173706741940244480,https://twitter.com/kglben/status/1173706741940244480,kglben,,"In the WeWork IPO, the Money Trails End Up at JPMorgan’s Doorstep https://wallstreetonparade.com/2019/09/in-the-wework-ipo-the-money-trails-end-up-at-jpmorgans-doorstep/ …",2019-09-16 21:14:28+00:00,0,0,0,,,
465,1173706418966474758,https://twitter.com/mycrazytaxworld/status/1173706418966474758,mycrazytaxworld,,How to lose $30 billion in 4 weeks: welcome to WeWork's IPO @mariainnyc https://www.inc.com/guadalupe-gonzalez/wework-ipo-explained.html … via @Inc,2019-09-16 21:13:11+00:00,0,0,0,@mariainnyc @Inc,,
466,1173706044272340992,https://twitter.com/alex/status/1173706044272340992,alex,eringriffith,"+1 to this, have seen a number of SValley investors take shots at WeWork which would be a huge no no if it was considered a SValley creation https://twitter.com/eringriffith/status/1173668285813936128 …",2019-09-16 21:11:42+00:00,1,7,7,,,
467,1173705714675716096,https://twitter.com/GoogleTrendsOn1/status/1173705714675716096,GoogleTrendsOn1,,WeWork considers dramatic valuation cut in IPO https://biz.blogdady.com/wework-considers-dramatic-valuation-lower-in-ipo-2/ …pic.twitter.com/LMsejuG2zD,2019-09-16 21:10:23+00:00,0,0,0,,,
468,1173705708015095813,https://twitter.com/ViralNewsNow1/status/1173705708015095813,ViralNewsNow1,,WeWork considers dramatic valuation cut in IPO https://biz.blogdady.com/wework-considers-dramatic-valuation-lower-in-ipo-2/ …pic.twitter.com/5bVmXWydE0,2019-09-16 21:10:21+00:00,0,0,0,,,
469,1173705701312667648,https://twitter.com/BlogDady/status/1173705701312667648,BlogDady,,WeWork considers dramatic valuation cut in IPO https://biz.blogdady.com/wework-considers-dramatic-valuation-lower-in-ipo-2/ …pic.twitter.com/UQaxxmNirm,2019-09-16 21:10:20+00:00,0,0,0,,,
470,1173705660300779521,https://twitter.com/allenchoo/status/1173705660300779521,allenchoo,,How to Lose $30 Billion in 4 Weeks: WeWork's IPO https://www.inc.com/guadalupe-gonzalez/wework-ipo-explained.html …,2019-09-16 21:10:10+00:00,0,0,0,,,
471,1173705512518635520,https://twitter.com/adamzea/status/1173705512518635520,adamzea,,Totally used my home-made VPN at the unsecured WeWork offices wifi today!,2019-09-16 21:09:35+00:00,0,0,0,,,
472,1173705508072632320,https://twitter.com/aibmv/status/1173705508072632320,aibmv,,10. trabalhar na WeWork,2019-09-16 21:09:34+00:00,0,0,0,,,
473,1173705483691155456,https://twitter.com/bizchecklist/status/1173705483691155456,bizchecklist,,How to lose $30 billion in 4 weeks: welcome to WeWork's IPO @mariainnyc https://www.inc.com/guadalupe-gonzalez/wework-ipo-explained.html … via @Inc,2019-09-16 21:09:28+00:00,0,0,0,@mariainnyc @Inc,,
474,1173705466213535744,https://twitter.com/HeyAmaka/status/1173705466213535744,HeyAmaka,,Loving all the different (and not shocking) opinions on WeWork.,2019-09-16 21:09:24+00:00,0,0,0,,,
475,1173705236810272768,https://twitter.com/Inc/status/1173705236810272768,Inc,,How to lose $30 billion in 4 weeks: welcome to WeWork's IPO @mariainnyc http://on.inc.com/eWqCMPZ,2019-09-16 21:08:29+00:00,37,96,96,@mariainnyc,,
476,1173705092027027456,https://twitter.com/247NAIJA_news/status/1173705092027027456,247NAIJA_news,,How to Lose $30 Billion in 4 Weeks: WeWork’s IPO pic.twitter.com/iZunHE6AzL,2019-09-16 21:07:54+00:00,0,1,1,,,
477,1173704999433584641,https://twitter.com/AtEmprendedores/status/1173704999433584641,AtEmprendedores,,"""Malos tiempos para las grandes valoraciones en startups: de Snapchat al complicado negocio de WeWork"". https://hipertextual.com/2019/09/malos-tiempos-grandes-valoraciones-startups …https://hipertextual.com/2019/09/malos-tiempos-grandes-valoraciones-startups …",2019-09-16 21:07:32+00:00,0,0,0,,,
478,1173704886266941441,https://twitter.com/nmasc_/status/1173704886266941441,nmasc_,,"Bad Haircuts, Expensive Robots, And We Eat Cereal As WeWork Dives. My weekly newsletter for @CrunchbaseNews:https://news.crunchbase.com/news/bad-haircuts-expensive-robots-and-we-eat-cereal-as-wework-dives/ …",2019-09-16 21:07:05+00:00,1,1,1,@CrunchbaseNews,,
479,1173704540509675522,https://twitter.com/AyataAnalytics/status/1173704540509675522,AyataAnalytics,,NYU professor calls WeWork's IPO 'Botox on a lame Unicorn' and says its price and valuation will be a 'throne of lies' https://www.businessinsider.com/nyu-professor-slams-wework-ipo-as-botox-on-a-lame-unicorn-2019-9?utm_source=twitter&utm_medium=referral&utm_content=topbar&utm_term=desktop&referrer=twitter … via @businessinsider,2019-09-16 21:05:43+00:00,0,0,0,@businessinsider,,
480,1173703948550774784,https://twitter.com/SiouxFallsPower/status/1173703948550774784,SiouxFallsPower,,15’s wrap up their first weekend at the Western States Invite. Back to work next weekend at the @naphl showcase in Blaine. 10-0 loss to Blue Army 4-1 loss to True North 9-5 loss to My Edge Hockey 4-3 win over My Edge Hockey OT #WeWork #POWERhouse,2019-09-16 21:03:22+00:00,0,10,10,@naphl,#WeWork #POWERhouse,
481,1173703657755463680,https://twitter.com/Founders_Cap/status/1173703657755463680,Founders_Cap,,Why WeWork might be the most undervalued company ever. An alternative view point of the future #wework #valuation #ipo #softbankhttps://www.linkedin.com/pulse/wework-most-undervalued-company-ever-stanley-conway- …,2019-09-16 21:02:13+00:00,0,0,0,,#wework #valuation #ipo #softbankhttps,
482,1173703423365189632,https://twitter.com/orsjuliana_/status/1173703423365189632,orsjuliana_,,obrigada meu deus por trabalhar no wework da barra funda onde não tem pebolim pois eu não aguentaria trabalhar mais de um dia nesse da paulista com esses corno gritando e fazendo barulho,2019-09-16 21:01:17+00:00,0,3,3,,,
483,1173703310504878080,https://twitter.com/stanleymconway/status/1173703310504878080,stanleymconway,,Why WeWork could the most undervalued company ever. An alternative view of the future #wework #ipo #valuation #softbank https://www.linkedin.com/pulse/wework-most-undervalued-company-ever-stanley-conway- …,2019-09-16 21:00:50+00:00,0,0,0,,#wework #ipo #valuation #softbank,
484,1173703228204228609,https://twitter.com/marketemia/status/1173703228204228609,marketemia,,Column: WeWork carries Silicon Valley&#039;s &#039;unicorn&#039; craze to its absurd limits - http://tinyurl.com/y3feahnj pic.twitter.com/GEf0Kz6Nhg,2019-09-16 21:00:30+00:00,0,0,0,,#039 #039 #039,
485,1173702875182182400,https://twitter.com/SamanthaMoua1/status/1173702875182182400,SamanthaMoua1,,rencontre femmes wework paris friend zone site de rencontres amicales pic.twitter.com/ohvfvSQvAm,2019-09-16 20:59:06+00:00,0,0,0,,,
486,1173702762628096001,https://twitter.com/rkischuk/status/1173702762628096001,rkischuk,,"I never thought I would see the day where Academics are criticizing IPOs by quoting Will Ferrell from ""Elf""... According to @profgalloway, WeWork's IPO price is ""sitting on a throne of lies"" https://www.businessinsider.com/nyu-professor-slams-wework-ipo-as-botox-on-a-lame-unicorn-2019-9 …",2019-09-16 20:58:39+00:00,10,61,61,@profgalloway,,
487,1173702615135375360,https://twitter.com/B2JRU/status/1173702615135375360,B2JRU,,«Ботокс для хромого единорога» — профессор Университета Нью-Йорка об IPO WeWork https://avvva.ru/ones-711054-botoks-dlya-hromogo-edinoroga-professor-universiteta-nyujorka-ob-ipo-wework.html …,2019-09-16 20:58:04+00:00,0,0,0,,,
488,1173702380623466499,https://twitter.com/airiters/status/1173702380623466499,airiters,,3 VC investors in flex-space startups slam WeWork’s governance and leadership as its valuation crumbles http://www.airiters.com/3-vc-investors-in-flex-space-startups-slam-weworks-governance-and-leadership-as-its-valuation-crumbles/ …,2019-09-16 20:57:08+00:00,0,0,0,,,
489,1173701756511051776,https://twitter.com/HarvardWinters/status/1173701756511051776,HarvardWinters,cctvidiots,WeWork IPO. https://twitter.com/cctvidiots/status/1173682358416863233 …,2019-09-16 20:54:39+00:00,0,5,5,,,
490,1173701626974146561,https://twitter.com/IanHathaway/status/1173701626974146561,IanHathaway,,"What would be unusual, however, is a collapse in valuation multiples at IPO that are so sharp, the exit valuation barely exceeds the total capital raised. And yet, that's a very real possibility that WeWork is facing. pic.twitter.com/Edjz62mzP5",2019-09-16 20:54:08+00:00,1,2,2,,,
491,1173701622171652103,https://twitter.com/Serebral360/status/1173701622171652103,Serebral360,,How to Lose $30 Billion in 4 Weeks: WeWork’s IPO by http://Inc.com http://serebral360.com/blog/how-to-lose-30-billion-in-4-weeks-weworks-ipo-by-inc-com/ …pic.twitter.com/RMWGz5M2kW,2019-09-16 20:54:07+00:00,0,0,0,,,
492,1173701093848694784,https://twitter.com/PatrickSeaman/status/1173701093848694784,PatrickSeaman,,"Don't mince words, tell us how you really feel: NYU Professor calls WeWork's IPO 'Botox on a lame Unicorn' and says its price and valuation will be a 'throne of lies' https://lnkd.in/eDKTkgX",2019-09-16 20:52:01+00:00,0,0,0,,,
493,1173701069278519297,https://twitter.com/NataliaZarina/status/1173701069278519297,NataliaZarina,steve_kupfer,somehow better than WeWork's?,2019-09-16 20:51:55+00:00,0,1,1,,,
494,1173700618323709952,https://twitter.com/plasticsceptic/status/1173700618323709952,plasticsceptic,WeWork,"London, chancery lane, but this is not the only one. Any thoughts to ban them across all of your spaces, irrespective of where?",2019-09-16 20:50:08+00:00,0,0,0,,,
495,1173700571532054528,https://twitter.com/IanHathaway/status/1173700571532054528,IanHathaway,,WeWork has raised a lot of capital in recent years https://twitter.com/IanHathaway/status/1173557762573422593 …pic.twitter.com/Zt6GzbMjrY,2019-09-16 20:49:57+00:00,10,39,39,,,
496,1173699581831536640,https://twitter.com/icoreprinciples/status/1173699581831536640,icoreprinciples,,How to Lose $30 Billion in 4 Weeks: WeWork's IPO http://ht.ly/4Y5p50wbUS2,2019-09-16 20:46:01+00:00,0,0,0,,,
497,1173698960801849350,https://twitter.com/MsNabilaAhmed/status/1173698960801849350,MsNabilaAhmed,,The biggest backers of SoftBank’s gargantuan Vision Fund are reconsidering their commitment to its next investment vehicle as the WeWork bet sours. https://www.bloomberg.com/news/articles/2019-09-16/softbank-backers-rethink-role-in-next-vision-fund-after-wework … @GillianTan @turnergs,2019-09-16 20:43:33+00:00,1,2,2,@GillianTan @turnergs,,
498,1173698952157380608,https://twitter.com/marshawright/status/1173698952157380608,marshawright,,Ok this one is pretty interesting... What do you think guys and gals? How to Lose $30 Billion in 4 Weeks: WeWork's IPO http://bit.ly/2LzBdlj #entrepreneur #marketing #successpic.twitter.com/tjCv3BDjAT,2019-09-16 20:43:31+00:00,2,1,1,,#entrepreneur #marketing #successpic,
499,1173698833190047744,https://twitter.com/alanmotley/status/1173698833190047744,alanmotley,,"With Microsoft set to take entire floor, big company workers at core of WeWork Capitol Hill strategy https://www.capitolhillseattle.com/2019/09/with-microsoft-set-to-take-entire-floor-big-company-workers-at-core-of-wework-capitol-hill-strategy/ …",2019-09-16 20:43:02+00:00,0,0,0,,,
500,1173698365147820034,https://twitter.com/kameraad52/status/1173698365147820034,kameraad52,kameraad52,"There is a way to go which is based on access. This is what WeWork promised but did not deliver to my sorrow, as I was very interested to see how that would go.",2019-09-16 20:41:11+00:00,0,0,0,,,
501,1173697619341860865,https://twitter.com/GoogleTrendsOn1/status/1173697619341860865,GoogleTrendsOn1,,This Isn’t Facebook: WeWork’s Lesson in Going Public https://biz.blogdady.com/this-isnt-fb-weworks-lesson-in-going-public/ …,2019-09-16 20:38:13+00:00,0,0,0,,,
502,1173697615810240513,https://twitter.com/ViralNewsNow1/status/1173697615810240513,ViralNewsNow1,,This Isn’t Facebook: WeWork’s Lesson in Going Public https://biz.blogdady.com/this-isnt-fb-weworks-lesson-in-going-public/ …,2019-09-16 20:38:12+00:00,0,0,0,,,
503,1173697611850801152,https://twitter.com/BlogDady/status/1173697611850801152,BlogDady,,This Isn’t Facebook: WeWork’s Lesson in Going Public https://biz.blogdady.com/this-isnt-fb-weworks-lesson-in-going-public/ …,2019-09-16 20:38:11+00:00,0,0,0,,,
504,1173697475875618816,https://twitter.com/MarilynOliva/status/1173697475875618816,MarilynOliva,,How to Lose $30 Billion in 4 Weeks: WeWork's IPO https://ift.tt/34QscMe,2019-09-16 20:37:39+00:00,0,0,0,,,
505,1173696998471589891,https://twitter.com/NICEBROgg/status/1173696998471589891,NICEBROgg,,"WeWork’s top communications executives are jumping ship as the company struggles to go public | Two senior WeWork communications executives have left the company, an unus ... https://nicebrogg.com/?p=84424",2019-09-16 20:35:45+00:00,0,0,0,,,
506,1173696917034950659,https://twitter.com/NICEBROgg/status/1173696917034950659,NICEBROgg,,The biggest backers of SoftBank’s $100 billion Vision Fund are reportedly reconsidering their investments in the second one after Uber and WeWork disappointed | Two of the biggest investors in SoftBank's original Vision Fund are debati ... https://nicebrogg.com/?p=84420,2019-09-16 20:35:25+00:00,0,0,0,,,
507,1173696707672059910,https://twitter.com/loudmoufpromo/status/1173696707672059910,loudmoufpromo,,#NewRelease > LotisMusic @Lotis_615 - #TrapParty prod by Krash Max via @DJHypemancrunk @cocoameka #MsMeka @BiggaRankin00 #CRDJS #BreezySays @IamBreezySays #TeamBiggaRankin coolrunningdjs #WeWork Track available… https://www.instagram.com/p/B2fFUUvHxm9/?igshid=11cn5dov8rvag …,2019-09-16 20:34:35+00:00,0,0,0,@Lotis_615 @DJHypemancrunk @cocoameka @BiggaRankin00 @IamBreezySays,#NewRelease #TrapParty #MsMeka #CRDJS #BreezySays #TeamBiggaRankin #WeWork,
508,1173696585991110662,https://twitter.com/djhypemancrunk/status/1173696585991110662,djhypemancrunk,,#NewRelease > LotisMusic @Lotis_615 - #TrapParty prod by Krash Max via @DJHypemancrunk @cocoameka #MsMeka @BiggaRankin00 #CRDJS #BreezySays @IamBreezySays #TeamBiggaRankin coolrunningdjs #WeWork Track available… https://www.instagram.com/p/B2fFRZYJpkp/?igshid=1r5vslezns81i …,2019-09-16 20:34:06+00:00,0,0,0,@Lotis_615 @DJHypemancrunk @cocoameka @BiggaRankin00 @IamBreezySays,#NewRelease #TrapParty #MsMeka #CRDJS #BreezySays #TeamBiggaRankin #WeWork,
509,1173696538385756160,https://twitter.com/carlos_amsf/status/1173696538385756160,carlos_amsf,,SoftBank Backers Rethink Role in Next Vision Fund on WeWork https://finance.yahoo.com/news/softbank-backers-rethink-role-next-151905672.html?soc_src=social-sh&soc_trk=tw … via @YahooFinance,2019-09-16 20:33:55+00:00,0,0,0,@YahooFinance,,
510,1173696448145215489,https://twitter.com/CHSfeed/status/1173696448145215489,CHSfeed,,"With Microsoft set to take entire floor, big company workers at core of WeWork Capitol Hill strategy http://www.capitolhillseattle.com/2019/09/with-microsoft-set-to-take-entire-floor-big-company-workers-at-core-of-wework-capitol-hill-strategy/?utm_source=dlvr.it&utm_medium=twitter …pic.twitter.com/wJTdqrhtbj",2019-09-16 20:33:34+00:00,0,0,0,,,
511,1173696309762674688,https://twitter.com/apcduplii/status/1173696309762674688,apcduplii,,Flexible Workspace Is Becoming The New Normal For The Enterprise Read more at: https://buff.ly/2LYc5DZ #WeWork #workspace #RealEstateNews #CRE #realestateinvestorpic.twitter.com/daUKaCrLgk,2019-09-16 20:33:01+00:00,1,1,1,,#WeWork #workspace #RealEstateNews #CRE #realestateinvestorpic,
512,1173695563168190465,https://twitter.com/rationalwalk/status/1173695563168190465,rationalwalk,,"I’m obviously being a bit sarcastic, but really, why would I want to rent a “hot desk” from WeWork at a cost of around $400 per month? A private office for ~$1000 at least makes more sense.",2019-09-16 20:30:03+00:00,0,1,1,,,
513,1173695478954938369,https://twitter.com/Web_Biz_Success/status/1173695478954938369,Web_Biz_Success,,How to Lose $30 Billion in 4 Weeks: WeWork's IPO https://ift.tt/34QscMe #Entrepreneur #BusinessGrowth #OnlineBusiness #GrowthHacking #Startup #SmallBusiness,2019-09-16 20:29:43+00:00,1,0,0,,#Entrepreneur #BusinessGrowth #OnlineBusiness #GrowthHacking #Startup #SmallBusiness,
514,1173695292761346053,https://twitter.com/nuyou22/status/1173695292761346053,nuyou22,,Alexandria Ocasio-Cortez says that anyone who invested in WeWork's $47 billion valuation is 'getting fleeced' https://www.businessinsider.com/aoc-says-anyone-who-invested-in-wework-is-getting-fleeced-2019-9 …,2019-09-16 20:28:58+00:00,0,0,0,,,
515,1173695149907435520,https://twitter.com/rationalwalk/status/1173695149907435520,rationalwalk,,"At a new, very nice and high end coffee shop where almost everyone seems to be working or studying, just like they would with a “hot desk” at WeWork. For $4 rent, which includes a free cappuccino, I could sit here as long as I want. WiFi and power provided.",2019-09-16 20:28:24+00:00,1,5,5,,,
516,1173695145415446528,https://twitter.com/jseattle/status/1173695145415446528,jseattle,,"With Microsoft set to take entire floor, big company workers at core of WeWork Capitol Hill strategy https://www.capitolhillseattle.com/2019/09/with-microsoft-set-to-take-entire-floor-big-company-workers-at-core-of-wework-capitol-hill-strategy/ …pic.twitter.com/mYunbyYVZo",2019-09-16 20:28:23+00:00,0,1,1,,,
517,1173695055418335235,https://twitter.com/PatrickSeaman/status/1173695055418335235,PatrickSeaman,,SoftBank Backers Rethink Role in Next Vision Fund on WeWork #fundinghttps://lnkd.in/ebXDWHk,2019-09-16 20:28:02+00:00,0,0,0,,#fundinghttps,
518,1173694693390991360,https://twitter.com/mlisse/status/1173694693390991360,mlisse,,WeWork's top communications executives are jumping ship as the company struggles to go public http://dlvr.it/RDDfwt pic.twitter.com/3Tq0LwVFnT,2019-09-16 20:26:35+00:00,0,0,0,,,
519,1173694673464045570,https://twitter.com/SmallBizExpo/status/1173694673464045570,SmallBizExpo,,How to Lose $30 Billion in 4 Weeks: WeWork's IPO http://twib.in/l/gEoAg7kMox4e pic.twitter.com/ByOtzi65cS,2019-09-16 20:26:31+00:00,0,0,0,,,
520,1173694529343541249,https://twitter.com/sophiewdownes/status/1173694529343541249,sophiewdownes,mariainnyc,"if you've been wondering what the [heck] is going on at WeWork, Lu has you covered: https://twitter.com/mariainnyc/status/1173693107348680704 …",2019-09-16 20:25:56+00:00,3,4,4,,,
