,id,permalink,username,author_id,text,date,formatted_date,to,retweets,favorites,replies,mentions,hashtags,urls,geo
378,1190329177020366848,https://twitter.com/ahmed_serougi/status/1190329177020366848,ahmed_serougi,746708599376863232,WeWork could be forming a gaming division http://dlvr.it/RHQx9f #mrahmedserougipic.twitter.com/EDXCLUx9od,2019-11-01 18:06:05+00:00,Fri Nov 01 18:06:05 +0000 2019,,0,0,0,,#mrahmedserougipic,http://dlvr.it/RHQx9f,
379,1190329078429052928,https://twitter.com/alexglutenfree/status/1190329078429052928,alexglutenfree,256222743,El @WeWork de Landmark en Zapopan es una extensión del @TECcampusGDL.,2019-11-01 18:05:42+00:00,Fri Nov 01 18:05:42 +0000 2019,,0,4,4,@WeWork @TECcampusGDL,,,
380,1190328998795988992,https://twitter.com/kathyklotzguest/status/1190328998795988992,kathyklotzguest,17792979,WeWork’s Ousted C.E.O. Adam Neumann Is Accused of Pregnancy Discrimination https://nyti.ms/36ln0AX Yikes. Now 2k people - including many women - will lose jobs while he gets a payout. Bad all around... weDONTwork,2019-11-01 18:05:23+00:00,Fri Nov 01 18:05:23 +0000 2019,,0,0,0,,,https://nyti.ms/36ln0AX,
381,1190328996426371073,https://twitter.com/edcamposj/status/1190328996426371073,edcamposj,334850273,WeWork could be forming a gaming division https://ift.tt/338cQ4I,2019-11-01 18:05:22+00:00,Fri Nov 01 18:05:22 +0000 2019,,0,0,0,,,https://ift.tt/338cQ4I,
382,1190328722869510144,https://twitter.com/BartoszBarista/status/1190328722869510144,BartoszBarista,3131608576,"We have raised a whooping €240 for charity at wework, which goes half-half to our charities of choice: @BeLonG_To and @DogsTrust_IE. Yeah! @Silverskin_ #charity #fundraising #Halloween https://www.instagram.com/p/B4VQscuHdN5/?igshid=u9ur3pj2yawb …",2019-11-01 18:04:17+00:00,Fri Nov 01 18:04:17 +0000 2019,,2,9,9,@BeLonG_To @DogsTrust_IE @Silverskin_,#charity #fundraising #Halloween,https://www.instagram.com/p/B4VQscuHdN5/?igshid=u9ur3pj2yawb,
383,1190328623116562433,https://twitter.com/Onceagain1232/status/1190328623116562433,Onceagain1232,1173713273323163648,Insane,2019-11-01 18:03:53+00:00,Fri Nov 01 18:03:53 +0000 2019,ginza12,0,0,0,,,,
384,1190328583350300672,https://twitter.com/VacancyDatabase/status/1190328583350300672,VacancyDatabase,980856025283735558,WeWork could be forming a gaming division https://ift.tt/338cQ4I Jay Peters,2019-11-01 18:03:44+00:00,Fri Nov 01 18:03:44 +0000 2019,,0,0,0,,,https://ift.tt/338cQ4I,
385,1190328568926130176,https://twitter.com/JahangeerDM/status/1190328568926130176,JahangeerDM,192237809,WeWork could be forming a gaming division https://www.theverge.com/2019/11/1/20943709/wework-gaming-division-play-by-we-uk-e-sports?utm_campaign=theverge&utm_content=chorus&utm_medium=social&utm_source=twitter … pic.twitter.com/G31R41vUWT,2019-11-01 18:03:40+00:00,Fri Nov 01 18:03:40 +0000 2019,,0,0,0,,,https://www.theverge.com/2019/11/1/20943709/wework-gaming-division-play-by-we-uk-e-sports?utm_campaign=theverge&utm_content=chorus&utm_medium=social&utm_source=twitter,
386,1190328258690191361,https://twitter.com/verge/status/1190328258690191361,verge,275686563,WeWork could be forming a gaming division https://www.theverge.com/2019/11/1/20943709/wework-gaming-division-play-by-we-uk-e-sports?utm_campaign=theverge&utm_content=chorus&utm_medium=social&utm_source=twitter …pic.twitter.com/SqmSlAJR2u,2019-11-01 18:02:26+00:00,Fri Nov 01 18:02:26 +0000 2019,,2,30,30,,,https://www.theverge.com/2019/11/1/20943709/wework-gaming-division-play-by-we-uk-e-sports?utm_campaign=theverge&utm_content=chorus&utm_medium=social&utm_source=twitter,
387,1190328080608432128,https://twitter.com/lustclouds/status/1190328080608432128,lustclouds,507855677,yo does anybody know anybody who works corporate for WeWork??,2019-11-01 18:01:44+00:00,Fri Nov 01 18:01:44 +0000 2019,,0,0,0,,,,
388,1190328040364138497,https://twitter.com/LBudikRE/status/1190328040364138497,LBudikRE,3309371075,". @WeWork founder Adam Neumann borrowed hundreds of millions, snapped up at least six homes and was eyeing more. Then last month happened, via @WSJRealEstate | http://ow.ly/E4WC50wS8sz pic.twitter.com/HQ0dahxQkO",2019-11-01 18:01:34+00:00,Fri Nov 01 18:01:34 +0000 2019,,0,0,0,@WeWork @WSJRealEstate,,http://ow.ly/E4WC50wS8sz,
389,1190327820159004672,https://twitter.com/robenfarzad/status/1190327820159004672,robenfarzad,17221422,". @VitaliyK: ""Why We Sold SoftBank"" https://contrarianedge.com/why-we-sold-softbank/?uid=*%7CUSERID%7C*&utm_source=IMA++-+Main+Articles&utm_campaign=36be577ddf-WHY_SOLD_SOFTBANK&utm_medium=email&utm_term=0_f1c90406d1-36be577ddf-151969237 … #SoftBank $SFTBY #WeWork",2019-11-01 18:00:42+00:00,Fri Nov 01 18:00:42 +0000 2019,,0,0,0,@VitaliyK,#SoftBank #WeWork,https://contrarianedge.com/why-we-sold-softbank/?uid=*%7CUSERID%7C*&utm_source=IMA++-+Main+Articles&utm_campaign=36be577ddf-WHY_SOLD_SOFTBANK&utm_medium=email&utm_term=0_f1c90406d1-36be577ddf-151969237,
390,1190327777863450624,https://twitter.com/scbrief/status/1190327777863450624,scbrief,3683172252,"WeWork Or Not, Logistics Technology Can Work by @freightos http://dlvr.it/RHQw4R #supplychain #logistics",2019-11-01 18:00:32+00:00,Fri Nov 01 18:00:32 +0000 2019,,0,0,0,@freightos,#supplychain #logistics,http://dlvr.it/RHQw4R,
391,1190327770284515334,https://twitter.com/ClassAction_org/status/1190327770284515334,ClassAction_org,239969709,Former WeWork Staffer Sues Ousted CEO Adam Neumann For Pregnancy Discrimination via @Forbeshttps://www.forbes.com/sites/rachelsandler/2019/10/31/former-wework-staffer-sues-ousted-ceo-adam-neumann-for-pregnancy-discrimination/#36b263621c2a …,2019-11-01 18:00:30+00:00,Fri Nov 01 18:00:30 +0000 2019,,0,0,0,@Forbeshttps,#36b263621c2a,https://www.forbes.com/sites/rachelsandler/2019/10/31/former-wework-staffer-sues-ousted-ceo-adam-neumann-for-pregnancy-discrimination/#36b263621c2a,
392,1190327646544171008,https://twitter.com/WeWork/status/1190327646544171008,WeWork,111092283,There's a lot that science can teach us about what goes into the creative process—and how each one of us can optimize our own. Here's a look into the four stages of the creative process: https://we.co/creativeprocesstw …. #wework,2019-11-01 18:00:00+00:00,Fri Nov 01 18:00:00 +0000 2019,,1,4,4,,#wework,https://we.co/creativeprocesstw,
393,1190327558920982529,https://twitter.com/TashaMacx_/status/1190327558920982529,TashaMacx_,196356826,pic.twitter.com/3H1vZks4sv,2019-11-01 17:59:39+00:00,Fri Nov 01 17:59:39 +0000 2019,ROKKR,0,0,0,,,,
394,1190327440708640768,https://twitter.com/KHurrikans/status/1190327440708640768,KHurrikans,1184887435647426562,DealBook: WeWork’s Creator Allegedly Called Maternity Leave’Holiday’ https://business-center-zug.ch/dealbook-weworks-creator-allegedly-called-maternity-leaveholiday-2/ …,2019-11-01 17:59:11+00:00,Fri Nov 01 17:59:11 +0000 2019,,0,0,0,,,https://business-center-zug.ch/dealbook-weworks-creator-allegedly-called-maternity-leaveholiday-2/,
395,1190327431875485698,https://twitter.com/ZugBcz/status/1190327431875485698,ZugBcz,989145400971063302,DealBook: WeWork’s Creator Allegedly Called Maternity Leave’Holiday’ https://business-center-zug.ch/dealbook-weworks-creator-allegedly-called-maternity-leaveholiday-2/ …,2019-11-01 17:59:09+00:00,Fri Nov 01 17:59:09 +0000 2019,,0,0,0,,,https://business-center-zug.ch/dealbook-weworks-creator-allegedly-called-maternity-leaveholiday-2/,
396,1190327428444557313,https://twitter.com/EmmaMcBower/status/1190327428444557313,EmmaMcBower,733854179261829122,Waiting to leave Paddington on my last day commuting on @GWRHelp after 9 years. On Monday I become a @SW_Help commuter as @TheLawyermag moves into new @WeWork digs.,2019-11-01 17:59:08+00:00,Fri Nov 01 17:59:08 +0000 2019,,0,5,5,@GWRHelp @SW_Help @TheLawyermag @WeWork,,,
397,1190327246726344707,https://twitter.com/AndrossR33/status/1190327246726344707,AndrossR33,4861028457,SoftBank management has lost their minds.,2019-11-01 17:58:25+00:00,Fri Nov 01 17:58:25 +0000 2019,ginza12,0,0,0,,,,
398,1190327025594056704,https://twitter.com/patrickdward/status/1190327025594056704,patrickdward,50517557,"""Look, this is worse than the WeWork stuff! If you hire a consultant to assess your culture and they come back saying 'the best way to describe your culture is with a word cloud,' then things are already bad."" @matt_levine https://www.bloomberg.com/opinion/articles/2019-11-01/the-silos-keep-blocking-the-vision …pic.twitter.com/8CrMrtgYkl",2019-11-01 17:57:32+00:00,Fri Nov 01 17:57:32 +0000 2019,,0,0,0,@matt_levine,,https://www.bloomberg.com/opinion/articles/2019-11-01/the-silos-keep-blocking-the-vision,
399,1190326835130896387,https://twitter.com/ryxcommar/status/1190326835130896387,ryxcommar,780557598089109504,"Twitter socialists: fantasize about what they'd do during the ""revolution,"" talk gleefully about a world without investment banks. Adam Neumann, founder and former CEO of WeWork: on the verge of singlehandedly bringing down one of the world's largest investment banks.",2019-11-01 17:56:47+00:00,Fri Nov 01 17:56:47 +0000 2019,,97,789,789,,,,
400,1190326772472143874,https://twitter.com/grpgrp/status/1190326772472143874,grpgrp,33526312,"Last few weeks just reinforce the axiom that tech companies become evil at scale, due to greed. Customers become digits in a metric instead of people. Facebook, WeWork, Airbnb.... https://twitter.com/VICE/status/1189902226145329154 …",2019-11-01 17:56:32+00:00,Fri Nov 01 17:56:32 +0000 2019,VICE,0,0,0,,,https://twitter.com/VICE/status/1189902226145329154,
401,1190326700380311552,https://twitter.com/RenetaKripalani/status/1190326700380311552,RenetaKripalani,45777192,"Accessing the future value of #SoftBank's assets and debts, an investor sold his stocks, after much deliberation considering the #WeWork deal. Interesting read on how buying and selling actually happens #WeWork #investmentbankinghttps://www.cfo.com/investor-relations-banking-capital-markets/2019/11/why-an-investor-soured-on-softbank/ …",2019-11-01 17:56:15+00:00,Fri Nov 01 17:56:15 +0000 2019,,0,0,0,,#SoftBank #WeWork #WeWork #investmentbankinghttps,https://www.cfo.com/investor-relations-banking-capital-markets/2019/11/why-an-investor-soured-on-softbank/,
402,1190326507715145731,https://twitter.com/AnalyticaGlobal/status/1190326507715145731,AnalyticaGlobal,3059457425,WeWork and ex-CEO Neumann accused of pregnancy discrimination by former employee https://wapo.st/2oHzstW,2019-11-01 17:55:29+00:00,Fri Nov 01 17:55:29 +0000 2019,,0,0,0,,,https://wapo.st/2oHzstW,
403,1190326385128148994,https://twitter.com/Weatherinternal/status/1190326385128148994,Weatherinternal,883293422462922753,WeWork CEO Adam Neumann Accused Of Pregnancy Discrimination https://weatherinternal.com/wework-ceo-adam-neumann-accused-of-pregnancy-discrimination/ …pic.twitter.com/llNiRz1xMh,2019-11-01 17:55:00+00:00,Fri Nov 01 17:55:00 +0000 2019,,0,0,0,,,https://weatherinternal.com/wework-ceo-adam-neumann-accused-of-pregnancy-discrimination/,
404,1190326382074707969,https://twitter.com/realfredglick/status/1190326382074707969,realfredglick,15288587,@WeWork has to be the W.,2019-11-01 17:54:59+00:00,Fri Nov 01 17:54:59 +0000 2019,carlquintanilla,0,0,0,@WeWork,,,
405,1190326347291230208,https://twitter.com/revistafactorrh/status/1190326347291230208,revistafactorrh,543023229,GINgroup y WeWork firman alianza #destacados http://tinyurl.com/y3qs6zw4 pic.twitter.com/gNbbqZXUCC,2019-11-01 17:54:51+00:00,Fri Nov 01 17:54:51 +0000 2019,,0,0,0,,#destacados,http://tinyurl.com/y3qs6zw4,
406,1190326263631798272,https://twitter.com/AParra210/status/1190326263631798272,AParra210,26120406,Just shy of a billion. Oof,2019-11-01 17:54:31+00:00,Fri Nov 01 17:54:31 +0000 2019,ginza12,0,0,0,,,,
407,1190326128814305282,https://twitter.com/matsysdesign/status/1190326128814305282,matsysdesign,474672122,"Wait, you’re going to @HyparAEC ?! That’s great!!! Good luck!",2019-11-01 17:53:58+00:00,Fri Nov 01 17:53:58 +0000 2019,matsysdesign,0,1,1,@HyparAEC,,,
408,1190326082370756609,https://twitter.com/InvestorDeck/status/1190326082370756609,InvestorDeck,750789806553075712,Why would you want this person's advice. They should rather pay him to stay away. What a joke.,2019-11-01 17:53:47+00:00,Fri Nov 01 17:53:47 +0000 2019,ginza12,0,3,3,,,,
409,1190325805341126657,https://twitter.com/_AlbertJeremia/status/1190325805341126657,_AlbertJeremia,725915741774446592,A new world for unicorns: What the WeWork flop means for Seattle’s top startups https://ift.tt/36uEY4f,2019-11-01 17:52:41+00:00,Fri Nov 01 17:52:41 +0000 2019,,0,0,0,,,https://ift.tt/36uEY4f,
410,1190325787691339777,https://twitter.com/matsysdesign/status/1190325787691339777,matsysdesign,474672122,Best of luck with whatever comes next for you Andrew! I’m sure you will continue to do amazing work in the future.,2019-11-01 17:52:37+00:00,Fri Nov 01 17:52:37 +0000 2019,andrewheumann,0,0,0,,,,
411,1190325492232028160,https://twitter.com/BobbyMagicGuy/status/1190325492232028160,BobbyMagicGuy,2910368497,I don't like Allevents' forcing people to use Nosebook or Geezmail to register.,2019-11-01 17:51:27+00:00,Fri Nov 01 17:51:27 +0000 2019,go2amitech,0,0,0,,,,
412,1190325406886285313,https://twitter.com/DJtweetALOT/status/1190325406886285313,DJtweetALOT,31594583,It's on Twitter everyday and I don't still don't know shit about WeWork,2019-11-01 17:51:06+00:00,Fri Nov 01 17:51:06 +0000 2019,,0,0,0,,,,
413,1190325118922309634,https://twitter.com/83darren/status/1190325118922309634,83darren,1189770532947943424,How is this even possible?,2019-11-01 17:49:58+00:00,Fri Nov 01 17:49:58 +0000 2019,ginza12,0,0,0,,,,
414,1190324868702621697,https://twitter.com/UglyResearch/status/1190324868702621697,UglyResearch,20604333,"Hi @Jason I'm curating ancient tech artifacts for @MuseumofAI - if you wind up with two WeWork t-shirts, please donate one to our permanent collection. tracy@museumof.ai",2019-11-01 17:48:58+00:00,Fri Nov 01 17:48:58 +0000 2019,Jason,0,1,1,@Jason @MuseumofAI @museumof,,,
415,1190324478280183810,https://twitter.com/MidWestMet/status/1190324478280183810,MidWestMet,268792491,WeWork’s Ousted C.E.O. Adam Neumann Is Accused of Pregnancy Discrimination https://nyti.ms/36ln0AX,2019-11-01 17:47:25+00:00,Fri Nov 01 17:47:25 +0000 2019,,0,0,0,,,https://nyti.ms/36ln0AX,
416,1190324390480629760,https://twitter.com/SingaporeNewsSG/status/1190324390480629760,SingaporeNewsSG,350584364,WeWork could cancel deals for new leases in London as it launches sweeping review https://sg.news.yahoo.com/wework-could-cancel-deals-leases-151859813.html … :Auto pickup by wikyou,2019-11-01 17:47:04+00:00,Fri Nov 01 17:47:04 +0000 2019,,0,0,0,,,https://sg.news.yahoo.com/wework-could-cancel-deals-leases-151859813.html,
417,1190324351398223876,https://twitter.com/JeremyJBH/status/1190324351398223876,JeremyJBH,123551769,Elizabeth Warren and Bernie Sanders literally could not ask for a better piece of ammunition,2019-11-01 17:46:55+00:00,Fri Nov 01 17:46:55 +0000 2019,ginza12,1,7,7,,,,
418,1190324307215503361,https://twitter.com/mytwits_fornon/status/1190324307215503361,mytwits_fornon,741264851650109444,Who is ill advised WEWORK CEO???,2019-11-01 17:46:44+00:00,Fri Nov 01 17:46:44 +0000 2019,jimcramer,0,0,0,,,,
419,1190324158745468933,https://twitter.com/washingtonpost/status/1190324158745468933,washingtonpost,2467791,WeWork and ex-CEO Neumann accused of pregnancy discrimination by former employee https://wapo.st/2oHzstW,2019-11-01 17:46:09+00:00,Fri Nov 01 17:46:09 +0000 2019,,25,53,53,,,https://wapo.st/2oHzstW,
420,1190324144170123264,https://twitter.com/mmo_culture/status/1190324144170123264,mmo_culture,1158995005245022208,@WeWork is preparing to enter the esports market! More details here: https://mmoculture.com/2019/11/play-by-we-wework-preparing-new-business-unit-to-take-on-esports/ …,2019-11-01 17:46:05+00:00,Fri Nov 01 17:46:05 +0000 2019,,0,0,0,@WeWork,,https://mmoculture.com/2019/11/play-by-we-wework-preparing-new-business-unit-to-take-on-esports/,
421,1190323085506994176,https://twitter.com/VOAStevenson/status/1190323085506994176,VOAStevenson,347568180,Some WeWork employees are now worried that they have a 'black mark' on their resumes http://businessinsider.sg/wework-employe ... pic.twitter.com/bZpV5PNGxC @businsidersg,2019-11-01 17:41:53+00:00,Fri Nov 01 17:41:53 +0000 2019,,0,0,0,@businsidersg,,http://businessinsider.sg/wework-employe,
422,1190322919077031937,https://twitter.com/DSMWcom/status/1190322919077031937,DSMWcom,72906858,"WeWork, Former CEO Adam Neumann Accused of Rampant Pregnancy and Gender Discrimination http://www.dontspreadmywealth.com/wework-former-ceo-adam-neumann-accused-of-rampant-pregnancy-and-gender-discrimination/ …",2019-11-01 17:41:13+00:00,Fri Nov 01 17:41:13 +0000 2019,,0,0,0,,,http://www.dontspreadmywealth.com/wework-former-ceo-adam-neumann-accused-of-rampant-pregnancy-and-gender-discrimination/,
423,1190322852567797761,https://twitter.com/pvchesney/status/1190322852567797761,pvchesney,801470715127922688,But then we won’t be able to invest that capital in great companies like WeWork.,2019-11-01 17:40:57+00:00,Fri Nov 01 17:40:57 +0000 2019,GRichelson,0,0,0,,,,
424,1190322459964321795,https://twitter.com/Ryan_Ori/status/1190322459964321795,Ryan_Ori,2269132896,WeWork recently became the largest office tenant downtown. Now the co-working giant is in survival mode. What does it mean for the Chicago office market? https://www.chicagotribune.com/columns/ryan-ori/ct-biz-wework-chicago-outlook-ryan-ori-20191101-oueehpmfgjetdns4j472gy7pka-story.html …,2019-11-01 17:39:24+00:00,Fri Nov 01 17:39:24 +0000 2019,,5,3,3,,,https://www.chicagotribune.com/columns/ryan-ori/ct-biz-wework-chicago-outlook-ryan-ori-20191101-oueehpmfgjetdns4j472gy7pka-story.html,
425,1190322127020281857,https://twitter.com/joshuajcarter_/status/1190322127020281857,joshuajcarter_,20834338,"A bunch of cool events are happening at @WeWork Custom House next week. @SXSW Meet and Greet on Tuesday, @BunkerLabsPDX is having their first Bunker Brews, and @tfblockchain is having their monthly meetup here. You can find all of those and more here: https://calagator.org/events#event-1250476327 …",2019-11-01 17:38:04+00:00,Fri Nov 01 17:38:04 +0000 2019,,4,5,5,@WeWork @SXSW @BunkerLabsPDX @tfblockchain,#event,https://calagator.org/events#event-1250476327,
426,1190322047316049920,https://twitter.com/silentman08/status/1190322047316049920,silentman08,23382444,Poster & cup thanks . I’ll drive down and get it haha,2019-11-01 17:37:45+00:00,Fri Nov 01 17:37:45 +0000 2019,ROKKR,0,0,0,,,,
427,1190321954160594956,https://twitter.com/mina_pantazi/status/1190321954160594956,mina_pantazi,3404030991,Working remotely at its best! #edinburgh #scotland #work #wework @WeWork pic.twitter.com/GR3MVioUgv,2019-11-01 17:37:23+00:00,Fri Nov 01 17:37:23 +0000 2019,,0,3,3,@WeWork,#edinburgh #scotland #work #wework,,
428,1190321930043297796,https://twitter.com/Quikolas17/status/1190321930043297796,Quikolas17,19463184,Next: Amazon or Sony should buy GoPro. Apple should buy or partner with Warby Parker. And Google or Amazon should take a heavy investment in WeWork.,2019-11-01 17:37:17+00:00,Fri Nov 01 17:37:17 +0000 2019,,0,1,1,,,,
429,1190321681862189056,https://twitter.com/JUST1NSAIYAN/status/1190321681862189056,JUST1NSAIYAN,2544438645,Excited to live in a state with an official team! Cant wait to watch you guys kick some butt,2019-11-01 17:36:18+00:00,Fri Nov 01 17:36:18 +0000 2019,ROKKR,0,0,0,,,,
430,1190321542477029379,https://twitter.com/FreitasRbf/status/1190321542477029379,FreitasRbf,3064466422,"Sucesso de $BABA + implosão do Wework : SoftBank $SFTBY negociada por menos que o valor da participação da empresa em $BABA , já excluindo dívida. Sprint, SoftBank Japão ( telefonia celular), ARM (chips), Private Equity, participação no Vision Fund vão de brinde. E volta troco",2019-11-01 17:35:45+00:00,Fri Nov 01 17:35:45 +0000 2019,bitencourtbas,0,0,0,,,,
431,1190321365854896128,https://twitter.com/startups_observ/status/1190321365854896128,startups_observ,905708461668872192,WeWork Founder Adam Neumann’s Trove of Pricey Properties https://buff.ly/35YxciJ pic.twitter.com/jeyGZ4Iofo,2019-11-01 17:35:03+00:00,Fri Nov 01 17:35:03 +0000 2019,,0,0,0,,,https://buff.ly/35YxciJ,
432,1190321327183290368,https://twitter.com/NickJRishwain/status/1190321327183290368,NickJRishwain,188531255,WeWork.,2019-11-01 17:34:54+00:00,Fri Nov 01 17:34:54 +0000 2019,Jason,0,4,4,,,,
433,1190321324234878977,https://twitter.com/chilli8910/status/1190321324234878977,chilli8910,2341994915,"I’ve had the most wonderful week doing work experience with IPFA in London! Couldn’t have asked for a better mentor than Maddie. A huge thank you to IPFA, WeWork and The Diana Award for such an amazing opportunity - I learnt so much! pic.twitter.com/hjUJNYirvX",2019-11-01 17:34:53+00:00,Fri Nov 01 17:34:53 +0000 2019,,0,8,8,,,,
434,1190321244161368065,https://twitter.com/ginza12/status/1190321244161368065,ginza12,135399673,@WeWork @LouDobbs @CNBCnow @jimcramer Fired WeWork CEO Neumann will receive $185K/day as a consultant for the next 4 years -in ADDITION to the $600M he received for stock and almost bankrupting the company. BETTER to give 1k workers an extra $185 a day...,2019-11-01 17:34:34+00:00,Fri Nov 01 17:34:34 +0000 2019,,11,18,18,@WeWork @LouDobbs @CNBCnow @jimcramer,,,
435,1190321180873388033,https://twitter.com/jasonlk/status/1190321180873388033,jasonlk,4215921,"Softbank didn't invest again in WeWork, it bought it",2019-11-01 17:34:19+00:00,Fri Nov 01 17:34:19 +0000 2019,,4,89,89,,,,
436,1190321170404372480,https://twitter.com/imchrismayfield/status/1190321170404372480,imchrismayfield,15281154,I have WeWork pens and stickers,2019-11-01 17:34:16+00:00,Fri Nov 01 17:34:16 +0000 2019,Jason,0,2,2,,,,
437,1190321138246635520,https://twitter.com/seanmarengo/status/1190321138246635520,seanmarengo,55494329,Can I sit in WeWork for free? like Starbucks?,2019-11-01 17:34:09+00:00,Fri Nov 01 17:34:09 +0000 2019,Jason,0,0,0,,,,
438,1190321107489845248,https://twitter.com/theunicornboard/status/1190321107489845248,theunicornboard,1114186196631072768,"Community Associate, Abu Dhabi: Dubai, Dubai, United Arab Emirates WeWork About the Role A… http://dlvr.it/RHQr5G #startups #jobs #hiring",2019-11-01 17:34:01+00:00,Fri Nov 01 17:34:01 +0000 2019,,0,0,0,,#startups #jobs #hiring,http://dlvr.it/RHQr5G,
439,1190320733127184385,https://twitter.com/theunicornboard/status/1190320733127184385,theunicornboard,1114186196631072768,"EMEA Payroll Manager (FTC): London, United Kingdom WeWork Through design, technology, and… http://dlvr.it/RHQqmY #startups #jobs #hiring",2019-11-01 17:32:32+00:00,Fri Nov 01 17:32:32 +0000 2019,,0,1,1,,#startups #jobs #hiring,http://dlvr.it/RHQqmY,
440,1190320642274447360,https://twitter.com/Jason/status/1190320642274447360,Jason,3840,"Also, does anybody have a WeWork T-shirt? https://twitter.com/Jason/status/1190320354062782464 …",2019-11-01 17:32:10+00:00,Fri Nov 01 17:32:10 +0000 2019,Jason,5,25,25,,,https://twitter.com/Jason/status/1190320354062782464,
441,1190320485646700546,https://twitter.com/VIXC_News/status/1190320485646700546,VIXC_News,911339992194134016,WeWork's woes will test Chicago office market - Chicago Tribune - https://is.gd/qSACxq #VIXC #LatestComments,2019-11-01 17:31:33+00:00,Fri Nov 01 17:31:33 +0000 2019,,0,0,0,,#VIXC #LatestComments,https://is.gd/qSACxq,
442,1190320415345795073,https://twitter.com/WolfgangBremer/status/1190320415345795073,WolfgangBremer,14331417,I’m confused or maybe tired. You write about the AirBnb scam but the link goes to an article about WeWork from August? pic.twitter.com/XpdFfJcvE9,2019-11-01 17:31:16+00:00,Fri Nov 01 17:31:16 +0000 2019,johnkoetsier,0,0,0,,,,
443,1190320380466155521,https://twitter.com/kaytimothy/status/1190320380466155521,kaytimothy,367208495,Opportunities Rise From WeWork’s Woes https://at.law.com/LZjMCF?cmp=share_twitter … via @GlobeStcom,2019-11-01 17:31:08+00:00,Fri Nov 01 17:31:08 +0000 2019,,0,0,0,@GlobeStcom,,https://at.law.com/LZjMCF?cmp=share_twitter,
444,1190320376678621187,https://twitter.com/CameronSperance/status/1190320376678621187,CameronSperance,15704727,"On an earnings call this week, Boston Properties executives downplayed @WeWork's impact on its portfolio...but that didn't halt analyst skepticism the coworking provider is hindering leasing at a high-profile Brooklyn office. More at @Bisnow:https://www.bisnow.com/boston/news/office/boston-properties-ceo-wework-causes-pause-on-coworking-sector-us-economy-is-moderating-101575 …",2019-11-01 17:31:07+00:00,Fri Nov 01 17:31:07 +0000 2019,,1,0,0,@WeWork @Bisnow,,https://www.bisnow.com/boston/news/office/boston-properties-ceo-wework-causes-pause-on-coworking-sector-us-economy-is-moderating-101575,
445,1190320370630320133,https://twitter.com/RealPowerOfWE/status/1190320370630320133,RealPowerOfWE,714885691252072448,"WeWork is Reportedly Getting Into Esports with Play By We, Which Could Rent Its Offfice Space for Professional Gaming Events http://dlvr.it/RHQqQP pic.twitter.com/HTUZMARtHM",2019-11-01 17:31:06+00:00,Fri Nov 01 17:31:06 +0000 2019,,0,0,0,,,http://dlvr.it/RHQqQP,
446,1190320328611893250,https://twitter.com/KendallCRE/status/1190320328611893250,KendallCRE,636453747,Is there an emoji for a that’s a grifter,2019-11-01 17:30:56+00:00,Fri Nov 01 17:30:56 +0000 2019,IDollyLenz,1,4,4,,,,
447,1190320241928261633,https://twitter.com/WorkItDaily/status/1190320241928261633,WorkItDaily,18898143,Layoffs happen to everyone. Here's what WeWork employees should know about career success... http://bit.ly/2Wyyj4c,2019-11-01 17:30:35+00:00,Fri Nov 01 17:30:35 +0000 2019,,1,1,1,,,http://bit.ly/2Wyyj4c,
