,id,permalink,username,to,text,date,retweets,favorites,replies,mentions,hashtags,geo
1087,1185435173929836544,https://twitter.com/BloombergJapan/status/1185435173929836544,BloombergJapan,,WeWorkの資金調達でバンカーと投資家奔走、来月にも資金枯渇か https://bloom.bg/31otIm0 pic.twitter.com/qO9nEnPHgb,2019-10-19 05:59:04+00:00,6,12,12,,,
1088,1185435154497466369,https://twitter.com/C_A_Lott/status/1185435154497466369,C_A_Lott,sergioaved,"Your guess is as good as mine. Even if WeWork is valued at 10 cent, it's still too much.",2019-10-19 05:58:59+00:00,0,1,1,,,
1089,1185434690452443136,https://twitter.com/SarkarMania/status/1185434690452443136,SarkarMania,,This episode is absolute good on WeWork. https://podcasts.apple.com/in/podcast/943-unicorn-cowboy/id290783428?i=1000452356743 …,2019-10-19 05:57:09+00:00,1,6,6,,,
1090,1185434554405969920,https://twitter.com/DemianBlg/status/1185434554405969920,DemianBlg,,Adam Neumann planeó que sus hijos y nietos controlen WeWork – https://dearce.com.uy/adam-neumann-planeo-que-sus-hijos-y-nietos-controlen-wework/ …,2019-10-19 05:56:36+00:00,0,0,0,,,
1091,1185434257868627968,https://twitter.com/dasvee/status/1185434257868627968,dasvee,Tartantory56,"Bond vigilantes right now have driven WeWork debt to over 13%, with Aston Martin debt issued at 12%.They still exist. The ratings agency response to this deal will be interesting. I can't believe raising trade barriers overnight (inc internally with NI) will be seen as a positive",2019-10-19 05:55:26+00:00,0,1,1,,,
1092,1185434218186334208,https://twitter.com/mokednewsil/status/1185434218186334208,mokednewsil,,המשבר ב-WeWork: “אדם נוימן עשוי להידרש להוסיף כסף או למכור נכסים שצבר” https://www.mokednews.co.il/archives/282771,2019-10-19 05:55:16+00:00,0,1,1,,,
1093,1185434131427147776,https://twitter.com/willynguen/status/1185434131427147776,willynguen,,"'Pinoystartup/data-science' Top: WeWork valuation may drop below $8 billion in Softbank bailout: report - Business Insider https://www.businessinsider.com/wework-valuation-could-slip-below-8-billion-softbank-bailout-report-2019-10 …, see more http://tweetedtimes.com/v/2346?s=tnp",2019-10-19 05:54:55+00:00,1,0,0,,,
1094,1185433241299251200,https://twitter.com/YoshieSano2/status/1185433241299251200,YoshieSano2,,関西学院大学国際学部生がシンガポールのWework beach Centerで日本酒の体験型イベントを開催します。シンガポール在住のみなさま、ぜひぜひお立ち寄りくださいませー！ https://www.facebook.com/events/375500790061668/?event_time_id=375500793395001?ti=icl …,2019-10-19 05:51:23+00:00,0,1,1,,,
1095,1185433191328305152,https://twitter.com/tmiyatake1/status/1185433191328305152,tmiyatake1,tmiyatake1,アップデート11：WeWorkが年内でキャッシュアウトするため、Softbankが資金調達を実行する予定。時価総額は$8B（前回ラウンドは$47B）と噂されている。 https://www.theinformation.com/briefings/9d16f6 …,2019-10-19 05:51:11+00:00,0,0,0,,,
1096,1185431851642474497,https://twitter.com/CHOCO91798202/status/1185431851642474497,CHOCO91798202,,"""自己啓発セミナーと孫正義、ソフトバンク倒産。wework問題、引き寄せの法則の嘘。"" を YouTube で見る https://youtu.be/i32b5KJ43g4 いま おすすめ する職業 ①市議会議員 ②YouTuber ③農業 ④大工 ③④はﾏｰｹﾃｨﾝｸﾞまで含む",2019-10-19 05:45:52+00:00,0,3,3,,,
1097,1185431510066683905,https://twitter.com/mat_kelcey/status/1185431510066683905,mat_kelcey,,Reading about the WeWork collapse I had no idea their valuation! Just shy of $50B must have put them close to the #1 valued startup in U.S. ?,2019-10-19 05:44:30+00:00,0,6,6,,#1,
1098,1185431170424557568,https://twitter.com/DanGoldgeier/status/1185431170424557568,DanGoldgeier,,The stories that are being published about WeWork are crazier than the ones that came out about Theranos. https://www.businessinsider.com/wework-adam-neumann-said-family-control-company-300-years-january-2019-10 …,2019-10-19 05:43:09+00:00,0,0,0,,,
1099,1185430109123006465,https://twitter.com/BobbyMagicGuy/status/1185430109123006465,BobbyMagicGuy,Forbes,"It's $200 Million per year more for Meetup / Wework, according to Rich's calculations. https://twitter.com/Richgreenx/status/1185174092254797830 …",2019-10-19 05:38:56+00:00,0,0,0,,,
1100,1185429932031332352,https://twitter.com/triketora/status/1185429932031332352,triketora,,jpmorgan assembling a $5b rescue package for wework that values it at under $8b... that’s a pretty far cry from $47b (or what goldman was pitching at $90b+!!). do they think we are all stupid or what https://www.bloomberg.com/news/articles/2019-10-18/softbank-is-said-to-eye-wework-rescue-valuation-below-8-billion …,2019-10-19 05:38:14+00:00,40,138,138,,,
1101,1185429372242579457,https://twitter.com/lynncyrin/status/1185429372242579457,lynncyrin,,"I hate the wework guy, I've decided",2019-10-19 05:36:01+00:00,0,13,13,,,
1102,1185429234455461888,https://twitter.com/BobbyMagicGuy/status/1185429234455461888,BobbyMagicGuy,AnyaTimoshenkoM,"Anna, no one's heard of Orbis, so tweet it out more. The meetup $2 fee is $200 million/year, according to a tweet by ""Rich"".",2019-10-19 05:35:28+00:00,0,1,1,,,
1103,1185428808440016896,https://twitter.com/marketing_tob/status/1185428808440016896,marketing_tob,yusuke_kojima55,たまに打ち合わせでweworkに行くのだけれど、ディスプレイに接続するというシンプルな事さえ難易度が高い https://twitter.com/yusuke_kojima55/status/1185425116278095872 …,2019-10-19 05:33:46+00:00,0,1,1,,,
1104,1185428362098987008,https://twitter.com/TedHemberger/status/1185428362098987008,TedHemberger,,“What’s happening?” How could you ask that twitter? Where is Bunky!? AND Goku!!? Conspiracy. There’s two spots just waiting for them to be all cute on the WEWORK POLOROID PUPPY PLAY WALL!? We UNDERSTAND. Dey Too cute eyhhh!? pic.twitter.com/0GWveePh2O – at WeWork Culver City,2019-10-19 05:32:00+00:00,0,3,3,,,
1105,1185428181576310786,https://twitter.com/paddypisa/status/1185428181576310786,paddypisa,,"why is that? well the best way to make money in most industries today (just look at uber, spacex, wework, and 95% of the ICO industry) is just ""number go up"". so you want someone who can sell a good story, not necessarily bring in revenue.",2019-10-19 05:31:17+00:00,0,6,6,,,
1106,1185428067604258817,https://twitter.com/BobbyMagicGuy/status/1185428067604258817,BobbyMagicGuy,Richgreenx,"Rich, ""short sighted"" is nowhere near what's going on ""behind the curtains."" Try digging up more!",2019-10-19 05:30:50+00:00,0,0,0,,,
1107,1185426949797138432,https://twitter.com/BobbyMagicGuy/status/1185426949797138432,BobbyMagicGuy,BobbyMagicGuy,*correction: Hawksberry,2019-10-19 05:26:23+00:00,0,0,0,,,
1108,1185426627401904128,https://twitter.com/BobbyMagicGuy/status/1185426627401904128,BobbyMagicGuy,coderhs,"Meetup imo is no longer ""what is once was"". Lookup TrustPilot. And, read what management is doing in Henry Hawksbury's whistleblower report. Be guided by ""principle"" not ""convenience"". There will be an alternative, in time.",2019-10-19 05:25:06+00:00,0,0,0,,,
1109,1185425246188388352,https://twitter.com/atlantico_fr/status/1185425246188388352,atlantico_fr,,"Bye bye Uber, Deliveroo ou WeWork ? Voilà pourquoi le mode de vie urbain des années 2010 est en train de s’effondrer https://www.atlantico.fr/decryptage/3581238/bye-bye-uber-deliveroo-ou-wework--voila-pourquoi-le-mode-de-vie-urbain-des-annees-2010-est-en-train-de-s-effondrer-sebastien-laye?utm_term=Autofeed&utm_medium=Social&utm_source=Twitter#Echobox=1571436517 …pic.twitter.com/XmjCnWeCQH",2019-10-19 05:19:37+00:00,1,0,0,,#Echobox,
1110,1185425116278095872,https://twitter.com/yusuke_kojima55/status/1185425116278095872,yusuke_kojima55,,WeWork時価総額推移 ●2019年1月：約5兆円 ↓ ●2019年9月：約2兆円 ↓ ●2019年10月：約8700億円（現在） レンタルオフィス世界No.1リージャスの時価総額3000億円に近づいてきた WeWorkのバリエーションを引き上げているコア技術、ビルディング・インフォメーション・モデリングにも疑念の声が,2019-10-19 05:19:06+00:00,1,9,9,,,
1111,1185425047873380352,https://twitter.com/kicktemp/status/1185425047873380352,kicktemp,inwend,@kicktemp Team heute beim #joomla #PBF19 im @WeWork https://twitter.com/inwend/status/1185424318391554048 …,2019-10-19 05:18:50+00:00,0,3,3,@kicktemp @WeWork,#joomla #PBF19,
1112,1185424318391554048,https://twitter.com/inwend/status/1185424318391554048,inwend,,Sind jetzt unterwegs zum Joomla #PBF19 nach Hamburg @WeWork /w @Niels_Nuebel Happy testing and patching Joomlers all over the world. #jpositiv #jfriends #joomla #jughhpic.twitter.com/MzzVHTDY9B,2019-10-19 05:15:56+00:00,4,21,21,@WeWork @Niels_Nuebel,#PBF19 #jpositiv #jfriends #joomla #jughhpic,
1113,1185423403823452160,https://twitter.com/V2KeHvXmcxwxNyM/status/1185423403823452160,V2KeHvXmcxwxNyM,,【谷歌非洲前CEO：比特币是改变人类的“礼物”】计算机科学家、WeWork南非公司总经理Stafford Masie表示，比特币(BTC)对人类未来的改变将超过任何其他技术创新。Masie表示，比特币在没有中介的情况下提供价值交换，这是人类有史以来获得的最伟大的技术礼物。（cointelegraph）,2019-10-19 05:12:18+00:00,0,0,0,,,
1114,1185422528237293569,https://twitter.com/macromon/status/1185422528237293569,macromon,rorotrader,WeWork is going to emasculate Jamie. JP MO almost got away with stuffing investors with $47 billion of that toxic waste.,2019-10-19 05:08:49+00:00,1,2,2,,,
1115,1185421194096340993,https://twitter.com/YukoTaira1/status/1185421194096340993,YukoTaira1,,New Post WeWork、小学校閉鎖へ コスト削減し中核事業に専念 https://newsphere.jp/business/20191019-1/ …,2019-10-19 05:03:31+00:00,0,0,0,,,
1116,1185421059367018497,https://twitter.com/kaushalvshah/status/1185421059367018497,kaushalvshah,,Can anyone explain to me how does this founder has 700m USD to buy half of his company's next round? Then Indian banks worry about their NPAs! @riteshagar And of course it's Softbank again. @WeWork wasn't enough. https://www.bloombergquint.com/business/india-startup-oyo-raises-1-5-billion-at-10-billion-valuation …,2019-10-19 05:02:59+00:00,0,0,0,@riteshagar @WeWork,,
1117,1185420973086035969,https://twitter.com/Viralamoo/status/1185420973086035969,Viralamoo,,Adam Neumann planned for his children and grandchildren to control WeWork – TechCrunch https://www.viralamo.com/adam-neumann-planned-for-his-children-and-grandchildren-to-control-wework-techcrunch/ …pic.twitter.com/ydRO4acjx7,2019-10-19 05:02:38+00:00,0,0,0,,,
1118,1185420742218964993,https://twitter.com/Foertsch/status/1185420742218964993,Foertsch,,Read my Oct 19 Newsletter featuring “WeWork Is Facing an Executive Exodus” https://nzzl.us/3KUhyiR,2019-10-19 05:01:43+00:00,0,0,0,,,
1119,1185420315968581632,https://twitter.com/social_rosie/status/1185420315968581632,social_rosie,,Adam Neumann planned for his children and grandchildren to control WeWork - http://feedproxy.google.com/~r/techcrunch/startups/~3/E5kLmBMFnZA/ …,2019-10-19 05:00:02+00:00,0,0,0,,,
1120,1185420189904576512,https://twitter.com/itsRickRobinson/status/1185420189904576512,itsRickRobinson,,Adam Neumann planned for his children and grandchildren to control WeWork https://techcrunch.com/2019/10/18/adam-neumann-planned-for-his-children-and-grandchildren-to-control-wework/ …,2019-10-19 04:59:31+00:00,0,0,0,,,
1121,1185419987932123136,https://twitter.com/jayaprakashpv/status/1185419987932123136,jayaprakashpv,,"Top story: Adam Neumann planned for his children and grandchildren to control WeWork – TechCrunch https://techcrunch.com/2019/10/18/adam-neumann-planned-for-his-children-and-grandchildren-to-control-wework/ …, see more http://tweetedtimes.com/jayaprakashpv?s=tnp …",2019-10-19 04:58:43+00:00,0,0,0,,,
1122,1185419686458081280,https://twitter.com/kimyn63/status/1185419686458081280,kimyn63,,WeWork’s woes threaten Hong Kong’s teetering office market https://www.ft.com/content/acf0c4b4-f14d-11e9-ad1e-4367d8281195 …,2019-10-19 04:57:31+00:00,0,0,0,,,
1123,1185419441498185728,https://twitter.com/ato_gallery/status/1185419441498185728,ato_gallery,johnbiggs,,2019-10-19 04:56:33+00:00,0,0,0,,,
1124,1185418849358962689,https://twitter.com/Sean_Hyman/status/1185418849358962689,Sean_Hyman,,Leaked video reveals Adam Neumann told staff earlier this year that his family had 100% control of WeWork and that even in 300 years his descendants would be in control #SmartNewshttps://www.insider.com/wework-adam-neumann-said-family-control-company-300-years-january-2019-10 …,2019-10-19 04:54:12+00:00,1,0,0,,#SmartNewshttps,
1125,1185418847542755330,https://twitter.com/_David_Kang/status/1185418847542755330,_David_Kang,,Adam Neumann planned for his children and grandchildren to control WeWork https://techcrunch.com/2019/10/18/adam-neumann-planned-for-his-children-and-grandchildren-to-control-wework/ …,2019-10-19 04:54:11+00:00,0,0,0,,,
1126,1185418635596222464,https://twitter.com/joemosch/status/1185418635596222464,joemosch,MilenaRodban,Seems like the only exit WeWork is having anytime soon is the whole executive team.,2019-10-19 04:53:21+00:00,0,0,0,,,
1127,1185417617814638593,https://twitter.com/LimitedLiabili3/status/1185417617814638593,LimitedLiabili3,,Adam Neumann planned for his children and grandchildren to control WeWork https://www.limitedliability.solutions/blog/2019/10/19/adam-neumann-planned-for-his-children-and-grandchildren-to-control-wework/ …,2019-10-19 04:49:18+00:00,0,0,0,,,
1128,1185417578732310528,https://twitter.com/305cpa/status/1185417578732310528,305cpa,,WeWork’s fall could spell disaster for other overvalued unicorns https://www.fastcompany.com/90417250/weworks-fall-could-spell-disaster-for-other-overvalued-unicorns … #Valuation #StartupChats,2019-10-19 04:49:09+00:00,1,2,2,,#Valuation #StartupChats,
1129,1185417400533078018,https://twitter.com/Sp1ndex1/status/1185417400533078018,Sp1ndex1,,Adam Neumann planned for his children and grandchildren to control WeWork https://www.sp1ndex.com/2019/10/19/adam-neumann-planned-for-his-children-and-grandchildren-to-control-wework/ …,2019-10-19 04:48:26+00:00,0,0,0,,,
1130,1185417295276982272,https://twitter.com/acerbo_andrea/status/1185417295276982272,acerbo_andrea,,Adam Neumann planned for his children and grandchildren to control WeWork https://acerbolivio.com/2019/10/19/adam-neumann-planned-for-his-children-and-grandchildren-to-control-wework/ …,2019-10-19 04:48:01+00:00,0,0,0,,,
1131,1185416928766185472,https://twitter.com/ourpublicworks/status/1185416928766185472,ourpublicworks,,"""As WeWork crashes and Uber bleeds cash, the consumer-tech gold rush may be coming to an end."" https://www.theatlantic.com/ideas/archive/2019/10/say-goodbye-millennial-urban-lifestyle/599839 …",2019-10-19 04:46:34+00:00,0,1,1,,,
1132,1185416781244129280,https://twitter.com/ourpublicworks/status/1185416781244129280,ourpublicworks,,"#LateStageCapitalism: ""If you wake up on a Casper mattress, work out w/ a Peloton, Uber to your desk at a WeWork, order DoorDash for lunch, take a Lyft home & get dinner through Postmates, you’ve interacted w/ 7 companies that will collectively lose nearly $14 billion this year.""",2019-10-19 04:45:59+00:00,0,0,0,,#LateStageCapitalism,
1133,1185416158066774016,https://twitter.com/freeter_ooya/status/1185416158066774016,freeter_ooya,,自己啓発セミナーと孫正義、ソフトバンク倒産。wework問題、引き寄せの法則の嘘。 https://youtu.be/i32b5KJ43g4 @YouTubeさんから,2019-10-19 04:43:30+00:00,0,0,0,@YouTubeさんから,,
1134,1185416114454454273,https://twitter.com/lordmoz/status/1185416114454454273,lordmoz,,Adam Neumann planned for his children and grandchildren to control WeWork – TechCrunch https://techcrunch.com/2019/10/18/adam-neumann-planned-for-his-children-and-grandchildren-to-control-wework/ …,2019-10-19 04:43:20+00:00,0,0,0,,,
1135,1185415527054766080,https://twitter.com/VitoCarrozzo/status/1185415527054766080,VitoCarrozzo,ritholtz,"Last one out , turn off the beer tap #WeWork #WeWalk https://twitter.com/ritholtz/status/1185311310227169280 …",2019-10-19 04:41:00+00:00,0,0,0,,#WeWork #WeWalk,
1136,1185415034844790784,https://twitter.com/theunicornboard/status/1185415034844790784,theunicornboard,,"Security Lead: Santiago de Chile, Region Metropolitana de Santiago, Chile WeWork Job… http://dlvr.it/RGVyFD #startups #jobs #hiring",2019-10-19 04:39:02+00:00,0,0,0,,#startups #jobs #hiring,
1137,1185414924366802945,https://twitter.com/TIAscience/status/1185414924366802945,TIAscience,ASMILEwithAnna,pic.twitter.com/AVZnsKJpnp,2019-10-19 04:38:36+00:00,0,1,1,,,
1138,1185414673186689024,https://twitter.com/TIAscience/status/1185414673186689024,TIAscience,ASMILEwithAnna,Please do!!,2019-10-19 04:37:36+00:00,0,1,1,,,
1139,1185414519478030336,https://twitter.com/ASMILEwithAnna/status/1185414519478030336,ASMILEwithAnna,TIAscience,"Love you, Tia!!!!pic.twitter.com/RUTZ1KUrPL",2019-10-19 04:37:00+00:00,0,1,1,,,
1140,1185414417032331264,https://twitter.com/newpaper24/status/1185414417032331264,newpaper24,,"WeWork, Solar Hung Kai signal lease deal as struggling US start-up prepares to open co-working area in Nanjing – NEWPAPER24 https://newpaper24.com/wework-sun-hung-kai-sign-lease-deal-as-struggling-us-start-up-prepares-to-open-co-working-space-in-nanjing-newpaper24/ …pic.twitter.com/qPNrR6Z6jJ",2019-10-19 04:36:35+00:00,0,0,0,,,
1141,1185414248056250368,https://twitter.com/ASMILEwithAnna/status/1185414248056250368,ASMILEwithAnna,TIAscience,I don’t know! I will keep you posted. It is all an unknown adventure to me.,2019-10-19 04:35:55+00:00,0,1,1,,,
1142,1185414174186172416,https://twitter.com/radexql/status/1185414174186172416,radexql,,weworkとwarfork、字面が似てる,2019-10-19 04:35:37+00:00,0,0,0,,,
1143,1185413882443026433,https://twitter.com/TIAscience/status/1185413882443026433,TIAscience,ASMILEwithAnna,So when do we get to see the interview!!,2019-10-19 04:34:28+00:00,0,1,1,,,
1144,1185413271970603008,https://twitter.com/Digital_Bizness/status/1185413271970603008,Digital_Bizness,,Adam Neumann planned for his children and grandchildren to control WeWork https://techcrunch.com/2019/10/18/adam-neumann-planned-for-his-children-and-grandchildren-to-control-wework/?id=B1kBOG5EYw …,2019-10-19 04:32:02+00:00,1,0,0,,,
1145,1185413252127186944,https://twitter.com/Shichun888/status/1185413252127186944,Shichun888,,ケネディクスのオフィスREITの説明会に出ていたんだけど、最近何かと話題のweworkもテナントにいるんですね。やっぱり高い賃料を取っているのかな？ pic.twitter.com/QkCY12x0mP,2019-10-19 04:31:57+00:00,0,2,2,,,
1146,1185413181381824512,https://twitter.com/priyankbhilai/status/1185413181381824512,priyankbhilai,,"WeWork debacle: how Awfis, IndiQube, other Indian co-working startups can build viable businesses - ET Prime https://prime.economictimes.indiatimes.com/news/71572337/technology-and-startups/wework-debacle-how-awfis-indiqube-other-indian-co-working-startups-can-build-viable-businesses …",2019-10-19 04:31:41+00:00,0,0,0,,,
1147,1185413144451190785,https://twitter.com/mr_lucky_cool/status/1185413144451190785,mr_lucky_cool,,自己啓発セミナーと孫正義、ソフトバンク倒産。wework問題、引き寄せの法則の嘘。 pic.twitter.com/XlHpODjqPm,2019-10-19 04:31:32+00:00,0,1,1,,,
1148,1185413019230035975,https://twitter.com/favorite_douga/status/1185413019230035975,favorite_douga,,今回はこの動画♪ 自己啓発セミナーと孫正義、ソフトバンク倒産。wework問題、引き寄せの法則の嘘。 29602 views &#160; 1997 likes &#160; 1 気に入ってくれたらリツィート！ http://movie.stone-well.net/2019/10/19/post-65384/ …,2019-10-19 04:31:02+00:00,0,0,0,,#160 #160,
1149,1185413003048411136,https://twitter.com/coffee_souzoku/status/1185413003048411136,coffee_souzoku,,動画でリフレッシュ！ 自己啓発セミナーと孫正義、ソフトバンク倒産。wework問題、引き寄せの法則の嘘。 29602 views &#160; 1997 likes &#160; 1 http://movie.stone-well.net/2019/10/19/post-65384/ …,2019-10-19 04:30:58+00:00,0,0,0,,#160 #160,
1150,1185412999151943681,https://twitter.com/KenkoGet/status/1185412999151943681,KenkoGet,,動画で心の健康を(^^) 自己啓発セミナーと孫正義、ソフトバンク倒産。wework問題、引き寄せの法則の嘘。 29602 views &#160; 1997 likes &#160; 1 http://movie.stone-well.net/2019/10/19/post-65384/ …,2019-10-19 04:30:57+00:00,0,0,0,,#160 #160,
1151,1185412998065573889,https://twitter.com/mr_lucky_cool/status/1185412998065573889,mr_lucky_cool,,『動画でひと休み』を更新しました。 自己啓発セミナーと孫正義、ソフトバンク倒産。wework問題、引き寄せの法則の嘘。 29602 views &#160; 1997 likes &#160; 1 http://movie.stone-well.net/2019/10/19/post-65384/ …,2019-10-19 04:30:57+00:00,0,0,0,,#160 #160,
1152,1185412883246649344,https://twitter.com/Techviralinfo/status/1185412883246649344,Techviralinfo,,Adam Neumann planned for his children and grandchildren to control WeWork https://techviral.info/adam-neumann-deliberate-for-his-kids-and-grandchildren-to-manage-wework/ …pic.twitter.com/6cfYoMTigj,2019-10-19 04:30:29+00:00,0,0,0,,,
1153,1185412097573904384,https://twitter.com/danwang0509/status/1185412097573904384,danwang0509,,先日のweworkでのクラスにはマトちゃんも参加してくれた。ステキな文章をありがとうー〜！！ 今日も皆さんに良い時間を提供できるように、頑張ります。 #repost @matoyu ・・・ yoga reunion… https://www.instagram.com/p/B3yU3wBhAHO/?igshid=hz3bxxm00gus …,2019-10-19 04:27:22+00:00,0,1,1,@matoyu,#repost,
1154,1185412076115652608,https://twitter.com/TIAscience/status/1185412076115652608,TIAscience,WeWork,When I need some positivity I watch this. I love you Anna!!,2019-10-19 04:27:17+00:00,0,1,1,,,
1155,1185411968754171904,https://twitter.com/Technologik4/status/1185411968754171904,Technologik4,,Adam Neumann a prévu que ses enfants et petits-enfants contrôlent WeWork – Un site d'actualité internationale https://technologik.fr/adam-neumann-a-prevu-que-ses-enfants-et-petits-enfants-controlent-wework-un-site-dactualite-internationale/?feed_id=30956&_unique_id=5daa908bb608d …,2019-10-19 04:26:51+00:00,0,0,0,,,
1156,1185410930412326917,https://twitter.com/techjunkiejh/status/1185410930412326917,techjunkiejh,,"#WeWork Proves There's No Such Thing As A 'Tech' Company. You Build Software, Or You Don't. — Forbes https://buff.ly/31ztYik #TechJunkieNewspic.twitter.com/ojIBr3isrD",2019-10-19 04:22:44+00:00,1,0,0,,#WeWork #TechJunkieNewspic,
1157,1185410204571230209,https://twitter.com/Sortiwa/status/1185410204571230209,Sortiwa,,"Barry Sternlicht on WeWork: Despite its failures, it's still a 'real company' https://is.gd/Rh9CxI",2019-10-19 04:19:51+00:00,0,0,0,,,
1158,1185409710171639808,https://twitter.com/tabbata/status/1185409710171639808,tabbata,BOHE_BABE,あ、weworkの救済資金は、SVFでなくSB本体から入れるんだ。。。 なんでも有りっすなあ。。。SVFの次のファンドレイズ諦めたのかな https://twitter.com/BOHE_BABE/status/1185367906579709953 …,2019-10-19 04:17:53+00:00,2,10,10,,,
1159,1185409056825118720,https://twitter.com/jorisbeerda1/status/1185409056825118720,jorisbeerda1,,Top WeWork buildings pay no UK tax despite profits of £10m #Digital #openbanking #banking via http://twinybots.ch https://www.yahoo.com/lifestyle/wework-uk-tax-profits-revenue-ipo-funding-120711276.html …,2019-10-19 04:15:17+00:00,0,0,0,,#Digital #openbanking #banking,
1160,1185408720211234816,https://twitter.com/mysohotimes/status/1185408720211234816,mysohotimes,,"We're officially out of the closet! Special thanks to wework Soho for being the host venue of our first public appearance last week! Head over to the blog for more from our popup at WeWork Great Chapel St,… https://www.instagram.com/p/B3yTVJnnvtS/?igshid=1rep97bmghtjs …",2019-10-19 04:13:57+00:00,0,2,2,,,
1161,1185408451578601472,https://twitter.com/BkPublicist/status/1185408451578601472,BkPublicist,,@WeWork hi. Your 175 Varixcj office door isn’t working and i need to get my laptop. Please let me know how i can do so asap. Thank you.,2019-10-19 04:12:53+00:00,1,0,0,@WeWork,,
1162,1185408239204089856,https://twitter.com/YSDStore/status/1185408239204089856,YSDStore,,"David X Prutting/Patrick McMullan via Getty Images; WeWork Summit 2015/WeWork/Vimeo; Samantha Lee/Business Insider As Adam and Rebekah Neumann built WeWork into a $47 billion coworking giant, the couple relied on the teachings of the Kabbalah http://rspec.io/r/1227fkuG974953 …",2019-10-19 04:12:02+00:00,0,0,0,,,
1163,1185407981715890176,https://twitter.com/Kchhapra/status/1185407981715890176,Kchhapra,,"If you wake up on a Casper mattress, work out with a Peloton before breakfast, Uber to your desk at a WeWork, order DoorDash for lunch, take a Lyft home, you’ve interacted with companies that will collectively lose nearly $14billion. Atlantic #notcombubble",2019-10-19 04:11:01+00:00,0,1,1,,#notcombubble,
1164,1185407790761893889,https://twitter.com/Lenewstrotteur/status/1185407790761893889,Lenewstrotteur,,Adam Neumann a prévu que ses enfants et petits-enfants contrôlent WeWork https://newstrotteur.fr/2019/10/19/adam-neumann-a-prevu-que-ses-enfants-et-petits-enfants-controlent-wework/?feed_id=40522&_unique_id=5daa8ca791966 …,2019-10-19 04:10:15+00:00,0,0,0,,,
