,id,permalink,username,to,text,date,retweets,favorites,replies,mentions,hashtags,geo
1587,1185091784386347008,https://twitter.com/ktckm4649/status/1185091784386347008,ktckm4649,,ソフトバンクＧ、さらにＣＤＳ上昇－WeWorkで悪材料続く https://www.bloomberg.co.jp/news/articles/2019-10-18/PZJQNQDWX2PV01 … @businessさんから,2019-10-18 07:14:33+00:00,0,2,2,@businessさんから,,
1588,1185091449924259840,https://twitter.com/BlendenBlick/status/1185091449924259840,BlendenBlick,,WeWork founder used contacts at Kabbalah Centre to fund firm https://www.haaretz.com/us-news/wework-founder-used-contacts-at-kabbalah-centre-to-fund-firm-1.8005585 …,2019-10-18 07:13:14+00:00,0,0,0,,,
1589,1185091351093760000,https://twitter.com/nakama_desu/status/1185091351093760000,nakama_desu,,NewsPicksの人の本、コワーキングで読んだけど、結構ページ割いてWeWorkのビジネスモデル褒めてるけど今のハシゴの外し具合ウケる。,2019-10-18 07:12:50+00:00,0,0,0,,,
1590,1185090502309400576,https://twitter.com/CorpGovUK/status/1185090502309400576,CorpGovUK,,RT @ToGovern: The WeWork Circus And REIT Stocks - Forbes http://bit.ly/2P373JD #CorpGov via @ToGovern,2019-10-18 07:09:28+00:00,1,0,0,@ToGovern @ToGovern,#CorpGov,
1591,1185090192039993346,https://twitter.com/purelyfast/status/1185090192039993346,purelyfast,,Airbnb’s WeWork problem https://ift.tt/35G1erg,2019-10-18 07:08:14+00:00,0,0,0,,,
1592,1185090183131205632,https://twitter.com/urbantoronto/status/1185090183131205632,urbantoronto,,"Google snubs struggling WeWork, signs Toronto lease with co-working rival IWG - The Japan Times: https://ift.tt/2MMYWxU",2019-10-18 07:08:12+00:00,0,0,0,,,
1593,1185089897146830849,https://twitter.com/BloombergJapan/status/1185089897146830849,BloombergJapan,,利率15％のWeWork債、勇敢な投資家のキャリア脅かすほど危険か https://bloom.bg/2J1cWDj pic.twitter.com/N2aZp6V0wv,2019-10-18 07:07:04+00:00,5,11,11,,,
1594,1185089662802649088,https://twitter.com/w8qb8nz2/status/1185089662802649088,w8qb8nz2,,#news #ニュース ソフトバンクＧ、さらにＣＤＳ上昇－WeWorkで悪材料続く – ブルームバーグ https://ift.tt/32rdHgu,2019-10-18 07:06:08+00:00,0,0,0,,#news #ニュース,
1595,1185089654204194816,https://twitter.com/L_Spencer/status/1185089654204194816,L_Spencer,,Sex drugs and (failed) IPO: WeWork mania has been good for business publishers http://dlvr.it/RGRXLg pic.twitter.com/S0Ya0Db4hb,2019-10-18 07:06:06+00:00,0,0,0,,,
1596,1185089493596102657,https://twitter.com/reviews_blogger/status/1185089493596102657,reviews_blogger,,WeWork could run out of cash by mid-November — here's what would happen next A year ago WeWork boasted about being the largest private office tenant in Manhattan. That could make a potential bankruptcy particularly ugly. https://ift.tt/33FRVFX http://bitly.com/2sjBBbW,2019-10-18 07:05:27+00:00,0,0,0,,,
1597,1185089481340309504,https://twitter.com/reviews_blogger/status/1185089481340309504,reviews_blogger,,"SoftBank is in talks with JP Morgan on WeWork bailout as cash expected to dry up by mid-November A little over two weeks after withdrawing its IPO filing, WeWork is in need of cash. SoftBank and J.P. Morgan Chase are trying to pull something together. https://ift.tt/31insvZ bi…",2019-10-18 07:05:24+00:00,0,0,0,,,
1598,1185089479872266240,https://twitter.com/reviews_blogger/status/1185089479872266240,reviews_blogger,,Layoffs expected at WeWork in coming weeks CNBC's Deirdre Bosa gives new details on reports saying that WeWork could see layoffs in the coming weeks following its botched IPO. https://ift.tt/33uA0lm http://bitly.com/2sjBBbW,2019-10-18 07:05:24+00:00,0,0,0,,,
1599,1185089386267865088,https://twitter.com/prettysuzuki/status/1185089386267865088,prettysuzuki,,ソフトバンクＧ、さらにＣＤＳ上昇－WeWorkで悪材料続く。(メ｀ロ´)o,2019-10-18 07:05:02+00:00,0,0,0,,,
1600,1185089278608584705,https://twitter.com/jbkavungal/status/1185089278608584705,jbkavungal,,Airbnb’s WeWork problem https://tcrn.ch/32sodE3,2019-10-18 07:04:36+00:00,0,0,0,,,
1601,1185089227744272384,https://twitter.com/MKhumanthem/status/1185089227744272384,MKhumanthem,,Airbnb’s WeWork problem https://ift.tt/35G1erg,2019-10-18 07:04:24+00:00,0,0,0,,,
1602,1185089182047313920,https://twitter.com/itandfeel/status/1185089182047313920,itandfeel,,Airbnb’s WeWork problem https://tcrn.ch/2N3GZvl,2019-10-18 07:04:13+00:00,0,0,0,,,
1603,1185088959073914880,https://twitter.com/puledo/status/1185088959073914880,puledo,,Airbnb’s WeWork problem https://ift.tt/35G1erg #Technology #technews #puledo_tech_update,2019-10-18 07:03:20+00:00,0,0,0,,#Technology #technews #puledo_tech_update,
1604,1185088903377752065,https://twitter.com/Angloha_/status/1185088903377752065,Angloha_,,"""WeWork avait-il conscience de la présence de ce gaz cancérigène dans ses locaux ?"" https://ift.tt/2MRWTbJ #Anglohasys",2019-10-18 07:03:07+00:00,0,0,0,,#Anglohasys,
1605,1185088558278828033,https://twitter.com/ToGovern/status/1185088558278828033,ToGovern,,The WeWork Circus And REIT Stocks - Forbes http://bit.ly/2P373JD #CorpGov via @ToGovern,2019-10-18 07:01:44+00:00,1,0,0,@ToGovern,#CorpGov,
1606,1185088466792714240,https://twitter.com/rachit24x7/status/1185088466792714240,rachit24x7,,Airbnb’s WeWork problem https://tcrn.ch/2BrjpTv by kateclarktweets pic.twitter.com/wSJRtEW6Zt,2019-10-18 07:01:23+00:00,0,0,0,,,
1607,1185088385183993856,https://twitter.com/ZARASOKU/status/1185088385183993856,ZARASOKU,,WeWork社内の士気低下、マーケティングのトップも退任 https://www.bloomberg.co.jp/news/articles/2019-10-17/PZJJMQ6JIJUR01?srnd=cojp-v2 …,2019-10-18 07:01:03+00:00,1,2,2,,,
1608,1185088293316321280,https://twitter.com/SQ1Resources/status/1185088293316321280,SQ1Resources,,Will there even be office spaces 10 years from now? With #cloud #technology more and more jobs are being done #remotely. What do you think? #tech #it #news #business #wework #jobs #recruitment #London #remoteworkhttps://www.techradar.com/uk/news/how-technology-is-impacting-workspaces …,2019-10-18 07:00:41+00:00,0,0,0,,#cloud #technology #remotely #tech #it #news #business #wework #jobs #recruitment #London #remoteworkhttps,
1609,1185088279743471616,https://twitter.com/StartupAround/status/1185088279743471616,StartupAround,,[New Story] Airbnb’s WeWork problem – TechCrunch #startuparound #startup #StartupGrind #startupweekend #entrepreneurshiplife #Airbnb #’ #WeWork https://ift.tt/2pvsk3I pic.twitter.com/UFhTRzDZZO,2019-10-18 07:00:38+00:00,0,0,0,,#startuparound #startup #StartupGrind #startupweekend #entrepreneurshiplife #Airbnb # #WeWork,
1610,1185087877509722119,https://twitter.com/jesusmargon/status/1185087877509722119,jesusmargon,,"¿Las cifras de WeWork en ESP? - Cientos de millones de euros en alquileres comprometidos con Colonial, GMP… - Contratos a 10-15 años - 8 edificios abiertos y otros 4 en proceso de apertura ¿Qué pasará tras el rescate? [En @la_informacion] http://bit.ly/2OXNTor pic.twitter.com/9PwtGbdGpv",2019-10-18 06:59:02+00:00,7,6,6,@la_informacion,,
1611,1185087674371100673,https://twitter.com/charles267/status/1185087674371100673,charles267,,@business We need more WeWork stories! Can’t get enough!,2019-10-18 06:58:14+00:00,0,0,0,@business,,
1612,1185087569278537729,https://twitter.com/ZARASOKU/status/1185087569278537729,ZARASOKU,,ソフトバンクＧ、さらにＣＤＳ上昇－WeWorkで悪材料続く https://www.bloomberg.co.jp/news/articles/2019-10-18/PZJQNQDWX2PV01 …,2019-10-18 06:57:49+00:00,6,15,15,,,
1613,1185086920344440833,https://twitter.com/manelvalcarce/status/1185086920344440833,manelvalcarce,,"TECNOLOGÍA Y EMPRESA: WeWork y el inicio de la 'desuberización': la economía colaborativa se hace adulta, vía El Mundo https://buff.ly/32dpe2W #tecnologia #startups #empresa #economiacolaborativahttps://buff.ly/32dpe2W",2019-10-18 06:55:14+00:00,0,2,2,,#tecnologia #startups #empresa #economiacolaborativahttps,
1614,1185086054736359424,https://twitter.com/tiartrop/status/1185086054736359424,tiartrop,KAZUHIK86279757,WeWorkはソフトバンク本体で引き受けてうちが始末しますから…ってことですかね ソフトバンクが転けたら大変なことになりますよね、ほんとに,2019-10-18 06:51:47+00:00,0,1,1,,,
1615,1185086007995035649,https://twitter.com/GourArbind/status/1185086007995035649,GourArbind,,"WeWork Selling Conductor SEO Company https://www.searchenginejournal.com/wework-conductor/328173/?utm_source=twitter.com&utm_medium=social&utm_campaign=share-back-traffic … via @martinibuster, @sejournal",2019-10-18 06:51:36+00:00,0,0,0,@martinibuster @sejournal,,
1616,1185085511217635333,https://twitter.com/Elexonic/status/1185085511217635333,Elexonic,,Airbnb’s WeWork problem https://ift.tt/35G1erg,2019-10-18 06:49:38+00:00,0,0,0,,,
1617,1185085496545775616,https://twitter.com/KAZUHIK86279757/status/1185085496545775616,KAZUHIK86279757,tiartrop,WeWorkの株をグループ内でグルグルさして、決算書も怪しい SVFにはMIZUHOや三井住友銀行も出資？っぽいから、引くに引けないのかな 日経225の10%以上、ソフトバンク牽引してるから、転けたら雪崩れになりそう,2019-10-18 06:49:34+00:00,0,1,1,,,
1618,1185085462702108672,https://twitter.com/arduinobeltrame/status/1185085462702108672,arduinobeltrame,,La 'vendetta globale della liquidità' ha messo in ginocchio WeWork e scatenato un'epidemia di insolvenze tra gli hedge fund https://it.businessinsider.com/la-vendetta-globale-della-liquidita-ha-messo-in-ginocchio-wework-e-scatenato-unepidemia-di-insolvenze-tra-gli-hedge-fund/ … di @bi_italia,2019-10-18 06:49:26+00:00,0,0,0,@bi_italia,,
1619,1185084540794089473,https://twitter.com/HindsCC_FB/status/1185084540794089473,HindsCC_FB,,"Down, but never out. #EFT #WeWork pic.twitter.com/SS3xljzggL",2019-10-18 06:45:46+00:00,48,127,127,,#EFT #WeWork,
1620,1185084424372805636,https://twitter.com/15MinuteNewsBus/status/1185084424372805636,15MinuteNewsBus,,WeWork could run out of cash by mid-November -- here's what would happen next https://www.15minutenews.com/article/172641388/wework-could-run-out-of-cash-by-mid-november-heres-what-would-happen-next/ … #RealEstate,2019-10-18 06:45:19+00:00,0,0,0,,#RealEstate,
1621,1185084421076062208,https://twitter.com/15MinuteNewsBus/status/1185084421076062208,15MinuteNewsBus,,Airbnb's cash numbers could show that it's not another WeWork in the making https://www.15minutenews.com/article/172646703/airbnbs-cash-numbers-could-show-that-its-not-another-wework-in-the-making/ … #RealEstate,2019-10-18 06:45:18+00:00,0,0,0,,#RealEstate,
1622,1185084351882465282,https://twitter.com/yaruzou3/status/1185084351882465282,yaruzou3,,ソフトバンクＧ、さらにＣＤＳ上昇－WeWorkで悪材料続く。(メ｀ロ´)o,2019-10-18 06:45:01+00:00,0,0,0,,,
1623,1185084326016192512,https://twitter.com/att_u___/status/1185084326016192512,att_u___,,フリーランス仲間のみんなー 良くも悪くも最近話題のweworkが梅田にもできるってよー https://www.google.co.jp/amp/s/www.ryutsuu.biz/store/l100212.html/amp …,2019-10-18 06:44:55+00:00,0,0,0,,,
1624,1185084299818786817,https://twitter.com/moringaschool/status/1185084299818786817,moringaschool,,"In @Forbes article, @audreypcheng our founder highlights what emerging market investors & entrepreneurs could learn from @WeWork's news. She says, ""Rather than the growth-at-all-cost story, we should pursue a grow-for-your-stakeholders story."" Read more https://bit.ly/2J1GhgS pic.twitter.com/eIhbw4EKrB",2019-10-18 06:44:49+00:00,6,22,22,@Forbes @audreypcheng @WeWork,,
1625,1185084276909494272,https://twitter.com/15MinuteNewsBus/status/1185084276909494272,15MinuteNewsBus,,The WeWork Circus And REIT Stocks https://www.15minutenews.com/article/172643208/the-wework-circus-and-reit-stocks/ … #StockMarkets,2019-10-18 06:44:44+00:00,0,0,0,,#StockMarkets,
1626,1185084170982305792,https://twitter.com/cleebration/status/1185084170982305792,cleebration,,RT @42angelitos: SoftBank Plans $5 Billion Rescue Financing for WeWork - Bloomberg https://bloom.bg/2Mop4jy,2019-10-18 06:44:18+00:00,0,0,0,@42angelitos,,
1627,1185084072550379520,https://twitter.com/aditihires/status/1185084072550379520,aditihires,,"Are you passionate about making talent acquisition cognitive? Does getting people jobs excites you? If yes, meet us tom., 19th October, from 10:00 am to 1:00 pm at WeWork Futura, 1st Floor, Next to Seasons Mall, Magarpatta, Pune Contact: 8149670610 #immediatejoiner #itrecruiter",2019-10-18 06:43:55+00:00,0,1,1,,#immediatejoiner #itrecruiter,
1628,1185084030926151680,https://twitter.com/initechsoft/status/1185084030926151680,initechsoft,,"Airbnb’s WeWork problem http://zpr.io/tfmzi Exit,Fundings & Exits,Startups,TC,Airbnb,artificial intelligence,brian chesky,business,citigroup,economy,entrepreneurship,Fred Wilson,jpmorgan,Lyft,machine learning,morgan stanley,neologisms,Private Equity,real estate,sharin",2019-10-18 06:43:45+00:00,0,0,0,,,
1629,1185083987670093825,https://twitter.com/RealtyNXT/status/1185083987670093825,RealtyNXT,,"#NewsUpdate | The fund will come directly from @SoftBank. Masayoshi Son was instrumental in ousting @WeWork’s controversial co-founder Adam Neumann, but is convinced the once high-flying startup can be turned around. #RealtyNXT https://realtynxt.com/2019/10/18/softbank-plans-5-billion-rescue-financing-for-wework/ …",2019-10-18 06:43:35+00:00,0,0,0,@SoftBank @WeWork,#NewsUpdate #RealtyNXT,
1630,1185083847987335168,https://twitter.com/res902/status/1185083847987335168,res902,,WeWork afronta su rescate con cientos de millones comprometidos en alquileres https://www.lainformacion.com/empresas/wework-rescate-millones-alquileres-colonial-gmp-fondos/6515537/?utm_source=twitter.com&utm_medium=socialshare&utm_campaign=desktop … vía @la_informacion,2019-10-18 06:43:01+00:00,0,1,1,@la_informacion,,
1631,1185083592952733696,https://twitter.com/42angelitos/status/1185083592952733696,42angelitos,,SoftBank Plans $5 Billion Rescue Financing for WeWork - Bloomberg https://bloom.bg/2Mop4jy,2019-10-18 06:42:01+00:00,0,0,0,,,
1632,1185083258939174912,https://twitter.com/kawauchi_co/status/1185083258939174912,kawauchi_co,,>RT まさにWeWork…(´･_･`),2019-10-18 06:40:41+00:00,0,0,0,,,
1633,1185083126990528512,https://twitter.com/IchaVarma/status/1185083126990528512,IchaVarma,,"*Twitter do everything you can do dong* Rekomendasikan co-working space untuk profesional company yg MRT-able Buat temen aku yg perusahaannya jepang bgt biar bisa maksi di blok m. Sebelumnya, di wework astra, dpt kubik sendiri Makasih",2019-10-18 06:40:09+00:00,1,0,0,,,
1634,1185082962003582976,https://twitter.com/mcezeh1/status/1185082962003582976,mcezeh1,,Airbnb's WeWork problem https://tcrn.ch/2BrjpTv via @techcrunch,2019-10-18 06:39:30+00:00,0,0,0,@techcrunch,,
1635,1185082538743648257,https://twitter.com/kaoruww/status/1185082538743648257,kaoruww,,WeWorkが絶賛ゴタゴタ中にシェアオフィスを取り上げてしまうドキュメント72時間。今からタピオカ屋定点観測をやりかねない。,2019-10-18 06:37:49+00:00,0,0,0,,,
1636,1185082506720079873,https://twitter.com/cosmicjester/status/1185082506720079873,cosmicjester,,I’ve somehow avoided finding out what WeWork is. Sounds boring but. It would blow my mind if it’s actually something unexpected like a polyamory dating app or a new type of e-cigarette,2019-10-18 06:37:42+00:00,0,2,2,,,
1637,1185082302713487360,https://twitter.com/o_eh/status/1185082302713487360,o_eh,,ソフトバンクＧ、さらにＣＤＳ上昇 WeWorkで悪材料続く https://www.bloomberg.co.jp/news/articles/2019-10-18/PZJQNQDWX2PV01 …,2019-10-18 06:36:53+00:00,0,0,0,,,
1638,1185082051365609473,https://twitter.com/NYMag/status/1185082051365609473,NYMag,,"WeWork is about to run out of cash, which has the company’s new leadership choosing between two unappealing options https://nym.ag/2N2CrW3",2019-10-18 06:35:53+00:00,3,8,8,,,
1639,1185081911766482944,https://twitter.com/tushjain15/status/1185081911766482944,tushjain15,,WeWork could be the venture capital boom’s ‘burning bed’ moment https://www.ft.com/content/7e3f9a7c-ee6f-11e9-bfa4-b25f11f42901 … via @financialtimes,2019-10-18 06:35:20+00:00,0,0,0,@financialtimes,,
1640,1185081871199358978,https://twitter.com/harropj/status/1185081871199358978,harropj,,"Hey look, it's me! Being #remote has its challenges, but it's been amazing for my productivity. Different from #workfromhome though! I'd go insane without my WeWork space. https://lnkd.in/eEMm3Bp",2019-10-18 06:35:10+00:00,0,0,0,,#remote #workfromhome,
1641,1185081586020163585,https://twitter.com/BobbyWarrenWMG/status/1185081586020163585,BobbyWarrenWMG,,Airbnb’s WeWork problem https://techcrunch.com/2019/10/17/airbnbs-wework-problem/?id=rPxNky7Tf1 …,2019-10-18 06:34:02+00:00,0,0,0,,,
1642,1185081421439758336,https://twitter.com/tushjain15/status/1185081421439758336,tushjain15,,WeWork’s woes threaten Hong Kong’s teetering office market https://www.ft.com/content/acf0c4b4-f14d-11e9-ad1e-4367d8281195 … via @financialtimes,2019-10-18 06:33:23+00:00,0,0,0,@financialtimes,,
1643,1185080458595438592,https://twitter.com/kid_brut/status/1185080458595438592,kid_brut,,"Business troubles aside, WeWork phone booths found to give customers formaldehyde poisoning. Yikes. ""A WeWork member told staff about a smell in the booths and eye irritation, which prompted the company to hire an outside consultant and test a sampling… https://ift.tt/2VQhhOI pic.twitter.com/iDvkKPoTmC",2019-10-18 06:29:33+00:00,0,0,0,,,
1644,1185080356548022273,https://twitter.com/rajeeve_raja/status/1185080356548022273,rajeeve_raja,,"If Wework could run out of cash, does that mean that co-working isn't a sustainable venture?",2019-10-18 06:29:09+00:00,0,0,0,,,
1645,1185080067677921280,https://twitter.com/JVRufinoINQ/status/1185080067677921280,JVRufinoINQ,,WeWork’s woes threaten Hong Kong’s teetering office market https://on.ft.com/2J16sEm via @financialtimes #coworking,2019-10-18 06:28:00+00:00,0,0,0,@financialtimes,#coworking,
1646,1185079997427523584,https://twitter.com/Louiseaileen70/status/1185079997427523584,Louiseaileen70,,WeWork could run out of cash by mid-November — here's what would happen next Speed of this downfall startling. mid Sept IPO filed at valuation of $45bn Mid Nov bankrupt? https://cnb.cx/32pCG3M,2019-10-18 06:27:43+00:00,1,8,8,,,
1647,1185079461764460545,https://twitter.com/michaelbrodsky1/status/1185079461764460545,michaelbrodsky1,,"As WeWork crashes and Uber bleeds cash, the consumer-tech gold rush may be coming to an end. https://www.theatlantic.com/ideas/archive/2019/10/say-goodbye-millennial-urban-lifestyle/599839/?utm_source=pocket&utm_medium=email&utm_campaign=pockethits …",2019-10-18 06:25:36+00:00,0,0,0,,,
1648,1185079100358250496,https://twitter.com/w8qb8nz2/status/1185079100358250496,w8qb8nz2,,ソフトバンクＧ、さらにＣＤＳ上昇－WeWorkで悪材料続く – ブルームバーグ https://www.recentnewsofjapan.com/business/2019/10/18/%e3%82%bd%e3%83%95%e3%83%88%e3%83%90%e3%83%b3%e3%82%af%ef%bd%87%e3%80%81%e3%81%95%e3%82%89%e3%81%ab%ef%bd%83%ef%bd%84%ef%bd%93%e4%b8%8a%e6%98%87%ef%bc%8dwework%e3%81%a7%e6%82%aa%e6%9d%90%e6%96%99/ …,2019-10-18 06:24:09+00:00,0,0,0,,,
1649,1185078904698101760,https://twitter.com/MY21_Oracle/status/1185078904698101760,MY21_Oracle,,WeWork’s woes threaten Hong Kong’s teetering office market https://www.ft.com/content/acf0c4b4-f14d-11e9-ad1e-4367d8281195?segmentId=080b04f5-af92-ae6f-0513-095d44fb3577 … via @financialtimes,2019-10-18 06:23:23+00:00,0,0,0,@financialtimes,,
1650,1185078584819384322,https://twitter.com/alanjcostello/status/1185078584819384322,alanjcostello,,"WeWork - each SPV biz model still works. The confidence and false valuation has been sucked out by corporate messing. Long terms risks are balanced. Good operational business, but demonstrates the confidence in a business that is tied to Leader and Strategic Comms #OLAD19",2019-10-18 06:22:06+00:00,0,0,0,,#OLAD19,
1651,1185078217847136256,https://twitter.com/DAllenda_1/status/1185078217847136256,DAllenda_1,petrovic_george,True but plenty do that on the long side too. I am still trying to get hold of the #WeWork IPO slide deck from JPM and Goldman's..,2019-10-18 06:20:39+00:00,0,1,1,,#WeWork,
1652,1185078081352065024,https://twitter.com/MY21_Oracle/status/1185078081352065024,MY21_Oracle,,WeWork Founder Mixed Spiritual Group With Business - WSJ https://www.wsj.com/articles/wework-founder-mixed-spiritual-group-with-business-11571232391 …,2019-10-18 06:20:06+00:00,0,0,0,,,
1653,1185078045960335360,https://twitter.com/BeepnowS/status/1185078045960335360,BeepnowS,,HPに昨日参加した名古屋weworkの様子をアップしました！ https://beepnowsys.com/news/2019/10/18/weworknagoya20191017/ …,2019-10-18 06:19:58+00:00,0,0,0,,,
1654,1185077380555202561,https://twitter.com/papakipos/status/1185077380555202561,papakipos,,"Wow, WeWork may well be in bankruptcy by Thanksgiving. https://www.cnbc.com/2019/10/17/what-happens-if-wework-runs-out-of-cash.html?__source=sharebar%7Cfacebook&par=sharebar …",2019-10-18 06:17:19+00:00,0,0,0,,,
1655,1185076798746443776,https://twitter.com/pierotaglia/status/1185076798746443776,pierotaglia,,"WeWork to lay off 2,000, Deloitte marketing report reveals ‘experience debt,’ and LinkedIn debuts employee engagement features - https://buff.ly/2MPhZHI",2019-10-18 06:15:01+00:00,0,1,1,,,
1656,1185076514741800960,https://twitter.com/startdoms/status/1185076514741800960,startdoms,,Airbnb’s WeWork problem http://ow.ly/jWkm101X2V0 pic.twitter.com/pBGYXZuqbn,2019-10-18 06:13:53+00:00,0,0,0,,,
1657,1185076399935115264,https://twitter.com/incorta/status/1185076399935115264,incorta,EyadHAbed,You can join us for lunch on Fridays and offset the cost of housing here! Every little bit help!,2019-10-18 06:13:26+00:00,0,1,1,,,
1658,1185076012587147264,https://twitter.com/Automobilnews1/status/1185076012587147264,Automobilnews1,,"Airbnb, with $3 billion on balance sheet, trying to avoid WeWork – EAST AUTO NEWS https://eastautonews.com/airbnb-with-3-billion-on-balance-sheet-trying-to-avoid-wework-east-auto-news/ …pic.twitter.com/k3qOMPkWRc",2019-10-18 06:11:53+00:00,0,0,0,,,
1659,1185075893393182720,https://twitter.com/black_pikahiro/status/1185075893393182720,black_pikahiro,,ソフトバンクＧ、さらにＣＤＳ上昇－WeWorkで悪材料続く https://www.bloomberg.co.jp/news/articles/2019-10-18/PZJQNQDWX2PV01 … @businessさんから 100億ドル（約１兆1000億円）以上を投資するウィーワークのＩＰＯに暗雲が立ち込めた９月中旬あたりからＣＤＳの上昇は加速,2019-10-18 06:11:25+00:00,0,0,0,@businessさんから,,
1660,1185075208585203715,https://twitter.com/Mantu_Group/status/1185075208585203715,Mantu_Group,,"Mantu's CDO @SeverinNaudet believes #WeWork had a huge impact on the organization of work, but its private investment funding culture could be behind its current troubles. #technews #futureofworkhttps://www.youtube.com/watch?v=YAfYHUbZ_dU …",2019-10-18 06:08:42+00:00,1,7,7,@SeverinNaudet,#WeWork #technews #futureofworkhttps,
1661,1185074014638624768,https://twitter.com/smartcreation00/status/1185074014638624768,smartcreation00,,442 名無しさん sage ▼ New! 2019/10/18(金) 15:00:54.82 ID:EyZwDZewF [2回目] ソフトバンクＧ、さらにＣＤＳ上昇－WeWorkで悪材料続く https://bloom.bg/2BiPwF0 pic.twitter.com/qy3qqvoKSc,2019-10-18 06:03:57+00:00,0,0,0,,,
1662,1185073518741839872,https://twitter.com/charliednewell/status/1185073518741839872,charliednewell,,Maybe they should change the name to WeBroke! https://www.google.com/amp/s/www.cnbc.com/amp/2019/10/17/what-happens-if-wework-runs-out-of-cash.html … #wework #nomoney,2019-10-18 06:01:59+00:00,0,3,3,,#wework #nomoney,
1663,1185073444565606401,https://twitter.com/yontengoP/status/1185073444565606401,yontengoP,,Youtubeが唐突に weworkの宣伝をぶっこんでくるようになったのだが 特に検索もしてないしリスティング広告でもリタゲでもなさそうなんだけども何事だろうか,2019-10-18 06:01:41+00:00,2,6,6,,,
1664,1185072937407152130,https://twitter.com/tiartrop/status/1185072937407152130,tiartrop,KAZUHIK86279757,解散ですか！笑 ソフトバンクグループはSVFがWeWork抱え込んで大変そうですね…,2019-10-18 05:59:40+00:00,0,1,1,,,
1665,1185072788173836294,https://twitter.com/GeorgeMentz/status/1185072788173836294,GeorgeMentz,,The WeWork Circus And REIT Stocks http://dlvr.it/RGRMtr pic.twitter.com/d9gGvImQW5,2019-10-18 05:59:04+00:00,0,0,0,,,
1666,1185072530601762816,https://twitter.com/BloombergJapan/status/1185072530601762816,BloombergJapan,,ソフトバンクＧ、さらにＣＤＳ上昇－WeWorkで悪材料続く https://bloom.bg/2BiPwF0 pic.twitter.com/AXeMNmY7Sm,2019-10-18 05:58:03+00:00,37,47,47,,,
1667,1185071490485477376,https://twitter.com/tatsu_i/status/1185071490485477376,tatsu_i,,ソフトバンクＧ、さらにＣＤＳ上昇－WeWorkで悪材料続く https://www.bloomberg.co.jp/news/articles/2019-10-18/PZJQNQDWX2PV01 … @business,2019-10-18 05:53:55+00:00,0,0,0,@business,,
1668,1185071398328209408,https://twitter.com/yukiosak1/status/1185071398328209408,yukiosak1,,ビジョンファンドのポートフォリオがみなWeWork的であれば、ソフトバンクは既にもう終わった企業と言うことになる。なので今でもCDSは安すぎるくらいだ。 ソフトバンクＧ、さらにＣＤＳ上昇－WeWorkで悪材料続く https://www.bloomberg.co.jp/news/articles/2019-10-18/PZJQNQDWX2PV01?srnd=cojp-v2 …,2019-10-18 05:53:33+00:00,0,1,1,,,
