,id,permalink,username,author_id,text,date,formatted_date,to,retweets,favorites,replies,mentions,hashtags,urls,geo
381,1189248227175993344,https://twitter.com/clowerycontent/status/1189248227175993344,clowerycontent,67988298,Welcome!!!,2019-10-29 18:30:47+00:00,Tue Oct 29 18:30:47 +0000 2019,alexjmedick,0,1,1,,,,
382,1189247747418968065,https://twitter.com/sh108th/status/1189247747418968065,sh108th,904447240214900736,What's really funny is that GrubHub is the only one that's profitable. I think WeWork has shown that VC evaluations are a scam to trick IPO investors into losing money.,2019-10-29 18:28:52+00:00,Tue Oct 29 18:28:52 +0000 2019,conorsen,0,0,0,,,,
383,1189247604133117955,https://twitter.com/mancavebits/status/1189247604133117955,mancavebits,54362006,"WeWork says SoftBank will provide $5B in new financing and buy up to $3B in shares from existing shareholders, which http://rviv.ly/CdRWnq",2019-10-29 18:28:18+00:00,Tue Oct 29 18:28:18 +0000 2019,,0,0,0,,,http://rviv.ly/CdRWnq,
384,1189247332417724416,https://twitter.com/freebiesketch/status/1189247332417724416,freebiesketch,1109479640324890624,WeWork homepage https://ift.tt/2Nla2us | #SketchApp #Freebies #UI #UX #design,2019-10-29 18:27:13+00:00,Tue Oct 29 18:27:13 +0000 2019,,0,0,0,,#SketchApp #Freebies #UI #UX #design,https://ift.tt/2Nla2us,
385,1189246628340912128,https://twitter.com/KhlidAlhamdan/status/1189246628340912128,KhlidAlhamdan,705512970,جنب المكتب حقنا #WeWork pic.twitter.com/ydQUEvhKVV,2019-10-29 18:24:25+00:00,Tue Oct 29 18:24:25 +0000 2019,,0,1,1,,#WeWork,,
386,1189246545767649281,https://twitter.com/ericaephillips/status/1189246545767649281,ericaephillips,635916478,Someone should start a daily newsletter *just for WeWork news.,2019-10-29 18:24:06+00:00,Tue Oct 29 18:24:06 +0000 2019,mollywood,0,0,0,,,,
387,1189246193102213133,https://twitter.com/jamesrobinson50/status/1189246193102213133,jamesrobinson50,39139406,"My friend says she loves Cafe Matraz to work at, also ""hospicio, werkshop, ios offices, mutuo, wework""",2019-10-29 18:22:42+00:00,Tue Oct 29 18:22:42 +0000 2019,alexmuench,0,2,2,,,,
388,1189245825026789376,https://twitter.com/NickPotts_SD/status/1189245825026789376,NickPotts_SD,1043548475349245954,"thread/ We'll see if this ages well... In 4-6 years, we look back at the @wework deal and think that @SoftBank didn't end up TOO bad. Need to: -Change culture from #startup to #business -Create better fiscal practices -Monetize #data/ #network sooner",2019-10-29 18:21:14+00:00,Tue Oct 29 18:21:14 +0000 2019,,1,3,3,@wework @SoftBank,#startup #business #data #network,,
389,1189245151107014657,https://twitter.com/SaltzmanJason/status/1189245151107014657,SaltzmanJason,330101332,"Good work, done well, for the right reasons. It is the backbone of all of our initiatives. I have a post coming on my feelings on the whole WeWork situation. It’s a reflection of the company we have been building for almost 10 years. I cannot wait to post! Stay tuned. pic.twitter.com/RJfipPUZBG",2019-10-29 18:18:33+00:00,Tue Oct 29 18:18:33 +0000 2019,,73,194,194,,,,
390,1189244544996532224,https://twitter.com/JKlymochko/status/1189244544996532224,JKlymochko,1640715014,2/ In this #podcast we discuss: - Softbank Bails Out Near-Bankrupt #WeWork as its Valuation Tumbles from $47 Billion to $8 Billion. Did Softbank Commit the Sunk Cost Fallacy with $WE?pic.twitter.com/aWocRGEkjB,2019-10-29 18:16:09+00:00,Tue Oct 29 18:16:09 +0000 2019,,0,0,0,,#podcast #WeWork,,
391,1189244480290996227,https://twitter.com/alex/status/1189244480290996227,alex,7380362,"well, @SophiaKunthara and I are writing about the worst IPO filing we’ve ever seen and it’s not about wework!",2019-10-29 18:15:53+00:00,Tue Oct 29 18:15:53 +0000 2019,,1,3,3,@SophiaKunthara,,,
392,1189244467439689728,https://twitter.com/smpbrixton/status/1189244467439689728,smpbrixton,2285452334,A big Brixton thank you to @WeWork for the charity football tournament they held on our behalf. pic.twitter.com/XoSmxDtHhQ,2019-10-29 18:15:50+00:00,Tue Oct 29 18:15:50 +0000 2019,,12,78,78,@WeWork,,,
393,1189244380269436928,https://twitter.com/TheDealNewsroom/status/1189244380269436928,TheDealNewsroom,314005753,"By allowing companies to stay private and accumulate up to 2,000 investors, unicorns such as office space company @WeWork have been able to stay private longer, without the oversight accompanying public companies, @rorol writes. https://pipeline.thedeal.com/article/20002105/index.dl …pic.twitter.com/O6o7OlDz8i",2019-10-29 18:15:30+00:00,Tue Oct 29 18:15:30 +0000 2019,,1,2,2,@WeWork @rorol,,https://pipeline.thedeal.com/article/20002105/index.dl,
394,1189244084906610688,https://twitter.com/niklaslohmann/status/1189244084906610688,niklaslohmann,31387109,This could have saved WeWork - would love to do a podcast on this topic,2019-10-29 18:14:19+00:00,Tue Oct 29 18:14:19 +0000 2019,LisaOFu,0,1,1,,,,
395,1189243794228744192,https://twitter.com/matthewstoller/status/1189243794228744192,matthewstoller,2030711,I had not realized just how corporatist the European left really is. Listening to someone propose a European public version of Softbank because it is an important funder of technology companies like uber and WeWork. #digitalcapitalism,2019-10-29 18:13:10+00:00,Tue Oct 29 18:13:10 +0000 2019,,7,17,17,,#digitalcapitalism,,
396,1189243435594723331,https://twitter.com/alexjmedick/status/1189243435594723331,alexjmedick,813979081519677442,Okay - I finally took the plunge and set up a space at @WeWork in Downtown Summerlin.,2019-10-29 18:11:44+00:00,Tue Oct 29 18:11:44 +0000 2019,,0,1,1,@WeWork,,,
397,1189243373489709057,https://twitter.com/caseycgolden/status/1189243373489709057,caseycgolden,176288383,"working out of Banes & Noble today, the original wework. #sf #powerstations #startuplife",2019-10-29 18:11:29+00:00,Tue Oct 29 18:11:29 +0000 2019,,0,1,1,,#sf #powerstations #startuplife,,
398,1189243280111874049,https://twitter.com/EnriqueDiazAlva/status/1189243280111874049,EnriqueDiazAlva,776765730,"Wework: Softbank claims they are going to eat the loss. Even if they don't, most of their leases are signed by SPVs and they can just walk away (nice portfolio of options!). How in the world are the bonds still yielding almost 12%?",2019-10-29 18:11:07+00:00,Tue Oct 29 18:11:07 +0000 2019,,2,2,2,,,,
399,1189243250596556806,https://twitter.com/caiwuunion/status/1189243250596556806,caiwuunion,738924043307503616,"Comrades! CAIWU are having an open meeting Come and learn about all our campaigns against WeWork, Google and many more, and see how you can get involved. We want to hear your ideas and your fighting spirit! Friday 1st November, 6.30pm @maydayroomspic.twitter.com/TRYG7tdz6Q",2019-10-29 18:11:00+00:00,Tue Oct 29 18:11:00 +0000 2019,,9,9,9,@maydayroomspic,,,
400,1189243168153391104,https://twitter.com/dudemochi/status/1189243168153391104,dudemochi,17861424,not enough people “go postal” in this new economy so make “go wework” the thing,2019-10-29 18:10:41+00:00,Tue Oct 29 18:10:41 +0000 2019,,0,1,1,,,,
401,1189242982869983232,https://twitter.com/birgitliodden/status/1189242982869983232,birgitliodden,271367322,"We can't wait to welcome you all to join us for ZERO Warmup & Sunset Session Tuesday 5 November, the day before the ZERO Conference 2019! Welcome to a great afternoon & evening featuring WeWork, Young Sustainable Impact, FreiXchange AS, Katapult Ocean and…https://lnkd.in/eQHHzbn",2019-10-29 18:09:56+00:00,Tue Oct 29 18:09:56 +0000 2019,,0,5,5,,,https://lnkd.in/eQHHzbn,
402,1189242172840779777,https://twitter.com/cottonwood100/status/1189242172840779777,cottonwood100,2876963253,Ben Horowitz: WeWork's company culture caused it to lose touch with reality https://youtu.be/sikadaZj1Jw via @YouTube,2019-10-29 18:06:43+00:00,Tue Oct 29 18:06:43 +0000 2019,,0,0,0,@YouTube,,https://youtu.be/sikadaZj1Jw,
403,1189242127873724417,https://twitter.com/loukwok/status/1189242127873724417,loukwok,7806382,"IBM searching for huge block of space, may drop WeWork http://dlvr.it/RHCT5S pic.twitter.com/GlZ0VfmpVq",2019-10-29 18:06:32+00:00,Tue Oct 29 18:06:32 +0000 2019,,0,0,0,,,http://dlvr.it/RHCT5S,
404,1189242012882612224,https://twitter.com/catdanpete/status/1189242012882612224,catdanpete,66395798,"Consider what your business does, but don’t be limited by your core business when it comes to how you can add value in the greater ecosystem (eg Microsoft intersection with tech vs healthcare). @FaraiMubaiwa @BrunswickGroup Great Purpose Debate (btw we are at brand new @WeWork!)",2019-10-29 18:06:05+00:00,Tue Oct 29 18:06:05 +0000 2019,,0,0,0,@FaraiMubaiwa @BrunswickGroup @WeWork,,,
405,1189242011506925568,https://twitter.com/stephollivier/status/1189242011506925568,stephollivier,334011780,"WeWork rachète Spacious, la startup qui transforme les restaurants en coworking https://siecledigital.fr/2019/08/28/wework-rachete-spacious-la-startup-qui-transforme-les-restaurants-en-coworking/ …",2019-10-29 18:06:05+00:00,Tue Oct 29 18:06:05 +0000 2019,,0,1,1,,,https://siecledigital.fr/2019/08/28/wework-rachete-spacious-la-startup-qui-transforme-les-restaurants-en-coworking/,
406,1189241943412350977,https://twitter.com/kubotayosio1/status/1189241943412350977,kubotayosio1,292212536,【ソフトバンクの危機】WeWork騒動はトランプの仕込みだった！？【深田萌絵】【WiLL増刊号 #089】 https://youtu.be/SJZKS_AvlP0 @YouTubeさんから,2019-10-29 18:05:49+00:00,Tue Oct 29 18:05:49 +0000 2019,,0,0,0,@YouTubeさんから,#089,https://youtu.be/SJZKS_AvlP0,
407,1189241654923935746,https://twitter.com/CamilleTech/status/1189241654923935746,CamilleTech,221548217,"In the midst of all this WeWork stories, the electrical engr in me was surprisingly in awe to visit the space for the LA Cleantech Incubator yesterday for a meeting. It wasn't filled with software startups, but hardware startups. A different, cool vibe.",2019-10-29 18:04:40+00:00,Tue Oct 29 18:04:40 +0000 2019,,0,1,1,,,,
408,1189241342339289090,https://twitter.com/FarientAdvisors/status/1189241342339289090,FarientAdvisors,222567620,Farient CEO Robin Ferracone breaks down WeWork’s controversial exit package in this @WSJ report. https://on.wsj.com/2BQ7Y87 by @eliotwb #corpgov,2019-10-29 18:03:25+00:00,Tue Oct 29 18:03:25 +0000 2019,,1,1,1,@WSJ @eliotwb,#corpgov,https://on.wsj.com/2BQ7Y87,
409,1189241178774003714,https://twitter.com/Red_In_Tech/status/1189241178774003714,Red_In_Tech,4339149855,"Hoy estuvimos presentes en el taller de FO - FTTH organizado por @CAISITarg, en WeWork Polo (Palermo) junto a uno de nuestros clientes. #FO #FTTH #RIT #CAISITpic.twitter.com/qc8ETsWjYz",2019-10-29 18:02:46+00:00,Tue Oct 29 18:02:46 +0000 2019,,0,0,0,@CAISITarg,#FO #FTTH #RIT #CAISITpic,,
410,1189241010875965445,https://twitter.com/GeorgeMentz/status/1189241010875965445,GeorgeMentz,354537587,WeWork Is in the Early Stages of Forming Electronic-Gaming Arm http://dlvr.it/RHCSHy pic.twitter.com/f3ZZdLDLeD,2019-10-29 18:02:06+00:00,Tue Oct 29 18:02:06 +0000 2019,,1,0,0,,,http://dlvr.it/RHCSHy,
411,1189240913970782208,https://twitter.com/adammerino/status/1189240913970782208,adammerino,2261096517,“ @WeWork was dis-intermediating landlords”,2019-10-29 18:01:43+00:00,Tue Oct 29 18:01:43 +0000 2019,,0,1,1,@WeWork,,,
412,1189240871105056770,https://twitter.com/nicns/status/1189240871105056770,nicns,228675188,"As usual,the story makes a lot of sense (decluttering, smaller living spaces etc.). But at the end of the day, this is just real estate (like WeWork) with a different use. Barriers to entry are low-doesn't take huge expertise to lock up some stuff in a room https://twitter.com/aaronvalue/status/1189228534503563271 …",2019-10-29 18:01:33+00:00,Tue Oct 29 18:01:33 +0000 2019,aaronvalue,0,1,1,,,https://twitter.com/aaronvalue/status/1189228534503563271,
413,1189240623242592257,https://twitter.com/allarearealty/status/1189240623242592257,allarearealty,883045135059214339,What WeWork’s Demise Could Do to #NYCRealEstatehttps://hubs.ly/H0lwZwP0,2019-10-29 18:00:34+00:00,Tue Oct 29 18:00:34 +0000 2019,,0,0,0,,#NYCRealEstatehttps,https://hubs.ly/H0lwZwP0,
414,1189240588165668866,https://twitter.com/BusinessDayNg/status/1189240588165668866,BusinessDayNg,217456838,Knotel wants to be Wework — without the ‘bloodbath’ ‘ https://businessday.ng/financial-times/article/knotel-wants-to-be-wework-without-the-bloodbath/ …,2019-10-29 18:00:25+00:00,Tue Oct 29 18:00:25 +0000 2019,,0,0,0,,,https://businessday.ng/financial-times/article/knotel-wants-to-be-wework-without-the-bloodbath/,
415,1189240575360409601,https://twitter.com/cxinsider/status/1189240575360409601,cxinsider,236294966,"NYU professor @profgalloway says that WeWork is a sign of things to come, as more tech companies crash and burn: ‘The world is not as impressed with Silicon Valley as Silicon Valley is with itself’ https://buff.ly/2B1Zpqn via @businessinsider",2019-10-29 18:00:22+00:00,Tue Oct 29 18:00:22 +0000 2019,,0,0,0,@profgalloway @businessinsider,,https://buff.ly/2B1Zpqn,
416,1189240484364988421,https://twitter.com/WeWork/status/1189240484364988421,WeWork,111092283,"In August, we opened our first location in Johannesburg and have loved being part of the community ever since. Here's our guide to the city for those traveling for work: https://we.co/joburgguidetw . #wework #weworkjoburg #traveltuesday @karabo_poppypic.twitter.com/sotqqA6K7l",2019-10-29 18:00:01+00:00,Tue Oct 29 18:00:01 +0000 2019,,1,13,13,@karabo_poppypic,#wework #weworkjoburg #traveltuesday,https://we.co/joburgguidetw,
417,1189240002191986688,https://twitter.com/Espacebeauxarts/status/1189240002191986688,Espacebeauxarts,344144852,"IBM searching for huge block of space in city, may drop WeWork https://newyork.7a7.info/?p=263971",2019-10-29 17:58:06+00:00,Tue Oct 29 17:58:06 +0000 2019,,0,0,0,,,https://newyork.7a7.info/?p=263971,
418,1189239823413985281,https://twitter.com/fostergarveylaw/status/1189239823413985281,fostergarveylaw,75084993,In #ShortTermRental news: WeWork nixes planned #Seattle WeLive location; http://Booking.com shakes up short-term rentals w/ new star rating system; 9th Circuit affirms #SantaMonica's short-term rental regulations. https://bit.ly/2BTC8rb pic.twitter.com/J7gf7kEoIx,2019-10-29 17:57:23+00:00,Tue Oct 29 17:57:23 +0000 2019,,1,2,2,,#ShortTermRental #Seattle #SantaMonica,"http://Booking.com,https://bit.ly/2BTC8rb",
419,1189239303672680449,https://twitter.com/eliotwb/status/1189239303672680449,eliotwb,39403756,Manhattan: one big wework ad pic.twitter.com/cHrbxbmsZx,2019-10-29 17:55:19+00:00,Tue Oct 29 17:55:19 +0000 2019,,1,16,16,,,,
420,1189238703136428032,https://twitter.com/parismartineau/status/1189238703136428032,parismartineau,57724877,"wework is starting a gaming company called ""Play By We” P L A Y B Y W E please release me from this mortal coil, turn me to ash and ship me to the sun im OUT https://www.bloomberg.com/news/articles/2019-10-29/wework-is-in-the-early-stages-of-forming-electronic-gaming-arm …",2019-10-29 17:52:56+00:00,Tue Oct 29 17:52:56 +0000 2019,,2,19,19,,,https://www.bloomberg.com/news/articles/2019-10-29/wework-is-in-the-early-stages-of-forming-electronic-gaming-arm,
421,1189238631531200513,https://twitter.com/ElisaC/status/1189238631531200513,ElisaC,10336,Thank you for sharing that. Yet another thing people like Bezos and that guy from WeWork etc. could easily fund with their ridiculous wealth.,2019-10-29 17:52:39+00:00,Tue Oct 29 17:52:39 +0000 2019,schmutzie,0,1,1,,,,
422,1189237964523671553,https://twitter.com/reactionlife/status/1189237964523671553,reactionlife,742371740832137216,Why WeWork’s Japanese investors are doubling down after failed IPO - @reactionlifehttps://reaction.life/why-weworks-japanese-investors-are-doubling-down-after-failed-ipo …,2019-10-29 17:50:00+00:00,Tue Oct 29 17:50:00 +0000 2019,,0,1,1,@reactionlifehttps,,https://reaction.life/why-weworks-japanese-investors-are-doubling-down-after-failed-ipo,
423,1189237797779058705,https://twitter.com/emmaluigii/status/1189237797779058705,emmaluigii,2718013872,"Claude owns a small tech startup, Gold Deer LLC, that operates out of a WeWork office space. Claude’s company prefers not to put all their eggs in one basket and share investments and partnerships across multiple companies and industries.",2019-10-29 17:49:20+00:00,Tue Oct 29 17:49:20 +0000 2019,,0,1,1,,,,
424,1189237764027551750,https://twitter.com/triercompany/status/1189237764027551750,triercompany,23212586,"The cofounder of legendary VC firm Andreessen Horowitz on what almost killed #Uber, what really led to #WeWork's downfall, and what happened after he passed on Airbnb https://www.businessinsider.com/entrepreneurship-advice-ben-horowitz-company-culture-startups-venture-capital?utmSource=twitter&utmContent=referral&utmTerm=topbar&referrer=twitter … via @businessinsider",2019-10-29 17:49:12+00:00,Tue Oct 29 17:49:12 +0000 2019,,0,1,1,@businessinsider,#Uber #WeWork,https://www.businessinsider.com/entrepreneurship-advice-ben-horowitz-company-culture-startups-venture-capital?utmSource=twitter&utmContent=referral&utmTerm=topbar&referrer=twitter,
425,1189237499912245252,https://twitter.com/MstarCrdRatings/status/1189237499912245252,MstarCrdRatings,768158977783894016,"#WeWork is innovating the #CRE space, but the company also poses unique risks to office properties. Our Walter Johnston explains how #coworking spaces disrupt every step of the valuation process. Learn how we're solving this problem: https://bit.ly/30Wi2XQ #creditratings #CMBSpic.twitter.com/FtlQjEDlYe",2019-10-29 17:48:09+00:00,Tue Oct 29 17:48:09 +0000 2019,,0,0,0,,#WeWork #CRE #coworking #creditratings #CMBSpic,https://bit.ly/30Wi2XQ,
426,1189237458782822407,https://twitter.com/suemcgill/status/1189237458782822407,suemcgill,79877909,Great read and lessons about tech startup unit economics from WeWork’s IPO fallout https://venturebeat.com/2019/10/27/3-lessons-about-tech-startup-unit-economics-from-weworks-ipo-fallout/ …,2019-10-29 17:47:59+00:00,Tue Oct 29 17:47:59 +0000 2019,,0,0,0,,,https://venturebeat.com/2019/10/27/3-lessons-about-tech-startup-unit-economics-from-weworks-ipo-fallout/,
427,1189237429947060224,https://twitter.com/notTHATcisco/status/1189237429947060224,notTHATcisco,1017450793883111425,YESSSSSS!!!!,2019-10-29 17:47:52+00:00,Tue Oct 29 17:47:52 +0000 2019,TomManatos,0,0,0,,,,
428,1189236007566225408,https://twitter.com/kkkk_dddddd/status/1189236007566225408,kkkk_dddddd,477810858,WeWorkが好きすぎて、企画してる新サービスの名前にWeSex、Weファクタリングなどの名称を考えて居る。,2019-10-29 17:42:13+00:00,Tue Oct 29 17:42:13 +0000 2019,,0,3,3,,,,
429,1189235847457054722,https://twitter.com/YaBasta41116768/status/1189235847457054722,YaBasta41116768,1127254327335112704,"It simply means that you can bring your own Coke there and stop whining ab REALLY nothing. SALES r BANNED, not consumption. No rights are infringed here, it’s plain BS.",2019-10-29 17:41:35+00:00,Tue Oct 29 17:41:35 +0000 2019,Keto_Insider,0,1,1,,,,
430,1189235827634819072,https://twitter.com/AmritaMathur/status/1189235827634819072,AmritaMathur,65054984,"Nope, not always. It can help alleviate some challenges, more so in B2B, less so in mass market plays. Uber, WeWork, heck even McDonalds are all case studies in more sales ≠ profitability, market perception, future growth, so on and so forth.",2019-10-29 17:41:30+00:00,Tue Oct 29 17:41:30 +0000 2019,FounderEric,0,1,1,,,,
431,1189235793468022785,https://twitter.com/jonathanmaietta/status/1189235793468022785,jonathanmaietta,809613132,Beyond was an easy one to call (especially back in the summer). Right up there with shooting holes in #WeWork's business model. $BYNDhttps://twitter.com/jonathanmaietta/status/1185648318078181377 …,2019-10-29 17:41:22+00:00,Tue Oct 29 17:41:22 +0000 2019,jonathanmaietta,0,0,0,,#WeWork,https://twitter.com/jonathanmaietta/status/1185648318078181377,
432,1189235275580497926,https://twitter.com/LeeGiang3101/status/1189235275580497926,LeeGiang3101,892352371698708481,Heard like WeWork,2019-10-29 17:39:19+00:00,Tue Oct 29 17:39:19 +0000 2019,cz_binance,0,0,0,,,,
433,1189235013784686593,https://twitter.com/tokikodasa/status/1189235013784686593,tokikodasa,2311622167,ソフトバンクに日銀が支援！？アベノミクスの闇。wework、ETF、ゴールドマンサックス https://www.youtube.com/watch?v=j4WJSTJiye8&feature=share …,2019-10-29 17:38:16+00:00,Tue Oct 29 17:38:16 +0000 2019,,0,0,0,,,https://www.youtube.com/watch?v=j4WJSTJiye8&feature=share,
434,1189234940954710016,https://twitter.com/NicolasGiulian2/status/1189234940954710016,NicolasGiulian2,1004700397,Comment la chute de WeWork trouble la grande mode du coworking - Boursorama https://www.boursorama.com/bourse/actualites/comment-la-chute-de-wework-trouble-la-grande-mode-du-coworking-4e5fe6da00410ee8777f840acaf25a81 …,2019-10-29 17:37:59+00:00,Tue Oct 29 17:37:59 +0000 2019,,0,1,1,,,https://www.boursorama.com/bourse/actualites/comment-la-chute-de-wework-trouble-la-grande-mode-du-coworking-4e5fe6da00410ee8777f840acaf25a81,
435,1189234762822701057,https://twitter.com/SouthernPosh_/status/1189234762822701057,SouthernPosh_,1387060411,Why are they still airing #WeWork commercials on tv when their company was a total scam?,2019-10-29 17:37:17+00:00,Tue Oct 29 17:37:17 +0000 2019,,0,0,0,,#WeWork,,
436,1189234761472118784,https://twitter.com/sean_keady/status/1189234761472118784,sean_keady,300787105,"Of course I do charity work. Just last week I took a business card from a wework recruiter, feigned ignorance and said I’d check it out.",2019-10-29 17:37:16+00:00,Tue Oct 29 17:37:16 +0000 2019,,0,7,7,,,,
437,1189234690097647617,https://twitter.com/MaziGerald/status/1189234690097647617,MaziGerald,300839471,"If SoftBank can finance WeWork at all costs, why can't they finance this one? Na proper soft work be that sef. I support the mission.",2019-10-29 17:36:59+00:00,Tue Oct 29 17:36:59 +0000 2019,asemota,0,0,0,,,,
438,1189234478289510400,https://twitter.com/KJHarvs/status/1189234478289510400,KJHarvs,2403125672,This is great though! Go team,2019-10-29 17:36:09+00:00,Tue Oct 29 17:36:09 +0000 2019,trent_mclaren,0,1,1,,,,
439,1189234252140838912,https://twitter.com/jeffreyweil/status/1189234252140838912,jeffreyweil,91395997,Is WeWork An Impending Train Wreck? https://officetimes.com/2019/10/29/is-wework-an-impending-train-wreck/ …,2019-10-29 17:35:15+00:00,Tue Oct 29 17:35:15 +0000 2019,,0,0,0,,,https://officetimes.com/2019/10/29/is-wework-an-impending-train-wreck/,
440,1189234217529610240,https://twitter.com/Mark236CPA/status/1189234217529610240,Mark236CPA,2267794724,Wall Street learned long ago that the news cycle is shorter than the corporate management wealth cycle.,2019-10-29 17:35:07+00:00,Tue Oct 29 17:35:07 +0000 2019,ThorntonMcEnery,0,2,2,,,,
441,1189234204283936768,https://twitter.com/NL_DannyW/status/1189234204283936768,NL_DannyW,18556034,"Admiring the view of @TheShardLondon, @StPaulsLondon and other iconic buildings from the #RoofTerrace @WeWorkUK #QueenStreet #London this evening. Operating from London a couple of days each month is certainly a great experience. #NextLevel #Views #WeWork #Office #Videopic.twitter.com/fK4NagbU7v",2019-10-29 17:35:03+00:00,Tue Oct 29 17:35:03 +0000 2019,,0,2,2,@TheShardLondon @StPaulsLondon @WeWorkUK,#RoofTerrace #QueenStreet #London #NextLevel #Views #WeWork #Office #Videopic,,
442,1189234140673138691,https://twitter.com/TomTSEC/status/1189234140673138691,TomTSEC,2525149488,"Do you trust Wall Street and the stock markets? Earlier this year, they told us ""WeWork"" was worth 47 million USD. Now it looks like it is worth 8 billion and declining. pic.twitter.com/GSChx13qJt",2019-10-29 17:34:48+00:00,Tue Oct 29 17:34:48 +0000 2019,,3,5,5,,,,
443,1189233950851551235,https://twitter.com/TonyDeSisto/status/1189233950851551235,TonyDeSisto,20009581,"""By acquiring the language of uplift and spirituality, American capitalism hasn’t reformed itself. It’s just claimed another commodity to be possessed, marketed, and sold."" @DKThomp on Adam Neumann's exit from WeWork: https://www.theatlantic.com/ideas/archive/2019/10/how-weworks-adam-neumann-became-billionaire/600607/?utm_source=twitter&utm_medium=social&utm_campaign=share …",2019-10-29 17:34:03+00:00,Tue Oct 29 17:34:03 +0000 2019,,0,0,0,@DKThomp,,https://www.theatlantic.com/ideas/archive/2019/10/how-weworks-adam-neumann-became-billionaire/600607/?utm_source=twitter&utm_medium=social&utm_campaign=share,
444,1189233302139539458,https://twitter.com/SirBolustic/status/1189233302139539458,SirBolustic,121792959,Lol why. I don’t think he’s committed any crime. The fools that pumped their cash into WeWork should deal with the consequences of their actions.,2019-10-29 17:31:28+00:00,Tue Oct 29 17:31:28 +0000 2019,teaponpi,0,0,0,,,,
445,1189232666249453568,https://twitter.com/SethGoldstein13/status/1189232666249453568,SethGoldstein13,833056519361011712,"What about the real victims of WeWork scam? The 4,000 employees about to be laid off holding worthless stock options.",2019-10-29 17:28:57+00:00,Tue Oct 29 17:28:57 +0000 2019,,0,0,0,,,,
446,1189232151650357248,https://twitter.com/DanielaLeon06/status/1189232151650357248,DanielaLeon06,126122946,"Perdí la cuenta de las veces que Wework me ha brindado una mala experiencia. De verdad, no sólo está en crisis el negocio sino también su experiencia.",2019-10-29 17:26:54+00:00,Tue Oct 29 17:26:54 +0000 2019,,0,0,0,,,,
447,1189231550795259905,https://twitter.com/jfc_3_/status/1189231550795259905,jfc_3_,2263851511,"Not a WeWork, and no",2019-10-29 17:24:31+00:00,Tue Oct 29 17:24:31 +0000 2019,EconomicsBruce,0,0,0,,,,
